username,tweet
pujaypujilpuu,pesan saya malam bendung lah semua peras beban pikir kuat tenaga saya tahu anda lelah pekerjan urus luar sana coba ingat tentang saya selalu siap tunggu tani anda dengar keluh kesah menang sama
pujaypujilpuu,iya iya serah anda
pujaypujilpuu,iya lah bukan anda ngaku kalau habis isi link
pujaypujilpuu,nama gadis
pujaypujilpuu,pakai mata batin saja
pujaypujilpuu,tahu itu si
pujaypujilpuu,chatan saja la tidak usah bicara
pujaypujilpuu,kalau dipangil teman tidak bisa lihat muka sangka sombong padahal mata minus
pujaypujilpuu,orang bicara pakai otak tidak pakai mulut
pujaypujilpuu,kemarin anginya ada dingin sekali seperti air deh mak nyes begitu dinginya pamulang rasa puncak malam
pujaypujilpuu,eh
pujaypujilpuu,kalau garibet gaidup saudara
pujaypujilpuu,mau joget malu gajoget sayang sekali otu rbt enak benar lagu
pujaypujilpuu,iya begitu saudara benar kesal sendiri saya tlp biasa saja lah akhir
pujaypujilpuu,suhu tubuh saya ayo positif pikir ayo
pujaypujilpuu,orang kalau nelpon pakai wasaf itu paham muntah si kalau suara tunda ganti kenapa ngomongnya tidak orang budeg
pujaypujilpuu,iya
pujaypujilpuu,saya benci ini bagi
pujaypujilpuu,orang kalau kaca apa si lihat
pujaypujilpuu,nyata jumat rasa senin
pujaypujilpuu,kan anda bahasa arab mulai
pujaypujilpuu,oke hanya ambil peduli dan datang kembali segera
pujaypujilpuu,jadi dimana anda pergi
pujaypujilpuu,akan hilang apa
pujaypujilpuu,selamat tinggal nya ganti sama kata begitu coba
pujaypujilpuu,tidak usah macam seperti
pujaypujilpuu,umum sini tidak mav ngerepotin
pujaypujilpuu,ingat ketika saya told anda tidak masalah dimana saya pergi saya ll tidak pernah tinggal milik anda sisi anda akan tidak pernah jadi sendiri bahkan ketika saya pergi through changes bahkan ketika saya baca old ingat itu saya told anda saya ll temu saya cara kembali rumah shaun cause saya milik anda rumah
pujaypujilpuu,diserver jek bukan sini saudara
pujaypujilpuu,kalau anda rasa tampan ywd anda sholat jumat masjid dulu lah sana
pujaypujilpuu,tawa iya saudara laki
pujaypujilpuu,sudah lanjur baca saudara laki fijo
pujaypujilpuu,serah anda bang serah
pujaypujilpuu,lembek anda tulang anda bang tidur hanya
pujaypujilpuu,langsung nimbrung saja jadi lah tidak usah pakai jbjb dulu
pujaypujilpuu,hari jumat baik kita
pujaypujilpuu,pibesdey
pujaypujilpuu,hai
pujaypujilpuu,coba baca coba
pujaypujilpuu,coba baca benar ayo ayo
pujaypujilpuu,kan saya sudah kenal anda ywd gaperlu jbjb lah
pujaypujilpuu,kenapa saya jeli sih
pujaypujilpuu,bukan saudara
pujaypujilpuu,semangat rafi anda sembuh anda bisa saya bantu doa anda rafi sabar tetap semangat anda sembuh
pujaypujilpuu,salam
pujaypujilpuu,muntah begitu dong
pujaypujilpuu,putar balik bang periksa titik
pujaypujilpuu,gaster bang
pujaypujilpuu,kelas seperti gin seperti gin sekali agar jbjb sama warga twitter
pujaypujilpuu,pesan saya malam silah sembunyi apa simpan apa anda mau turut saya tidak perlu tahu coba ingat tentang anda punya orang wanita yang tatap mata saya tahu segala yang anda laku belakang
pujaypujilpuu,miris sekali saudara lihat salam
pujaypujilpuu,kalau anda ibu gaperlu jbjb matahari
pujaypujilpuu,pamulang rasa puncak
pujaypujilpuu,keysip
pujaypujilpuu,tawa
pujaypujilpuu,muntah garis saudara laki
pujaypujilpuu,wah kereta mulai operasi sluman slumun slamet
pujaypujilpuu,kamen kendara
pujaypujilpuu,canda saudara
pujaypujilpuu,larut dong
pujaypujilpuu,eh
pujaypujilpuu,tambah doang muntah jbjb percuma saudara lalu
pujaypujilpuu,ywd bilangin saja tidak usah utama twitter
pujaypujilpuu,eh
pujaypujilpuu,yang folowan muntah jbjb motivasi apa
pujaypujilpuu,kalau mau ayo kalau tidak mau ywd
pujaypujilpuu,nah sudah
pujaypujilpuu,tidak
pujaypujilpuu,tahu itu rumit sekali
pujaypujilpuu,tahu itu warga
pujaypujilpuu,kesal suruh bantu motong kentang ibu semangat sekali saudara motonginya dalam hati saya ngebayangin saya potong orang saya lin
pujaypujilpuu,mendung tentu hujan mendung pasti hujan mendung arti hujan arti hujan
pujaypujilpuu,ya orang kesal
pujaypujilpuu,mau pulang ontime hujan coban mesti sabar
pujaypujilpuu,tidak ketawa dong
pujaypujilpuu,selamat pagi jiwa sukses pindah nyala luluh tidak sapa hai sama mantan
pujaypujilpuu,parah ibu
pujaypujilpuu,eh
pujaypujilpuu,baca bagaimana sih
pujaypujilpuu,tahu itu warga
pujaypujilpuu,iya
pujaypujilpuu,asal sibuk sama pekerjaan saja saudara
pujaypujilpuu,pesan saya malam terus lah sibuk diri dunia anda anda lupa kalau saya hidup anda coba ingat tentang saya selalu siap terima anda pulang kapan dalam kondisi apa diri
pujaypujilpuu,hai yow apa atas saudara laki
pujaypujilpuu,saudara laki saya pu temenin goa ayo beli soto sana saya santai juga saya nah biasa kalau pacar begini dia mau curhat saya ini
pujaypujilpuu,kenapa begitu saudara
pujaypujilpuu,bahagia paling sederhana anda tahu nyala notif twitter anda
pujaypujilpuu,iya saudara laki betul
pujaypujilpuu,iya dong
pujaypujilpuu,tidak cinta sekali tidak suka sekali karena sekali buat anda sakit sekali
pujaypujilpuu,astaga
pujaypujilpuu,yang pakai sekali gabaik saudara laki
pujaypujilpuu,miring muntah pakai sekali miring dikit
pujaypujilpuu,nah begitu dong
pujaypujilpuu,iya orang susu kental manis
pujaypujilpuu,pakai e dong
pujaypujilpuu,yakin hidup anda mau tidak aman terus coba tengok keluar sana banyak orang peduli sama anda anda iya anda
pujaypujilpuu,susu kontol manis
pujaypujilpuu,bagaimana mulai
pujaypujilpuu,saya fine memang
pujaypujilpuu,o
pujaypujilpuu,eh apa ini
pujaypujilpuu,tul
pujaypujilpuu,sekali begini buat jbjb sama warga twitter tidak jatohin gambar liput admin
pujaypujilpuu,bapak ibu saya jawa saya kecil sudah dikenalin sama lagu gending jawa turut saya lagu enak kalau buat hantar tidur buat dari kalian takut bahkan parno karena lagu model begini suka buat backsound film horor
pujaypujilpuu,ywd si peta salah ketik arti ih
pujaypujilpuu,lah iya memang begitu kan
pujaypujilpuu,seperti toko saja sudah
pujaypujilpuu,amit cabang bayi
pujaypujilpuu,cukup media sosial sama themes telepon saja darkmode hidup saya tidak
pujaypujilpuu,kata hati stalkin pacar sana kata otak tidak usah lah sudah saya pilih otak saya saja
pujaypujilpuu,kasih tenaga banyak bukan buat baik malah buat neraka
pujaypujilpuu,bagus kalau begitu
pujaypujilpuu,saudara laki maksud
pujaypujilpuu,uang tidak punya bapak tidak punya ibu tidak punya saudara tidak punya saudara tidak punya saudara tidak punya teman inti uang tidak punya siapa
pujaypujilpuu,tawa
pujaypujilpuu,ibu jek
pujaypujilpuu,masa sih saudara lalu
pujaypujilpuu,anak laki memang lemari baju cuma punya warna item abu putih
pujaypujilpuu,buat baik tidak tunda hai hai buat baik tidak tunda hai hai
pujaypujilpuu,iya
pujaypujilpuu,ceritain saja saudara kalau yang rasa astaga
pujaypujilpuu,hubung usaha kalau sendiri anda wirausaha saja baik
pujaypujilpuu,pikir
pujaypujilpuu,muntah kuat sudah dengar suara falseto nya anak pria
pujaypujilpuu,ngetwit soal apa kita rasa bukan apa mau dilike orang percuma disosmed dilike rl tidak ada suka sama anda
pujaypujilpuu,punya masalah cinta teman saya pikir solusi saya kenapa ya orang begitu
pujaypujilpuu,lagi cemberut saudara laki
pujaypujilpuu,baik warga nya jek ini saudara laki
pujaypujilpuu,benar
pujaypujilpuu,eh
pujaypujilpuu,sudah tetap saja mata perih
pujaypujilpuu,ketawain dulu baru bantu
pujaypujilpuu,sudah lama muntah unggah video tik tok
pujaypujilpuu,pantas dulu seko nembak gadis tidak pernah tolak
pujaypujilpuu,yahahaha sudah banyak dosa saya malah nambahin dosa saudara laki
pujaypujilpuu,saat hidup engkau sendiri sama angin cerita seluruh rahasia lalu tetes air mata bung karno
pujaypujilpuu,gibah dong
pujaypujilpuu,ketika anda punya sebuah masalah dengan milik anda mata balik kerja naik motor mau tutup kaca helm jalan muntah lihat gatutup kaca helm perih mata saya sial
pujaypujilpuu,saya itu kalau yang bilang yang mau saya sampein ini saya mau bicara sama anda eh saya mau cerita sama anda ini rasa gugup seperti mau presentasi depan kelas degdegkan mules kringet dingin gafokus aduh mau bicara apa ini
pujaypujilpuu,tua pasti dewasa pilih
pujaypujilpuu,siapa buat anda pikir anda adalah alias lah anda lagak akrab bos
pujaypujilpuu,diri sabotase
pujaypujilpuu,banyak gaenakan sama orang orang jadi senak sama
pujaypujilpuu,saya
pujaypujilpuu,iya saudara lalu peta
pujaypujilpuu,pada sombong harta
pujaypujilpuu,anda pikir siapa lebih gila saya lah kalau mau utama gilan ibu anda kena t tahu saya lain sisi jadi cermat dengan itu
pujaypujilpuu,tumpeng dong mulai
pujaypujilpuu,nah lebih bagus itu
pujaypujilpuu,nah kalau saudara laki lewat tidak lagi gibah saudara laki kasih mic saja sama bicara
pujaypujilpuu,apa retweet mutualan anda twitter kan lewat di beranda anda walaupun anda tidak suka tetap tidak bisa lewat kan sudah lihat saja telenin
pujaypujilpuu,suzuki xl turut saya sempurna mata saya
pujaypujilpuu,saya dokter
pujaypujilpuu,mabruk alfa mabruk
pujaypujilpuu,jam gin lapar buat mie gelas jalan ninja saya
pujaypujilpuu,yang seperti begitu
pujaypujilpuu,iya saudara lalu iya
pujaypujilpuu,sekarang orang kalau habis balik luar kota pasti diri sendiri sehat lama minggu diruma baru rasa aman
pujaypujilpuu,tawa
pujaypujilpuu,kan makanya ramean
pujaypujilpuu,masalah beda server saudara sama jadi tidak bisa
pujaypujilpuu,tidak apa apa jadi banyak kan
pujaypujilpuu,iya
pujaypujilpuu,kornet
pujaypujilpuu,tidak bisa saudara tidak akan sampai kapan
pujaypujilpuu,iya saya dapat itu terimakasih saudara lalu
pujaypujilpuu,enak itu seperti kalau sama mie
pujaypujilpuu,masya saudara lalu
pujaypujilpuu,laki kalau pakai baju item lihat nya begitu sekali
pujaypujilpuu,untung nmax helm nya tetap bogo
pujaypujilpuu,berapa orang ingin berlian rings berapa hanya ingin semua tapi semua cara tidak apa apa jika saya ain t dapat anda alicia keys
pujaypujilpuu,ken jadi lambat responsif cara bagaimana
pujaypujilpuu,yahahaha
pujaypujilpuu,banyak mau jogging gbk
pujaypujilpuu,muntah begitu mai saudara laki
pujaypujilpuu,muntah begitu saudara laki
pujaypujilpuu,saking halusinasi nya siang gin saya lihat daster ibu saya ember seperti baju renang punya saya sudah tengah tahun pernah renang
pujaypujilpuu,kejar gebetan sampai trauma
pujaypujilpuu,apa rasa si saudara cerita makanya
pujaypujilpuu,kereta kan tidak bisa ngerem dadak
pujaypujilpuu,iya dari tentu
pujaypujilpuu,mereka kenapa mandiri saat memang pepet sekali
pujaypujilpuu,nama gadis saudara laki makanya saya tidak suka sama gadis
pujaypujilpuu,buka botol sirup saja tangan anda luka pu lemah sekali anda pu
pujaypujilpuu,yoi cemil donat minum es teh tarik lebih asyik
pujaypujilpuu,anda salah satu doa saya saya minta paling masuk akal
pujaypujilpuu,sudah sudah tidak usah pakai obat tidur ginjal anda hai pakai cara saja bang
pujaypujilpuu,bang sudah tidak minum obat tidur saya dulu sempat ken coba saya gaberani takut gantung coba kalau mau tidur wudu dulu terus tebasin kasur kali dibacain al tidak mau tidur baca ayat kursi
pujaypujilpuu,memang saya saudara wanita kunti
