username,tweet
puteriroro,enak yang punya saudara laki sudah lama saya tidak punya
puteriroro,ayo jalan jalan saja tik
puteriroro,wkwowkwok gb kenapa habis waktu hari cuma saudara pakai whatsapp sama twitter padahal ayo ra ono video panggil lho
puteriroro,benar benar saya hilang brkali juga gin cari cari sendiri akhir tidak bertemu juga tapi
puteriroro,pintu pikir
puteriroro,dokter hewan minggu buka salatiga kah
puteriroro,versi siang versi manja minta gendong bawa masuk gerobak
puteriroro,dong kembar saudara
puteriroro,sana
puteriroro,solotigo ne ndi ini
puteriroro,lebaran tik
puteriroro,dia e saya balas begitu karena tidak saudara responsif
puteriroro,gratis saudara asal punya teman saudara sopir ambil
puteriroro,risa chanel yang terima pakai bekas apa begitu pernah tahu saudara sby baik layak pakai maupun untuk sekitarkita tidak
puteriroro,sering dulu pos apa saudara kibas tersebut tidak saudara responsif cukup penting gilir yang pos guyon tangepi alhasil saya did ini untuk tunjuk sudah cukup muak mau saudara tingalin tapi kenapa yayasan keluarga tidak saudara tinggal kenapa beban
puteriroro,saya orang tua sengaja diam tidak terlalu tunjuk atas sekolah yayasan keluarga supaya tidak diangap terlalu dominasi apa buta tapi kenapa diangap tidak bahkan tidak penting padahal juga ajar situ perlakuanya tidak enak sekali
puteriroro,kalian jodoh
puteriroro,pkn pjok
puteriroro,salatiga
puteriroro,saudara wanita dulu terlalu insekyur sama rahang jadi bawa sampai sekarang jadi bias sukit ubah tapi sikap saudara ubah lho saudara wanita
puteriroro,ampun
puteriroro,terimakasih hibur
puteriroro,gayung bekas ember cat saudara laki
puteriroro,kejut rumah rumah koreah
puteriroro,mapin saya
puteriroro,mugi kupas engal sehat
puteriroro,wah saya lali selamat
puteriroro,tawa sedih saya sumbu saya isone mung ngo twitter tok ojo tuku parsel gb sumbu game gb isone mung ning lobi
puteriroro,yang mau pulsa saja buat saya aktifin parsel data agar beli kuota lebih banyak saya banking
puteriroro,saya punya gaberasa punya tidak kenal saya itu
puteriroro,lingkar cahaya saudara yang banting
puteriroro,kalau gin bagaimana tidak makin tidak suka sama kalian laku yang tidak ini
puteriroro,cerita bagaimana
puteriroro,nenek tumbas ini ombe ngendi saja ra akan buat paham nenek alkohol
puteriroro,ayo inpus pakai inpus woter
puteriroro,iya habis cuci
puteriroro,kenapa hayo
puteriroro,malu muka saudara tutup aurot tidak tutup itu hai
puteriroro,kenapa muncul blibli akhir
puteriroro,ribu anda orang itu maksud orang
puteriroro,cilok
puteriroro,mbuh eg saudara laki e deloke kendaran mburi eg
puteriroro,awowkwowkwok
puteriroro,mlengos mlengos nganguk nganguk ngomongnya spednya cepat sangat lambat
puteriroro,rasido wedi nenek ra hubung sama nangismy
puteriroro,culno
puteriroro,sayap kae ono sg balas twetku sangat sentuh sebentar tidak golekane
puteriroro,yang paling saya tidak bisa nyebut saat absensi
puteriroro,saya cinta his presisi
puteriroro,apa
puteriroro,kui
puteriroro,musuh sama teman keluarga tetangga beda paham corona
puteriroro,jadi ingat bawa cilok dalam tuhan tidak bawa minum pedas pedas serer
puteriroro,pintar sekali bahasa ingrisnya
puteriroro,saya beli saudara instagram
puteriroro,kayak sudah pantas buat tumpang
puteriroro,saya ken sekali
puteriroro,kira karena nama beda grup akan beda admin
puteriroro,wahg adminya sama sama admin
puteriroro,gambar tempe begitu warna
puteriroro,apa cuma saya yang bosan begini saja saya tonton sampai selesai
puteriroro,ntah memang begitu eg kecil
puteriroro,kucing pria biji macam upil kecil sangad
puteriroro,semangat ayo sa
puteriroro,saya tidak pakai instagram sayang sekali
puteriroro,seblak
puteriroro,racun an drama kalau sakit tapi malah sok makin sakit gara
puteriroro,saya suka nongkrong saudara kuljas
puteriroro,apa cuma saya tetap lihat sampai akhir karena font nya bagus
puteriroro,omong omong kucing mirip koko begitu saudara muka selalu melas selalu nurut
puteriroro,pijetin mini dong kenapa lelah pikir kucing belah ngelairin tidak yang mirip mini
puteriroro,periksa
puteriroro,udyah akyu saudara em
puteriroro,admin admin kuota saya bisa buat twiteran saya punya dosa apa tidak bisa kerja saya
puteriroro,kuota gin bisa buka axisnet twitter salah apa sih
puteriroro,eh maksud juli
puteriroro,sekolah juni sudah baru normal di jateng smk sama juni bagi raport tahun ajar akhir juli
puteriroro,iya makanya rambut begitu begitu doang
puteriroro,joko saya dengernya
puteriroro,ayah saudara saya begitu saya paksa tidak boleh ikut sholat jumat jadi saya dosa tidak
puteriroro,coba periksa telepon nya hasil apa kalau saya hasil kena tipu sekali kemudian nabung jadi tahun kerja dapat telepon
puteriroro,anda kira kita ngira
puteriroro,iya telegram saja
puteriroro,berapa musim tawa sebentar tidak carike
puteriroro,tidak sesal kayak drama hai selamat tinggal ibu ngurusi pasien prioritas
puteriroro,semangat al saya
puteriroro,extracurricular
puteriroro,berita palsu
puteriroro,tidak apa apa
puteriroro,suara
puteriroro,temu saya in punya anda ingat lantai lantai pilih akhir kalau sudah tidak drama korea teh
puteriroro,itaewon kelas
puteriroro,extracurricular
puteriroro,apa cuma saya tidak punya rencana sama sekali
puteriroro,manis baik anda masalah dan butuh itu pahit anda coba doang itaewon kelas
puteriroro,lah saya kenapa tidak ken tetangga
puteriroro,sa
puteriroro,saya apus balas saya bang
puteriroro,saya tonton episode bang pusing
puteriroro,bvwkwkw
puteriroro,haduh
puteriroro,saudara wanita kelas cowonya cuma
puteriroro,bisa cepetin tidak sih ngmgnya apa cepat inet saya lambat
puteriroro,iya guru lanjut guru saya fokus cerdas murid murid realife saja
puteriroro,sudah bar mandi hairdryer an malah kemringet ken hujan gendong aman sa
puteriroro,ayo saudara jajan saudara laki banyak
puteriroro,nah sering ngetwet ayo mutualan saya mutualan saya folowersnya tidak ada yang responsif sama sekali kan kasihan
puteriroro,lingkar cahaya bapak koharmadio info cara detail keluhanya admin
puteriroro,keren buat anda bisa abisin saya abisin lembar roti celup telur lalu dipangang saja sudah tidak mampu
puteriroro,semoga hujan nya datang zona pliket kabeh ini
puteriroro,tawa saya kilas lihat akun kasi
puteriroro,nyaring tiap konten baca lihat tidak bisa maksain orang sesuai hendak kita kita sendiri lah harus sesuai diri sendiri kita tidak bisa nyalahin orang bagi konten ikut henti ikuti akun bahkan blok akun hak
puteriroro,turut gin sosial media tempat mana banyak banyak orang kalau memang anda tidak mau lihat suatu konten tidak apa apa kan tidak usah lihat konten yang sama bagi oleh satu orang baik henti ikuti tidak apa apa karena diri sendiri yang bisa
puteriroro,saudara saudara
puteriroro,cokpad banya saudara
puteriroro,tidak buka rumah cuma buka janan depan rumah
puteriroro,mon peta sarang batin iya
puteriroro,maksain prinsip nya orang sama dia
puteriroro,huwo
puteriroro,culke ra ayo
puteriroro,saya juga bodoh untuk pegang anda untuk sebuah panjang waktu
puteriroro,iya
puteriroro,saya lebih suka mie pengirim mie nya enak mie
puteriroro,pusing sekali
puteriroro,lucu anda sayang
puteriroro,jadi dosen bimbing waktu skripsi ibu cantik kirim ucap saya kira teman saya dong obrol utama jawab okesip saja semoga saja baca whatsapp beliau atur abu abu doang
puteriroro,akan lhokak anda tidak saudara tolong
puteriroro,pose akhir ayah telat humoris sekali sih keluarga kompak kompak
puteriroro,serius tanya saudara kan tidak atur kalau mau henti ikuti harus izin kalau izin baik baik ujung nya tidak jadi henti ikuti
puteriroro,buru ikut saudara agar tidak masuk neraka
puteriroro,saya larang mobil bocor ganti sendiri pengirim bocor malah bahkan larang mobil ayah bocor saya gang gantin
puteriroro,sumbu buat game lacar
puteriroro,tidak tahu ix sa telegram begitu ganti provider
puteriroro,semangat sayang
puteriroro,periksa
puteriroro,saya tidak bisa obrol whatsapp kenapa kirim tweet kuota masih banyak
puteriroro,periksa
puteriroro,tidak bisa tidur pikir tri sama cuci kendaran
puteriroro,selalu balas apa coba dikit dik apa coba astaga tidak semua konteks cocok di apa coba in
puteriroro,pol sampai emosi sendiri tebak habis ngetik gin sampai bisa hafal bagaimana
puteriroro,syukur akhir lihat bapak wapres alhamdulilh sehat nyata
puteriroro,iya saya tidak bisa hidup handphone hidup twitter diri diri
puteriroro,paham paham
puteriroro,oalah bijak rumah sakit
puteriroro,kalau rtv ibu tidak heran saya sudah sering
puteriroro,ren kenapa omong kosong kurang kenapa
puteriroro,cnth
puteriroro,saya tonton beranda
puteriroro,inti parsel
puteriroro,ampun hampers itu apa sih
puteriroro,bisa pakai versi lawas saya ogah perbarui
puteriroro,edit lah
puteriroro,sudah besok buat
puteriroro,nyonya sama punya foto bareng tidak turun sini
puteriroro,salatiga cuma pakai motor lho saudara
puteriroro,mucih
puteriroro,tangis iya lalu kalau mau lapor sudah pensiun tunggu tatap muka
puteriroro,jijik sumpah
puteriroro,kemarin senin kantor pajak salatiga jam set kenapa tutup apa sudah tutup
puteriroro,saya memberi tugas siswa isi sensus banyak mereka kenapa tidak beban isianya jadi jebak masuk apa sinyal atay bagaimana
puteriroro,mungkin cuma saya yang whatsapp nya tidak ramai bahkan pernah hari tidak notif masuk sudah tidak memberi tugas online murid ampun lingkar teman saya payah sekali
puteriroro,apa tidak kasi bibir monyong terus
puteriroro,diajakin buat jadi teman foto lebih baik mim saya diajakin jauh jauh yogyakarta cuma buat dijadin sopir
puteriroro,apa sensor saudara bawah tapi atas lupa macam saya yuba yuba
puteriroro,gonku catat e ra iso scanning
puteriroro,ph salatiga kotak mangkal depan toko di trotoar saya kira itu cemil sudah dingin tahu hangat mana saudara wanita ramah
puteriroro,tuhan saya tidak tahu semua padahal saya suka cemil saya tahu cuma inces nabati bluwekan
puteriroro,titip tengteng tidak dibangunin
puteriroro,saudara saya kira saya yang bodoh lama ngartin sarkasme beda sama saudara wanita
puteriroro,tawa iya
puteriroro,iya jomblo
puteriroro,selesai selesai rumah
puteriroro,sama pach orang
puteriroro,merah guru
puteriroro,sahur mepet subuh
puteriroro,tidur saudara wanita habis sahur
puteriroro,benar benar seleksi
puteriroro,lholho bawa rasa siapa hayo kan saya cuma ken tahu siapa sudah begitu saja kenapa tidak lebih
puteriroro,orangtuaku panggil ibadah magrib sudah bilang malam
puteriroro,syukur guru guru karyawan sekolah sekali saudara laki sejak bulan maret hingga sekarang murid bantu kuota internet semoga sekolah segera dan penuh
puteriroro,tawa
puteriroro,dia
puteriroro,orang tua saudara kadang ada pikir mau bundir mik lah yang tidak saudara wanita saya bonyok saya makin bahagia tahu saya kayak gin lalu akhir saya sadar
puteriroro,saya nang lho
puteriroro,sa vantika ki tidak margareth
puteriroro,tutup twitter buka whatsapp lalu menit balik ke twitter tetiba suruh masuk password autentikasi dia
puteriroro,cuma modal catat catat hutang nya estes
puteriroro,ingin tahu dikit si nyata tanya balas
puteriroro,syukur saya tidak saudara tidak usah ingin tahu saudara orang macam pasti tidak ada habis habis ulah lain baik ingin tahu benang benang yang manpat saudara
puteriroro,tidak ken menikah cepat kalau calon pasang ada saya
puteriroro,siapa ikram itu terkadang saya rasa untung tidak tahu orang orang macam
puteriroro,seksek siapa sih
