username,tweet
siti89nurjanah,saat bilang sudah tidak apa apa
siti89nurjanah,tahan waktu sambat
siti89nurjanah,kalunganya tasbeh bukan
siti89nurjanah,hidup insekyur hanya heran
siti89nurjanah,paling malas kalau belanja online parsel kirim sama ninjaxpres tidak sampai sampai
siti89nurjanah,twitter tidak harap difolow tidak mau ikut ikut kembali teman rl goa sekali tawa
siti89nurjanah,yah ketinggalan foto
siti89nurjanah,seru adab ingin tahu pakai oleh anda kenapa goa ada jadi promotor status whatsap tawa karena keren ala ala saudara wanita selebgram sesal kalau tidak coba
siti89nurjanah,goa pikir kalau dihack
siti89nurjanah,rindu ngebolang pakai google maps gara gara tidak tahu jalan sering salah paham yang nyetir yang memberi tahu arah ngelewatin jalan yang itu karena ketululan goa baca maps sering diklaksonin sama mobil karena ngedarain motor dolog taruh
siti89nurjanah,yang wajib dulu dilunasin baru sunah eh begitu gasih
siti89nurjanah,masya
siti89nurjanah,jauh segala sakit marabahaya hal yang baik lain
siti89nurjanah,satu bulanya ada cepat sekali ibadah maksimal boleh rasa hilang harap sambut rasa bulan suci ramadhan tahun ikut adan lebih baik dalam bagai
siti89nurjanah,ramadhan lebaran kali benar benar beda bukan tidak lihat sisi positif sedih bagi manusia
siti89nurjanah,aduh sudah melow sekali kayak gin
siti89nurjanah,duga
siti89nurjanah,hormat sama orang pengetahuanya luas kalau sok paling tahu segala jijay tawa
siti89nurjanah,beri kuat yang lemah kemulian yang hina kebahagian semua
siti89nurjanah,sudah sudah simpen sendiri tidak usah cerita
siti89nurjanah,kalau orang balas obrol tidak sesuai sama apa yang tanya arti tidak mau bahas hal tolong harga
siti89nurjanah,jijibet sih
siti89nurjanah,jelang tengah malam suka tiba tiba sedih begitu heran
siti89nurjanah,hidup perlu doa medoakan doa harap segala tidak baik ubah jadi baik
siti89nurjanah,kalau mau laku baik coba ingat betapa sesal sekarang hal buruk masa lalu yang pernah jadi
siti89nurjanah,tidak paham sama peras sendiri tawa
siti89nurjanah,goa ngapasi iya tuhan tidak jelas sekali
siti89nurjanah,sudah hatam
siti89nurjanah,kalau bosan suka lihat instastory orang orang cuma keran keran karena sinyal jelek isi item semua tawa ibarat cerita sudah sedia
siti89nurjanah,kalau sinyal kencang anak instagram kalau sinya banyak anak twt
siti89nurjanah,hih buat apa
siti89nurjanah,begini saya terlalu cepat kalau kabar gembira sedih terlalu rapi simpan sendiri alas tunggu waktu yang tepat untuk orang bisa ikut rasa
siti89nurjanah,kalau keingetan paling cuma bilang tidak apa apa jadin ajar saja agar kedepany lebih baik syukur kasih sempat malu mau ngedumel takut malah jadi tidak syukur
siti89nurjanah,beberapa hari kalau tidur siang malam si mimpi aneh aneh sekali mana rem
siti89nurjanah,terimakasih iya tuhan banyak bangat ajar ambil salah satu tulus laku baik apa kepada siapa harapanya sekarang terus bisa lebih baik bahkan jauh lebih baik
siti89nurjanah,amin semoga segera temu
siti89nurjanah,nah tidak sekali ini sama seperti hati yang kata sudah mati bukan tidak mungkin akan hidup kalau memang jodoh
siti89nurjanah,kalau goa yang cemil tidak selesai seminggu itu masalah perut
siti89nurjanah,tidak terlalu sibuk cari coba jadi
siti89nurjanah,tidak semua sambat an diungkapin lalu typing
siti89nurjanah,biasa semua putus yang ambil sudah dasar timbang punya alas tidak semua jelas
siti89nurjanah,buka twitter saja suka tunda instagram pantas kuota tidak habis habis
siti89nurjanah,apa nama kalau bukan julid
siti89nurjanah,hih karena memang niat tidak sampai yang tahu eh malah anda kejulitanya sini
siti89nurjanah,terimakasih indocafe
siti89nurjanah,rem emen pakai segala mati tidak boleh begitu ada sempat tawa
siti89nurjanah,alas haha perlu tahu selebtwet sudah buat twitter ramai haha
siti89nurjanah,kena dikit ibu
siti89nurjanah,tawa saking keponya sampai nebak nebak
siti89nurjanah,kalau tidak julid pamer pikir tidak begitu
siti89nurjanah,perlu dingatkan tempat sambat bukan tempat pamer
siti89nurjanah,tetap saja akan kejulitan buat yang peka hih e begadang dengan alas qiyamulail mumpung ramadhan tawa
siti89nurjanah,nyimpen nomor cogan soleh yang sudah mau menikah yang satu ken menikah cuma belum tahu kapan untung rasa tahu diri ada goa jadi tidak berani ngechat tawa lebih baik tertawa diri sendiri dari tawa orang dosa
siti89nurjanah,hai tempat sambat ceramah tahan dulu
siti89nurjanah,itu sudah hobi tidak tahu saja haha
siti89nurjanah,hih makin takut
siti89nurjanah,hai tempat sambat ceramah tahan dulu tawa
siti89nurjanah,yah lupa sebut orang
siti89nurjanah,baik lebih rem apa yang sering anda sebut goa sudah tobat tidak julitin goa hanya hih
siti89nurjanah,tidak boleh begitu
siti89nurjanah,ganti ah ini baca
siti89nurjanah,iya tuhan untung bukan goa
siti89nurjanah,sering baca yasin tiap habis maghrib saja tetap suara begitu begitu saja tawa memang sudah bakat seperti haha
siti89nurjanah,tidak pasti akan tidur atas sajadah tawa
siti89nurjanah,baik belum pindah
siti89nurjanah,baik belum pindah nyala
siti89nurjanah,baik belum pindah nyala
siti89nurjanah,coba anda renung ya
siti89nurjanah,kenapa orang sih ngaji pakai suara yang enak sekali buat didenger
siti89nurjanah,benar takut asam lambung tawa cuma tidak tahu bagaimana agar habis subuh tidak tidur selain minum kopi tidak sahur
siti89nurjanah,whatsapp iya kanas tugas akhir in
siti89nurjanah,iri taruh sudah lihat orang yang sholatnya benar benar khusu
siti89nurjanah,satu server
siti89nurjanah,syukur kasih sempat ramadhan tahun tapi kenapa agak sedih begitu karena suasana beda sama tahun tahun
siti89nurjanah,meski suasana yang beda tahun kita tetap bahagia nyambut ramadhan
siti89nurjanah,banyak baca nasihat masih mempan bebal sekali
siti89nurjanah,ngeyel sudah dari hidup tidak ngeyel tidak enak
siti89nurjanah,kasih saya sempat
siti89nurjanah,buat tmpt yang alfamart bawah freezer tinggal kenapa kasir bilang tidak pakai struk karena mungkin itu eskrim sudah beli sama karyawanya sudah cetak stuk jadi tidak mau beli lagi tidak mungkin ctak struk karena dsistem stokny walupun fisik itu sudah punya orang
siti89nurjanah,dalam hati banyak yang ken ungkapin tidak tahu mau mulai mana
siti89nurjanah,telepon adepin saja kalau yang nlpn suka tidak angkat
siti89nurjanah,iya iya cermatin baik baik kalau sampai ngulang tidak ajar arti
siti89nurjanah,terjulid malas hih
siti89nurjanah,merinding seperti ditemplokin ulet bulu
siti89nurjanah,goa tidak pernah lupa sama orang orang yang pernah baik sama goa semoga tuhan kasih izin buat goa balas baik
siti89nurjanah,kalau sudah tidak satu frekuensi malas basa basi
siti89nurjanah,hih serah deh tawa puas iya selamat malam jumat saudara laki tawa
siti89nurjanah,jadi taruh sudah dahal ibu anda yang doa buat balik tawa
siti89nurjanah,tidak samasekali tawa sudah ah malas galou maksud agar imbang begitu masa dunianyata dilema duniamaya galou hih cari konten receh saja tidak
siti89nurjanah,wah pena gertak sini goa jelas inti begini kalau yang datang terus pergi ulang ulang arti tidak niat buat tinggal sadar lah anda bapak
siti89nurjanah,panik ketika waktu buat jawab soal tinggal menit goa bisa lihat tanya apa sinyal sering e tawa
siti89nurjanah,pertama kali punya twitter tahun kelas mts karena tidak paham makenya tidak pada kalau sambat situ akhir tidak perna ngetwet telah goa periksa balas an tawa sudah dibiarin saja itu akun sampai lupa password
siti89nurjanah,saya bisa buat itu
siti89nurjanah,saya tahu apa yang saya laku
siti89nurjanah,ayo hadapin ayo tidak ngindar hanya
siti89nurjanah,yang tunggu tunggu benang oleh anda
siti89nurjanah,tidak awal sudah asa seperti akan ngebuly ini hih
siti89nurjanah,sayang sinyal tidak dukung buat lihat video uwuan orang
siti89nurjanah,sudah tebak ujung nya ngebuly hih malas goa tidak seperti begitu sih tawa
siti89nurjanah,mobil ingat hiragana yang pernah dipelajarin agar tahu baca apa
siti89nurjanah,pena coba
siti89nurjanah,sinyal tidak dukung buat lihat uwuan
siti89nurjanah,oke sesap tidak dilema sini bapak
siti89nurjanah,karena buru buru jadi keliru ah parah
siti89nurjanah,numpang tanya twiternya saudara laki saudara laki biasa mana
siti89nurjanah,kalau rambut sih dipisahin terus lanjut cemil kalau ulet tidak berani cemil tawa
siti89nurjanah,ini saudara wanita cil
siti89nurjanah,minimal beri sempat temu lalu minta maaf baik semua
siti89nurjanah,banyak sekali bisa syukur salah satu beri ruang waktu ungkap semua syukur iya tuhan
siti89nurjanah,sebentar akan kabar baik tuhan sabar untuk diri
siti89nurjanah,wahai tuhan terimakasih beri tempat ruang waktu
siti89nurjanah,ada asing nama kila sudah bias priscila
siti89nurjanah,jadi makin cinta sama bahasa indonesia gara gara bang siwon
siti89nurjanah,panik memang tidak tapi terlalu santai tidak
siti89nurjanah,wajah mirip kucing desa
siti89nurjanah,satu yakin yang beda keyakinanya
siti89nurjanah,tidak niat buat cari total ikut memang tidak yang mau molow sih tawa bahkan tahu ikut teman di rl rasa bagaimana begitu kayak hilang bebas sambat sambat
siti89nurjanah,jujur setuju buat akun supaya sedikit sambat kurang sedikit beban cari motivasi memfolow orang yang inspirasi
siti89nurjanah,sering sekali sudzon sama tuhan alhamdulilahnya kalau banyak beban tuhan kasih sempat buat ngungkapin semua hakim cukup dengar sampai peras benar plong yakin semua baik saja karena tuhan
siti89nurjanah,saat ragu wujud impi besar kita milik ingat tuhan mahabesar
siti89nurjanah,benar sekarang ibu kalau cerah dikit mau keluar tidak usah sebentar sebentar malah hujan
siti89nurjanah,jahe kunyit sereh kayu manis
siti89nurjanah,kenapa belum muncul sudah ketawa sih untung lihat sampai habis jadi paham tawa
siti89nurjanah,status whatsap banyak yang goa bisu buka apa apa lihat cuma lewat lewat doang agar cepat
siti89nurjanah,tenang tuhan kadang bangga hati pikir ingat
siti89nurjanah,insya yakin tidak ragu
siti89nurjanah,hanya cari usaha jadi
siti89nurjanah,segera lah lucu sekali iya tuhan
siti89nurjanah,terlalu asik sembunyi takut publikasi
siti89nurjanah,tidak tahu apa sudah beberapa hari inj rasa yang ngeganjel hati
siti89nurjanah,anak alexandria islamic sekolah penah nyebut sekolah sebut kola tidak
siti89nurjanah,dulu waktu kecil bingung kota santri itu di zona mana
siti89nurjanah,nonaktif lapor baca nyaman
siti89nurjanah,nama nama kucing goa jaman dulu oren hitam belang begy lupa hua rindu
siti89nurjanah,beberapa hari ada ngalamin jadi aneh tidak tahu deh tidak pikir pakai logika pusing
siti89nurjanah,contoh baik anak twitter suka ngelike bantu retweet suka kirim saldo ovo gopay si pengirim yang susah
siti89nurjanah,sakinah mawadah warohmah
siti89nurjanah,ingin dukung kenyat solusi tidur saja
siti89nurjanah,tidak paham
siti89nurjanah,darah halal di bakuhantam
siti89nurjanah,sudah goa kirimin ss an saja goa bilang tidak bicara padahal ibu yang tidak baca njing
siti89nurjanah,tidak berapa yang lebih itu gadis pena goa hantam rasa
siti89nurjanah,ooh shelly yang lcd nya rusak
siti89nurjanah,goa di surabaya
siti89nurjanah,susah sekali si buat tidak pikir sama omong orang ahelah
siti89nurjanah,jauhin orang yang julid dan sarkasme
siti89nurjanah,ken bicara tidak ngegas biadab dia lebih tua
siti89nurjanah,sensitif mudah singgung tidak usik
siti89nurjanah,pura pura asik sama orang yang benci itu muak taruh rasa
siti89nurjanah,kalau sudah nang plong sekali sanyanya
siti89nurjanah,dan mampu usaha maksimal mungkin
siti89nurjanah,lumayan lho oke
siti89nurjanah,memang paling cocok energen sudah cemil mie kenapa mules
siti89nurjanah,lebih ngaji ngaji ngaji nagji ngaji
siti89nurjanah,umur tahun main petakumpet lompat karet bola gebog main rumah an manjat pohon ngebolang sawah banyak
siti89nurjanah,iya sering begitu memang hari yang lalu syukur isi pulsa oke untung sekali dapat cashback oke buat internet yang knya lansung paketin karena kalau tidak buru buru akan potong alam
siti89nurjanah,matin data dulu baru paketin
siti89nurjanah,lucu sekali
siti89nurjanah,suka sekali sama pohon natal tidak apa apa kan
siti89nurjanah,jujur tidak pernah bosan sama rumah sendiri yang rcti
siti89nurjanah,suruh tahajud ini seperti tawa
siti89nurjanah,mana kala seperti sejahtera semua
siti89nurjanah,mau log keluar takut lupa password mau uninstal takut memori tidak cukup tidak mau dinstal
siti89nurjanah,ken mati bulan bulan saja begitu media sosial susah minta ampun
siti89nurjanah,diam ngebatin bicara akan nyakitin heu bingung
siti89nurjanah,bukan tidak tahu cuma pura pura tidak tahu karena tidak semua harus tahu yang usik tenang
siti89nurjanah,santai nikmat proses tidak buru buru kait masa depan
siti89nurjanah,terus semoga bijak ambil putus
siti89nurjanah,penting ibu satu setuju satu frekuensi agar sama sama terus semoga
siti89nurjanah,dia em ibu dong c
siti89nurjanah,neraka tidak perlu balas neraka karena noda tulus
siti89nurjanah,tidak perlu musingin orang yang cuma manfatin baik apalagi sampai pikir henti buat baik
siti89nurjanah,buat baik orang tidak harap dapat balesan baik orang sebut karena balesanya jadi sumber yang tidak duga
siti89nurjanah,sekarang ibu mikirnya kalau mau buat baik lakuin saja harus pikir cuma dimanfatin doang tidak tiap buat ada balesanya
siti89nurjanah,pada bingung mau apa baik pikir resolusi saja iya kan
siti89nurjanah,lelah da pura pura tidak tahu buat menghargain orang lagi bohong pikir
siti89nurjanah,sampai bingung mana saudara laki yang asli benar sudah
siti89nurjanah,aman tidak ini tawa
siti89nurjanah,itu ibu tawa tidak sampai naro tempat yang salah kan
siti89nurjanah,ya goa iri sama gadis pintar cerdas ada ken begitu pintar kayak tapi sama gadis yang dar cantik doang ibu goa biasa saja masa serius sudah
siti89nurjanah,wah apa ini saudara laki bijak kenapa ngatur uang tawa
siti89nurjanah,tenang tuhan sudah nyiapin yang lebih baik depan sekarang banyak saja doa sama usaha
siti89nurjanah,rem ketika viewer status whatsap nomor tidak simpan kenapa sih lihat status goa padahal nomor tidak goa simpan wah bahaya ini
siti89nurjanah,positif pikir itu tidak mudah buat orang lagi turun
siti89nurjanah,harap lancar tidak halang apa
siti89nurjanah,tidak tahu tunjuk dar uji yakin buat lanjut tidak
siti89nurjanah,goa sih lebih pilih diam ngebatin harap tuhan segera memberi tahu orang bagaimana benar kalau tidak mulut goa tambah nambahin dosa saja iya
siti89nurjanah,tugas anda bukan sembuh
siti89nurjanah,kira goa doang tawa
siti89nurjanah,bangga sekali sudah tulis goa mirip sama tulis saudara wanita dian
siti89nurjanah,lama pengunan kartu internet indosat telkomsel
siti89nurjanah,dulu hilang orang yang diangap baik buat sadar diri sendir baik karena yang baik yang baik nah situ harus mulai baik diri
siti89nurjanah,an nas alfalaq alikhlas
siti89nurjanah,iya tuhan bukan yang saya mau ganti yang jauh lebih baik tolong
siti89nurjanah,tidak ken curhat nerima nasihat cuma ken temenin nang saja
siti89nurjanah,masih utuh jaga baik karena kalau hancur sulit seperti mula
siti89nurjanah,alahuma sholi ala sayidina muhamad whatsapp ala alih sayidina muhamad
siti89nurjanah,kira malam akan hujan sudah sedia enak soto telur
siti89nurjanah,ajar buat lebih lunak karena lama terlalu keras
