username,tweet
triaisharaa,begitu itu siksa mulut yah pi
triaisharaa,rekomendasi toko saudara laki tawa
triaisharaa,anak kantor tiba nyetel lagu sudah tuhan
triaisharaa,definisi tidak ada tempat jelek kamera saja kurang bagus tidak punya ketrampilan
triaisharaa,bagaimana anda seperti itu deret det deret det
triaisharaa,sok rada tidak kaharti da pikir nana curhatan cermin lelaki hambar lelaki dunia mun enya teh manya euleuyeur kabeh
triaisharaa,ganti dompet kalau temu yang humoris rata tahun sih
triaisharaa,hidup memang penuh kejut lur
triaisharaa,awkowkwowkowkwokwkwk
triaisharaa,bagaimana mungkin dapur se sempurna
triaisharaa,makin makin hitam
triaisharaa,unpad tahu nyontek hadiah e buat semua matkul semester takut tapi entah mungkin prodiku doang
triaisharaa,ayo pilih
triaisharaa,hampir ini selera
triaisharaa,iya sarfaraz saudara laki
triaisharaa,jagu s benar cinta
triaisharaa,cemil pokok nasi kenapa tidak baso aci
triaisharaa,ingat tidak
triaisharaa,ini saya nyieun cheese kue persis kieu kempes
triaisharaa,coco
triaisharaa,tonton fir br tamat kemarin tawa gemas sama ikjun
triaisharaa,uri ikjun tawa
triaisharaa,mungkin sebuah alas kenapa semua itu doors adalah tutup jadi anda bisa buka satu itu pimpin anda untuk itu sempurna jalan
triaisharaa,tawa baru mulai episode musim betapa telat diri
triaisharaa,awkowkwowkowkwokwkwk
triaisharaa,awkowkwowkowkwokwkwk skripsi tante hal pelakor sugan
triaisharaa,tante tawa kenapa paham pis dunia susu
triaisharaa,benar begitu tawa rindu jng esteh sarebuan
triaisharaa,tawa jaman sampai nya ge pempek nya itu ibu cireng
triaisharaa,asmara bara debar deru dada sejak jumpa anda segala
triaisharaa,eh sial sudah syok nyata lelucon
triaisharaa,utuy dewasa
triaisharaa,jelas itu ibu tawa
triaisharaa,tawa bukankah semua ini tan
triaisharaa,lupa sudah lama tawa
triaisharaa,lelah nangepin ponakan yang doyan tunjuk mati
triaisharaa,cantik tidak galak seperti ateu anda yah dek
triaisharaa,hubung syekali
triaisharaa,tampar tampar awkowkwowkowkwokwkwk
triaisharaa,jadi jomblo saja kenapa
triaisharaa,sedih sekali
triaisharaa,henteu tidak asa ca
triaisharaa,iya sama jadi padat tidak habis kulkas benar arti tawa omong omong terimakasih resep
triaisharaa,kenapa saya kurang beronga habis kukus itu ciut tekstur jadi seperti kue srikaya
triaisharaa,kena t hakim sebuah kue oleh itu s tutup
triaisharaa,apa kata benar kan akhir begitu
triaisharaa,tonton telegram tante ada sejak jam pagi
triaisharaa,mata dadak cerah kalau sudah lihat yang pakai jaket orens
triaisharaa,sesuai prediksi
triaisharaa,tatjana sukan
triaisharaa,nasib film yang lepas bagaimana
triaisharaa,iya mungkin sebut nama kali anisa anisa anisa asik
triaisharaa,lah kan sudah menikah saudara laki
triaisharaa,markicob resep ciskek yang keliatanya masuk akal apa gagal maning pai susu
triaisharaa,setuju jadi jomblo saja semua agar aman
triaisharaa,iya ampun lagu dilema jaman dulu tawa
triaisharaa,coba pakai fw senka yang sempurna putih tanah liat saya rasa kurang clogged pores komedo sejak pakai
triaisharaa,favorit drama awal humoris seru lama mewek serba bingung mau pilih siapa
triaisharaa,baik iya banyak yang sudah hengkang haha
triaisharaa,pusing sekali pusing
triaisharaa,akhir episode yang uras emosi nya tan
triaisharaa,ingat sampai
triaisharaa,iya kali ditayangin jam
triaisharaa,dong tito
triaisharaa,tidak lupa klaim voucher gratis ongkir
triaisharaa,sini has selamat buru barang receh yang murah
triaisharaa,lupa diri tante
triaisharaa,kalap modal goceng tawa kalap tetap hemat
triaisharaa,masih counting
triaisharaa,pusing lihat shopee tidak bisa renti checkout padahal modal shopepay cuma goceng
triaisharaa,lucu balasan nya
triaisharaa,sedih ih
triaisharaa,sanasib tres tawa sampai kali bersih
triaisharaa,tapi cukup mimpi kalau benar jadi mau gila rasa
triaisharaa,kejut mimpi yang luar biasa
triaisharaa,apa haus saudara laki
triaisharaa,zodiak ayah apa cik wkakak
triaisharaa,cisitu tawa kuliah du saudara tawa
triaisharaa,tawa mcd tempat lari kuliah kosong meksim ayo lapar tengah malam meksim ayo janji tunggu orang meksim ayo meksim adalah lyfe
triaisharaa,baru sadar tampan tahun tidak nyadar sama sekali tawa
triaisharaa,kuasa jalan ibu ibu penguna dan max orang ngabuburit kalau ibu ibu ngabuburit naik dan max
triaisharaa,karawang sih
triaisharaa,salah jadwal dong saja terlalu semangat kira libur nyata salah lihat tanggal
triaisharaa,iya tuju
triaisharaa,naha saudara indomaret ning saya ibu saudara rumah langsung tawa
triaisharaa,benar deh padahal rasa eskrimnya turut biasa sekali
triaisharaa,hore besok saat tonton pelakor
triaisharaa,buat konten video klarifikasi baik pi agar dapat adsense
triaisharaa,tawa versi tembem arti
triaisharaa,salah server anda sambil balas seret yuga
triaisharaa,tidak pi tawa
triaisharaa,tuy mirip ih
triaisharaa,malah seperti raya deuih jng pelakor laina celaka miskin
triaisharaa,lelaki tahu diri misquen banyak tingkah
triaisharaa,itu kuasa dari pelakor
triaisharaa,episode lebih emosi bil tawa
triaisharaa,keren
triaisharaa,episode sudah bom ramai
triaisharaa,balas nya ampun deh
triaisharaa,henteu tonton heula br komentar tidak seperti netizen
triaisharaa,buat kota ca tonton
triaisharaa,ji chang wok
triaisharaa,kyuty
triaisharaa,semua siswa indonesia pernah gin
triaisharaa,lihat jajan sini jadi ingat masa sampai dengan
triaisharaa,kembali dana sih
triaisharaa,tidak rasa maret sudah lewat padahal tunggu karena ken tonton sebuah diam tempat
triaisharaa,hai gara iklan tokopedia tres
triaisharaa,sama pertama korean hancur umur gin baru tahu begini
triaisharaa,hari alexandria menemani tonton marcel apa mischa sih
triaisharaa,kalau lapar tinggal jilat bibir
triaisharaa,asimilasi
triaisharaa,syukur yah tawa nyanyi sehat nya rantau sana
triaisharaa,virtual hugs pungpung
triaisharaa,tawa jl pandu itu baru dinding ari raya
triaisharaa,hanasui maret kirim juga ini
triaisharaa,dia
triaisharaa,lihat baik atas padahal bawah sudah gosong seperti surabi
triaisharaa,sial ada saya matak tawa teh
triaisharaa,gembul pena peluk
triaisharaa,kuntilanak
triaisharaa,tidak apaleun
triaisharaa,iya saya baru utama baru perbarui aplikasi mau mulung eh kenapa tidak bisa tawa
triaisharaa,kadang pikir seperti salah ngefolow akun soal jadi impulsif ampun tapi bagaimana
triaisharaa,obat batuk bingung jobdesc
triaisharaa,iya
triaisharaa,mau pergi sapa tetangga sapa teman kantor mobil nyengol dinding akhir ketok sihir bokek naik motor bonceng mau duduk jari kaki tidak sengaja nendang pager benjol naik motor mau pk helm terlalu tenaga helm lempar se ceroboh kalau banyak orang
triaisharaa,si kumbil orang ibu pada ken buat cegah
triaisharaa,sosial jarak sudah tanam diri saya
triaisharaa,sempat lintas loh jujur
triaisharaa,keri
triaisharaa,kira kapan yak kantor diliburin rangka cegah sebar corona tidak sabar
triaisharaa,dia si eci tasik mut kemarin br kabar ayo ah kabarin kalau tasik
triaisharaa,mut kapan tasik si eci ajak ketemu kemarenan baru nge whatsapp masih ingat tidak
triaisharaa,kalau saja tahun cuma preview hidup saya harap saya bisa mulai semua over lagi
triaisharaa,semua varian buat ukur jalan ukur seperti sample jadi pilih mana yang cocok
triaisharaa,kamera mampu terka tiap gera si aa
triaisharaa,kocyak tawa menit
triaisharaa,saudade
triaisharaa,tawa balik bawa virus sebar non super spreader
triaisharaa,sekali mampu beli tiket pesawat seoul tapi corona emosi
triaisharaa,keren bgtsi tim kreatif nya ya pikir seperti gin
triaisharaa,beda garis tangan jadi tyda jodoh
triaisharaa,tarik tawa
triaisharaa,layak jadi konten youtube seperti
triaisharaa,kocyak
triaisharaa,lempar pengantin buket tangan buket sudah mainstream
triaisharaa,jadi ingat amin du jaman kuliah kenapa saya lemah lihat laki utama biola
triaisharaa,kapan neh miko tapei menikah
triaisharaa,dia
triaisharaa,itu saudara
triaisharaa,baru beli tanggal kemarin saudara baru semprot kali foto sekarang masih penuh
triaisharaa,hmns orgasme preloved
triaisharaa,hmns orgasme preloved
triaisharaa,hmns orgasme preloved
triaisharaa,hmns orgasme preloved
triaisharaa,stasiun bandung todong ribu buat donasi yayasan kanker anak dapat voucher cemil sampai tahun depan qaqa
triaisharaa,akhir bayar sudah sampai wangi semriwing seperti saudara wanita yang mai pvj
triaisharaa,pena pindah
triaisharaa,jail sekali ikut perang parfum hype si hmns orgasme eh dapat lah sekarang bingung mau bayar apa tidak sayang uang tapi ken
triaisharaa,benci sama hashtag yang tidak klik isi cuma bel tweet haha malu tidak jelas yang penting tren kira berita apa begitu
triaisharaa,sudah nyebar di grup whatsapp kalau renang omong kosong hamil pft
triaisharaa,h kelam lubuk lingau jadi tingkat mampu ayah jokes
triaisharaa,yeu bukan kalau kata taytay agar s dapat keluar dari ini kota drive keluar dari itu kota jauh dari itu crowds
triaisharaa,saya ingin pisah myself jauh dari semua orang
triaisharaa,kenapa pikir
triaisharaa,aeh suganteh tawa
triaisharaa,eh mnh tidak datang memang tawa
triaisharaa,nya benar kan bieu moshing ceuk saya ge
triaisharaa,kamar ibu ahmad yani ning dekat almut tapi tutup deui ayeuna ibu tawa tapi da singaparna ge tasik panci
triaisharaa,bakso sumatra laksana simpati cicim
triaisharaa,bakso firman ojo loma mie ayam beybey seblak teh eni
triaisharaa,iya benar keren semoga jangkau sama warga pra sejahtera
triaisharaa,buka konsep ngegas lebih baik tapi masih urus kamar orangtua anak laki sama perempuan yang wajib pisah sih terlalu maksa eh tidak apa apa sih kalau perintah mau memberi rumah warga hehehehe
triaisharaa,wajib suami juga sih
triaisharaa,itu hardest bagi ketika saya kalah seseorang tidak yakin yang se sayang sama
triaisharaa,ayo kaliwat nu ribu na aduh
triaisharaa,gumush
triaisharaa,emosi stabil dulu untuk guncang
triaisharaa,angels sampai demons itu tak lihat tamu burung kotak percy jackson dan itu petir curi bc putra dari poseidon adalah jadi goda definitely mungkin
