username,tweet
vanillasvgar,malu bicara baik
vanillasvgar,tawa onyet nackal
vanillasvgar,saya baru balas kalimat langsung dibace seperti mati kan saya kededep jadi e
vanillasvgar,tawa balas langsung sekian detik
vanillasvgar,syudah syul berkat dorong suhu
vanillasvgar,lanjut ya
vanillasvgar,pukpukpuk
vanillasvgar,xabiru menang lihat wkwkwkwkwkwk
vanillasvgar,tawa ibu saya sekali ini
vanillasvgar,kenapa hai ki neh bawa rasa tawa
vanillasvgar,ncips
vanillasvgar,tawa rambut kuda saudara peka e
vanillasvgar,cita cita mulai hari ken jadi tatjana saphira
vanillasvgar,awal sudah sudzon terus pikir tidak boleh sudzon sama orang lalu coba pikir positif usaha hilang pikir buruk akhir malah jadi benar memang benar kadang percaya sama intuisi
vanillasvgar,tidak habis ini mati ikut balas tweet ini tawa
vanillasvgar,astaga sekali bai saudara sebut name e sini makin kesini makin jelas bai wkwkwkwkwkw
vanillasvgar,lah malu lah jadi suami idam wkwkwkwkwkwkw
vanillasvgar,apa mungkin apa nenek malu kelak rindu ude e
vanillasvgar,seperti kene blokir layang bedue tawa
vanillasvgar,aduh tambah jelas ciri ciri e hai mati agik aktif sini tawa
vanillasvgar,aok pria apa kate agresif tawa
vanillasvgar,lah lah kelak kebace nian seperti orang e tawa
vanillasvgar,saudara itu frontal igak malu
vanillasvgar,ahahahahahahaha kelak kebace orang e malu
vanillasvgar,tawa kubus pria berani
vanillasvgar,tanda saudara laki e luk tawa
vanillasvgar,tangis kelak saya ceritain
vanillasvgar,kayak e karena karena e lah malu nikahin saudara bang
vanillasvgar,meriang itu
vanillasvgar,firasat buruk minggu lalu nyata benar jadi memang kalau peras tidak enak ada yang tidak selesai
vanillasvgar,icik klean
vanillasvgar,tawa apa cocok ki ngumong bahasa kubak
vanillasvgar,cuti karena tamu bulan itu wkwkwkwkwkw
vanillasvgar,tawa ki dek betunang
vanillasvgar,ki butuh hibur tawa
vanillasvgar,ingen ki
vanillasvgar,iri bilang bos
vanillasvgar,boba coca kasih putri salju je
vanillasvgar,suka sekali aroma vanila pandan kamar ada kayak di toko kue tawa
vanillasvgar,tangis lupa kapan akhir kali mandi pantai jadi ken
vanillasvgar,kenapa dek uju jadi kayak chibi marukochan tawa
vanillasvgar,mau dikadalin gimanapun tetap akan tahu saya saya tonton anda uwo
vanillasvgar,sumpah tawa tawa
vanillasvgar,asli sejuk ada kayak di kaliurang tawa
vanillasvgar,tahun sekali layang bekabar malu saking sibuk e
vanillasvgar,tawa agik uad lah mati malu
vanillasvgar,hawa kulur malu
vanillasvgar,bosan utama warna jadi begini
vanillasvgar,rusep ubat e
vanillasvgar,bukan ester ajar e tawa
vanillasvgar,tawa buka jasa titip saudara
vanillasvgar,saudara beli toko biase bai tawa
vanillasvgar,baca watpad tidak moy tawa
vanillasvgar,ahahahahahaha saya cari shopee harge e lebih mahal yang saya beli toko kera toko e salah kasih harge tawa
vanillasvgar,jauh lah cuy lebih panjang kubus beli yang kecil dulu
vanillasvgar,rase e sama kayak faedah cuma beda ini dakde bau e moy
vanillasvgar,bukan moy dingin fresh itu
vanillasvgar,penasaran jadi coba kata sejuk dan nyata benar sejuk dong rasa seperti kompres pakai es batu tidak pakai menit pertama langsung ada sensasi dinginya kira cuma iklan doang tawa
vanillasvgar,hilih njlehi
vanillasvgar,tawa saya baru tidak sadar maksud tweet ki ne moy tawa
vanillasvgar,mana sempat keburu telat
vanillasvgar,sini kijang
vanillasvgar,apa lah begeser moy syedih saya
vanillasvgar,seru mantengin proses mungut suara penasaran campur degdegan rasa pena cepat cepat selesai saja
vanillasvgar,kenapa lucu sih tuhan tawa
vanillasvgar,tawa utek saya apa nyampai moy tolong tidak buat teka teki
vanillasvgar,apa kera cerita e ini ki mabuk
vanillasvgar,lingkar cahaya sini gelap
vanillasvgar,modboster saya
vanillasvgar,malas ah panjang
vanillasvgar,cimoy sabar
vanillasvgar,terus saya anda anggap apa
vanillasvgar,bukan
vanillasvgar,haha kedit pakai jepit baju
vanillasvgar,jam gin ada saja yang buat emosi sudah salah paham antem jelasin panjang lebar eh nyata dese tidak nyambung karena lihat video yang saya tanyain ampun kenapa tidak bilang awal samsol
vanillasvgar,saya saya maaf saya tidak cinta anda
vanillasvgar,tiap selesai tonton drama korea selalu rasa sedih kayak yang hilang langsung ada sendiri
vanillasvgar,lelah bolak balik dapur tiap beberapa menit sekali sampai pikir bawa galon kamar agar tidak haus terus pikir ide bagus
vanillasvgar,ahahahahahahaha kenal sekali sama sering bicara begini awal modus balas tweet instastory
vanillasvgar,baru hari tidak ketemu sudah rindu saudara saja padahal tadi pagi sudah vidcal memang obat rindu cuma ketemu tidak yang
vanillasvgar,tawa lihat laku jun wan sama ik matahari tidak kegep sama ik jun
vanillasvgar,lama ada umur tahun
vanillasvgar,baru saja dapat whatsapp saudara tiga memberi kabar hari dia lulus sampai kejut saya sadar nyata diri anjak tua
vanillasvgar,cemil alpukat pakai kental manis jam gin dosa tidak
vanillasvgar,bahaya sekali buka forum jual beli adan perut kosong segala ken beli aduh gusti kuat hamba
vanillasvgar,mayes kenapa nenek tedok
vanillasvgar,tawa eduardo dong
vanillasvgar,dapat sms promosi salon langanan aduh godan
vanillasvgar,akhir besok rasa kerja di rumah haru
vanillasvgar,nang kejer tawa
vanillasvgar,rencana putar
vanillasvgar,dimane rambut kuda muke ki lah muncul whatsapp instagram twitter langok bantut
vanillasvgar,itu s oke itu s cinta
vanillasvgar,mber mber begitu dong
vanillasvgar,ngegas baik anda
vanillasvgar,ah peras dek intan
vanillasvgar,saya talking untuk saya diri in itu cermin
vanillasvgar,sejak siwon ubah jadi saudara laki agung tawa
vanillasvgar,bang anda kenapa sudah tidak bilang bentar anda jadi juri dangdut akademi
vanillasvgar,tawa lem tikus ceu
vanillasvgar,akhir latar belakang foto profil sekarang tidak buat sakit mata seperti latar belakang belum tawa
vanillasvgar,lah paham nian seluk beluk per spj an tawa
vanillasvgar,pikir capatu
vanillasvgar,ada waktu menit enak apa pikir
vanillasvgar,dari lee ik jun adalah itu anda tawa
vanillasvgar,je saudara jelasin bang iya bai pecaye
vanillasvgar,ahahahahahah lanjutin dong nya saudara laki hibur sekali
vanillasvgar,ngukuk kolam renang kasih nama agar tidak ketuker sama tetangga julid sekali anda tawa
vanillasvgar,tawa subtitlenya lucu budak cinta sama saudara ipar sendiri
vanillasvgar,ini lah alas parsel tbs layang kemarin telat e tawa
vanillasvgar,bosan baru ingat laptop tinggal kantor tangis syedih tidak bisa ngedrakor
vanillasvgar,libur panjang saya bosan sih kenapa ada lama sekali
vanillasvgar,syukur sehat lur doa lancar sampai hpl
vanillasvgar,baru tahu kalau mau konsul dokter kandung penuh juang begini antrianya banyak sekali jadi baru selesai tengah malam
vanillasvgar,sibok ki nee
vanillasvgar,badan ada remuk
vanillasvgar,ahahahahahah ketawain ah
vanillasvgar,hai dasar jones gabuy utama sini la
vanillasvgar,tawa sini utama kejora
vanillasvgar,baru kali tonton drama episode jam tidak selesai
vanillasvgar,rasa budak cinta langsung tampak diri sini tawa kurang sikok agik ini
vanillasvgar,bau e sampai sini
vanillasvgar,ayam pukul enak cimoy
vanillasvgar,saya kenapa nyet
vanillasvgar,saya coba sadar teman teman budak cinta
vanillasvgar,jaz cemil tengkleng setuju hidup
vanillasvgar,saya jadi duta sampo
vanillasvgar,ken tengkleng sama sate kambing ngiler
vanillasvgar,kenapa susah sekali ngilangin pecicilan ken seperti orang angun begitu
vanillasvgar,nah baru benar jt rupiah potong pajak
vanillasvgar,mon peta eja baik
vanillasvgar,wah tanya sulit
vanillasvgar,kira sama bapak tawa
vanillasvgar,rindu apa ini
vanillasvgar,baru tinggal jam sudah saja chatnya memang grup isi cerewet semua tawa
vanillasvgar,mie ayam terpal enaq
vanillasvgar,tangis sedih tiap dengar suara takbir biasa rumah dengar suara ayah takbir masjid
vanillasvgar,ayo ajak saudara laki endot
vanillasvgar,mie ayam pangsit fina enak ini kayak
vanillasvgar,hari akhir puasa halusinasi nya makin parah syok lihat garis tangan sendiri kira cacing
vanillasvgar,tawa tawa tawa akun saya apa gembok
vanillasvgar,wakakakakakakakakakakaka mpuy
vanillasvgar,lingkar cahaya pln bicara manajer jaring
vanillasvgar,turun username e sini shuy
vanillasvgar,admin info akun twitter pln wilayah bangka belitung dong
vanillasvgar,tawa lingkar cahaya
vanillasvgar,ntah lah apa paham agik la saya seperti kawan saudara ini je
vanillasvgar,mau bilang rindu ini ya
vanillasvgar,eh aok saudara kan apa puaso tawa
vanillasvgar,awas pagi keluh apa bangun sahur
vanillasvgar,turun foto pakai almet tidak tawa
vanillasvgar,serah aa nya saja deh selera selera
vanillasvgar,bendel berapa sebuah
vanillasvgar,bingung mau apa
vanillasvgar,tawa besok jumat tidak buat dosa agik
vanillasvgar,yang sudah peta mapan kantor kira akan libur panjang eh tahu jumat ketemu wkwkwkwkwkwk kena lelucon
vanillasvgar,panggil manajer jaring e saya nenek bicara
vanillasvgar,pura pura tidak baca
vanillasvgar,whatsapp njaluk diplintheng cocote
vanillasvgar,baru mau sambat mati lampu eh sudah nyala saja ah pln payah
vanillasvgar,kalau saya kembang kempis
vanillasvgar,kembang desa nenek apa
vanillasvgar,ibu dokter di ruang operasi malah asik foto diri pasien sudah tunggu hai keburu metong tawa
vanillasvgar,mandi aik kembang rupa moy
vanillasvgar,chakep
vanillasvgar,apa gi kenapa ikak moy
vanillasvgar,ajar bahasa korea tebak gambar tawa
vanillasvgar,julid anda
vanillasvgar,tawa lucu langsung jemput suram reaper
vanillasvgar,minum formalin ceu
vanillasvgar,bawak oi kelak ibu nenek pakai tawa kalau yang rumah lah habis baru saya ambil facial cuci e saya bacok pale saudara pokok e pria saya kesitu agik saudara itu
vanillasvgar,tawa gulir pin e bawa kantor besok facial cuci sengaja saya tinggal agar apa repot kalau inap tawa yang sikok itu saudara simpen lah agar saudara selalu rasa hadir saya situ
vanillasvgar,kera shuy
vanillasvgar,tidak itu sims tulang belakang lupa dilurusin
vanillasvgar,hari sibuk buat kue itu sims saya tidak urus
vanillasvgar,tawa fakboi sejak dulu
vanillasvgar,tawa mirip potong rambut doang duka
vanillasvgar,pasang favorit
vanillasvgar,syukur hari ada mes masuk ceu
vanillasvgar,jam siang sampai magrib mantengin adon sama oven pingul ada mau copot
vanillasvgar,gong ayo umur tahun tampan
vanillasvgar,jam gin itu paling enak tidur selalu gakuat tahan godan ngantuk kutuk
vanillasvgar,saya benci saya rindu
vanillasvgar,budak cinta anda
vanillasvgar,kelam pikir keburu jual keluar tawa
vanillasvgar,tawa nyinden pakai ost drama kolosal
vanillasvgar,ingat umur mboke tulang lah keropos nenek goyang pulik
vanillasvgar,cita cita sungguh mulia wahai orang tua
vanillasvgar,kedadak kayak e saudara ini tawa
vanillasvgar,efek samping kepiting saos padang ini tawa
vanillasvgar,tawa apa usah kasih ampun buk tia kebiase ngulok orang tue gawe e tawa
vanillasvgar,mamam itu ketu tawa
vanillasvgar,tawa karma bayar instan baru tadi saudara ngate saya lemah jantung
vanillasvgar,tetapin dulu seperti siape
vanillasvgar,saya kan apa tahu makanya tanya seperti saudara
vanillasvgar,jam gin ken nyemil bongkar kulkas temu baso ayam langsung buat pentol mercon
vanillasvgar,kegangu kera e je
vanillasvgar,ampun ndoro
