username,tweet
munawaroh_mona,sudah saudara
munawaroh_mona,twitnya tante amerika saudara wanita jaman dulu sering ikut twitnya jaman ngetwit brondong yang parasit sampai sekarang tetap cinta sama twitnya yang selalu bobot
munawaroh_mona,akur akur akur
munawaroh_mona,syukur admin tlp rumah bisa terimakasih banyak atas fast responsif
munawaroh_mona,satu orang ikut saya otomatis periksa oleh
munawaroh_mona,syukur bisa fungsi baik inet indihomenya terimakasih admin atas fast responsif tinggal tlpnya yang
munawaroh_mona,tidak kata hanya timbul luka
munawaroh_mona,sudah periksa pesan langsung tolong terimakasih saudara
munawaroh_mona,lingkar cahaya inet sudah hari tidak conet ini sama tlp rumah juga sudah lama sekali mati tugas datang rumah periksa terimakasih
munawaroh_mona,satu orang henti ikuti saya otomatis periksa oleh
munawaroh_mona,ayo mau daftar tingkat smpyapera hits tingkat smkyapera hits smayapera resmi via online datang langsung yaperahits tunggu kedatanganya
munawaroh_mona,salam wr wb umum umum smk an nurmaniyah yapera ciledug tangerang buka daftar didik baru pdb online ayo segera daftar kan anak saudara
munawaroh_mona,pagi ikut tawa habis yang mobil tawa tawa sekali
munawaroh_mona,satu orang ikut saya dan satu orang henti ikuti saya otomatis periksa oleh
munawaroh_mona,satu orang ikut saya dan satu orang henti ikuti saya otomatis periksa oleh
munawaroh_mona,satu orang ikut saya dan satu orang henti ikuti saya otomatis periksa oleh
munawaroh_mona,lingkar cahaya bagaimana kabar dana yang salah transfer september mei bulan belum pasti apa sulit kah tarik dana yang bukan hak
munawaroh_mona,salam bang saudara wanita sama saudara laki ziarah makam saudara laki doa saudara laki semoga saudara laki tempat surga tuhan mafkan emaknya ain yang tidak ikut
munawaroh_mona,salam wr wb selamat hari raya idul fitri h bening hati cuil benih prasangka santunya ucap kala khilaf tidak sengaja mohon maaf
munawaroh_mona,satu orang henti ikuti saya otomatis periksa oleh
munawaroh_mona,pesan langsung saudara harga terimakasih
munawaroh_mona,bisa mes ciledug tangerang
munawaroh_mona,orang ikut saya dan orang henti ikuti saya otomatis periksa oleh
munawaroh_mona,lingkar cahaya kabar uang yang salah transfer bagaimana september sampai mei butuh uang buat bayar kuliah anak tolong bantu selesai
munawaroh_mona,malu sama
munawaroh_mona,pernah coba dan hasil jaga pola cemil tidak diterusin tidak tahan godan bakso mie ayam goreng karena memang makanya yang rebus bakar saja
munawaroh_mona,saya sekali ini saudara wanita rasa begini saya ibu sudah ibu
munawaroh_mona,syukur clear terimakasih atas fast responsif juara sekali deh
munawaroh_mona,sudah terimakasih anda
munawaroh_mona,lingkar cahaya mes sate ayam tambah lontong mes lontong kemas cuma kalau kayak gin komplainya mana
munawaroh_mona,satu orang henti ikuti saya otomatis periksa oleh
munawaroh_mona,ibu drama korea bukan film korea
munawaroh_mona,benar pakai sekali
munawaroh_mona,banyak saudara wanita kondisi begini lsm ormas datang sekolah alas minta lapor padahal inti minta amplop buat thr padahal sekolah libur hanya tugas piket
munawaroh_mona,orang henti ikuti saya otomatis periksa oleh
munawaroh_mona,satu orang henti ikuti saya otomatis periksa oleh
munawaroh_mona,akhir akun palsu blokir
munawaroh_mona,drama
munawaroh_mona,setuju
munawaroh_mona,satu orang ikut saya otomatis periksa oleh
munawaroh_mona,akun resmi ceklis biru
munawaroh_mona,hati yang punya rekening foto bukan akun resmi bank bri hati sama persis akun asli
munawaroh_mona,syukur keburu sadar kalau bukan akun twitter resmi karena hubung nasabah mengunakan nomor telepon bukan akun resmi
munawaroh_mona,inalilahi wainailahi rojiun lamar jalan saudara laki didi kempot
munawaroh_mona,rekening nasabah terima kan sudah tidak aktif belum salah transfer karena saldo cuma ribu tapi karena salah transfer jadi aktif karena dana masuk pihak dong tarik dana saya
munawaroh_mona,jadi sekarang mesti bagaimana apa tetap tunggu bulan bulan atau tahun tahun sampai saldo yang salah transfer tarik nasabah terima
munawaroh_mona,jembatan sampai bulan saldo masih nangkring rekening terima salah transfer sampai sekarang bagaimana jembatan minta kontak nasabah langsung tidak kasih mau datang langsung cabang terima tidak jamin cair temu
munawaroh_mona,bukti salah transfer jelas tidak rek jelas kenapa tunggu bulan cair dana
munawaroh_mona,minta nomor kontak nasabah yang salah kirim tidak kasih jadi benar maksud apa sekian bulan tahan dana nasabah
munawaroh_mona,malah suruh yang cabang langsung kalau cabang lampung tidak pasti bisa cair dana
munawaroh_mona,paham kenapa saudara ya minimal pihak bank hubung kantor cabang lampung info rek terima segera hubung terima minta setuju unthk debet rekening
munawaroh_mona,masa iya tiap tlp panggil pusat bank cabang buka jawab sama saja jadi bagai nasabah mesti bagaimana
munawaroh_mona,masa iya tinggal mindahin dana harus tunggu bulan bulan dalam satu bank loh bukan beda bank
munawaroh_mona,mungkin bank bri uang seperti itu kecil bagi tunggal ibu kondisi sepwrti ya sangat butuh dana sebut
munawaroh_mona,lapor dari tanggal september sampai sekarang hari tanggal mei ada juga
munawaroh_mona,kan terima rekening jelas cabang jelas dana tetap di rekening yang salah transfer kenapa tinggal narik saja balikin rekening susah sekali
munawaroh_mona,lingkar cahaya apa iya urus salah transfer sama bri waktu proses balik rekening tidak batas
munawaroh_mona,saudara di periksa terimakasih
munawaroh_mona,lingkar cahaya bagaimana kabar dana yang salah transfer bulan nov sampai sekarang ada kabar padahal salah transfer sama bri
munawaroh_mona,orang henti ikuti saya otomatis periksa oleh
munawaroh_mona,satu orang ikut saya dan orang henti ikuti saya otomatis periksa oleh
munawaroh_mona,satu orang ikut saya dan orang henti ikuti saya otomatis periksa oleh
munawaroh_mona,satu orang henti ikuti saya otomatis periksa oleh
munawaroh_mona,mohon sabar uji
munawaroh_mona,nama bukan mudik pulang desa
munawaroh_mona,drama korea soal selingkuh dunia dari itu meni
munawaroh_mona,orang ikut saya dan satu orang henti ikuti saya otomatis periksa oleh
munawaroh_mona,ingat saat kalian gabung twitter ingat
munawaroh_mona,satu orang ikut saya otomatis periksa oleh
munawaroh_mona,tuhan padahal biasa darah rendah pantas saja tengkuk leher sakit sekali tuhan sehat sehat sehat
munawaroh_mona,ken nang tidak tuhan tidak ngebayangin depa bagaimana
munawaroh_mona,satu orang henti ikuti saya otomatis periksa oleh
munawaroh_mona,padahal sudah usaha kerja maksimal sekali masih salah saja mau bagaimana sih inalilahi
munawaroh_mona,satu orang henti ikuti saya otomatis periksa oleh
munawaroh_mona,hai saudara admin beberapa kali mau isi saldo ovi via bri bni tidak kenapa apa sedang ganguan tidak tanya saldo rekening bank insya tuhan isi ovo ribu sih
munawaroh_mona,tuhan bareng gin syukur selamat saudara aisyah bang atas lahir putri selamat buat saudara laki galang sudah punya saudara semoga jadi sejuk hati
munawaroh_mona,syukur punya cucu selamat saudara dimasalhidayah saudara novapurnia atas lahir putri pertama semoga jadi sejuk hati orangtua selalu jadi bang
munawaroh_mona,satu orang ikut saya otomatis periksa oleh
munawaroh_mona,salam wr wb umum umum smk an nurmaniyah yapera ciledug tangerang buka daftar didik baru pdb online ayo segera daftar kan anak saudara
munawaroh_mona,salam wr wb umum umum smk an nurmaniyah yapera ciledug tangerang buka rim didik baru pdb online ayo segera daftar kan anak saudara
munawaroh_mona,saya menikah baru bulan suami mati rasa bagaimana begitu bawa rindu nang sedih bapak yang sekian tahun sudah anak aah brebes mil
munawaroh_mona,kemarin sempat pikir apa iya karena lama cuma omong saja realisme silah jawab sendiri nyata banyak teman yang pikir saya
munawaroh_mona,satu orang henti ikuti saya otomatis periksa oleh
munawaroh_mona,padahal infoin wajib pakai masker yang urus dengan rumah sakit
munawaroh_mona,reporter televisi tidak pakai masker padahal ada rumah sakit rujuk corona
munawaroh_mona,satu orang ikut saya dan satu orang henti ikuti saya otomatis periksa oleh
munawaroh_mona,kayak lagu elvy sukaesih bang
munawaroh_mona,saudara laki tempat sampah
munawaroh_mona,cashback beli pertama kode munaw ayo unduh aplikasi shopee sekarang nikmat belanja gratis ongkir
munawaroh_mona,tuhan kenapa sih pada berani sekali padahal kan virus corona sebar tidak pikir kalau keluarga kena masyarakat apa iya tidak di tunda unbk yang rencana jauh hari corona rebak saja di tunda inalilahi
munawaroh_mona,satu orang ikut saya dan orang henti ikuti saya otomatis periksa oleh
munawaroh_mona,munawaroh bagi kupon diskon rp buat belanja sembako ngantri tokopedia klik link untuk ambil kuponya akhir
munawaroh_mona,jaga sehat diri sampai keluarga tangan sanitizer gratis bagi info sekarang
munawaroh_mona,diam
munawaroh_mona,satu orang henti ikuti saya otomatis periksa oleh
munawaroh_mona,hehehehe iya sih saudara wanita kalimat akhir memang humoris sekali kira apa begitu nyata cuma agar irit saja
munawaroh_mona,hehehehe kalimat akhir kenapa tidak ap ngirit saja
munawaroh_mona,tawa saja lah
munawaroh_mona,percaya luka apa sembuh hati belah sekalipun akan rapat iring hadir rekat
munawaroh_mona,saya bukan patung robot kuat kuat tahan emosi kadang hati tiba belah kadang darah ikut rapat meski tidak utuh
munawaroh_mona,hidup rasa ekspresi tanpa emosi hati harus kokoh lebih kokoh karang laut
munawaroh_mona,satu orang ikut saya otomatis periksa oleh
munawaroh_mona,ego selalu lewat batas tanjung terlau banyak timbang yang ujung nya paksa hendak sendiri
munawaroh_mona,agar yang muda yang karya selera bagus beda kita yang kepala bahkan lebih
munawaroh_mona,padahal waktu sudah mepet tanjung dong bapak situ menangin ego sendiri saja
munawaroh_mona,biasa terlalu ngebosy mau sendiri
munawaroh_mona,debat kusir akhir zonk
munawaroh_mona,ibu ken nang tidak mak tanjung benar rasa
munawaroh_mona,satu orang henti ikuti saya otomatis periksa oleh
munawaroh_mona,kronologi
munawaroh_mona,tuhan inalilahi semoga husnul khotimah amin
munawaroh_mona,cinta bukan arti menang kalah bukan perkara milik milik cinta lengkap enap
munawaroh_mona,da kala hati jalan logika cinta buah rasa bisa pudar kapan
munawaroh_mona,cashback beli pertama kode munaw ayo unduh aplikasi shopee sekarang nikmat belanja gratis ongkir
munawaroh_mona,biasa emosi tidak jelas tanya baik malah nyuekin
munawaroh_mona,cashback beli pertama kode munaw ayo unduh aplikasi shopee sekarang nikmat belanja gratis ongkir
munawaroh_mona,babeh sakit ya tuhan angkat sakit baba amin amin amin
munawaroh_mona,mau anda lihat matahari tenggelam sama kapan
munawaroh_mona,sungguh minggu benar minggu lelah utama hari banyak banyak istigfar saja deh
munawaroh_mona,jadi cukup iya bapak begitu iya bapak tidak ap
munawaroh_mona,kalau jawab juga pusing sama lapor
munawaroh_mona,kalau bicara saya diam saja kata tidak hormat sama bos
munawaroh_mona,benar memang perempuan hebat kuat semangat harus pintar rasa kalau bos ngomongnya saya semua dengan masalah yang beda bagaimana tidak pusing
munawaroh_mona,lah siang gilir bos yang satu ngadunya lah bapak kenapa jadi saya semua sih saya juga pusing bapak buat lapor terus
munawaroh_mona,kenapa si bapak tidak negor ketua langsung kan tidak tahu ap ajak rapat juga tidak pernah ampun sudah
munawaroh_mona,lah hari pagi sudah whatsapp urus yang bukan enak sekali whatsapp kirim foto langsung marah difikir kita tidak pekerjaan
munawaroh_mona,hari yang lalu bos sayang ngambek syukur akhir sudah tidak ngambek
munawaroh_mona,gin ini repot kalau punya banyak bos riwuh
munawaroh_mona,maaf anak smkyapera hits emaknya ain rekan foto duluan smks an nurmaniyah ciledug
munawaroh_mona,satu orang ikut saya otomatis periksa oleh
munawaroh_mona,perhati sayangnha sama anak gadis emaknya ain yang begini kadang yang buat maju mundur
munawaroh_mona,ambyar
munawaroh_mona,mulai deh ego keluar mau menang sendiri keluar
munawaroh_mona,juga kalau canda enak suasana hati enak padahal bukan etik orang yang mudah ajak canda
munawaroh_mona,kalau manis enak nyaman buat ngobrol
munawaroh_mona,baik sekali si bapak selalu ngertin emaknya ain
munawaroh_mona,memang anda pikir anda doang yang kerja anda doang repot anda doang lelah sama emaknya ain juga manusia yang tanjung bisa lelah
munawaroh_mona,hai anda orang surabaya tanjung benar mesti kalah terus nerima terus ngertin terus tidak sekali kali anda yang kalah anda paham anda yang nerima buka pasang harus saling beri terima
munawaroh_mona,aduh bapak pakai bilang tangungjawab bapak pertama karena bapak bapak sambung hai bapak nama bapak nikahin janda satu parsel lah tidak sama emaknya saja anak urus aduh esmosi pagi
munawaroh_mona,ah suka sekali ini sama jawab terimakasih tante amerika
munawaroh_mona,saudara wanita cantik kalau pria baru dekat terus kalau ajak jalan cemil alas tidak punya uang terus ujung nya pinjam uang apa juang dengan alas cinta maaf tidak modal
munawaroh_mona,hotel lihat keren dekat gunung bromo buru matahari terbit perlu begadang via
munawaroh_mona,satu orang ikut saya dan satu orang henti ikuti saya otomatis periksa oleh
munawaroh_mona,satu orang henti ikuti saya otomatis periksa oleh
munawaroh_mona,satu orang ikut saya dan satu orang henti ikuti saya otomatis periksa oleh
munawaroh_mona,satu orang ikut saya dan satu orang henti ikuti saya otomatis periksa oleh
munawaroh_mona,satu orang henti ikuti saya otomatis periksa oleh
munawaroh_mona,saya pahlawan saya semua sehat beh saya sayang anda penuh klinik prima medika ciledug
munawaroh_mona,rencana jalan libur keluarga h saya malang batu lewat
munawaroh_mona,satu orang ikut saya otomatis periksa oleh
munawaroh_mona,pertama gambar christ gereja melaka
munawaroh_mona,satu orang henti ikuti saya otomatis periksa oleh
munawaroh_mona,mau coba aah terimakasih info tante amerika
munawaroh_mona,item tinta cuminya saudara wanita
munawaroh_mona,satu orang ikut saya otomatis periksa oleh
munawaroh_mona,terimakasih info admin yang baik
munawaroh_mona,admin mau tanya kan sudah ngecek ini parsel hari ribu jadi kalau lama seminggu aktifin parsel tiap hari ada yang langsung seminggu parsel roamax
munawaroh_mona,saudara umat nasrani raya natal selamat bahagia sama keluarga cinta damai sejahtera
munawaroh_mona,satu orang ikut saya otomatis periksa oleh
munawaroh_mona,mobil pesan buku bapak dokter lihat status saudara laki fesbuk
munawaroh_mona,selamat ibadah malam natal saudara laki eko keluarga raya semoga ibadah malam jalan baik lancar tuhan kati amin amin amin
munawaroh_mona,hubung seperti gelas kaca kadang lebih baik meningalkan gelas pecah pada sakit diri sendiri menyatukanya
munawaroh_mona,satu orang ikut saya otomatis periksa oleh
munawaroh_mona,terimakasih info admin
munawaroh_mona,selamat malam admin mau tanya parsel internet yang langsung negara malaysia singapura thailand lama satu minggu karena lihat aplikasi masing negara satu minggu mohon info terimakasih
munawaroh_mona,syukur ke kali terima admin terimakasih atas responsif semoga makin maju amin
munawaroh_mona,bingung sama sopir kenapa kalau memang lokasi jauh terus saldo tidak cukup mes pelang terima edisi kalau batal ken cemil roti
munawaroh_mona,saya butuh bahu untuk menang nyala
munawaroh_mona,bilah pisau tancap keping hati sisa luka amat sakit untuku
munawaroh_mona,oke bapak dokter terimakasih info akhir balas
munawaroh_mona,rasa rindu makin dera hati hilang anda bang rusdi al fatihah
munawaroh_mona,lanjut
munawaroh_mona,satu orang ikut saya otomatis periksa oleh
munawaroh_mona,bapak dokter mau ikut po cara bagaimana
munawaroh_mona,sepi sekali rasa tinggal anak pkl minggu bagaimana kalau kuliah luar kota luar propinsi luar negara
munawaroh_mona,lebih baik sendiri sangat tanya calo sudah belum
munawaroh_mona,rindu sapa rindu sudah lagi doa yang selalu panjat semoga saudara laki dapat tempat baik sisi tuhan swt hilang anda jadi sangat bang alfatihah
munawaroh_mona,satu orang ikut saya otomatis periksa oleh
munawaroh_mona,satu orang ikut saya otomatis periksa oleh
munawaroh_mona,satu orang henti ikuti saya otomatis periksa oleh
munawaroh_mona,orang guru bukan dia profesi bagai guru siapa yang ikhlas rela ilmu orang selamat smks an nurmaniyah ciledug
munawaroh_mona,cashback beli pertama kode munaw ayo unduh aplikasi shopee sekarang nikmat belanja gratis ongkir
munawaroh_mona,satu orang ikut saya dan satu orang henti ikuti saya otomatis periksa oleh
munawaroh_mona,cashback beli pertama kode munaw ayo unduh aplikasi shopee sekarang nikmat belanja gratis ongkir
munawaroh_mona,orang ikut saya otomatis periksa oleh
munawaroh_mona,cashback juta shopee buru periksa habis
munawaroh_mona,satu orang henti ikuti saya otomatis periksa oleh
munawaroh_mona,satu orang ikut saya otomatis periksa oleh
munawaroh_mona,satu orang henti ikuti saya otomatis periksa oleh
munawaroh_mona,satu orang ikut saya dan satu orang henti ikuti saya otomatis periksa oleh
munawaroh_mona,dokter pernah pakai dorong terlalu akhir ujung lepas akhir dokter buat ngeluarinya
munawaroh_mona,orang henti ikuti saya otomatis periksa oleh
munawaroh_mona,syukur pagi dapat kirim alumni yang datang buat legalisir tambah mantan anak paskibra yang syukur lagi rajin wara wiri smkyapera hits buat latih
munawaroh_mona,cashback beli pertama kode munaw ayo unduh aplikasi shopee sekarang nikmat belanja gratis ongkir
