username,tweet
hasinanr,besok deh kalau sempat tawa
hasinanr,ikut tama alias tiwi alias tiwul tidak naks karangjambu gizi unes mayan ini buat konsul gizi
hasinanr,iya seperti e pey realisme kali agar bapak nya tidak kecewa
hasinanr,baru nyadar kalau semoga pbg nya buat ambigu sa tawa
hasinanr,saya kasi bapak nya res takut tidak dapat trevel
hasinanr,tidak pikir sampai sini tidak buat nama rawat kulit semoga pbg tawa peta bapak usaha jalan nya tunggu uang dulu
hasinanr,nah makanya mit sudah hati saja kadang ada rasa efek samping larut tawa
hasinanr,jadi ingat kalau praktek bnr hati sama larut yang seperti gin karena takut kalau ktauan asdos ngasal ambil larut juga habis sudah lah yang kata sengaja tumpah air keras muka orang gmne cerita hadap an sama asdosku ini kynya agar tw rasa
hasinanr,masak makan vlog komedi dari radit sama mendengarkan lagu acak saja bang
hasinanr,kuning alias kuning tidak tahu kenapa tawa
hasinanr,anda rindu sekali lari muterin putar keranjang deng
hasinanr,rindu sekali pmr an rindu bharega
hasinanr,belum paham juga fungsi cepat uji sbnr nya buat apa kalau nyata begini
hasinanr,ingetin coba tutup buat duduk kesi tanjung nongkrong hanya
hasinanr,kan baru saja slese kn dym
hasinanr,tawa saya sudah tak lihat seperti ceng
hasinanr,sedih kelelawar kalau unggah apa facebook sepi sekali seperti tidak punya teman
hasinanr,minta tolong diplay sampai seperti terimakasih
hasinanr,banyak batire nyata tawa
hasinanr,ayo
hasinanr,mantap sehat menang peta lahir batin
hasinanr,hwa amin terimakasih winda semangat di rantau eh mudik tidak menang
hasinanr,terimakasih sipeh senang eid mubarak mapin kalau banyak salah peh
hasinanr,tolong sadar saya bhw ada kn bedah jurnal ujan
hasinanr,cie tepuk belah tangan
hasinanr,lama an mg njawab nya luar kepala kan sang
hasinanr,brti joki in an
hasinanr,coba jawab anya ke saya ann skor tingkat
hasinanr,ngawur sekali jam gin baru ingat isi logbook
hasinanr,semangat bulan juni res bismillah
hasinanr,sekarang ganti coba res anda cari jurnal nya agar lebih valid tawa canda
hasinanr,res saya googling
hasinanr,tawa itu cercah cerah kenapa kur tawa
hasinanr,siap terimakasih pencerahanya kur tawa
hasinanr,kenapa begitu tawa
hasinanr,kadang tiba rasa kati tiba sedih terus tiba sedih sekali kenapa omong kosong begitu
hasinanr,tele disblh mana sa tawa
hasinanr,bagaimana mitt tawa
hasinanr,cie hny sbts teman obrol
hasinanr,semangat mit
hasinanr,perlu contoh perang
hasinanr,hay mrula
hasinanr,asin tawa
hasinanr,ada jalan an semangat
hasinanr,saya kemarin berani kenapa sama dpl
hasinanr,tul sekali yan tawa isi piring sekarang tawa
hasinanr,tips nya kakwkwk
hasinanr,tawa saudara wanita gizi bagaimana saudara wanita gizi
hasinanr,siap bnr sekali yan tawa semangat terus sudah
hasinanr,tidak pernah bayang si akan kn seperti gin
hasinanr,tidak bosan iya an tawa
hasinanr,duka tawa
hasinanr,peye
hasinanr,mikrohifema kelas mata kiri karena kena bola tidak utama minggu tidur duduk syukur sembuh tapi meningalkan minus
hasinanr,nenek tidak lali
hasinanr,hai ci tawa periksa wasap
hasinanr,ci
hasinanr,asik tunggu an
hasinanr,permisi dulu cantik sekarang buluq
hasinanr,lingkar cahaya tawa
hasinanr,ani tawa
hasinanr,tidak begitu juga hai lama tidak lupa otak nya ini
hasinanr,hai tidak mau pikun saya cuma lola saja ani
hasinanr,iya tuhan brisik anda diam sesal saya dengan perkatan iya tuhan peta saya
hasinanr,hai ini mit tawa kbnykan tidur saya seperti nya jadi oleng tawa
hasinanr,puasa dong tawa iya tuhan ingat saja anda fel tawa perkatan yang timbul perkara malu in kelelawar
hasinanr,mapin saya celwk
hasinanr,mafkan saya selola bel tawa
hasinanr,sudah mau wudhu depan kran terus pikir sebentar ganti baju dulu habis utuk langsung sholat belum sholat sampai slese sholat kenapa rasa seperti yang kurang apa iya nyata belum wudhu hz
hasinanr,bodoamat elah mit tawa sudah ktebak si ssh seperti nya
hasinanr,tawa
hasinanr,topik skripsi pengaruh mie nutrisari hadap tingkat tadi derita hipotensi tawa iya tuhan astaga
hasinanr,yang hipotensi coba kali tawa
hasinanr,sodium tapi seperti nya enak
hasinanr,tawa jatuh
hasinanr,tawa hai untung belum terlalu jauh dingatkan tawa
hasinanr,kenapa kalian humoris skali tawa
hasinanr,podo ci tawa semangat cipan
hasinanr,anda ujan kapan ci
hasinanr,sgt tarik bagaimana iya tidak masok tawa
hasinanr,in
hasinanr,rindu pondok tidak rindu kulyah
hasinanr,iya yah yang hafizh kalau tawa
hasinanr,tawa restya minta dicarin jodoh kata ini yah
hasinanr,kejut mg lagi ujan tapi mon peta belum yang masuk otak ini plajaran
hasinanr,haduh rian mantul anda baik kalah res tawa
hasinanr,tutur od mnt
hasinanr,tidur yang nikmat sekali si tawa
hasinanr,tawa untung kebangunya tidak jam ci
hasinanr,kulon jam ndan ci tawa
hasinanr,bapak ibu ingin kelahi harap dirmh mntup pintu
hasinanr,oiya ding sama
hasinanr,kenapa iso ci
hasinanr,tawa misi ci
hasinanr,diam od menuh in notif nya bapak ganjar saja anda
hasinanr,kan anda kemarin siap dulu untuk ms kuliah online yang panjang mit tawa
hasinanr,imtihan undur kuliah online seperti nya panjang tapi kacamata kitab saya ktingalan semoga tawa sedih
hasinanr,tidak begitu od
hasinanr,kurang tahu siapa bapak ganjar tapi sudah yang sosialisasi keliling pakai mobil sampai bicara
hasinanr,haduh mantul sudah skripsi saja lubang semangat
hasinanr,tul germas ayo germas tawa
hasinanr,pipit saudara saudara
hasinanr,panci si res sama kpl bisa hubung tawa
hasinanr,yuhu balik ini jumat kemarin cel tawa
hasinanr,tinggal aman sel
hasinanr,tidak an saya iya ibu baik ibu terimakasih ibu
hasinanr,iya f sudah jelas standar tawa kemarin anda buat besar kelelawar kal ndan
hasinanr,benar sekali perang podo ngon saya tawa
hasinanr,iya tawa ayo anda coba mit sapa tahu hasil
hasinanr,kalau doyan coba f pengirim dia
hasinanr,kera cuci pakai sabun bang tawa
hasinanr,tidak apa apa saya setia ci tawa
hasinanr,terimiciw cipan tunggu traktir durenya lagih ci tawa
hasinanr,tahu tahu tua tahu tahu semester tua iya
hasinanr,mak saya suruh buat twt saja kali tawa
hasinanr,leptop wifi onyka tawa
hasinanr,uji
hasinanr,suka naik kereta sejak kuliah walaupun rumah jauh sekali stasiun tapi pulang pergi ken nya naik kereta tawa saudara wanita naik kereta nyaman waktu nya jelas selalu penasaran akan ketemu dapat alam baru dengan tiap jalan
hasinanr,folbek oy
hasinanr,oke terimakasih ninda
hasinanr,yang tahu tidak bobotsari kalau jam malam gojek ambil tidak
hasinanr,tapi kedele sama vla nya ubi ungu itu tawa
hasinanr,habis buat tawa
hasinanr,coba cerita pu tawa
hasinanr,puncak model poltek memang mantap
hasinanr,kesal sekali ci uji sabar
hasinanr,kenapa kalau matlis desa nyala suka buat lama sekali iya
hasinanr,hai asli tawa maksa dikit si tapi muat kenapa
hasinanr,muat cel tawa
hasinanr,awas kalau masih tidak tidur hari sisain buat pkl an tawa
hasinanr,kantong mata sudah besar apa an
hasinanr,amin
hasinanr,humoris sekali tawa
hasinanr,moso za
hasinanr,kenapa jiwa ngantukan saya sangat darah daging
hasinanr,gosah komentar kerjain tugas akhir saja sana
hasinanr,mafkan saya yang kaku nya seperti kanebo kering bapak ibu
hasinanr,sa biji bunga matahari nya belum tidak ambil astaga tawa
hasinanr,tidak percaya
hasinanr,kan bnrn tidak semoga
hasinanr,syukur kliatan tinggi dikit
hasinanr,ish iya mungkin
hasinanr,lagi diam merhatin saja tanya ngantuk mudah
hasinanr,haduh mantul saya
hasinanr,ajak saya utama ci tawa
hasinanr,hacp mit tidak lupa tawa
hasinanr,amin amin
hasinanr,heleh nasib saya juga pai ki tawa tidak tahu ah
hasinanr,lah ganti desa
hasinanr,rumah sakit yang dekat sini saja mbu yang situ memang beda seperti tawa
hasinanr,iya iya peta pa dokter semangat
hasinanr,telinga merhatin kenapa mit awkwk
hasinanr,kenapa dosen yang kerja rumah sakit sabar sekali tidak pernah marah
hasinanr,agar itu alir
hasinanr,selamat ulang tahun sasa selamat datang kepala
hasinanr,tahu saya kode kan
hasinanr,saya ajak juga dong tawa
hasinanr,kalau lagi ajar tidak usah lah coba ngafalin merem hafal tidak tidur iya awkwk
hasinanr,sebwah nasihat
hasinanr,kembar saya memang res awkwkw
hasinanr,cemungud ayo pulang desa sama
hasinanr,saya lagi mbilangin anda juga maksud ci
hasinanr,brisik pkl saja sana
hasinanr,hasil hahahihi doang res awkwk
hasinanr,coba jawab
hasinanr,anda tidak pulang si ci
hasinanr,seperti gin sudah lihat lagi nge tari benar kan
hasinanr,ci pindah gizi saja sini ci
hasinanr,sayang punya anda diri apadanya saja la tawa
hasinanr,dulu bilang kurus saudara wanita tapi kenapa sekarang bilang kurus malah sedih tawa
hasinanr,apa minta dikatain apa tawa
hasinanr,bingung kenapa
hasinanr,kalau sudah tahu jawab kasih tahu saya gung tawa
hasinanr,pesan langsung saya tidak baca saudara
hasinanr,syap tunggu saja tawa
hasinanr,rindu kamo ci
hasinanr,coba julidin saya ci
hasinanr,sudah cemil malam belum anda
hasinanr,tawa apa
hasinanr,ayo syukur
hasinanr,anda si tidak pernah ajak utama
hasinanr,flo
hasinanr,kulit beli dimana yut
hasinanr,ikut kembali bang
hasinanr,setuju tawa
hasinanr,gaktau gung haha saya sobat kos medit jadi tidak pernah beli
hasinanr,belum tawa tempat sampah gung
hasinanr,seperti leminerale tidak si manis nya begitu
hasinanr,tidak bulan tengah tawa
hasinanr,bulan yang tidak rasa
