username,tweet
kerakteloorr,yem tumben lambe sangat patut acung jempol terus tidak ngene ayo nduk genduk
kerakteloorr,sedang gugup an
kerakteloorr,kelan kelon tinggal nang modyar nyala
kerakteloorr,nglamak tawa
kerakteloorr,terimakasih anda fi
kerakteloorr,seng kate nuko tidak kowe endog siapa gundul teabreak ono telur e sebuah v menang
kerakteloorr,turu lek jomblo rausah megaya kelon an
kerakteloorr,saya saya bangkrut anda jadi deep madu
kerakteloorr,sedang cari jodoh cari tenang diri
kerakteloorr,ndek telegram durung metu saudara wanita v
kerakteloorr,bicara anda sama kaca
kerakteloorr,rindu tutuk kene sambat kademen
kerakteloorr,cara baru saya cemil pon tawa
kerakteloorr,uw takut
kerakteloorr,ujan saja dulu seperti sudah paling benar tok v
kerakteloorr,benar sekali tawa
kerakteloorr,apa buat suasana hati anda baik hari jajan kucing
kerakteloorr,saya minta punya kating tawa cuma formalitas saja gas tuhan ken kayak sekarang gaspol begitu nah tok agar slese jadi tinggal matkul doang gitunag
kerakteloorr,tawa benar tawa
kerakteloorr,sudah tidak tahu lage menanges paksa sama bapak ame saja kalng kabot v
kerakteloorr,memang tahu arti apa merk teh persegi kan
kerakteloorr,iring jalan waktu kerja v
kerakteloorr,sudah ompol ngengek ayo ngene tawa ganok seng buka deng megelno
kerakteloorr,ganti te amo saja kan juga
kerakteloorr,tidak rasa mau semester saja baru kemarin pesmaba hai
kerakteloorr,anda hapus satu kata kamus arti siapa akan mengunakanya kata apa anda pilih benci benci tidak pakai bisa
kerakteloorr,anda mimpi apa tadi malam mimpi setan
kerakteloorr,rampal tawa dieng v
kerakteloorr,paham yawes suwun hayuk renang
kerakteloorr,ho saya lihat masuk daftar makas kriwil
kerakteloorr,bukan loh tutup ish corona jancok ini mana shen
kerakteloorr,oalah paham saya coba iku sudah df e meo ini buat kantong bolong v pantas saja meong njaluk nyusu tok twt
kerakteloorr,oke masuk daftar makas rekomnya
kerakteloorr,berapa kilogram
kerakteloorr,saya hitung tidak mau rumit tawa sudah df e tok kan seng bahaya df e sangat baik kui gapopo tugas akhir kan murah padahal kandung garemnya memang tidak banyak buat sakit ginjal
kerakteloorr,iya saudara maksud saya itu kalau df nya bagaimana begitu tawa oricat mahal tidak
kerakteloorr,iyoiyo sok lek ono teh istirahat sama seblak tidak tuko ne saya lali omahmu eh eling deng sok awan ayo
kerakteloorr,ancen tidak ono benar e urip brti
kerakteloorr,yang warna warna merah muda gas boleh murah kenapa tidak apa apa malah si df meo mahal bahaya
kerakteloorr,ndamau rumit
kerakteloorr,mathane dia kolam sudah buka tugas akhir ayo gas saja rampal bagaimana saya kate ngolek sepeda pancal dia shen
kerakteloorr,menanges yang harga range tapi bagus apa da kalau wf meo tidak masalah ya df nya saja kan
kerakteloorr,dia lali john twt peta daku tawa ayo renang temenan ini apa mlayu tugas akhir ken seng segar
kerakteloorr,v
kerakteloorr,dia benar saya memberi wf sama df meo meong
kerakteloorr,peta tipu soale dudu yahudi
kerakteloorr,ayo peta untuk sayang tawa ken renang saya shen
kerakteloorr,taek anda pren
kerakteloorr,tidak ken tugas akhir tidak tuku saudara laki v
kerakteloorr,mangkane jametmu gentien semire
kerakteloorr,saya saya racun
kerakteloorr,mesti kalau sudah seperti gin pusing mbliyeng tidak jelas
kerakteloorr,sumpah pakde saya gel nguyu
kerakteloorr,leo budak cinta psikopat
kerakteloorr,pena mukul kepala sendiri teriak tidak henti bentar saja
kerakteloorr,enak seperti kalau punya orang yang diandelin
kerakteloorr,siapa hendak mukul kepala sampai jari kaki la kuin percuma
kerakteloorr,emosi benar campur aduk sekarang
kerakteloorr,seperti cuma ngela napas anjr tawa
kerakteloorr,saya
kerakteloorr,iya tunggu saya mati sebentar tawa
kerakteloorr,pikir saya lupa dokter tidak saran minum susu bahkan basa lupa tanya alasan
kerakteloorr,dokter tidak nyaranin tidak asam lambung minum susu omong omong
kerakteloorr,asam lambung naik mantap
kerakteloorr,ive tryin talkin untuk saya ibu tapi dia tidak pernah heard saya
kerakteloorr,game favorit cinta nik v
kerakteloorr,bangkai
kerakteloorr,senja tai biadab
kerakteloorr,sama saya juga tidak pikir coba cari artikel tanya orang ahli
kerakteloorr,iya malu lupa kalau bot gimane sik anda ah
kerakteloorr,bagaimana anda jelas warna orang buta tidak tahu sumpah tidak pikir kalau dipakein tulis braile begitu bagaimana
kerakteloorr,ajar lah ajar online kan proses kan saya jawab tanya ente maemunah
kerakteloorr,aduh tidak simak pertanyane deng tawa bahasa ingris ofc jerman sama spain uh elegan sekali susah
kerakteloorr,sudah gila gar utama instagram
kerakteloorr,anda bicara bahasa lancar bahasa apa itu bahasa indonesia doang tawa yang lancar kan jowo sama meduro paleng eh tanya tugas akhir ayo
kerakteloorr,tulis dokter jelek lek apik kesuwen ukir selak pasien e nglumpuk tawa
kerakteloorr,tidak
kerakteloorr,gemuy
kerakteloorr,diskusi bagaimana memang e
kerakteloorr,omelin bi tawa
kerakteloorr,atau mungkin lebih dar teman siapa yang tahu iya iya swante saja tawa
kerakteloorr,mangkane pengirim e kepiye untuk
kerakteloorr,pengirim percaya kalau semua ada kota sawah entek
kerakteloorr,anda lebih suka bicara dengar nya gantung suasana hati sikon
kerakteloorr,takut besar ditingalin
kerakteloorr,gila apa pernah anda laku muka umum tidak pernah aneh malu in depan orang banyak tidak kenal tawa
kerakteloorr,lebih bahagia masa kecil masa sekarang sekarang
kerakteloorr,gendenh tidak mungkin hari hai twt tawa tidak bawakno seblak sebuah
kerakteloorr,sabar sil bukan sekarang waktu bukan sekarang tidak usah kumat tolong
kerakteloorr,njemur sebentar lur
kerakteloorr,sumpah bengkok gendeng anak ini ancen gaopo njaluk apa saya tidak ternk omahmu
kerakteloorr,hoo seng cilik sekali iku lho rada mbulet apa lonjong ngono tawa muda malu muda v
kerakteloorr,iyase malaikat lek kyok ngono anda baik mbok busek saja yem lek mbok jawab pangah parah
kerakteloorr,apok iso e magrib metu kesleo tugas akhir dislok awak wi butuh jenguk sebuah tawa
kerakteloorr,tengkyu bang jo saudara wanita te saudara laki hijau koneng poteh
kerakteloorr,kiri pakai android samsul saya yang sangat kicil mini gemuy
kerakteloorr,kon rambut kuda lapo nang cangar
kerakteloorr,mangap anda ngab v tawa
kerakteloorr,masuk leceh gase kyok ngunu wi
kerakteloorr,minta makmu
kerakteloorr,hai sumpah kon kyok ngono
kerakteloorr,kene tidak kei ir cekne enak
kerakteloorr,saudara laki ken
kerakteloorr,saya mau gambar kayak gin v butuh bantu
kerakteloorr,malang lek musim mahasiswa baru ngene ngawe kulit klopekan masya tuhan
kerakteloorr,hanying tawa saya
kerakteloorr,iya peta
kerakteloorr,kalau saya santai mesake pasien saudara laki
kerakteloorr,perban tugas akhir dia sudah eruh jadwal urung senin ujan lho ayo
kerakteloorr,anak gendes ndi saiki awak
kerakteloorr,nomor tidak facebok iya
kerakteloorr,uname saya keraktelor belum pernah coba keraktelor yang benar tawa kalau kerak telur gosong habis ngoreng pernah kali v
kerakteloorr,ujan minggu harap sekali dwong saya tidak tahu mau ajar darimana
kerakteloorr,lokal pred soko ngendi
kerakteloorr,giblik e yasalam terus bagaimana apa seng tugel
kerakteloorr,anak gendeng nubruk apa
kerakteloorr,anda punya bias salah pleasure apa cemil banyak mie tawa
kerakteloorr,yang dimpikan binatang tidak tahu twt saya bukan cenayang binatang
kerakteloorr,ada teori konspirasi anda percaya apa percaya tidak suka lihat nontonin nesie hakim iya tawa
kerakteloorr,asli tanya anda ket winginane ayo
kerakteloorr,lho loro apa awak
kerakteloorr,cilukba sekali wkwkwkwkwkwk anak durhaka seperti gimane begini
kerakteloorr,tuhan umur saya pibesday saudara laki keak nu
kerakteloorr,tolong tidak beri atas nyala saya
kerakteloorr,selamat pute akhir sambat nya buah hasil lancar putew sampai sumpah semoga barokah amin
kerakteloorr,ken deh punya teman yang kalau ngefoto bagus tawa susah sekali anjr
kerakteloorr,gituya saya kira deseu cuma mau nyemangatin diri sendiri ngab v
kerakteloorr,postinglah yang indah kucing oren indah masio nakal wkekwkwk
kerakteloorr,bagaimana anda tahu kalau anda sedang celaka cinta ayo ndelok pacar saja binar tawa
kerakteloorr,bagaimana anda kenal diri aplikasi kencan ntah ngalir saja ditanyain nama jawab begitu lah tawa
kerakteloorr,gadis tidak cuma satu le aduh
kerakteloorr,yoix brouw
kerakteloorr,padahal cerah lur
kerakteloorr,ntah tidak tahu saya malang bukan kraksan tawa
kerakteloorr,anda pernah pikir jadi vegetarian pernah pikir ayam geprek enak sama rendang kuat v
kerakteloorr,anda ubah satu dari keluarga apa anda ubah tidak
kerakteloorr,apa giat favorit waktu sengang main telepon
kerakteloorr,katae sih begitu saudara bagaimana yak posisi mall kerja tawa
kerakteloorr,beta setuju saudara
kerakteloorr,iya se saya lupa tweet lewat begitu nde beranda periksa suhu mal dulu kayak macam formalitas saja soale dicekin masuk dicekin masuk tidak tahu dri luar suhu lingkung kayak apa v
kerakteloorr,tuhan manusia gin yak
kerakteloorr,drama gimane paman
kerakteloorr,sial hipoter v
kerakteloorr,anda punya lelucon favorit coba cerita tidak punya v
kerakteloorr,berapa dekat anda ayah ibu apa yang paling kesan mereka hidup paling dekat sama ibu sih soal ayah kan dulu kerja pindah sekarang netap ya pisah tawa semua sama beliau kesan kenapa mau
kerakteloorr,rambut poni pager atau rambut smothing poni pager rambut saya sudah lurus sekali
kerakteloorr,satu yang pertama kali lihat pria mau suka sama gadis gatao saya kan gadis tawa
kerakteloorr,pilih wanita kerudung pilih wanita tidak kerudung sama semua yang bedain dua cuma akhlak sama sikap akhlak yang tahu cuma tuhan bukan anda sikap barudeh ngliat sendiri
kerakteloorr,apa paling bisa anda laku matematika logika matematika bodoh sekali tawa kan sama saja v
kerakteloorr,ada orang pria yang dekat anda buka hati dia pikir tentu kenapa tidak sebagai teman benar
kerakteloorr,anda orang aktor anda lebih pilih tampil bagai aktor teater film film deh seperti eh teater asik tidak si saya tidak tahu beda tampil mana
kerakteloorr,benar musim mahasiswa baru
kerakteloorr,tawa tidak nyambung sumpah tikar bukan soal lapar ngaknya les
kerakteloorr,pol
kerakteloorr,neraka
kerakteloorr,ken mukul orang sumpah
kerakteloorr,benar sekali saudara laki e tawa
kerakteloorr,cepat sembuh adeknya saudara yang nuduh neraka benar bodoh kalau mabuk atau apa sengaknya bantu siram dulu perkara ngehujat belakang kenapa sil tuhan
kerakteloorr,amin tutup itu biji mata
kerakteloorr,tidak pernah iya ada ente
kerakteloorr,tempat sampah saya chatime saya maksa
kerakteloorr,hai rambut kuda anjr
kerakteloorr,kalau suruh nebak sakit paksa hapalan anatomi mahamin organisme dulu saudara wanita masio malaikat dijabani lek dikongkon matematika fisika ngitung kyok ngono kimia asli menang
kerakteloorr,ayo peta tugas akhir brouw tawa
kerakteloorr,tidak paham dek
kerakteloorr,ganok uwong e tawa
kerakteloorr,ampun tawa
kerakteloorr,siapa siapa sini kasi tahu
kerakteloorr,lha kon bicara seng brewokan bagaimana untuk brouw
kerakteloorr,lapo lapo kene ngrasakno pis kan wkwkwkwkwkwk
kerakteloorr,kadang heran kalau pakai profpict segeran dikit replynya sial manis taruh seperti gula abet saya gilir tidak pakai muka saya jadi tai kesal wkwkwkwkwkwk jijik
kerakteloorr,lho brouw ini lak brewok pis untuk
kerakteloorr,enak saja anda saya dipangil saudara laki mata anda peang
kerakteloorr,memang saya bajing tidak dosa paham tidak konteks saya bicara begitu apa bz
kerakteloorr,mata telanjang tangkap cepat suara cepat cahaya tidak deh seperti
kerakteloorr,apa bahagia anda jajan jalan saya belai
kerakteloorr,bagaimana cara tunjuk adan hati saudara wanita ketawa lelah muring benci bicara sumber tawa
kerakteloorr,kapan akhir kali anda nang karena apa tadi malam sakit kumat tawa
kerakteloorr,cipta satu kata baru arti bubugaga saya cinta anda tawa giblik
kerakteloorr,jadi tidak rasa salah yeu kalau baca baca doang v
kerakteloorr,nyoh ini sebuah tawa
kerakteloorr,suka suka saya ngab biasa ribut saja
kerakteloorr,tidak paham
kerakteloorr,menang saya lihat tugas
kerakteloorr,memang semua kucing oren tidak saudara akhlak dikit sama babu heran saya
kerakteloorr,tawa sedih gimane masya tuhan
kerakteloorr,kuyang ubah jadi cantik begitu yeu
kerakteloorr,wi gumush
kerakteloorr,tidak saudara soal tidak ada lawan
kerakteloorr,pertama saudara v
kerakteloorr,saudara laki ayo kontrak saya laki tidak apa apa
kerakteloorr,saya tunggu cuma set jam kenapa tawa turut rasa biasa saja cuma memang pemandanganya ala paralayang saja
