username,tweet
arisetiyani12,labil mau maju mundur
arisetiyani12,akhir akhir cuaca labil sekali
arisetiyani12,ayo ayo
arisetiyani12,template lelucon favorit apa blundernya siapa orang tawa
arisetiyani12,tidak apa apa penting tidak sampai malas buat napas
arisetiyani12,hari hari rabu pukul wib menit kemudian adalah hari
arisetiyani12,akhir akhir twitter ramai sekali baku hantam onlinenya
arisetiyani12,sudah bismillah saja
arisetiyani12,tiap detik buka syukur malah tidak aman astaga ada
arisetiyani12,kalau obat ampuh atas tidak aman sama pikir lebih jamin laku keras
arisetiyani12,drama korea vip transtv tiba tiba ditamatin gara rating nya rendah
arisetiyani12,anda tahu saya sungguh sungguh buat
arisetiyani12,tidak apa apa
arisetiyani12,denting piano padahal mai pakai gitar
arisetiyani12,kali kali uap tetap gagal lelap dasar siapa
arisetiyani12,ken cerita banyak tidak tahu mau cerita apa
arisetiyani12,iya saudara laki memang anda tidak pernah peduli sama saya
arisetiyani12,kena lelucon tawa saya benar tidak masuk dong
arisetiyani12,benar sekali sih akhir akhir memang rindu semua waktu kuliah tidak telat masuk makul salah satu dosen tidak masuk kelas dong
arisetiyani12,soal langsung diterapin uang bentuk nyata jadi langsung tawa
arisetiyani12,mau ralat buat peras jadi tambah beranta kan memang sudah beranta kan piss
arisetiyani12,benar sekali sih ya ampun rindu ngitung begini tawa
arisetiyani12,saudara laki satu memang jakarta garis keras tiada sih
arisetiyani12,apik untuk tawa kan siap mau ngawi agar afdal jadi tahu lagu
arisetiyani12,mau coba mendengarkan ya kayak nuansa sendu dapat tawa
arisetiyani12,tumben tidak jakarta saudara laki tawa coba tek mendengarkan
arisetiyani12,lagu juta umat shawn mendes ibu nyanyi merem agar tambah hayati tawa
arisetiyani12,mantap sih apalagi tidak rasa beri atas sama diri sendiri
arisetiyani12,turun lagu sering anda mendengarkan lama seminggu
arisetiyani12,cepat seperti nya saya amin in tawa
arisetiyani12,jalan jalan jalan syukur syukur syukur syukur syukur syukur syukur syukur syukur syukur syukur syukur syukur syukur syukur syukur syukur syukur inti syukur tidak terhinga saja dulu semoga nikmat tidak terhinga jumlah amin
arisetiyani12,tidak pikir buat ngecrop
arisetiyani12,dong tidak semua harus diupdate mau diupdate semua tidak apa inti ibu gantung masing masing individu asal paham batas lebih bijak memposting jepret whatsapp sih kunci tidak malah aib orang umbar semua jepret whatsapp malu
arisetiyani12,lah kesal tidak buat apa apa cuma mesem haha malu tahan makdeg doang
arisetiyani12,kena t banding kena t banding kena t banding kena t banding kena t banding kena t banding kena t banding kena t banding kena t banding kena t banding kena t banding kena t banding kena t banding kena t banding kena t banding kena t banding kena t banding kena t banding diri sendiri dengan
arisetiyani12,yiseo jadi ah pilih satu satu ini jadi kalian tidak usah ban taman saeroyi tawa
arisetiyani12,langsung cemil saja sudah enak pengirim
arisetiyani12,temulawak kunyit lengkuas jahe ketumbar lada adas jinten
arisetiyani12,iya jang nara benar misteri sekali siapa selingkuhanya
arisetiyani12,beberapa waktu lalu ken tonton episode banyak jadi tunda dulu tawa
arisetiyani12,drama vip kayak bagus
arisetiyani12,wah ini oknum nyanyi harus waspada dunia usaha peng angkring
arisetiyani12,rindu sego kucing sambal teri sambal hati goreng hangat wedang jeruk sate usus bakso puyuh kabeh menu saudara wanita angkring pokoke
arisetiyani12,benar sekali sih meski akhir nasi cooker saya hilang semester skripsi
arisetiyani12,tidak banding diri sendiri dengan lain orang anda yang cantik hanya itu cara anda adalah
arisetiyani12,dulu sering sekali gin tapi tidak apa apa sih turut bagi media buat curah emosi yang kadang sudah tahan hari bahkan mungkin sudah bulan tapi sekarang tidur lebih mendengarkan podcast dulu habis nyetel murotal buat antar tidur asli jamin nyenyak bgtapk
arisetiyani12,pesan moral bisa ambil baca adalah saya tidak mudah percaya sama ilustrasi buka
arisetiyani12,ninuninu
arisetiyani12,silakan jawab dewek tawa
arisetiyani12,tidak apa apa kalau tidak tahu jadi kalau mau ngawi barangkali minat kartonyono tanpa medot janji tawa
arisetiyani12,alula sudah besar bukan bayi dong waktu lalu cepat nyata
arisetiyani12,mau kartonyono medot janji po
arisetiyani12,buat baik dan baik akan datang untuk anda
arisetiyani12,tidak ayah bisa nabung banyak yang penting kalau sempat buat laku baik tidak lewat nabung baik dulu yang banyak akan panen baik juga kenapa yang mungkin tidak pernah sangka saking luar biasa baik yang akan panen
arisetiyani12,sudah lah serah saja sama maha kuasa tidak usah pikir lebih hanya tiap waktu kata diri
arisetiyani12,tipe gabah sungguh keluar dari itu kotak sih alias kreatip sekali nya pikir sampai situ tawa
arisetiyani12,data seperti gin mau di jalan gas kelakar baru normal
arisetiyani12,nilai lebih dosen beberapa mata kuliah wajah cantik itu sebut buah hak istimewa kalau iya dulu saya sering saksi demikian omong omong saksi rasa maklum kntnk tawa
arisetiyani12,datang wisuda bawa bunga lalu foto studio doesn t buat dia dia tinggal
arisetiyani12,saya sekali ibu tawa
arisetiyani12,uang hasil korupsi buat tonton konser coldplay ini punya otak karena ngelakuin hanya orang brainless akhlakles
arisetiyani12,kalau ngeprintnya perum uri saya mau uang kalau ngeprintnya kanon tidak mau
arisetiyani12,tul harus optimis dulu dari gambar jadi saldo rekening benar yah amin tawa
arisetiyani12,peta jadi ngerepotin buat otak pikir tawa
arisetiyani12,tidak mau sombong dengan kerja keras nabung hari akhir beli kouta buat unduh beberapa gepok uang ratus ribu
arisetiyani12,bagaimana sudah temu jala tawa
arisetiyani12,memang benar tindak si ibu bukankah harus utama rasa kemanusian
arisetiyani12,lah kata coba cari jalan buat balik bagaimana sih tawa
arisetiyani12,tidak buntu ikan saya beberapa pintu
arisetiyani12,gotta dapat kembali untuk anda gotta gotta dapat kembali untuk anda
arisetiyani12,saya lokasi tidak tahu
arisetiyani12,kayak risiko jadi kampus konservasi tengah rindang gunungpati
arisetiyani12,tawa
arisetiyani12,nge tweet mau anak anjing saja ramai
arisetiyani12,kalau butuh ketawa tawa tonton sih
arisetiyani12,tonton drama waikiki dulu baru paham kul tawa
arisetiyani12,ayo kata kali diri sendiri tawa omong omong rindu junki
arisetiyani12,pagi sudah dapat baik suasana saja amin semoga selalu
arisetiyani12,benar sekali tidak tahu behind itu scenenya seperti apa yah karena cuma lihat luar saja iya lagi ajar buat iri tempat
arisetiyani12,gantung sih kalau terlalu lucu arti halunya sekali eh tidak ding tawa
arisetiyani12,sudah lanjur iri jadi tidak ganggu rasa iri dengan behind itu scenenya dong
arisetiyani12,manis hidup dalam bentuk cemil minum
arisetiyani12,besok habis pandemi selesai ajak lah agar rasa kasi tawa
arisetiyani12,peta tidak bosan cuma cari aman saja takut tidak untuk lewat eh tahu dalam efi tidak dapat kursi alhasil duduk pakai alas kardus
arisetiyani12,baru normal jadi jawab saja habis corona selesai tawa
arisetiyani12,kasi kan naik efi yogyakarta dulu baru naik untuk semarang seperti saya sama dulu pernah gin
arisetiyani12,besok kalau ngumpul ajak saya diskusi rectjeh saja seperti biasa wkawk
arisetiyani12,tidak tahu hasrat hibah tahun akhir merosot drastis alias baik gosip buat cerdas pintar kritis buat asupan otak bukan ribut gosip hidup orang yang kita tidak tahu benar seperti apa
arisetiyani12,ilmu agama ilmu parenting semua memang tidak anda ikut akun tawa besok tambahin ilmu apa tad
arisetiyani12,kira anda penyet tidak jeruk garis keras dulu tidak cemil ketemu kan sana wakwk
arisetiyani12,iya sih pikir gin takut kira plin rencana alias tidak konsisten jadi tetap saja balesnya pakai kromo
arisetiyani12,syukur saya tidak sendiri tawa
arisetiyani12,kira jenis buah buah hai ngejudge tad
arisetiyani12,saya ngechatnya pakai bahasa indonesia eh dibalesnya pakai boso kromo turun sekali nama hai alias saya jadi tidak enak rasa tidak sopan
arisetiyani12,ampun dulu ajak anda cemil dosono asli enak taruh
arisetiyani12,lee minho saya tim tunggu akhir dulu tawa
arisetiyani12,drama apa hai sudah bulan tidak tonton drama
arisetiyani12,kali atas kompor kira kedap api hai
arisetiyani12,omong omong buat tweet jadi stories whatsapp satu menit kemudian kuping belah kiri kenapa tiba jadi panas
arisetiyani12,kira pala ikan ini asal pengal saja
arisetiyani12,bisa orang macam ini sudah sering minta bantu dibantuin humoris belakang malah ghibahin memang ada saja tingkah manusia akhir jaman
arisetiyani12,omong omong saya hapal lirik masa
arisetiyani12,pernah nyimpen lagu di telepon pertama
arisetiyani12,alula bangga lihat
arisetiyani12,lebih kesal lagi tambah ejek saya sih cuma pakai hadap cuci produk saudara doang tidak pakai apa lah anda pakai produk sebuah biasa c tapi muka kenapa tetap saja sama hai nama muka tetap sama mata hidung mulut alis dahi dagu pipi bulu mata hasmboh
arisetiyani12,untuk saya etik biasa amin
arisetiyani12,yang nama setal tiga uang jual dapat uang cemil jadi ngirit tawa
arisetiyani12,memang cerdik lihat peluang anda tapi asli milik nya doyan jajan sih tawa
arisetiyani12,kalau beli rawat kulit mikirnya puluh kali eh baru yakin beli kalau jajan cemil tidak pikir sekali saja alias baru lihat saja langsung beli
arisetiyani12,salah satu target mulai hari kemarin biasa minum liter hari mulai kemarin minimal liter hari
arisetiyani12,kita biggest fans ini minggu mlndmnsr terimakasih anda via
arisetiyani12,mungkin semoga tidak
arisetiyani12,lebaran akhir masih hari esok
arisetiyani12,teman nge pesan langsung instagram saking lama saya tidak pernah buka instagram kira sudah pindah planet sama kayak instagram jadi salah satu tolak ukur bahwasanya masih eks masih hidup pikir
arisetiyani12,matur nuwun saudara laki
arisetiyani12,s marketing ini saudara laki agung
arisetiyani12,syukur mei dua kali lipat berkah senang eid mubarak senang milad semoga berkah tambah terus amin
arisetiyani12,yah dicheck var nyata mati sisi tidak jadi pinalti deh tawa
arisetiyani12,mal aidzin wal faidzin ya saudara wanita
arisetiyani12,tiap tahun ngucapinya pakai sama matematika habis pikir mikirnya seperti apa kalau orang biasa seperti
arisetiyani12,nama manusia kadang sering mbatin jadi mohon maaf lahir batin sobat
arisetiyani12,kenapa puasa ramadan rasa cepat sekali tiba tiba sudah lebaran saja
arisetiyani12,benar sih soal lebaran pada sibuk sekali sibuk pikir cari jawab gr ditanyain itu sama orang misal
arisetiyani12,tidak sangka tahun tambah umur tidak hari raya idul fitri semoga jadi awal lebih baik belum lebih baik ke depa segala untuk terus amin
arisetiyani12,yah tahu deh kalau ganti
arisetiyani12,saya yakin hasil sidang isbat nyata lebaran tahun celaka tanggal syawal hijriah
arisetiyani12,rumah lari tawa
arisetiyani12,sehat selalu dek ibu ayah surga sana bangga sama anda
arisetiyani12,coba kalau saya nyanyi makin dapat rasa nya rasa ken naboknya tawa
arisetiyani12,kayak memang serentak pusat perbelanjan saat mulai ramai sama orang yang mau beli pakai buat lebaran kayak pengaruh sama konspirasi soal orang yang masang stories konspirasi corona eh pagi pergi buat beli baju lebaran
arisetiyani12,lah benar mvnya usung kampanye antikekerasan begitu tapi tetap saja kalau mendengarkan lagu sedih dapat
arisetiyani12,kalau mendengarkan lagu tidak pakai peras sekali saudara wanita
arisetiyani12,dulu tonton awal tidak paham akhir tonton kali jadi mayan paham tawa
arisetiyani12,syukur tuhan
arisetiyani12,unes hari masuk tren kali baik baik nes
arisetiyani12,jauh anda lari satu pilih hadap hidup terima nasib tidak
arisetiyani12,kawan imunity
arisetiyani12,mau balas pakai gambar tapi tidak jadi soal mau usaha edukasi orang agar tidak cemil judul doang orang cuma dapat ss an grup whatsapp sebar baca isi cara selurah
arisetiyani12,ada saja whatsapp saya ss an dan tanya turut saudara wanita ari bagaimana
arisetiyani12,yiseo dong
arisetiyani12,kata damai virus
arisetiyani12,sudah buat dari ini untuk ini tinggal aman semua
arisetiyani12,siap tad mau tidur bentar agar begadang sampai sahur
arisetiyani12,tidak perlu buat lihat baik anda sudah jadi orang baik kenapa
arisetiyani12,mau nambahin tetap lihat sangat baik jadi panutan
arisetiyani12,apa benar nyata diri apa cuma saya rupa dari pernyatan halus pria specialkan diri diri lebih baik ketimbang lain
arisetiyani12,sudah hari saja tidak rasa kurang lebih jam lebaran tiba
arisetiyani12,huruf apa dulu kalau ily tidak apa apa sih sama sapa
arisetiyani12,saya balas obrol sampai paragraf eh malah cuma balas kata doang padahal harap dapat feedback lebih alias sekali diskusi
arisetiyani12,makin lihat realitas yang nyata hidup tidak adil saudara laki orang orang yang tidak milik jabat dekat dengan pihak pihak yang memang jabat atas suatu kuas lampau adil saudara laki yang memang jabat dar milik dekat dengan yang milik kuas
arisetiyani12,ibadah bisa laku salah satu mohon ampun
arisetiyani12,tambah kaji guru adi hidayat
arisetiyani12,misi buru lailatulqadr malam rabu mei malam jumat mei malam ahad mei malam selasa mei malam khamis mei cari malam lailatulqadr malam ganjil hari akhir bulan ramadhan hari bukhari muslim
arisetiyani12,terlalu kagum untuku tidak aman ran
arisetiyani12,ampun lupa nyata mau cemil teh nok yah padahal ibu tidak tawa
arisetiyani12,alasan orang daerah gerbang utama bukan tidak kalimasada kenapa
arisetiyani12,iya apa apa tinggal jalan jari kaki soal dekat warung tempat cemil dulu sayang tetap saja anda pergi bolak balik banar wkawk
arisetiyani12,paman aup makin kila ada saja ide kreatif buat konten halusinasi tawa hormat pis
arisetiyani12,kenapa malah jadi anda lebih hayati sekali tidak utama bukan malah axl
arisetiyani12,saya sekarang tahu itu hidup isn t sebuah ras dengan semua orang else
arisetiyani12,tidak jadi dilist lah sudah lupa siapa saja eh tawa kawasan gang strategis memang situ apa juga sih
arisetiyani12,bentar mau ngelist dulu pokok mantap tidak pernah palang pintu saja tetap aman
arisetiyani12,tumpah tidak ini tawa tidak ding memang tidak jaga kosnya ada jaga aman gang lebih sangar
arisetiyani12,tidak begadang cuma tidak sabar saja tunggu tiga malam tawa saudara wanita sekali begadang karena tunggu balas obrol perlu sekali anda baca
arisetiyani12,ninu ninu ninu
arisetiyani12,saking jadi orang tidak enak kalian balas obrol singkat saya intropeksi diri
arisetiyani12,semangat saudara laki hansol bisa t tunggu
arisetiyani12,sutradara putra mahkota lee chang benar nang kejer ibu cosplay jadi itu selamat zombie
arisetiyani12,kurang satu buat epron dong tawa
arisetiyani12,edisi jarak jadi tulis ikut
arisetiyani12,ketangkep roy kiyoshi diplesetin saudara laki saeroyi apa kasi sama yang sudah mati mati diri bam ic bahkan bisa kalah janga loh sudah lah acak sekali
arisetiyani12,lah tadi sore kata heboh bahkan cerita kalau tetangga yang sengaja beli bahan cemil banyak agar besok tidak keluar rumah akhir saya usaha apa yang saya paham
arisetiyani12,lah mirip paman aup versi muda tawa
arisetiyani12,stiker laptop kurang stiker himpun ukm peristiwa peristiwa itu tawa
arisetiyani12,mirip tidak utama itu runding ini tawa
arisetiyani12,saya minggu nyala twitter mentions suka retweet retweet capai balasan lihat milik anda dengan
arisetiyani12,para abk kerja indonesia telah gugur kapal sebut semoga amal ibadah terima saudara wanita amin
arisetiyani12,benar sekali
arisetiyani12,habis tonton video saudara laki hansol ini syok nyata saja orang orang bentukanya manusia kelakuanya seperti
arisetiyani12,cireng koh
arisetiyani12,banyak bilang begitu fakta atas benar sih cuma kalau marah balesnya iya doang tidak pernah saya itu alias baik tidak usah balas chatnya tawa
arisetiyani12,saya gemini saya tidak seperti gin tawa
arisetiyani12,semoga si abah sehat selalu limpah rizki lancar berkah amin lagi rasa sangat gagal syukur
arisetiyani12,beranda isi tebar keuwuwuan sudah saya nyimak saja
arisetiyani12,saya minggu nyala twitter mentions suka retweets oke retweet capai baru total ikut lihat milik anda dengan
arisetiyani12,kita biggest fans ini minggu sikecilmarmut novitahaida terimakasih anda via
arisetiyani12,raya patah hati banyak tembang tembang karya selamat jalan raja didi
arisetiyani12,untung anda pasang buat akun tawa
arisetiyani12,ekspresi tiba tiba ditingalkan alas sama tsana alias tiba tiba tinggal tidak langsung tawa
