username,tweet
dzakyhaidar__,tidak gudang senjata tawa
dzakyhaidar__,baca bagus
dzakyhaidar__,tawa
dzakyhaidar__,sendiri tentu garis waktu kita mulai baru mulai yang baru baik yang belum baik
dzakyhaidar__,akhir sendiri sampai kapan ada titik titik yang sama
dzakyhaidar__,alex ret manusia dari itu tanding ronaldo tidak kasih sempat nendang
dzakyhaidar__,napoli
dzakyhaidar__,aguero
dzakyhaidar__,timnas kalau utama sini saja mbah
dzakyhaidar__,semua bayern waktu
dzakyhaidar__,kalau yogurt heavenlyblush
dzakyhaidar__,dia semua bayern saat
dzakyhaidar__,kasi fans ipul yang tidak bisa lihat tim kesayanganya konvoi juara langsung televisi biasa cuman tonton gratis tvri
dzakyhaidar__,masa sih nel tawa
dzakyhaidar__,karena tidak pernah potong lahir kali cara aktivitas nya tidak buat kuku potong scr alamiah
dzakyhaidar__,ketika anda punya untuk buka milik anda laptop diluar milik anda kantor jam bcs di sana s sebuah trouble in produksi
dzakyhaidar__,sanksi sosial tunggu ini tetanganya ikut tidak tahu diri
dzakyhaidar__,kan bawa sim surat izin cinta
dzakyhaidar__,hari senin jalan lancar situ wekendmu bahagia
dzakyhaidar__,kalau mau parkir motor kemvil ada masuk dimensi beda
dzakyhaidar__,sabar ibu
dzakyhaidar__,muncul terus beberapa kali beranda tetap saja tawa
dzakyhaidar__,bar ini klarifikasi ning podcast e dedy
dzakyhaidar__,saya tadi malam baru saja kumpul sama beberapa teman kuliah yang bahas adl tg konyol masing waktu kuliah sampai suka duka kerja korporat tidak bahas nyerempet gaji jabat masing sudah paham kumpul buat sambung silaturahmi bukan mainin gengsi
dzakyhaidar__,aduh saudara laki tidak serius serius ini bukan facebok
dzakyhaidar__,hiya hiya hiya
dzakyhaidar__,ronaldo immobile luka
dzakyhaidar__,nyanyi sayap buat pitpitan nganti kerumun nutupi sak ndalan ndalan nyanyi sayap sudah buat ngebaki malioboro teh saiki nambahe mono padahal sayap sayap sudah tahu raono kasus balas meh dino paling kelakar mung tambah
dzakyhaidar__,tawa siapa lho emange
dzakyhaidar__,otak benar benar keluar dari itu kotak tawa anak kecil juga apa sampai pikir
dzakyhaidar__,waktu puasa ken itu buka puasa cemil porsi saja sudah lebih cukup dasar manusya
dzakyhaidar__,karena masih bisa menang itu perdana menteri liga
dzakyhaidar__,ke pelatuk arti hidup terlalu serius
dzakyhaidar__,gils surabaya sudah pergi keluar ke zona padahal tinggi tinggi nya kasus positif sana
dzakyhaidar__,kan cuma aktor sutradara bebas
dzakyhaidar__,juga sih teman kayak gin ulas ala ala begitu
dzakyhaidar__,saat transisi baru normal harus periksa adalah kesiap fasilitas sehat bukan pusat perbelanjan biadab
dzakyhaidar__,mangkat jam riuh tawa
dzakyhaidar__,selesai dulu urus masing masing selesai itu puncak prioritas s masih tentang diri sendiri
dzakyhaidar__,tidak apa apa kalau tidak sibuk kabar
dzakyhaidar__,habis apa coba kirim tawa
dzakyhaidar__,ngefans kali
dzakyhaidar__,tawa tawa
dzakyhaidar__,deep condolance
dzakyhaidar__,nah kayake karena olahraga luar ruang yang disaranin tidak kayak gin nyepeda langsung deh latah ngikut cenderung tawa
dzakyhaidar__,sungguh itu saya saya masuk pada itu
dzakyhaidar__,coba diniatin dulu paling tidak sampai bawa mimpi naik sepeda lak benar ken
dzakyhaidar__,lokasi dimana saudara laki nama tempat
dzakyhaidar__,baru normal toko sepeda makin laris baru nyadar olahraga
dzakyhaidar__,tawa gils gils tidak paham
dzakyhaidar__,tawa
dzakyhaidar__,salah satu rekrut fergie unik ia gabung anda usia akhir karir utama sepakbola justru jadi putus tepat gabung tim tepat
dzakyhaidar__,dan mostly pada pasang rata rata lulus kampus puncak indonesia bahkan artis artis lulus kampus ln malah ada makin tidak aman
dzakyhaidar__,wah iya betul mau jalur buat tingkat yang pikir akses stasiun nya sendiri saat saja seperti kelihatanya mungkin ada normalisasi rumah rumah semi permanen sekitar untuk lebar jalan sampai akses
dzakyhaidar__,bagaimana trav
dzakyhaidar__,fakboy sejak dini
dzakyhaidar__,izin curi
dzakyhaidar__,mungkin masih punya hati nurani jadi cuman ambil jatah libur saja buat nenangin pikir
dzakyhaidar__,sial acara ngeprank
dzakyhaidar__,gubernur anda memang bagus kenapa
dzakyhaidar__,tidak beda jauh kenapa saudara laki abad kalau hitung kasar juga
dzakyhaidar__,masuk acara tiktokan kali agar ke pelatuk
dzakyhaidar__,tapi kevin masih nyala his gairah untuk nikmat itu lagu
dzakyhaidar__,orang indonesia urus begini nomor satu
dzakyhaidar__,mashok ligina sudah jadi kiblat sepakbola eropa nyata
dzakyhaidar__,kemarin lebaran libur hari panjang hari libur mei juni kemarin tahan tidak buka laptop sama sekali
dzakyhaidar__,kalau buka laptop jatohnya malah buka buka aju pekerjaan masih pakai tools buat akses perbarui info kini
dzakyhaidar__,nyata bisa kualitas waktu sama diri sendiri walaupun optimal baca butuh libur tidak buka laptop sama sekali lama panjang hari libur kemarin
dzakyhaidar__,kemarin libur lebaran hari lalu kemarin libur panjang hari libur hari lahir pancasila hari tetap bawa laptop kos nyata tidak buka sama sekali lebih pakai tools lain laptop buat perbarui info kalau buka laptop malah pegang pekerjaan
dzakyhaidar__,lah balik bambang
dzakyhaidar__,ini po wok
dzakyhaidar__,setia sampai sabar tunggu memang enak padahal buat lama karena si ibu kalau masak suka digabungin jadi satu kalau yang datang duluan terus sen bakmi goreng cuman habis telah ada orang yang datang sen nasi goreng yang dibuatin nasi goreng dulu
dzakyhaidar__,isih banyak ning bogor ki haha
dzakyhaidar__,ashiup tawa
dzakyhaidar__,reporter nya sekarang ngeliput tidak ngebayangin dulu pakai sekarang seperti bagaimana
dzakyhaidar__,lewat jalan tikus saudara laki
dzakyhaidar__,tawa
dzakyhaidar__,saya nyala dasar sekolah tonton doraemon nyala sunday pagi juga saya ketika sudah had sebuah kerja masih tonton doraemon nyala sunday pagi
dzakyhaidar__,orang sekarang butuh var untuk periksa ini
dzakyhaidar__,kondisi oksigen atas jam pagi sudah tidak se clear banding range jam matahari sudah mulai naik olahraga dengan kena papar sinar matahari lama beberapa waktu biasa lebih mudah lelah ban oksigen dengan orang yang sama olahraga
dzakyhaidar__,cuma turut saya kalau baru mulai olahraga jam pagi atas rencana luar rumah beberapa yang jadi lihat
dzakyhaidar__,kalau baru keluar rumah olahraga atas jam pagi benar fine fine saja itu masih pagi kalau hari libur pada pilih bangun lebih siang biasa
dzakyhaidar__,anda bisa dorong milik anda batas nyala itu emas jam panjang run minimal oke tidak ada lelah kalau biasa
dzakyhaidar__,ibarat oksigen masuk dalam tubuh bisa lebih optimal banyak kontaminasi karbondioksida sumber oksigen
dzakyhaidar__,waktu sebut tubuh lebih banyak kerja hidrasi kulit mengoksigenasi darah jam kondisi oksigen di ruang buka paling bersih biasa belum banyak aktivitas kendaran motor yang buat polusi
dzakyhaidar__,turut saya emas jam nya orang orang rutin olahraga pagi ada jam
dzakyhaidar__,in itu baru normal mau haji umroh wajib uji pacar mau kuliah ln wajib uji pacar mau bisnis jalan ln wajib uji pacar mau libur jalan ln wajib uji pacar
dzakyhaidar__,fans garis keras sejak
dzakyhaidar__,dia boleh tubuh lukis
dzakyhaidar__,masih tanya kenapa baca tolong cuman memang baik si imam maupun si makmum sama sama erti kondisi bagaimana kalau
dzakyhaidar__,mau tahu tidak
dzakyhaidar__,ugm saja
dzakyhaidar__,tawa sabar ibu niat tadi ajak tertawa sama telah lihat penuh video nya justru tidak jadi ketawa malah sedih kenapa ada tawa
dzakyhaidar__,warga datang maksud
dzakyhaidar__,tidak akhlak memang anak acara
dzakyhaidar__,kun fayakun saudara laki hendak
dzakyhaidar__,ubah apa bagaimana
dzakyhaidar__,hai padahal jatim naik naik lho tawa
dzakyhaidar__,baik kalau begini
dzakyhaidar__,dwight yorke andy cole teddy sheringham oke gunar solskjaer kuartet legenda
dzakyhaidar__,dulu sih tidak kampanye doang
dzakyhaidar__,fizi
dzakyhaidar__,tawa sampai lebaran tahun depan ketawa kalau bangjo pingit
dzakyhaidar__,epl malu
dzakyhaidar__,jadi tren ada bel nya kali
dzakyhaidar__,hanya sebuah sederhana benda kalau mompain mompain larang depan belakang jadi ribu kasih saja ribu tidak buat anda rugi kalau beli bensin selesai disi langsung majuin motor tempat yang lebih lega tutup tangki sampai masuk uang situ
dzakyhaidar__,sudah paham koyo ngono tiap tahun isih saja tuku terus
dzakyhaidar__,lha kenapa tawa
dzakyhaidar__,biggest ampo in sampai oleh mes
dzakyhaidar__,epl hanya sebuah sederhana pikir
dzakyhaidar__,dia hanya di ini tahun
dzakyhaidar__,tonton film itu flu lumayan thriller saat pandemi rebak orang orang infeksi tidak sembuh dikumpulin satu tempat karantina tidak selamat langsung musnah
dzakyhaidar__,terima kasih dalam hari hidup jadi anak kos lebih jamin dapat bingkis klien kantor dikirimin cemil sama teman kantor dikirimin cemil sama ibu kos
dzakyhaidar__,anak terna tertawa lihat komentar komentar
dzakyhaidar__,throwback five tahun lalu
dzakyhaidar__,inzaghi tidak butuh untuk mahir benar manusia in itu benar moments
dzakyhaidar__,masjid al itihad pagi laksana sholat id jamah jarak saya pemda bogor letak pinggir jalan utama yang notabene jadi pusat perintah kab bogor memang benar lengah awas
dzakyhaidar__,barakalah
dzakyhaidar__,akhir benar kalau tidak puasa ramadan tidak ada bukber tidak apa apa sudah coba tahun walaupun benar alas tidak terima pada inti fokus ibadah yang lebih intens presisten di tahun insya tuhan
dzakyhaidar__,zlatan pindah barca antar juara champions lalu zlatan pindah mil barca juara champions ada kena kutu hanya
dzakyhaidar__,playing korban
dzakyhaidar__,bahasa janji manis jajah jaman sekarang
dzakyhaidar__,coba ngundang maudy ayunda begitu belva devara juga deh inti sosok yang inspirasi buat dunia didik pacar bisa kejar cita cita membangakan indonesia iya mungkin konten anda soal menikah menikah hanya mau kasih cemil pakai janji manis memang kenyang
dzakyhaidar__,tumbuh dengan kawan kebal
dzakyhaidar__,ashiup
dzakyhaidar__,nikmat s hidup
dzakyhaidar__,sabar ibu
dzakyhaidar__,tambah orang konfirmasi positif corona per tanggal mei banyak jauh underrated
dzakyhaidar__,tadi malam hujan angin jemur teras kos ambruk sampai cuma nyelametin baju baju doang pagi bangun lihat kondisi jemur diri normal lah terima kasih buat bapak kos yang baik hati
dzakyhaidar__,anak ujung kandang mingir dulu cerca
dzakyhaidar__,iya setuju
dzakyhaidar__,setuju
dzakyhaidar__,ini anda ajar gih tawa
dzakyhaidar__,netizen media sosial belah memang sering tidak akhlak
dzakyhaidar__,jam kemudian cabut sial tawa
dzakyhaidar__,cuaca bogor masih sulit tebak hari cerah hari lanjut hujan angin alahuma shayiban nafi an
dzakyhaidar__,gobs
dzakyhaidar__,hari masya tuhan
dzakyhaidar__,tawa
dzakyhaidar__,izin curi canda saudara
dzakyhaidar__,mudik dulu lebaran
dzakyhaidar__,humoris kambing
dzakyhaidar__,sengaja simpan cuti lampias saat semua kembali normal
dzakyhaidar__,oleh tipikal yogyakarta bakpia
dzakyhaidar__,malam ganjil bulan ramadan maksimal
dzakyhaidar__,takdir hidup negara berflower
dzakyhaidar__,sabar ibu tidak mudik kan
dzakyhaidar__,hari barakalah
dzakyhaidar__,syok
dzakyhaidar__,sudah mulai ningalin instagram lebih tepat lihat konten konten kayak begitu banyak drama nya juga tidak jelas cara tidak langsung lama lama memang jadi racun twitter lebih rasa gratis tidak keras asa sudah lama utama twitter akan lebih paham
dzakyhaidar__,izin curi canda nya saudara laki
dzakyhaidar__,hari masuk hari akhir ramadan waktu flies jadi fast
dzakyhaidar__,asiyaph
dzakyhaidar__,kobutri legenda
dzakyhaidar__,tawa baru mau tanya yakin indonesia lihat sekali sudah berita palsu nya di cina juga banyak bukit seperti bahkan memang lebih extrem
dzakyhaidar__,tega twitter akun maudy ayunda verifikasi
dzakyhaidar__,beli sepatu online beli kemeja online beli jersey bola online beli bmw online
dzakyhaidar__,definisi orang lagi jual lalu tinggal sholat daganganya tetap tunggu yang beli sabar arti kalau rezeki tidak mana
dzakyhaidar__,buka puasa masuk hari semoga tetap terus beri mudah
dzakyhaidar__,presiden sama tri nya ini memang
dzakyhaidar__,tawa tawa kucing nya nyala api
dzakyhaidar__,pergi kerja lebih pagi pulang lebih awal luang waktu buat istirahat sebentar buka puasa efektif kondisi tubuh
dzakyhaidar__,sabar ibu
dzakyhaidar__,hehehehe puasa
dzakyhaidar__,peh tawa
dzakyhaidar__,biasa saja ah saya tawa
dzakyhaidar__,sus sus susanti badminton ayo
dzakyhaidar__,al fatihah kagem pakdhe
dzakyhaidar__,tuhan ambyar
dzakyhaidar__,e e e e e e ayam ayam ayam
dzakyhaidar__,shinji kagawa
dzakyhaidar__,efisien waktu mungkin jam kerja saat kantor mana tugas untuk buat sudah mau deadline mana masih dibesokin inti set prioritas banding prioritas
dzakyhaidar__,padahal lumayan banyak tugas untuk buat mesti kerja nyata memang lebih baik kerja saat jam kerja
dzakyhaidar__,nyata sugesti bawa pekerjan sudah kos benar walaupun kemarin panjang hari libur laptop sama sekali tidak sentuh
dzakyhaidar__,forlan
dzakyhaidar__,avatar jurasic dunia jurasic dunia fallen raja itu takdir dari itu geram skyfal spectre
dzakyhaidar__,bias belanja niat mau beli apa sampai lokasi lihat banyak diskon sampai lokasi yang beli apa akhir over anggar
dzakyhaidar__,sahur sholat ngaji rebah beberes cuci iflix ulang
dzakyhaidar__,kucing nya kerja geser
dzakyhaidar__,tidak cocok
dzakyhaidar__,ngakbisa lanjut
dzakyhaidar__,baru mulai padahal tawa
dzakyhaidar__,bogor punya cara buat kurang kerumun orang saat pandemi turun hujan terus tiap sore jelang buka puasa
dzakyhaidar__,nasi kulit juara jadi juara menu buka puasa
