username,tweet
lenoydew,iya tidak sebut nama dokter balas twetnya seperti bgtuan
lenoydew,ampun baru saja periksa laku fans ibu ada saja ewkwk kurang cantik masih saja lihat
lenoydew,ewkwk akhir balas kira sudah mati
lenoydew,silah saudara buka bo syariahnya
lenoydew,tidak tidak alih isu eh
lenoydew,gapaham sama orang satu
lenoydew,amin tuhan
lenoydew,siap saudara laki
lenoydew,definisi sakit tidak darah ambyar jum
lenoydew,sedih
lenoydew,libra
lenoydew,lapor ah orang loncat
lenoydew,kon tidak paham omong garai pikir jancok bodoh ayo orang liyo ngelokno saya model seperti apa saja bedo cok awak guyon anda seperti taek
lenoydew,tolong henti itu
lenoydew,bajing tidak aman
lenoydew,laila monita tahalea
lenoydew,tonton orang asing sesuatu lihat sebelas bawa suram sedih pena nang saja
lenoydew,ada saat anda tahu
lenoydew,tidak habis habis
lenoydew,tidak dada beby
lenoydew,saya bom belenger kepengn
lenoydew,showrok vespa banyak
lenoydew,apa dari tirta lihat tweet inj
lenoydew,saya tidak punya uang buat beli pakai bh legging saja dulu
lenoydew,jadwal bq an padet sekali
lenoydew,dulu pernah ini mual tidak sampai muntah mobil saudara kata norak hai mobil anda ac tidak nyala panas sekali pengab mana sudah panas macet cok sok iya memang
lenoydew,dulu heboh sekali kalau corona tidak suka sama cuaca panas eh sekarang kenapa betah sekali surabaya rajalela
lenoydew,mau bq
lenoydew,leny jutek kelelawar
lenoydew,kalian tidak cuek italia mati days jenaza mana tenaga medis kalah sana bahkan bantu cina mereka tidak menang karena warga ngeyel disuruh sosial jarak
lenoydew,dia tidak berani balas ewkwk
lenoydew,temu
lenoydew,boleh sok dong
lenoydew,apa harus saya buat tidak apa apa tidak apa apa tidak apa apa
lenoydew,iyaw sampun
lenoydew,ken lucu lucu manja manja
lenoydew,ngilu
lenoydew,terimakasih ralat saudara
lenoydew,kejut unggul sekali teman seperti
lenoydew,baperan sekali syukur saya bukan psikopat
lenoydew,baperan sekali syukur punya peras
lenoydew,kejut jadi napuk mulut teman ya bajing kali kalau ejek dia punya peras dia jurus andalanya yek baperan bencanda saya
lenoydew,tajam kata
lenoydew,ewkwkwk syukurin
lenoydew,baperan sekali iya kalau tidak bawa kutingal rumah sudah tampar mulut anda
lenoydew,tawa tidak
lenoydew,iya saya memang tayi
lenoydew,makane ewkwkwk pria suka cerewet syekali
lenoydew,saya bosan jadi saya lihat akun akun yang lihat cerita igku lalu temu palsu rekening lalu saya pesan langsung
lenoydew,saya total ikut ih fit simi islinyi bidi yi saya bodoh salah sendiri ekpetasi
lenoydew,asa saya kuat sekali nice
lenoydew,oke
lenoydew,teman jualin anda minat
lenoydew,kejut informatif sekali
lenoydew,aduh peta nyata saya buta warna dia
lenoydew,saya senag jam tadi lewat indomart alfamart alfamidi pada buka
lenoydew,gaskeun bodoh amad
lenoydew,mau ngecek apa sjw ngoceh apa tidak
lenoydew,zona hitam indonesia
lenoydew,humoris kelelawar sih saya negara kalau salah galak benar etdah
lenoydew,sudah leny pintar tidak sok sok banyak uang amin tuhan banyak uang pusing saya itu
lenoydew,saya juga tidak sekali eh lagu e pikir
lenoydew,kereta tidak gentar terus laju saya takut
lenoydew,mau tanya agar unggah video utuh bagaimana mau unggah kenapa cuma dtk doang
lenoydew,isi nafsu doang
lenoydew,buat pria ibu mobil suka
lenoydew,ekpetasi realita
lenoydew,memang minta dihujad ini orang kali alias loncat sekali
lenoydew,begitu kreatif sekali pakai lem segala
lenoydew,yang aneh
lenoydew,kepala kalau goyang seperti boneka setan rem
lenoydew,tahu saja kalau bahan buat pikir lebih
lenoydew,ewkwkwk sami mawon
lenoydew,agar tidak juling kalau saya saudara wanita pusinh kalau lihat dekat seperti begitu
lenoydew,saudara wanita keramas dulu agar enak itu kepala tidak digarukin hanya
lenoydew,saya mau dong manja seperti
lenoydew,saja bom biasa kalau tahu
lenoydew,bajing anda
lenoydew,saja pantas saja saja kenapa diam diam baik
lenoydew,kata teman pria umur saya kasih tahu berapa umur asli
lenoydew,kadang semesta kalau buat betul heran bisa sampai bajing kali
lenoydew,heran aneh semua
lenoydew,orang orang kenapa heran
lenoydew,akyu
lenoydew,makna yang
lenoydew,hilal bom tampak diri
lenoydew,lah iyadong saya senang hati
lenoydew,memang yakin akan pilih eh aduh aduh aduh
lenoydew,enak yang mana
lenoydew,calon suami
lenoydew,lenoy
lenoydew,permen legenda
lenoydew,ralat yang rasa saja
lenoydew,yak yang punya masalah sama silah sok pesan langsung
lenoydew,kira pakai eyeshadow teman teman
lenoydew,jelek
lenoydew,laila
lenoydew,haha memang harus putar balik
lenoydew,leny
lenoydew,aduh aduh
lenoydew,kejut layar saya makin banyak pelangi
lenoydew,ken saya retweet akun pribadi karena hubung sekali
lenoydew,habis cemil mobil moshingan
lenoydew,niat mau manja sudah lah malas tidak jadi
lenoydew,ow ya
lenoydew,sudah saudara wanita baca obrol paling atas senyum eh tidak baca bawah pikir
lenoydew,alohuakbar sudah gila
lenoydew,buset bulan benar terang sekali pantul cahaya itu beda
lenoydew,bulan langit terang ini bagus sekali cahaya bulan
lenoydew,bagaimana kalau tagih tambah uang parkir langsung bintang minus
lenoydew,ya malas sekali buka twitter buat gulir saja cuma buat tweet doang wah apa ini
lenoydew,jadi peras takut hadap dunia
lenoydew,ampun baik sekali saudara laki
lenoydew,bangun gara gara takut
lenoydew,tahu deh memang malu maluin
lenoydew,tadi sudah rencana buat cemil eh eh batal pikir
lenoydew,tuhan kenapa sudah banyak sekali realisme yang bingung pikir
lenoydew,buat kulit tidak kering susah minta ampun
lenoydew,iya jancok saya iri
lenoydew,percaya diri banyak sampai tumpah baik sekali teman
lenoydew,setuju skincarean rawat diri agar tidak terlalu insyecure lihat anya
lenoydew,gantung niat ukhti buat manjain diri sendiri buat lihat pria seperti ukhti dulu yang niat buat lihat pria ups kasi sekali
lenoydew,malas ketik ulang
lenoydew,seperti memang sikap dri dulu bom ubah tahu gara gara mbkanya ejek kekeyi
lenoydew,seperti dulu lahir dri batu
lenoydew,ingin tahu sama onlyfans tapi restu
lenoydew,spertinya saya jin langgan agar bisa cemil
lenoydew,cik legenda
lenoydew,biadab ewkwkwkwk
lenoydew,mungkin ingin jadi popeye
lenoydew,kenapa tydack syok
lenoydew,malang tiap kesana ingat malang selalu peras aneh yang muncul lebih aneh suka buat jadi rindu malang
lenoydew,radi sih uwunya lewat
lenoydew,ratus purnama lalu saya baru tahu maksud jb jb inalilahi
lenoydew,bisa
lenoydew,jelas
lenoydew,orang orang sih
lenoydew,juancok loncat bajing jelek tidak ngoco
lenoydew,benar donh lihat ibu pakai masker rajut pikir tidak komentar deh
lenoydew,yeay anniversary
lenoydew,sayang anda serius tidak sama saya tidak biasa saja cemil nyam nyam
lenoydew,besok pagi kalau bangun ken sudah naik migo tapi tapi
lenoydew,kenapa setuju
lenoydew,oke buka bo bom kata dosa lesbian baru kata dosa oke
lenoydew,tanggap orang yang tuduh fitnah tidak dendam di akhirat tuhan yang adil semua tuhan
lenoydew,tonton buat nang biadab lah sintas tragedi tuding pki telanjang cari topi gerwani via
lenoydew,salah pilih kemarin pilih gubernur
lenoydew,wakwaw tidak tanya makin banyak yang kena subay euy kembali lalalala yeyeyeyeye
lenoydew,saya saya tidak seperti gadis lain yang lain saya iya gila apa ya kalau mesti sama diri anda bukan tidak suka bandingin soal jelas beda pintar anda tidak seperti semua orang
lenoydew,saya temu senjata sumpal mulut suka bacod sekali alias bom edukasi
lenoydew,saya kira tempel kenang masa lalu eh
lenoydew,bulan peta buat yang suka sama satu orang sama orang lain jancok sekali anda
lenoydew,iya saya tahu saya humoris ewkwkwkwk
lenoydew,ewkwk
lenoydew,iya gara salah semir sayap dadine tidak gawe model seperti awak
lenoydew,ekwkw terimakasih warna jadi
lenoydew,apa cepat jawab apa
lenoydew,rambut sudah tidak jamet lucu
lenoydew,leonard omong omong siapa yak
lenoydew,sedih sekali tonton akhir hayat soekarno
lenoydew,wahduh aduh
lenoydew,karena hujan hampir hari kemarin hari ada efek surabaya sejuk ya
lenoydew,saja pakai salah beli warna kucing
lenoydew,iku onok tulis e gambar mise en tempat jadi hello gelembung
lenoydew,ini nyanyi paling mudah pakai e seperti pakai shampoo tutorial banyak youtube pakai merk ini pilih yang choco kalau tidak coklat iku warna natural coklat
lenoydew,tidak kasih tahu rambut kan item terus anda semir coklat warna tidak akan ngejreng tenang saja malah seperti coklat alami bagus akan lihat coklat kalau panas doang lek ken aman belio garnier iku warna e aman natural
lenoydew,yah tidak suka warna biru
lenoydew,tydack sudah pernah disemirin warna abu abu
lenoydew,bentuk kalau tidak pakai nyaring jijik sekali sudah
lenoydew,tidak cuma mudah luntur terus warna kalau rambut item tidak sebegtu keluar memang mau semir warna apa
lenoydew,kemarin ragu hari pumusnahan rambut jamet selamat tinggal
lenoydew,ya ngeliatin hujan itu seperti enak sejuk sekali begitu
lenoydew,pakai miranda sok ya hasil seperti begitu deh
lenoydew,chico jerico tidak tahu sudah tulisan seperti bagaimana tampan sekali yak
lenoydew,hebat sekali surabaya peringkat gila prestasi membangakan
lenoydew,ip warna nya humoris ungu pikir
lenoydew,sedang tahan nafsu jajan yang gejolak tidak nyemil tidak nyemil
lenoydew,sedang cari jelas banci bukan belok seperti begimana
lenoydew,kalau suka cemil bakso tidak puasa terus buat konten tidak usah bacod biadab
lenoydew,saat nya saya joget wus
lenoydew,ewkwk mana dong pakai miranda jamin luntur risiko ditangung sendiri
lenoydew,tiba jadi suka sama rambut jamet pikir
lenoydew,selamat tinggal rambut jamet
lenoydew,untung tidak saya bodoh
lenoydew,nyata beli peyek dapat toples kalau lama baru buka rasa rasa plastik begitu
lenoydew,ken mampir kalau ke jakarta
lenoydew,ampun radi lucu sekali sih mau
lenoydew,bahagia orang orang
