username,tweet
nopiynovi,kesal saat
nopiynovi,saya dia eh peta tidak sengaja harap nya lewat
nopiynovi,selamat pagi saya saya
nopiynovi,gila saya dikomen sama budak yang susah pindah nyala sampai tahun tahun mantan
nopiynovi,anda siapa siapa bukan pura pura lupa sih memang malas buat ingat
nopiynovi,senang ulang tahun eja
nopiynovi,tuhan makhluk muncul
nopiynovi,kalau orang yang kemarin selalu lalu kini hilang sudah pikir positif mungkin sekarang sudah baru normal
nopiynovi,kasihan saya
nopiynovi,tangkap tiket nya dikirimin habis itu ditanyain mau di jalan jemput jam berapa
nopiynovi,terkadang semua perihal siapa yang tetap tahan meski bagai adan
nopiynovi,ngecekin akhir online whatsapp ny orang masuk budak cinta gasih iya budak cinta padahal tidak milik
nopiynovi,hai juni semoga ajaib baik banyak sini
nopiynovi,bagaimana mau sombong ikut pamerin gelincir gaji hasil mau pamerin foto wisuda saja tidak bisa karena tunda corona
nopiynovi,orang baik banyak sangat banyak mungkin malah cara porsi baik tiap orang yang beda semua
nopiynovi,indihome laju lambat kayak untuk tayo
nopiynovi,jam gin bom tidur karena pikir nasi padang iya tuhan
nopiynovi,senang ulang tahun gemar segala doa baik buat fanny
nopiynovi,kasi uang thr tetap saja pakai drama basa basi buat nolak padahal senang banyak jujur dasar saya
nopiynovi,bom sah nama kalau lebaran tidak dapat tanya perihal kapan
nopiynovi,banyak banyak salah jauh lebih banyak salah virus corona
nopiynovi,garap lur
nopiynovi,lebaran lah rumah kenal sama ibu tahun jadi kirim salam buat ibu peta tidak bisa lebaran rumah
nopiynovi,tidak baju baru yang penting semoga pacar baru
nopiynovi,bawan nya ken jatuhin cemil lantai terus agar latih biasa bilang sayang
nopiynovi,syukur cari kembali
nopiynovi,sugeng dalu saudara laki
nopiynovi,cemil sahur selalu kenyang seperti tidak cemil bulan
nopiynovi,baik puasa selesai malam takbir langsung balik mohon peta lahir bathin
nopiynovi,senang ulang tahun saya twitter
nopiynovi,lihat cicak terjun bebas kamar atas ac kasur sumpah benci sekali dasar binatang
nopiynovi,sampai lupa hari libur kapan benar tiap hari lah oke baik
nopiynovi,sampai detik tidak tahu rasa nikmat tidur pagi bagaimana soal saya masuk golong manusia yang paham tidur siang malam
nopiynovi,jaga jarak sudah jaga hati sudah
nopiynovi,benar benar rasa ambyar benar dengar berita duka pagi
nopiynovi,tikus pahala anda taq malu
nopiynovi,tidak soktaw
nopiynovi,juang tengah corona bangun renovasi rumah
nopiynovi,badan rindu sama sama berat
nopiynovi,hahahahahahahaha
nopiynovi,selamat datang semoga mei milik
nopiynovi,tawa
nopiynovi,tiba pikir ken lihat jerapah gin benar iya tuhan heran
nopiynovi,tutorial tips trik buat dia tinggal sesunguhnya bagaimana sih penasaran asli
nopiynovi,sahur subuh saya tidak tidur itu rupa berkah ramadhan kali
nopiynovi,apa cuma saya yang kalau cemil sahur jauh lebih banyak banding cemil tidak buka puasa
nopiynovi,malu iya tawa terimakasih fanny
nopiynovi,terimakasih alarm yang hasil bangun tunda
nopiynovi,yang bingung besok minta dibangunin sahur sama siapa sini saya ajar kasi tutorial pasang alarm yang baik benar
nopiynovi,bohong pura pura bahagia masuk kategori dosa gasih
nopiynovi,april selamat hari kartini
nopiynovi,kalau tidak bisa jaga hati jaga sehat jauh lebih penting saat corona seperti gin
nopiynovi,tidak enak badan situasi seperti gin buat parno sendiri asli
nopiynovi,tidak mau pikir tetap pikir
nopiynovi,skenario tuhan sudah baik saya percaya
nopiynovi,tawa antu baik sikat skripsi saja anda
nopiynovi,kalau bicara yang sopan anda tawa
nopiynovi,oke selamat siang tidak lupa cemil karena dilupain gaenak
nopiynovi,sugeng enjing saudara laki
nopiynovi,dulu hingga sekarang virus corona malam minggu saya selalu rumah saja
nopiynovi,ngabisin batrai telepon sampai untuk main game masak cacing anak memang dasar saya
nopiynovi,gaperlu nerka tetap saja tidak ad arti makna nya saudara laki
nopiynovi,kecapin dituangin kedondong ucapin selamat pagi dong
nopiynovi,bersin bersin terus kenapa sih
nopiynovi,wabah corona serang keong sudah masuk golong rumah saja terus iya gasih
nopiynovi,ketik bangku gereja bangku gereja kolom pesan salah satu cara hibur diri kasi saya
nopiynovi,semoga tidak tinggal di rumah tinggal dengan saya
nopiynovi,hehehehehehehehe gemar
nopiynovi,takut dosa takut corona
nopiynovi,coba diam
nopiynovi,cemil kenyang rebah buncit keluh
nopiynovi,terimakasih maret semoga april nya buat lebih terimakasih banyak
nopiynovi,anda sibuk terus
nopiynovi,ya bapak tawa
nopiynovi,corona buat merana asli
nopiynovi,penasaran pikir omong omong hilang anda
nopiynovi,padahal memang sudah biasa selalu sering rumah karena corona suruh rumah saja kenapa rasa beda
nopiynovi,semoga anda semoga buat saya
nopiynovi,nyepi hari sepi tiap hari
nopiynovi,tawa
nopiynovi,kaum rebah kaum bela lawan virus corona
nopiynovi,semoga benar sedang sosial jarak bukan mengangap anda tidak penting makanya jaga jarak
nopiynovi,iya tuhan receh
nopiynovi,asli kesal iya
nopiynovi,mau seperti situasi bagaimana tahan ketawa sangat sulit saya laku
nopiynovi,turut duka saudara laki
nopiynovi,kalau bosan bilang tidak hilang
nopiynovi,sering jadi hidup sabar semoga sehat selalu
nopiynovi,diri karantina rasa malas mandi makin jadi jadi
nopiynovi,wakil peras orang orang yang sering kena tingalin len
nopiynovi,ada sebar virus corona anjur jaga jarak ingat jaga jarak bukan jauh jauh jauh tahu tahu hilang
nopiynovi,iya sedia batas
nopiynovi,semoga corona virus jauh ajak serius dekat
nopiynovi,nah
nopiynovi,masuk anda arti
nopiynovi,banyak misteri balik maksud hehehehehehehe
nopiynovi,tawa
nopiynovi,baik bapak guru
nopiynovi,semoga tidak masuk golong cendikiawan sebut
nopiynovi,jadi orang introvert sudah paling benar tengah sebar virus corona
nopiynovi,semua libur gara gara virus corona semua malah sibuk libur jalan mana mana
nopiynovi,terimakasih orang baik yang tetap baik meski saya dulu pernah sikap tidak baik terimakasih semoga tetap jadi orang baik
nopiynovi,makin kesini sadar ingetin diri sendiri hidup perihal banyakin ikhlas sama syukur
nopiynovi,indihome banyak ini sengaja agar hubung agar diperhatin bagaimana sih sini coba bilang
nopiynovi,tawa oke siap tahun depan buat kabar yak
nopiynovi,tidak sampai dajal turun untuk uji sidang anda kerabat
nopiynovi,takut manusia skripsi akhir jaman ini
nopiynovi,kalau sudah buat biasa langsung lihat kedewasan ny sih kerabat
nopiynovi,sadar diri
nopiynovi,tawa saya bukan orang tua padahal
nopiynovi,orang tua kalau ngetik obrol lama sih tahu tahu nyata yang obrol pendek singkat saja itu bukan sesak sih seperti penasaran nya awal itu ngebayangin akan obrol nya panjang seperti isi surat kabar nyata tidak
nopiynovi,problematika ngantuk tidak tidur sungguh benar ad nyata
nopiynovi,karena pacar lalu sangat sudah mainstream baik teman sangat juga
nopiynovi,utama cacing ujung nya kesal sendiri
nopiynovi,kenapa telinga kucing nya tinggi ya ja
nopiynovi,diucapin baik pagi senang hari libur itu bagaimana sih rasa
nopiynovi,oke saya maju ovo oleng
nopiynovi,tawa baca gin kenapa langsung tawa iya tuhan
nopiynovi,mungkin baik orang soal paham kena jahatin itu tidak enak
nopiynovi,kalau saya dari mana untuk mana saya tahu
nopiynovi,valentine tidak perlu repot kasi saya cokelat bunga segala tuhan kasi saya jodoh saja
nopiynovi,bagaimana sih rasa buka telepon bangun tidur terus ad notif ucap selamat pagi penasaran
nopiynovi,semoga suatu saat akan rasa ditanyain hari apa saja
nopiynovi,orang seperti gin ini curiga tes cpns kena tolak
nopiynovi,siklus pagi bangun tidur kerja revisi ngprint rumah dosen pulang sekarang niatin buat mandi
nopiynovi,tiap hari kesan kalau ad drama kelahi ponakan sendiri umur tahun lawan tahun
nopiynovi,lama tahun lebih pakai behel baru kali sariawan curiga efek banyak ghibah
nopiynovi,terimakasih januari saya sudah sidang kemarin
nopiynovi,orang suka tebar janji manis awal waktu hamil ibu ngidam cemil permen karet terus bagaimana heran asli
nopiynovi,sidang nya kemarin pusing nya hari pusing yang tunda bagaimana ini
nopiynovi,apa yang jadi dirasain saat bisa jadi juga pernah lakuin orang yang tidak pernah sadar
nopiynovi,bom apa apa tidak mungkin kan harap banyak apa nya yang sadar
nopiynovi,tiktok kini jadi tontonanq buka stories
nopiynovi,bukan arti tidak penting ada lebih penting jadi inti tetap saja tidak penting
nopiynovi,kenyang penuh maks sampai ngantuk iya tuhan bodoh
nopiynovi,bagaimana seminggu
nopiynovi,selamat datang
nopiynovi,tepat sekali
nopiynovi,bilang saja gladiresik madu bulan
nopiynovi,budak cinta ros
nopiynovi,awal memang sadis saudara wanita rasa lama lama bahagia kenapa tenang saja
nopiynovi,iya git
nopiynovi,biaya inap cemil lama sana sudah ditangung ya bapak omong omong
nopiynovi,iya gita sama sini lebaran rumah malu
nopiynovi,tiket mahal
nopiynovi,twitter tolong buat milik anda sihir pikir
nopiynovi,selamat ulang tahun kemal
nopiynovi,tiba hari h mana mesti kuat mental jiwa badan hadap tanya basi basi ngeri keluarga sendiri
nopiynovi,salah satu modus siapa tahu balik
nopiynovi,pulang bangkrut tidak pulang rindu mungkin isi hati nasib pasang hubungan jarak jauh anak rantau efek tiket pesawat mahal
nopiynovi,saya
nopiynovi,ya
nopiynovi,bangun sahur pagi sponsor bukan karena alarm karena telepon celaka nimpa diri sendiri tepi dinding atas
nopiynovi,puasa baru hari ken bilang tidak ada hari lebaran
nopiynovi,oke
nopiynovi,mohon doa nya ya semoga tular cepat sidang skripsi saudara laki
nopiynovi,tidak yang mau soal
nopiynovi,sudah cukup sudah
nopiynovi,sengaja buat tweet sekarang agar kira habis jalan malam minguan tuhan basi
nopiynovi,tambah apa dulu ini saudara laki
nopiynovi,oke saudara laki liter saudara laki
nopiynovi,sudah saya pesan langsung
nopiynovi,naik krl bukan hobyku
nopiynovi,tiap orang milik porsi rasa kejut bangga laku masing masing bang
nopiynovi,hehehehehe
nopiynovi,tidak di pesan langsung buka dulu lah
nopiynovi,buka toko buka hati saudara laki
nopiynovi,kalau jawab kasi hadiah tidak
nopiynovi,malas malas pasionq
nopiynovi,tidak tahu malah
nopiynovi,dilema malam lapar bingung mesti cemil apa yang ken cemil
nopiynovi,oke sudah
nopiynovi,kata kan dasar fakta
nopiynovi,gigit jari sebab cacing itu kata
nopiynovi,nah
nopiynovi,langsung tanda gojek indonesia dong
nopiynovi,bom mau tidur diucapin baik malam halah
nopiynovi,oke langsung pesan langsung saya cepat
nopiynovi,tapir hehehehehe tapir
nopiynovi,naek ambil si sopir diam bahasa awal jemput sampai sekarang tengah jalan curiga ini orang anak limbad seperti
nopiynovi,iya telepon sepi ini
nopiynovi,minat
nopiynovi,saya minat ikut audisi oke
nopiynovi,iya saya gandeng
nopiynovi,tidak kenapa
nopiynovi,hahahahahahaha
nopiynovi,nah
nopiynovi,lapar bingung mesti cemil apa benar benar buat tambah lapar
nopiynovi,salam
