username,tweet
nevienpan,admin holiwing saja tidak sengaja ngeposting pokok sekarang semua lagi serba tidak sengaja
nevienpan,memang pernah lihat brompton klaten saudara wanita
nevienpan,mie ayam tulus jl damai mie ayam selera klaten
nevienpan,baca replyan tweet alis pelakor sesak sendiri mau nang hai entah apa saja yang sudah lalu tapi yang balas pakai foto alis pelakor ayah ini seperti sudah sampai tingkat bercandain kondisi keluarga rusak gara pelakor alis jelek hormat
nevienpan,gemas ken benarkan
nevienpan,iya semoga saya panjang umur karena tyda perna marah marah
nevienpan,ooh nama memang begitu baik terima kasih
nevienpan,iya juga yogyakarta tapi pernah tahu nama saudara
nevienpan,roti bakar mana saudara
nevienpan,kejut tengkyu inponyah
nevienpan,cus jaguar
nevienpan,yampon saya baru lihat mentionan tawa saat saya temu jodoh
nevienpan,iya memang saya sering cemil pisang goreng ngo lauk kebal diangap aneh tawa
nevienpan,kan tidak nongki pengkol saudara wanita tawa
nevienpan,masak ki ndadak ngango pikir isah sambil ndomblong
nevienpan,tonton preman pengsiun po tukang ojek sudah paling dingin tyda uras energi tawa
nevienpan,tawa coba cemil gudeg pecel nasi goreng ngango gedhang goreng mantap
nevienpan,saya nenek dikon pilih masak po isah isah pilih isah isah sih
nevienpan,kenapa ada pisang goreng antara eh antara nasi kenapa
nevienpan,tidak ikut emosi hemat energi bep
nevienpan,beli bekas tidak apa apa kasih bekas lucu
nevienpan,tidak akan dikasihin
nevienpan,anda ibu tidur terlalu pules kayak jadi tidak tahu saya ajak ngobrol
nevienpan,testimoni yang tidur sama saya sih kata saya kalau tidur suka tiba ajak ngobrol
nevienpan,anda yang menemani tidak telepon deh kayak tidak saya tidak tahu soal kalau telepon telepon anak putra segala tawa
nevienpan,aslik saya tidak ingat tragedi tengkar jelang ujian nasional sih saya tapi ingetnya lil sama jupe ngomel sampai nang tidak buka forum angkat gara minta henti pacar dulu agar pada bisa ujian nasional aman semua amn
nevienpan,oya saya tahu maksut saudara wanita saya paham saudara wanita
nevienpan,vitamin c tidak enervon c saudara mungkin pakai merk yang stok sudah lebih banyak edar pasar seperti becom c becomzet becefort dulu apotek masih sulit sedia enervon c dari distributor kalau datang paling cuma dus habis hari
nevienpan,malu nimbun masker kotak lembar dibagin masyarakat jakarta dapat lembar per orang kata kasar tidak sih
nevienpan,ingat tidak ingat konteks apa ingat tidak tidak pacar ambil undi dorprize acara blackmores malah balikin lagi nama yang sudah didapet ngremeng
nevienpan,eh tidak bahas apa itu
nevienpan,sial jaman tpa saya durung usum ibu cahaya kenapa sayang jadi buku iqro saya aman gambar mbah
nevienpan,apotek sepi sih ngo ya
nevienpan,wagela cari meses oren biru memang
nevienpan,woya mayan juga sih memang
nevienpan,obat apa memang ibu
nevienpan,baru tahu biadab doyan biskuit sama roti tawar baru broto
nevienpan,lah saudara wanita konspirasi ki sama berita palsu e mbuh lah toke ayo malaikat dikandani mbake
nevienpan,omong omong jadi ingat teman juga dulu isi formulir jalan in wawancara jabat lamar manajer
nevienpan,tawa mungkin sadar gairah bukan yang kerja langsung megang pekerjaan megang orang
nevienpan,ini banya stok pria kacamata
nevienpan,dengdam pribadi deh seperti
nevienpan,mandiri online users kiri kelompok tidak tangkap soal
nevienpan,sial penting sekali tanya begini tweet saya tidak tahu lama tidak ingin tahu
nevienpan,musnah saja tidak sih orang
nevienpan,akhir banyak pasang kandung bawang
nevienpan,apotek sepi sekali sekarang jam orang saja yang masuk syukur kasih leren iya bulan lalu tiap detik orang tanya masker
nevienpan,disko jadi manis
nevienpan,h tlisipan ros kalau banyak mau jadi tyda jumpa
nevienpan,pakai siapa eh
nevienpan,ini saudara laki belakang sebar undang ketinggalan seswatu saya
nevienpan,kalau runut kontak seva seva seva seva baru seva pakai
nevienpan,separone vicks inhaler po ayo
nevienpan,tawa alpara saya suci grail tidak deng saya intunal kuat
nevienpan,awal nanyanya sudah posesip sekali yaelah mase
nevienpan,tawa saya ayo jaman pacar nama kontak malah nama asli lengkap
nevienpan,padal saya retweet saudara laki e mergo anda retweet duluan saudara
nevienpan,penasaran kantor bidang apa sih saudara wanita begitu kerja orang tinggal aman saudara wanita jaga jarak utama sama yang kemarin habis jenguk
nevienpan,salah fokus jeneng kontak saudara laki bojo kadang penasaran kelanjutane
nevienpan,bingung saya masa apotek resmi kulak mereka kan tidak humoris
nevienpan,lah lah lah
nevienpan,akhir saya dapat hibur teman teman kalian baca
nevienpan,berat tetap syukur lingkar lengan sudah tambah cuma sudah hamil kali tawa
nevienpan,suami sagi mau ngetik parkir khusus pelang saja tanya dulu tidak nya apa
nevienpan,yah syedih
nevienpan,ngewri yang itu sudah tidak ketul soal paling lama
nevienpan,nepay tawa baru teringat dulu singkat begitu
nevienpan,napas
nevienpan,gosend jakal anda thx
nevienpan,tidak yang laen apa yang lebih mudah hidup orang geto roti seperti susu persegi seperti ngrepotin ndadak ngodog endhog h
nevienpan,harus endog godhog
nevienpan,lha tidak pacar ngrekam sidik jari hpmu lis jadi langsung buka
nevienpan,tinggal aman sayang minum vitamin sering sering cuci tangan
nevienpan,tuhan sekali saja saya sambat lelah jadi nakes ken kelon saja rumah sama bojo tidak mau pergi apotek
nevienpan,ingin tahu
nevienpan,ayo buat mbaping punya kan alat buat kulit molen
nevienpan,panci
nevienpan,tapi monmap sih pacar sana cemil sate usus jebul bojone kos cemil cumi
nevienpan,syukur punya suami erti selalu nanyain mau titip tidak less drama
nevienpan,heboh soal curhatan istri tidak tempat sampah cemil suami yang cemil sendiri luar sampai kait kaitin patriark
nevienpan,iya silakan anda
nevienpan,si sempurna nada sedang saya si nada tuli makanya jodoh teman teman
nevienpan,saya ajar fisika agar henti nabrak nabrak
nevienpan,kukur
nevienpan,yang lelah tidak situ doang kali
nevienpan,o bisya iya alasan begitu
nevienpan,kadang orang yang baca bahasa teks umum resmi pdf instansi tidak paham paham kalau pakai bahasa obrol sama manusia
nevienpan,apa
nevienpan,memang punya ganguan imbang ini kayak
nevienpan,kalau sholat isya awal waktu akhir malam mager sikat gigi
nevienpan,kali lebih hati bicara
nevienpan,ketrampilan jaga peras orang itu nyata memang asah tidak muncul saja
nevienpan,kejut saudara saya calon avatar
nevienpan,kenapa malah tibo iya ampun saya gugup an
nevienpan,dapat jawab
nevienpan,sering yang kata
nevienpan,tadi kilas tidak gulir yang cerita atasanya haram kerja saat hari libur sampai kena tegur gara tahu kirim e surat pekerjaan tidak hari libur ironi saat buka grup wasap hari sabtu malam indah ada bapak bos ngoyak nagih hutang bpjs
nevienpan,bangun tempat ibadah agama juga kenapa deh selalu heboh po nenek gerejane ramai njuk koe dadi ken melu mangkat saudara wanita gereja po bagaimana apa
nevienpan,saya juga kerja layan resmi syarat kerudung masuk kerah kalau tidak syar saya sekali tidak tengah tengah nyanyi gur disampirke tidak rapi walaupun bentuk kepala jadi aneh kalau kerudung dimasukin sudah mau bagaimana lagi nama atur
nevienpan,kayak tolong lah atur buat cuma buat asn wajar kale buat atur pakai seragam buat suatu kantor sama saja kayak buat atur seragam buat murid sekolah
nevienpan,akhir lelah sekali baca temlen isi ribut soal agama cadar lah bangun tempat ibadah agama lah
nevienpan,memang nenek ono tempat ibadah agama njuk iman tergangu po bagaimana heran deh orang mau ibadah saja ribut sekali
nevienpan,adalah itu anda
nevienpan,clueless
nevienpan,ingin tidur lantai saja rasa
nevienpan,otaku terlalu penuh rasa tidak nyaman baca alih ruwet pikir tapi lagi mobil gin baca lalu mual
nevienpan,kampul hai ah
nevienpan,kan mereqa butuh konten ibu
nevienpan,iyes haf lemon teh adalah teh kampul in solo bahasa tawa
nevienpan,gugup ayo ra
nevienpan,saudara wanita memang burjoan dodol soto
nevienpan,nah kan saya tidak aneh nenek nyebute teh kampul tangis
nevienpan,bukan mahram bude
nevienpan,ketangkep basah lagi ghibah
nevienpan,hai
nevienpan,numa malah syedih temenya tadi jemput pulang lalu gabuts suara catat bapak sudah
nevienpan,dibersihin
nevienpan,iya halus kan saya tidak suka kasar
nevienpan,mobil coba dong iya tuhan saya apa jam pagi nekuk jari kaki
nevienpan,tinggal hidup saudara benar sekali
nevienpan,ken wirausaha benar memang bukan karena ken ngejar uang lebih banyak karena saja karir bagai karyawanpun datang pasu yang lebih banyak stabil cuma ken kerja tidak ikat geser kontrak saja sih
nevienpan,saya biasa baru tidur lagi kalau mbendol sudah nglilir lalu obrol kenapa kw anak tangga turu e kalau sudah begitu ngantuk tawa apa sudah nep
nevienpan,ibu nglilir kmd kenapa ra bobok untuk saudara wanita iya saya tadi sudah tidur jam buk masa jam sudah tidur
nevienpan,memang kadang persepsi komentar orang tg suatu masalah malah lebih berat masalah sendiri
nevienpan,saya bisa hanya ucap tinggal kuat
nevienpan,kalau tidak begini dadak jadi pikir saya nyata anak datar tidak kasih kata kata sentuh tidak menye menye tidak semangat orang pantas saya sering kira tidak pernah motivasi ndol ben gek lulus
nevienpan,datang warung nyalimi teman teman sekolah yang lagi nongkrong juga yang lewat kenapa akrab siapa iya tuhan nyata tetangaku dewe
nevienpan,haid sudah hampir seminggu dismenorenya baru sekarang
nevienpan,yang tidak akan lupa jemput selesai geser sore pulang jam malam balikin motor saya sampai kos buka jok sudah air mineral saja dalam betul saya memang tidak sekali habis air lupa mau mampir beli
nevienpan,orang proyek suka utama musik anak motor reminds saya dari seseorang
nevienpan,wo la pantas masuk kartu mesin atm tidak masuk masuk dimasukin ktp
nevienpan,baca replyan tweet jadi pikir besok kalau punya anak memang baik dibiasain segala macam ketrampilan receh ketrampilan rumit hidup lebih mudah tidak ngrepotin orang
nevienpan,buat kecewa apa biasa sih ekspektasimu sendiri
nevienpan,ng mungkin pacar tekan atau mungkin memang ken simpan tawa
nevienpan,asal bukan ngonceki jeruk kalau jeruk bagianya babay
nevienpan,sambat tadi malam kook pagi sudah semangat
nevienpan,tadi tidur siang karena siap mau begadang buat lapor kerja sama pt buat rapat besok jebul jam selesai
nevienpan,padahal besok harus di jalan pagi lalu rapat latih hari
nevienpan,banyak tidur siang jam gin mata segar
nevienpan,ini nenek arep nyetliko jam semene kenapa ayo krik krik lantai sendiri
nevienpan,kalau saya ngelike banyak karena sempat baca sekarang utama benang atau ken ingin tahu komentar nya jadi tab seperti buat nyimpen sebentar kalau sudah baca diunlike
nevienpan,kalau ibu begini cuma mau ngecek saya merem tidak jalan
nevienpan,sering halusinasi badan rasa yang gremet pernah tidak warung sampai kamar mandi buka baju buat kebut in jam malam bangun sampai dadak mandi lelah tidak sih hai
nevienpan,naini kayak memang butuh micin kan buat naikin tensi upacara
nevienpan,juga banyak talking jijik
nevienpan,rasa ingin tidur rumah ros walaupun kadang berantakanya konyol saya sayang tangis lantai
nevienpan,ohiya sih
nevienpan,peta kalau malam banyak seperti anku muncul temlen kalean gais yang faedah sampai yang apa sih begini seperti saya tidak buka pict ini soal twiterku ada enol dot twitter dot com tawa jadi saya seperti saja semua tweet yang saya ken lihat lagi
nevienpan,hati bacok
nevienpan,warnain rambut saja dong tolong tawa
nevienpan,jare teman kepala malah gundul tawa
nevienpan,numa kepala berat pantas saja tidak pernah mau potong rambut
nevienpan,kepala berat pantas jadi ken potong rambut ros
nevienpan,drama per untuk an lebih tepat bebs riwayat keluarga kalau ngebis sering kebablasen tawa
nevienpan,lama telepon hidup anda pasti bisa hidup semangat
nevienpan,uras waktu uras energi uras emosi
nevienpan,suka ini begini begini
nevienpan,bablasen yk ke kosku
nevienpan,kliatan sekali tidak suka pikir
nevienpan,dingo maem nyanyi banyak arti ben semprone bakoh
nevienpan,tiap brainstorming malah rasa mau mewek terus
nevienpan,tidak mudah hakim orang anda tahu berapa keras juang sudah berapa jauh jalan
nevienpan,saya berat kilogram bmi ayo ibu konsultan gizi perlu obat apa
nevienpan,saya pernah anda cemil preksu
nevienpan,rem
nevienpan,percaya saat baca yang kuinget memang anda babay dan punya anda cinta benci hubung
nevienpan,gila kurus saya
nevienpan,lirik saya buat celaka cinta meski anda tidak cinta itu nyata
nevienpan,maaf saya tim ibu made euy
nevienpan,video ajar keras apa usaha terkadang hasil sesuai harap tinggal ikhlas bisa kita laku
nevienpan,hai nyamber saja kira lagi khusyuk
nevienpan,tetap dulu boleh la
nevienpan,suasana media sosial sedang duka gais
nevienpan,hayolo fir
nevienpan,saat anda tahu itu salah di saat sama anda tidak tahu bagaimana cara membetulkanya
nevienpan,hari tidur siang jam sampai panggil ibadah isya jam berapa nepin tidur malam
nevienpan,pinset ketlisut dunia pergabutanku hampa
nevienpan,baru nama sakit memang darah asw
nevienpan,ada lurus
nevienpan,lah baru buka twitter baca ritwit aah tawa
nevienpan,rekan sekali kalau naro baju habis cuci ndadak cari slot yang kosong
nevienpan,gin
nevienpan,sumuk tapi nenek mandi tambah sakit harus bagaimana
nevienpan,pencitran lah mik agar kira punya hati
nevienpan,cukup sekali
nevienpan,lah iya benar sekali
nevienpan,manusia bisa rencana tlisipan jam tentu
nevienpan,sumpah apa sekali tiba nang kereta padahal lagi nenteng hadiah batin uwong kira patah hati kali saya
nevienpan,ayam madu sayang samping bank mandiri tur tawa
nevienpan,kalimat semoga tidak acara dada adalah buah ilusi
nevienpan,hanya mie ayam geprek memang enaq sayang
nevienpan,padahal akhir cemil perut langsung panas menit selesai cemil kemudian saya anak anjing hari kali mana biasa saya bisa hari sekali
nevienpan,tidak datang rada bingung sih nasi mangkuk kenapa pakai persegi tidak pakai mangkuk jebul salah tekan menu ealah
