username,tweet
ladafiq,syukur senang akhir tidur tenang
ladafiq,makas anda spoilernya saya jadi tenang tonton khusyuk kalau sudah download
ladafiq,wah bau bau senang akhir
ladafiq,pikir hari
ladafiq,rsud daftar putar awal tonton episode biasa saja malah sempat tidak lanjut tonton terus lihat ulas orang seru jadi lanjut tonton memang seru
ladafiq,setuju tidak enak eneg aneh rasa pokok aman aman saja tapi kenapa buat yang tidak hamil belum menikah
ladafiq,omong omong saya akhir akhir twitnya drama korea terus ada tidak punya beban hidup saja kan
ladafiq,akhir tidak seperti overs tolong
ladafiq,makan malam pasang mistik pop atas bar seru drama apalg makan malam pasang
ladafiq,tadi pikir sampai akhir dapat simpul drama itu raja kekal raja ini seperti drama bulan cinta ratingnya rendah korea drama bagus bahkan tren terus mungkin akan seperti bulan cinta yang meski sudah tamat lama tetap saja banyak yang bahas
ladafiq,lagu paul kim sayang saya rasuk relung hati
ladafiq,lagu gembira yang introduce saya sebuah baik orang ini enak sekali
ladafiq,bantu jawab senin selasa tayang
ladafiq,waktu saya bilang kan sudah cemil mie ibu kata ibu rina kan cuma mie memang orang indonesia kalau tidak cemil nasi bukan cemil nama
ladafiq,ibu rina benar ken saya gemuk tadi sudah tempat sampah mie ayam pedas sekarang disuruh cemil nasi
ladafiq,bayang itu akan seperti goblin di episode sudah mulai paham sama beberapa episode konflik sudah mulai turun begitu nyata ah
ladafiq,panjang episode episode yang ter tidak saya paham ya jauh ekspektasiku
ladafiq,saya tonton bagai latih tidak syok kalau rencana putar di episode lanjut tanam mantra tidak usah banyak harap senang akhir daf
ladafiq,memang twitter itu surga cinta spoiler
ladafiq,uang tidak banyak ken beli banyak sungguh kontras sekali adan
ladafiq,dasar saya
ladafiq,mau beli bersih minyak saja mikirnya lama sekali sampai browsing lama segala macam ulas lihat ujung ujung pusing gakjadi beli
ladafiq,dots
ladafiq,saya diri sendiri kenapa lapar masa saya cemil nyata saya cemil siang lupa pikir
ladafiq,wah enak itu urun
ladafiq,harga dtolak dompet nyata bul
ladafiq,beli mana
ladafiq,wah kupu kupu
ladafiq,mr sinar matahari langit kastil
ladafiq,hotel del luna
ladafiq,makas fira
ladafiq,tkem drama korea fir disemangatin jadi makin semangat ngedrakor ini
ladafiq,lebih baik saya pasrah daripada pusing
ladafiq,pusing kepala habis baca teori tkem
ladafiq,obat sembuh diri adalah namatin
ladafiq,makas
ladafiq,grup teleku kenapa ya pengirim bagi link tidak pengirim
ladafiq,tiap hilang sakit butuh waktu akhir benar benar ikhlas lepas tidak apa hadap anda hebat tahan saat hilang juga berat
ladafiq,kantong mata buat tempat uang receh ini
ladafiq,ik jun dong
ladafiq,saya cemil bakso miu dekat miu makananya manusia cemil bukan bakso oke miu meong sila terjemah sendiri bahasa miu
ladafiq,ah lup drama ding jadi judul drama sedang langsung ya walaupun sudah tamat saya di episode
ladafiq,bosan sedang cari lari daf
ladafiq,nyata pertama kali saya tonton drama sedang langsung judul sekaligus wah lihat sekali kalau saya bosan
ladafiq,bagai siap sakit hati ingat ada cerah mungkin rendah potensi senang akhir drama saya jadi tonton
ladafiq,ada darurat pasang yang utama lagu ji hyo toilet
ladafiq,vagabond dia pribadi hidup goblin masih banyak
ladafiq,neraka tentang waktu memorist menikah tidak dating ada darurat pasang doctors
ladafiq,manis manis gin suka sekali lewat beranda saya untg saya sabar
ladafiq,minum saja pikir dulu sudah tidak puasa kan
ladafiq,fi anda kenapa tidak gila ibu saya lupa terus mau cemil ada puasa takut dosa kalau cemil
ladafiq,akhir yang sedih pengirim bagus tapi kenapa cerita
ladafiq,loading hanya ah telkomsel
ladafiq,semua kekorean waktu
ladafiq,saya kalau minta memberi rekomendasi drama korea bagus begitu bingung soal banyak bagus saya jadi gakbisa pikir bahkan sampai lupa judul
ladafiq,dimafin tidak
ladafiq,kasi lambung kerja keras gara gara saya makanya banyak maaf lambung
ladafiq,lelah cari cara lawan takdir saya akhir di fase terima
ladafiq,mohon maaf lahir batin ya lintang
ladafiq,amin mohon maaf lahir batin ya nimas
ladafiq,pikir pikir gakbisa komentar
ladafiq,iya sama
ladafiq,iya ayo tonton film kuruna akhir
ladafiq,mohon maaf lahir batin teman teman semua selamat hari raya idul fitri
ladafiq,saya rindu tonton film bioskop sama
ladafiq,tonton tktem sisi goblinya sisi mr sunshinenya ada sisi dotsnya harap cuma akhir ini sekali tidak seperti mr sinar matahari
ladafiq,iya memang nguin tiap minggu itu uji sabar tawa siap sebentar kukabarin kalau sudah tamat
ladafiq,bukan maksud akhir episode bukan akhir semua episode begitu malu
ladafiq,akhir episode astaga gila sampai tidak ulang ulang
ladafiq,keluar surat edar kalau bulan juni mulai posyandu tapi tetap dengan protokol corona semoga semua selalu sehat amin
ladafiq,sudah tidak tahu berapa kali saking sering
ladafiq,saya newbie jadi belum hafal semua judul lagu saudara wanita
ladafiq,salah ketik ceri
ladafiq,lagu iu vibesnya musim semi bunga bunga matahari pagi blueming tidak spring cinta atau riang mekar ft tinggi musim gugur pagi
ladafiq,kalau lagu ngenesnya iu akhir tempat jadi sih makna
ladafiq,lah twetku dua kali lipat yak kenapa baru sadar
ladafiq,iya jam bobok ini ibul apakabar
ladafiq,lepas sebagai fans iu suara pacar memang heartwarming sekali
ladafiq,daftar lagu iu buat anda susah tidur versi saya knees through itu malam sayang name saya old cerita antar tidur tenang tidak lantas buat anda bobok sih drekomendasikan buat yang suka korean yang tidak suka sebentar malah pusing hujat saya
ladafiq,daftar lagu iu buat anda susah tidur versi saya knees through itu malam sayang name saya old cerita antar tidur tenang tidak lantas buat anda bobok sih drekomendasikan buat yang suka korean yang tidak suka sebentar malah pusing hujat saya
ladafiq,yaudahlahya mau nyalahin orang rasa diri juga salah rasa sudah usaha memberi tahu yang benar tapi dcuekin malah yang ngelawan jadi gakbisa balik ngelawan malah jadi ribut kan nama saya tambah masalah sudah akhir yaudahlahya
ladafiq,desa sudah jadi zona merah saja desek desekan toko baju tidak pakai masker nongkrong dekat sungai
ladafiq,memang orang kalau tidak diri sendiri keluarga sendiri orang dekat yang nyata kena virus tidak akan kapok maaf ini bukan doa cuma memang biasa kan begitu baru kalau sudah tetangga tidak belah rumah kena begitu heboh sudah
ladafiq,yang sudah pasrah sudah kalau kena virus mau bagaimana yang kasi tahu bilang iya paham tapi dsuru pakai masker tapi gapake masker dsuru cuci tangan sabunya tidak pakai memang orang ini kalau disuruh beri alas pintar sekali
ladafiq,era hati orang saja satu saja susah subhana kadang malah susah dtgnya orang dekat seperti keluarga teman tetangga yang sudah punya paham soal virus yang konspirasi lah yang punya yakin kalau virus tidak akan sampai dia lah
ladafiq,kalau dtanya seperti begitu agar virus tidak makin sebar entah sebar diri sendiri keluarga orang dsekitar lingkung dengan atau tanpa kapan smw akhir tapi harus sabar spti
ladafiq,yang drumah saja drumah saja kalau tidak urus ptg kerja tidak keluar rumah klau trpaksa keluar pakai masker cuci tangan masker kain murah oke sudah dapat anda cuci tangan tidak sulit bangun candi dalam tadi malam kan
ladafiq,masa pandemi gin gerak sendiri hadap semua akan sgt berat kita karena mg masalah harus hadap sama dengan saling kalah turun ego masing siapa demi penting brsma bukan cuma buat kpntingan nakes saja buat semua masyrkt
ladafiq,iya la toko pulang kenal saudara maesan itu
ladafiq,eh iya
ladafiq,acara apa kucing
ladafiq,sprei beli online gara gara mega busana ramenya masya serasa tidak pandemi toilet
ladafiq,libur mau mana kan gakboleh mana mana
ladafiq,libur lebaran apa saya kenal kenal dulu ayo siapa tahu tahun depan dapat libur lebaran
ladafiq,iya kan kalau batas yang balas doang tetap lihat orang banyak
ladafiq,saya pikir begitu
ladafiq,tim kalau rujak pakai royco kalau buat masakan tim masako
ladafiq,susah deskripsi sih
ladafiq,bisa harap pasti
ladafiq,jumat kemarin tidak episode itu raja
ladafiq,wah arti harus cicil dari sekarang agar tidak ledak otak tidak masuk
ladafiq,aman kebal
ladafiq,begadang sama miu
ladafiq,eh sentuh alias labskil ngu corona selesai dong labskilnya
ladafiq,lupa saya toilet malu tapi ngampus dong kan gakbisa labskil online tidak praktek lagi ini gara corona
ladafiq,nahkan haha diri pakabar dek kuliah online ini apa sudah lulus
ladafiq,enak manga
ladafiq,tidak
ladafiq,nahkan fodfes banyak sekali foto mie instan untung saya rujak jadi rayu
ladafiq,waktu indonesia cemil mie instan
ladafiq,hanya jadi wacana rujak tengah malam akhir realisme dengan bumbu instan alias royco sama cabai doang luput per utama sang manga rujak pagi siang sudah tidak bisa alias puasa
ladafiq,memang saya tidak jelas orang tengah malam gin ken rujak manga untung manganya sudah seperti orang ngidam kan heleh
ladafiq,nokia
ladafiq,sampai olah olah kamar saja sudah cukup buat hidup tidak lupa kamar mandi
ladafiq,orang orang mesti pikir kalau saya kamar saja tidur terus padahal banyak yang laku kamar anda sudzon deh
ladafiq,pacar tidak temu
ladafiq,dafi siang gin sudah tepar habis apa habis konser
ladafiq,kalau tidak ingat dosa sudah minum saudara
ladafiq,puasa dia
ladafiq,memang salah karaoke siang siang gin selesai langsung tepar ada habis lari
ladafiq,malam anda alias jam
ladafiq,saya itu rindu tidur jam begitu anda
ladafiq,tuhan tawa lihat tempat jadi
ladafiq,iya peh
ladafiq,episode sedih se
ladafiq,dea imut sejak kapan utama drama menang indosair
ladafiq,mbaku ultang tahun sekarang gais
ladafiq,tidak minta saya pilih lee admin ho ji chang wok
ladafiq,tidak punya aplikasi instagram la saya kan buka pakai web
ladafiq,keren keren
ladafiq,sama sama
ladafiq,sama sama
ladafiq,lihat saya jadi ingat berapa lama saya tidak cemil mie
ladafiq,unduh telegram sebentar kas link buat gabung saudara grup cinta drama korea begitu saudara wanita
ladafiq,kalau anda cari yang resolusi bagus sekali mungkin akan rasa tidak nila pengirim tapi saya sebagai yang tonton drama korea saudara telepon nila sekali updatenya cepat donlotnya mudah tidak pakai iklan
ladafiq,yang punya masalah siapa yang ikut pikir siapa yak
ladafiq,saya kenapa takut sebentar halal sgla cara buat jadi ratu bahkan sampai ganggu jong tae eul begitu takut kerja sama lee lim
ladafiq,saya beli parfum saya pusing cium bau bagaimana sih saya kemarin tidak beli kan saya cium pakai hidung sendiri
ladafiq,dan tidak lupa pakai masker hitung pakai jari
ladafiq,rip fisik jarak pasar pujer
ladafiq,kucing kalau liay laptop memang bawa ken didudukin lewat atas keyboardnya masalah apa si kucing sama laptop itu
ladafiq,jenang sapar versi mini
ladafiq,turut dukacita peh
ladafiq,iu s hari
ladafiq,tetes micelar air sangat harga
ladafiq,ui drdlu sampai sekarang pendam rasa ken kuliah sini walaupun dtolak terus tawa alasan tidak tahu ui macam pertama cinta haha
ladafiq,pantas saja saya bolak balik kamar mandi bising usus disko
ladafiq,ada saja hal ramai tuiter ini
ladafiq,kemudian anda anda pikir keras pikir lama sampai begadang nyata saya cuma putar putar putus tidak duga memang dasar saya kalau sudah mau beli langsung apa coba saya buka shopee sampai pikir lama astaga lihat kn yang bodoh siapa
ladafiq,jam jam bolak balik buka shopee pikir keras sekali apa mau beli sampai begadang pikir lama sekali oke urus sama diri sendiri checkout kmudian keluar tulis tunda hari karena psb langsung gagal terus ngmng sndiri beli lgsung ajadeh
ladafiq,sama sama bunga plastik
ladafiq,cantik
ladafiq,saya sampai bingung harus duduk model bagaimana agar tidak bosan
ladafiq,sepi sekali iya  orang orang pada buka kali daf
ladafiq,akhir saya nangkring pemdaftaran rumah sakit tunggu jam praktek dokter jelas saya buka mana ibu
ladafiq,sambal mentah
ladafiq,astaga saya mengawalai hari dengan pikir hal yang tidak baik pikir kan
ladafiq,saya tidak habis pikir sama pikir saya pulang tidak suka sama orang sakit orang sakit nyusahin mati saja sudah nyusahin serius kalimat yang sangat sakit mungkin manusia tengah setan
ladafiq,segala tentang iu gakbisa lewat memang suka saya sama saudara wanita iu
ladafiq,salah satu bentuk mampu pindah nyala drama bulan cinta nontonin pria nyala sebuah misi doa dalam hati tuhan kapan iu sama lee jun ki utama drama pikir
ladafiq,iya rindu kuliah
ladafiq,gakpeduli sama baca nya bacan bacan
ladafiq,nya di prinkan tulis seperti begitu kan dapat itu puskesmas tetap tidak hirau apa perlu buat spanduk besar acara seminar ya agar dibac
ladafiq,iya fira tidak lupa pakai masker kalau keluar rumah cuci tangan
ladafiq,lagi hade
ladafiq,tindak yang sederhana tapi sangat bantu kurang sebar virus corona semoga orang yang sadar segera sadar mengunakan masker cuci tangan amin
ladafiq,miris sekali adan seperti gin banyak yang tidak pakai masker sadar mengunakan masker cuci tangan rendah kasi tahu malah marah jadi saya sgt berterimakasih skli oke semua orang yang sudah sadar pakai masker mau dsuru cuci tangan
ladafiq,pakai masker demi diri sendiri bukan cuma buat nakesnya saja agar tidak tular buat diri sendiri kalau sudah tegur nakesnya yang salah malah marah sama nakesnya bagaimana dong memberi tahu baik malah marah dekrema
ladafiq,terus saya bicara ibu pasien susah sekali dsuru pakai masker cuci tangan saja kalau tidak dtgu tidak diliatin tidak dpake sabunya padahal setuju utama ya demi sendiri fasilitas yankes kan tmpt pasien yang gaktau siapa yang bawa virus
ladafiq,saya mau negur sudah lihat pasang tidak mau bilang akhir ibu rina datang seperti memberi kode sudah dek gpa akhir saya diam konsultasi pasien pulang ibu rina bicara saya memg orang susah dbilangin dek sok orgnya
ladafiq,ibu lihat kesal bapak terus bicara e disa kanto sobung corona saudara wanita saudara desa sini apa corona saudara wanita saya brusaha sabar sabar akhir ibu sama bapak cuci tgn tapi tidak niat gapake sabun terus lgsung masuk oke tmpt periksa
ladafiq,itu datang lagi pasien pasutri sudah tua begitu datang nya gpake masker lgsung mau masuk terus saya tegur buk bapak cuci tangan dulu terus si ibu jawab beh sudah wudhu brusan saudara wanita saya nyaut iya ibu tapi cuci tangan sekarang wajib cuci tangn ibu kalau kesini
ladafiq,saya selesai sholat dtgulah pasienya terus ibu rina nyeletuk agar dek pulang apa balik pasienya ngosok ngambek seperti soal dsuru pulg ambil masker sudah gpa saya cuma mbatin tuhan pakai masker diri sendiri padahal sampai hingga seperti itu
ladafiq,jadi pertama buka pasien datang mau suntik kb rumahny dekat sekali saya sholat sama ibu rina dsuru pulg dulu ngambil masker karena sekarang fasilitan yankes memg wajib pakai masker aplg adan pandemi gin dn saudara maesan sudah zona merah
ladafiq,sore ada jadi yan buat saya sama ibu rina miris saya malah lebih sedih dalam hati kenapa gin sekali sih
ladafiq,sama lah kalau begitu tawa
ladafiq,serius ken kuliah
ladafiq,agar bobok lelah pikir tugas bukan lelah pikir yang
ladafiq,ken kuliah tuhan
ladafiq,iya fir sudah tdur brusan
ladafiq,salah satu bentuk neraka diri sendiri belum tidur sama sekali tadi malam pagi
ladafiq,tidak mempan tetap pikir astaga
ladafiq,gakpapa gakpapa
ladafiq,amin paling serius
ladafiq,tapi sekali akhir buah cerita bukan soal apa mau apa mau sih tawa
ladafiq,baca teori drama itu raja kekal raja buat pusing bukan cuma jelimet akhir yang seperti akan sama seperti akhir goblin padahal saya mau hidup bahagia bukan cuma ketemu doang akhir
ladafiq,semangat cemil apa ngantuk hai
ladafiq,saking semangat saya cemil tempe sampai tangan mau tidak cemil
ladafiq,kedengeran banyak alas tapi hpku kalau dpake tethering banyak asli soale tidak
ladafiq,saya gakbisa download apnya sekali balas punya
ladafiq,iu apa
ladafiq,lebih kesal sih benar
ladafiq,saya enak saja pengirim matte begitu hasil cuma memang kentel begitu kulit kombinasi omong omong
ladafiq,maximus lawan minimus
ladafiq,sabar kali
ladafiq,sudah sekian kali bahas grup keluarga canda sering ibu sampai sampai saya rasa olah olah jomblo umur gin itu seperti helaw anda mau menikah umur berapa biuh kira perkara menikah tinggal menikah saja begitu
