username,tweet
chyntw_,tidak sana butuh blokiranya buka gilir sini butuh mau ngehubungin malah blokir serah deh
chyntw_,anak tidak pilih orangtuanya siapa orangtua pilih mau punya anak tidak jadi tidak punya anak kalau misal rasa sanggup ngebesarinya jadi orangtua pekerjan umur hidup soal
chyntw_,iya kenapa bisa sih
chyntw_,humoris sekali
chyntw_,teh odynya pernah temu tidak
chyntw_,bentar bentar kalau mau ngelabrak saya siap siap dulu
chyntw_,mau tiba tiba minta beli pulau ah
chyntw_,tidak gatal anda
chyntw_,untung sudah jadi warga jeruk
chyntw_,memang harus budaya literasi
chyntw_,antisosial deh seperti ibu
chyntw_,wajar sih swasta tidak rugi kenapa pengirim ui bayar seperti itu nila itu harga sama apa akan anda dapetin sana jt angsur kali sudah dijelasin websitenya
chyntw_,kucing hilang tidak pernah balik balik padahal sudah minta kucing buat nemuin curiga kucing tidak pintar gaul makanya malas nyarinya
chyntw_,ayo
chyntw_,balas tidak ada lawan
chyntw_,tidak trilogi dong shin wo kan buat balas sama
chyntw_,hai sudah selesai prisonya gila cepat sekali
chyntw_,memang pernah beli bakso
chyntw_,kapan tahu saudara laki saudara laki beli bakso biasa ibu orang minta kecap saos sambelnya pisah polos benar bicara saudara laki bumbuin sekali saja orang rumah kalau bumbuin tidak enak
chyntw_,saya mau belut goreng
chyntw_,tadi pasang muda lumpur datang terus sen saudara wanita beli nasi mau marah padahal jelas sekali nama bakso banteng terus rombong bakso besar gaban depan muka
chyntw_,belakang bantu orangtua jual mumpung bisa balik yogyakarta lama jual hampir minggu temu orang tingkah saja
chyntw_,sudah sering
chyntw_,kalau sih yang doyan bapak
chyntw_,obat kurang darah
chyntw_,obat buat darah rendah apa sih aman rutin konsumsi
chyntw_,memang apa makananya minum ludah sendiri
chyntw_,kenapasih hastagnya
chyntw_,ken dong ajak utama yayasan begitu mit
chyntw_,hati saya tidak kuat seperti
chyntw_,tidak bayangin sakit dia rasa besar apa sampai seperti begitu
chyntw_,jarang komentar soal begini serius lucu sekali sudah jaksa mantan komedian begitu bagaimana
chyntw_,tidak punya anak kalau tidak siap jadi orangtua mental anak taruhanya anak luka luar lihat mukulin dada nang buat saya nang semoga hidup roy depa jauh lebih baik sekarang
chyntw_,enak kenapa kriuk kriuk
chyntw_,padahal saya cuma cubit sayang
chyntw_,kenapa orang orang santai benar sama saudara laki ngumpat begitu saya mangil tidak pakai saudara laki saja tabok
chyntw_,hari sekian mantengin instagram bako ranjau sudah balik apa bom nyata bom
chyntw_,gatal sekali ken rapin dasar tulis terbit ukur warna
chyntw_,congrats ega
chyntw_,tidak liatin cerita orang orang tidak sengaja akun mantan saudara laki hancur buka terus tidak sengaja otomatis bilang iya sudah putus waktu lihat foto cewenya sudah tidak
chyntw_,nyata memang campur tangan setan aljabar logaritma sama trigonometri tidak salah saya benci sekali
chyntw_,benar benar ngingetin sendiri depa kalau tuhan kasih rezeki lebih besar harus saya tingkatin tabung sama beri bukan gaya hidup
chyntw_,foto saya sik
chyntw_,dulu waktu kecil sering sekali begini suruh minum air kelapa muda sama cemil pisang hijau tidak lama baik deh kalau parah balur pakai balsem minyak hangat begitu enak karena gatal kena hangat minyak balsemnya
chyntw_,lebih kontrol deh mulut sama jari kalau kata mamawik kalau bisa buat kenang tidak meningalkan gores
chyntw_,pernah dicurhatin orang saya takut sekali mau curhat media sosial repost yang sedih sedih soal dikatain lebay sama si salah saya kalau orang sampai gila karena cara healingnya anda halang sadar tidak anda sudah neraka apa ngerusak mental orang
chyntw_,masalah sama kondisi lingkung sekitar kalian jelas beda yang hitung jadi tidak belaga olah semua hidup mau tidak begitu
chyntw_,sosial media ya serah mau apa lama tidak rugi anda yasudah biarin saja rasa kalian pernah ngalamin masalah sama tidak sampai curhat sosial media hai kalian tidak pernah benar benar rasa apa orang rasa
chyntw_,tidak ya lewat saja kalau memang tidak suka tidak semua orang punya tempat cerita dia percaya memang anda komentar lebay lain ini kalau dicurhatin sama mau jadi dengar jelas akan buat rasa lebih baik begitu tidak kan
chyntw_,sih mulut sama jari susah sekali buat tidak komentarin orang ada orang curhat sosial media bagai bentuk healingnya kalau tidak bisa bantu sudah biarin saja gatal sekali komentar lebay masalah pribadi umbar umbar dulu
chyntw_,akusih pilih balas
chyntw_,piring begini kasi panas dikit tidak apa apain belah sendiri
chyntw_,ya kemeja rayon itu enak sekali pakai mudah sekali kusut seperti kunyah sapi
chyntw_,harus temu komentar begini saya jadi pikir
chyntw_,syukur punya bapak saudara laki laki tidak rokok itu keluarga besar mayoritas laki laki yang rokok hitung jari
chyntw_,ooh jadi sekarang kalau mau tes tahan lipstik harus pakai cium dulu
chyntw_,sakit hati budaya jawa dikatain syirik sampai khurafat bicara ada paham sekali budaya orang astaga
chyntw_,saya suka opini saudara laki saya kalau punya pasang yang ajak diskusi malah apa hai doang malas
chyntw_,coveranya luthfi sama dinda kirana sopan sekali tidak masuk kuping enak benar didenger
chyntw_,nang benar salah apa sih
chyntw_,bayar penuh tidak ditempatin pikir kamar mandi motor air galon beras kasur gataulah
chyntw_,replynya ajar penting tanda baca spasi cara baca
chyntw_,semoga tidak sampai yak
chyntw_,benar benar ingetin diri sendiri nanti depa tidak ragu buat ngaku salah bilang maaf meski orang lebih muda
chyntw_,karena anda jauh lebih tua dewasa bukan arti anda pernah salah kan
chyntw_,yawda kalau begitu ke sarangeui opa saja
chyntw_,agar anda tidak cemil otokowok terus
chyntw_,pedo sial
chyntw_,nama kepsek saya tidak tk
chyntw_,punya saudara kelas nama brilian adeknya intan sama mutiara pacar teman nama godtama adeknya robtama mantan dulu punya saudara nama buyut kira canda doang dipangil nyata memang nama
chyntw_,tidak akhlak memang
chyntw_,gila habis nyolong pocky orang jadi manis sekali ngomongnya
chyntw_,alur grup alumni buat beberapa tahun lulus suruh saling undang teman kilas balik masa masa bareng ramai ngajakin kumpul tidak jelas waktu tempat kapan akhir sepi cuma disi promosi
chyntw_,kalau orang tidur suka digigitin minta elus suka masuk dalam mukena tidak sholat tidak akhlak ngelewatin muka ngibas ekor burung rumah bulu hampir habis digangu hanya sama
chyntw_,tahun
chyntw_,lah kenapa tiba tiba jadi himalaya
chyntw_,dari tentu
chyntw_,apaka anda
chyntw_,bisa t hubung skripsi harus lampir analisis blabla lampiranya doang halaman sendiri
chyntw_,penasaran sama pacar anda ju
chyntw_,iya mau cepat saja
chyntw_,akhir tonton episode akhir rsud daftar putar banyak bawang
chyntw_,lagu wajib tiap kelas kosong ibu tidak sampai
chyntw_,saya tahu saudara twom itutuh apa cuma telepon lebih oke turut
chyntw_,maaf apa twom drama baik sekarang pegang telepon
chyntw_,garela
chyntw_,episode pacar anda ju si mone sudah diliatin bom seperti mana orang
chyntw_,sampai sekarang tonton telepon episode karena rela pisah sama
chyntw_,dulu tidak pakai balut kalau banjir max jam sekali kalau mulai biasa saja saya usahain jam sekali sekarang pakai menscup buang max jam sekali
chyntw_,buat uzi ibu nasi padang boleh bawa masuk dalam bioskop
chyntw_,jadi lapar
chyntw_,cemil gratis adalah satu umat
chyntw_,tidak cemil
chyntw_,tidak tahu saya nenek tapi memang gelombang besar
chyntw_,suasana aneh sekali habis gempa terus hujan deras sekali jam sampai sekarang reda
chyntw_,episode dialog banyak anyeonghaseyo doang baru episode lihat ngobrol ketawa tetap gemas andrea tetap jadi dokter saja agar layar kapal
chyntw_,tidak ikhlas
chyntw_,apa nama kosnya saudara
chyntw_,rasa yogyakarta malang bandung doang ini belum
chyntw_,dia mau cemil daging mentah dimarahin sama semua gemesh sekali
chyntw_,kan seperti sayang begitu lho sama lagu hwa kalau deok matahari kan malah hina hina
chyntw_,lagu hwa ini sayang sekali sudah sama teman temenya
chyntw_,kemungkinanya dekat persen yak
chyntw_,kenya sih benar
chyntw_,mimpi gandeng bo gusi itu tidak apa apa lah gemesh sekali soal
chyntw_,orang henti ikuti saya otomatis periksa oleh
chyntw_,lewat beranda saya jam gin
chyntw_,sih tidak disalahin sekali salah satu emaknya salah suruh tamu cuci banyak piring mbanya salah karena tidak kewuh
chyntw_,seperti suruh cuci banyak piring deh bukan cuma piring doang
chyntw_,nyata sutradara sama baru sadar
chyntw_,mana sebut milik toko emas sangmun dong memberi hadiah kura kura emas yang kasi taek deok matahari hasil menang lomba baduk
chyntw_,tonton ulang rsud daftar putar karena gemas tunggu kelanjutanya baru sadar kalau drama korea hubunganya sama balas awal bapak deok matahari sama jung hwan episode soundtrack sama episode jelas sekali ada ibu matahari rayu sama bapak taek
chyntw_,tunggu admin terimakasih responsif
chyntw_,pacar mirip doesn t buat dia dia tinggal
chyntw_,periksa pesan langsung admin terimakasih
chyntw_,admin jaring dari pagi kenapa eror terus sudah direstart lampu tetap nyala warna merah terus
chyntw_,mau minta maaf orang orang sering sekali saya angurin chatnya ngechat kapan saya balesnya kapan ya belakang malas sekali chating
chyntw_,tidak punya pacar dulu tidak punya gosip apa saja diskusin penting macam uang rencana sampai gapenting macam kuasa ranger warna begitu doang boyfie pasang baik buat ghibah sama sebar rahasia turut
chyntw_,semangat cay semoga lelah jadi berkah
chyntw_,kenapa kucing orang dimandin anteng sekali saya mandin kucing saja dua soal bar bar sekali seperti surup
chyntw_,sama sama kata orang
chyntw_,umur umur tinggal lombok baru kali ngerayain idul fitri sini maaf lahir batin semua
chyntw_,tidak disautin kalau ngechat misi doang awal buang buang waktu tidak usah lelah lelah jelas apa tidak akan masuk otak
chyntw_,maaf lahir batin sopia
chyntw_,sering sekali cakep typingnya gaenak lihat kalau pakai tanda koma banyak sudah begitu koma kasi spasi benci sekali lihat
chyntw_,kasi kartu cubanget gemas
chyntw_,syukur terimakasih iya tuhan meski tengah pandemi saya bisa ngerayain idul fitri tengah orang orang baik sayang sekali
chyntw_,terimakasih sudah ditanyain
chyntw_,shayank
chyntw_,iya tuhan saya ingin yang kuping jari kaki sama bada beda warna
chyntw_,saya tim emoji cinta item cuma karena suka warna
chyntw_,dulu pilih pio karena lulus ken cepat dapat uang rasa gacocok sama matkul klinis eb nyata lulus teman teman klinis malah jadi hari
chyntw_,saudara anda tidak gin
chyntw_,terimakasih bapak karya bapak buat warna masa kecil tidak pernah tidak hadir beli tidur tiap minggu waktu sampai dengan
chyntw_,rap
chyntw_,gausa download streaming saja saudara
chyntw_,syukur arti saudara kalau rsud daftar putar tamat saya bingung tonton twom saja saya cuma tonton episode terus tidak tarik
chyntw_,sering tonton kimbab keluarga acak tanya ibu kalau saya menikah sama bule bagaimana mak tidak apa apa asal sudah jadi orang indonesia terus tingalnya jawa malu kalau sudah begini jadi bukan bule tidak sih
chyntw_,saya sudah kapok punya ekspetasi sama drama korea itu berapa banyak yang orang bilang bagus saya tidak minat makanya sekarang coba tonton dulu deh episode bagaimana
chyntw_,memang tidak sudzon dulu saudara
chyntw_,eh uzi ayo istighfar
chyntw_,drama korea unsur sahabat favorit lanjut balas
chyntw_,seperti yaudahlahya
chyntw_,belyna bangga dengar
chyntw_,tidak pernah dalam bayang akan ngelewatin lebaran idul fitri adan begini
chyntw_,malu lihat gambar pikir daging biadab mana nyata kurang tanda baca
chyntw_,saya ingetnya akhir balas sih tidak ningalin sangmun dong
chyntw_,loh saudara instrumen suka di balas kalau ngeshot komplek rumah pendek doang saya baru sadar tidak tonton ulang rsud daftar putar garagara gemas tunggu episode baru
chyntw_,apas instrumen nama
chyntw_,tidak episode saudara di depan tempat karaoke waktu ik jun sama anda ju tidak ost sih cuma seperti nada doang begitu
chyntw_,ih memang tahu
chyntw_,lebih rem jalan tempat kn saya mirip sama jalan benowo
chyntw_,baru sadar soundtrack rsud daftar putar sama seperti balas
chyntw_,oiya deng benar juga
chyntw_,ujanya enak sekali pakai tidur tuhan
chyntw_,rachel dapat hampers lebaran banyak sekali gils
chyntw_,kon ambil baru pasang
chyntw_,lah buka seperti
chyntw_,bisa punya teman banyak mau hampers beli hampers sendiri cuma buat ambil kartu ucapanya doang isi kasi orang
chyntw_,lah foto itu kucing beda
chyntw_,lucuk
chyntw_,keren oi
chyntw_,seperti saya masuk situ mobil sesat deh
chyntw_,benar sih saya nyantumin bagai rasa terimakasih sudah disuport lama proses pembuatanya biarpun mau sidang malah sudah
chyntw_,tidak sepi ken mendengarkan lagu atau lagu kemudian saya ah berisik sekali sih matin lagu ya saya itu gabetah mendengarkan lagu kalau tempat ramai
chyntw_,amin
chyntw_,piyo anda tidak doyan untuk nasi sama sawi putih
chyntw_,cinta pertama dunia drama korea kim rayu tempat sampah
chyntw_,zi piyo zi
chyntw_,doesn t buat dia tinggal
chyntw_,hormat sih sama warga bola nya sabar ngadepin beberapa model bule benang
chyntw_,sesak mbanya keren
chyntw_,kos
chyntw_,aloha
chyntw_,cakra ramai sekali buset
chyntw_,anda apa saja sih cay tahun doang mata makin parah minus sama silinder
chyntw_,samping cakep lebih enak lihat bo ra kadang
chyntw_,tiap episode punya inti cerita beda ini episode nenek cjma nangung
chyntw_,napas
chyntw_,baru tahu kalau mie goreng yang pakai cabai bubuk begini
chyntw_,sudah tonton karena deok matahari arti
chyntw_,akan sesal tonton
chyntw_,kan sudah disaranin kapan tahu suruh tonton tidak mau sih malah tonton drama korea selingkuh
chyntw_,serah deh lelah mau emosi puasa
chyntw_,saya lihat manusia tapi tidak manusia
chyntw_,minum ades cuma suka ngeremes botol doang
chyntw_,tidak tahu rasa amidis
chyntw_,sarang paling enak
chyntw_,rindu hari hari kakek nenek ada
chyntw_,baru saja jalan rumah sakit satu tempat ramai sekali tidak tahu tempat apa saya cuma hela nafas ken corona cepat sudah masih itu bagaimana
chyntw_,tidak debat
chyntw_,keren sekali
chyntw_,sudah lebih lega kalau butuh teman cerita bilang saja
chyntw_,balas
chyntw_,pernah tidak sih kalian habis bicara sok bijak orang dichat terus malu sekali tidak mau ketemu orang langsung seperti saya tadi bicara apas sial
chyntw_,ayo sini cerita
chyntw_,iya sudah kuitung niat sekali
