username,tweet
kodelle_,kyot
kodelle_,seperti avatar mau keluar jurus
kodelle_,anda humoris saudara laki
kodelle_,saya beranda adalah penuh dari pic dan video dari anak kucing mereka baca jadi gemas
kodelle_,gemas
kodelle_,raul gonzales tawa saya
kodelle_,keren sekali saudara laki
kodelle_,kejut
kodelle_,semoga bantu
kodelle_,itu s cara harfiah keras untuk hadap itu benar
kodelle_,pernah rasa yang susu bendera bubuk
kodelle_,si dian pikir saja tawa
kodelle_,otak anda jorok biadab
kodelle_,saya dengar keuwuan penganten baru
kodelle_,bosan sekali seperti tidak ada maju apa apa
kodelle_,mau ah ikut pdb lagi tawa
kodelle_,kalau saja dulu masuk sama apa rasa selalu sesal kalau sudah ingat fase
kodelle_,mau paling serius
kodelle_,tidak boong anda
kodelle_,lihat sw teman banyak sekali orang yang ngantri kopi daong mostly tidak pakai masker saya saya keluar dari kata benar
kodelle_,saya yakin ini balas an akan masuk artikel tawa
kodelle_,orang yang libur puncak pakai masker norak sekali gila
kodelle_,pernah
kodelle_,lama jadi guru sadar nyata ajar jadi orang tua bagaimana untuk ajar itu kids bagaimana untuk peduli dan paham mereka needs
kodelle_,semua orang has mereka milik sendiri musim ingat
kodelle_,saya tears sudah buang juga banyak in may june tolong jadi jenis
kodelle_,pon
kodelle_,kesal kadang sama diri sendiri kalau lagi debat tidak pernah ngelawan padahal saya benar tahan akhir cuma nang kenapa ya lemah jadi orang
kodelle_,baru tahu kalau lagu lathi aneh jenius dari indonesia tawa mana saja saya lama hai
kodelle_,saat mula cari cinta
kodelle_,saya didn t bahkan lihat kalau taplak meja sarung jadi kreatif
kodelle_,saya gaperna mau lagi harap sama orang
kodelle_,pakai kode cashzine saya dong saudara laki
kodelle_,nah koinya cair jadi uang di bajing dana rekening bank anda ayo coba
kodelle_,genks coba aplikasi cashzine deh baca berita rebah dapat uang unduh aplikasi lewat playstore di undang kode pakai kode ya anda akan dapat koin cara langsung
kodelle_,agar s lupa semua
kodelle_,luruh semua harap
kodelle_,gila pakai uli cocol rendang enaq
kodelle_,lebaran tahun peluk bapak erat sekali lalu dia cried dan ucap such sebuah manis kata untuk his satu dan hanya putri sayang bapak
kodelle_,waktu akan sembuh tapi itu menang t
kodelle_,hasek
kodelle_,wkt kecil sering sekali antem sama saudara saya kue wafer
kodelle_,akan hilang ramadhan sama
kodelle_,tiap sore selalu begini tidak tahu mau apa heran tidak takut nya
kodelle_,psb tidak laku cikerteg
kodelle_,sedih sekali jadi guru padahal mau lebaran tidak gaji bulan
kodelle_,rindu sekolah rindu anak anak rindu gaji rindu thr
kodelle_,nang nang nang nang buat kalian yang kumpul padahal tidak penting penting sekali tolong lah tidak usah egois itu virus isn t sebuah lelucon anymore
kodelle_,kira jam tengah padahal tengah buka puasa yang siang tawa tega sekali orang rumah gapada bangunin
kodelle_,mutualku lihat
kodelle_,sahur
kodelle_,setuju sekali neh saya kemarin lihat cerita wasap sampai instagram isi acara bukber semwa apa tidak takut
kodelle_,betul pengirim kali mau minum teh hangat ah
kodelle_,kalau nang pagi pagi puasa batal tidak
kodelle_,nang
kodelle_,ngehayal sampai ngehalu gairah virgo
kodelle_,sama energi dengan pasar cikerteg
kodelle_,transtv
kodelle_,rindu tonton
kodelle_,congrats
kodelle_,bismillah saya mau yang biasa
kodelle_,makas
kodelle_,ih
kodelle_,saudara wanita ken resep saya tahun kemarin saya buat tapi gagal lembek
kodelle_,saya memangilmu
kodelle_,kalau sudah nyemilin emping tidak bisa renti
kodelle_,poor saya mata
kodelle_,lemme tunjuk anda ini
kodelle_,sakit hati lihat mereka pikir corona virus adalah sebuah lelucon kali
kodelle_,saya mau yang biasa
kodelle_,kenapa jadi merinding baca balas an nya
kodelle_,segera tonton seri tunggu nyantai dulu tangis
kodelle_,saudara laki seperti cerita rem sekali tidak ada niat buat benang
kodelle_,hepi aniferseri sayang
kodelle_,balas pesan langsung admin
kodelle_,enak sekali tidur atas jadah tiap habis sholat
kodelle_,deep bicara bareng keluarga memang yang paling tenang
kodelle_,kejut balas dil
kodelle_,kewren
kodelle_,pulang sekolah ikut anak pria nebeng mobil dugul atau tidak mobil truk yang warna kuning bayang sekali tidak naik tarik mana cewenya cuma tawa padahal ongkos ojek cuma rebu
kodelle_,dosen bimbing saya masalah apa si sama idupnya saya memberi tunjuk sebuah mahasiswa memberi tunjuk biasa jadi yang benar yang mana
kodelle_,cisarua puncak ada
kodelle_,orang rumah rumit urus checkout baju lebaran lah saya selow saja malah tidak pikir sama sekali
kodelle_,woyla tampan sekali gumush
kodelle_,semoga sehat selalu dokter
kodelle_,hari musik yang bangunin sahur enak sekali masuk kuping
kodelle_,pacar baru iya
kodelle_,kira cuma ibu saya tawa
kodelle_,nya tiap mau tidur malah pikir banyak pikir jadi tidak bisa tidur benci
kodelle_,suka sedih kalau hal seperti gin itu sih jadi orang baik itu memang susah rakus sekali jadi orang
kodelle_,mohon maaf pa hari di zona sudah turun dana bansos kenapa suami istri dapat masing masing ribu jadi keluarga dapat jt yang dapat masuk keluarga yang kasi sama keluarga yang benar butuh
kodelle_,zona saya baru sekali hari dapat bantu khusus mon peta pa zona kenapa suami istri dapat masing masing ribu jadi keluarga dapat jt yang dapat masuk keluarga yang kasi sama keluarga yang benar butuh
kodelle_,bareng
kodelle_,bogor
kodelle_,enak sekali dengernya
kodelle_,jebak simpul
kodelle_,lihat balas an saya jadi insekyur karena zuzur hambar hal yang paling saya suka jadi kalau gambar apa jelek minta ampun
kodelle_,kenapa enak sekali mangil saudara laki
kodelle_,parah sekali si anarkis
kodelle_,film bidadari inspirasi saya sekali tidak saudara laki kecil ken punya tongkat ajaib yang hilang tawa
kodelle_,ken sekali sholat sana
kodelle_,paling tidak suka buat karang
kodelle_,sapa itu memperkenalkan dong mau saya tikung
kodelle_,apa yang benar sudah hamil saja ini lucu omong omong awas saja anda tidak nyanyi armada saya yang jadi bapak h
kodelle_,ngangur tetap dapat uang kan
kodelle_,saudara wanita sekali lihat hidup teman angkat yang cepat sekali perubahanya yang sudah menikah punya anak yang baru lulus kuliah ada yang baru kerja kejut itu s hidup
kodelle_,rindu ngebucin tawa
kodelle_,lucu sekali si heran
kodelle_,humoris sekali tawa
kodelle_,menikah itu tidak rumit online bisa
kodelle_,orang ubah circumstances ubah tapi allah selalu sisa itu sama
kodelle_,terus tiap hari begitu begitu saja sudah cemil bom apa gugup
kodelle_,lama karantina jam tidur benar benar kacau tidur tidak tengah malam atau sudah tengah malam hanya kalau ramadhan jam tdur saya gin terus asli tidak mau
kodelle_,hari adalah hari yang saya habis buat video ajar
kodelle_,mungkin siram pakai air wudu saudara
kodelle_,pertama coba
kodelle_,dia ucap itu s atas untuk hailey bcs itu s dia tubuh lucu
kodelle_,wah nyata lagu lena gomez yang kalah anda untuk cinta saya adalah sebuah sembuh sudah dia hubung saya justin itu harus jadi keras saya needed untuk kalah anda untuk temu saya saya cryn
kodelle_,bahasa ingris malu anda ajar yah
kodelle_,tawa
kodelle_,sekali
kodelle_,hari
kodelle_,nyata lebih baik ajar langsung kelas pusink terlalu lama lihat telepon buku catat
kodelle_,karantina hari
kodelle_,diri karantina hari
kodelle_,jiwa ronta ronta lihat kebucinan orang di cerita wasap alias anak bodoh anda sial
kodelle_,hai
kodelle_,apa nyata saya lucu sekali
kodelle_,hanya selesai tonton justin bieber musim nyala youtube ini adalah kutuk baik iya semua saya teary eyed
kodelle_,saya weren t perlu taruh in itu terbaik posisi untuk buat itu terbaik decisions
kodelle_,saya saya tidak gewd di gambar saya kena t sungguh seperti itu
kodelle_,oiya lupa
kodelle_,takut sekali itu waswas
kodelle_,saya cannot tidur karena dari jadi takut dari dentum dan gunung salak
kodelle_,kira alesano
kodelle_,whatsapp goa buka niy tengkuk sudah
kodelle_,wah dekat ini rumah
kodelle_,kenapa saya jadi khawatir gunung salak sama gunung pangrango
kodelle_,saya gemetar pagipagi
kodelle_,tuhan ibu baru sekali cerita tadi jam seperti itu bangun dengar suara dentum lama sekali sampai panggil ibadan subuh kira ibu ada curi mau ambil mesin air tuhan saya benar benar merinding lailahailalah
kodelle_,rasa libur dingin tidak banyak pikir
kodelle_,hari ibu percaya saya masak hasil sangat cengang masakan asin semua
kodelle_,sama sekali tuju
kodelle_,mau
kodelle_,wah terimakasih banyak info saudara
kodelle_,iya coba semoga baik
kodelle_,lihat laku bapak yasona
kodelle_,pena punya swami agar saya suru kerja tugas kuliah alias halusinasi saja dulu
kodelle_,tidak pait kenapa kan pakai gula merah ayo paksain tidak sakit terus memang takut si kalau gantung saya waktu nyeri kasih obat tapi tidak saya cemil takut tawa
kodelle_,maaf numpang tanya saudara pakai gramarly bayar berapa
kodelle_,pernah si jarang begitu mungkin tahun satu kali saja tangis padahal jamu ampuh sekali loh tidak saya haid seperti tidak rasa nyeri sama sekali paling kompres saja sama minum air hangat atau kalau tidak mempan minum obat mefenamic asam mg
kodelle_,lah iya si
kodelle_,banyakin minum air putih kalau tidak buat jamu begitu jahe kunyit sereh gula merah
kodelle_,hubung sekali masuk sekolah yang saya dia dia
kodelle_,hayang tidak balas kitu
kodelle_,ya malah jadi ilfel sama orang yang dingin nongkrong kafe kumpul bareng teman nya terus masuk insta cerita padahal pandemi gin aduh
kodelle_,dots si kalau saya
kodelle_,minggu hari dari diri karantina dan saya saya baca buku gulung atas in tempat tidur dengan sebuah cangkir dari kopi dan raining diluar tinggal aman tinggal rumah semua orang
kodelle_,tinggal aman warga bogor
kodelle_,benar sekali loves hujan musim sebuah banyak
kodelle_,iya sudah coba pakai mixer sudah tengah jam tidak kentel sedih saya itu
kodelle_,haha benar buyul mana gempor tangan ngadukna
kodelle_,soal kalau tidak begitu itu malas cari informasi terus malah nyebarin berita palsu yang tentu benara seperti rasa punya tanggung jawab untuk didik mereka begitu tangis saya harap semoga bisa bermanfat buat
kodelle_,rasa egois sekali kalau saya tidak sebar tentang corona whatsap masalah daftar nomor whatsapp saya banyak anak murid orang tua murid tetangga yang mana harus lebih kasih edukasi lebih aware
kodelle_,niat mau buat dalgona kopi pakai milo eh malah gagal dong encer sekali milo nya mana habis terus rasa seperti susu coklat biasa
kodelle_,itu s baradegongs
kodelle_,sering sekali sial melow sekali kalau tugas yang tidak bisa
kodelle_,yang patah bukan kayu
kodelle_,apa apanih
kodelle_,hotel mumbai apa happened untuk monday
kodelle_,hotel mumbai baru sekali selesai tonton pecah sekali gila sama bajrangi bhaijan seru
kodelle_,cantik sekali saudara pemandanganya seperti luar negeri
kodelle_,panjang ajar rumah tanggal april tambah kuliah semester tidak ada ujan ganti sama tugas rumah
kodelle_,tawa kelelawar sudah saya tolonk
kodelle_,saya kira cerita benar
kodelle_,seems seperti bunga obrol an nya kurang baik saya paham
kodelle_,semua shall lulus
kodelle_,yang mudah saja buat video tiptok tiap hari sehat jasmani rohani
kodelle_,nang
kodelle_,tanjung ya mantengin telepon terus kuliah online sekarang ajar online tiap mau nyimpen telepon suara obrol masuk anak habis rembet deh twiteran h
kodelle_,gubernur saya ini
kodelle_,baru dengar lagu shawn mendes sejuk benar sudah seperti ubin masjid
kodelle_,mau pulsa mau pulsa mau pulsa mau pulsa mau pulsa mau pulsa
kodelle_,hade salah ketik jadi malu tawa
kodelle_,sapu peta saya sudah goyang tiap hari
kodelle_,limain
kodelle_,saya mickey tikus
kodelle_,highly saran ini
kodelle_,kata kasar rasa pa menkes
kodelle_,sama energi dengan saya ibu pacar cemil omong emakemak tukang warung yang kata akan mati lampu seluruh dunia
kodelle_,sebar berita palsu terhandal mg emakemak
kodelle_,saya pikir itu s tidak itu benar waktu untuk ucap ini agar s appreciate kita perintah bcs mereka ve worked jadi keras
kodelle_,aduh makin semangat tonton drama korea kamsahamnida korsel
kodelle_,saya harap dia ll baca baca ini dan henti jadi sebuah vapers
kodelle_,gils
