username,tweet
nadiadjibran,habis kerja borang
nadiadjibran,saya hanya sungguh cinta untuk ingat myself itu punya kindhearted orang sekitar kita adalah satu dari itu biggest berkat
nadiadjibran,asiap yayucu cemumut
nadiadjibran,semoga berhasil nyala semua anda baca juang untuk yayucu
nadiadjibran,sampai kapan mau salah lingkung orang
nadiadjibran,taman lari diri selesai bantu hints lewat curang youtube pikir sendiri mantap game
nadiadjibran,jadi rindu saya comeback utama gartic tawa
nadiadjibran,aduh jadi manis skli tawa
nadiadjibran,lagi emosyenel saja tadi saudara wanita
nadiadjibran,aduh jadi lindu dek jay
nadiadjibran,biasa lagi emosyenel
nadiadjibran,ekwkwkwk
nadiadjibran,yang bahas tadi tawa reuni
nadiadjibran,eh iya mau kasi jalur yang mau tempuh tawa
nadiadjibran,hehehehe smo jadi artis tiktok saya saudara
nadiadjibran,siap teman teman cuma saya te bisa sampai malam malu
nadiadjibran,bgmn besok smo atur jadwal tawa
nadiadjibran,kyknya yang suka pimpin bagendang anda ibu nugus
nadiadjibran,pikir turut analisaku juda
nadiadjibran,eheheheh
nadiadjibran,siap qaq laksanankan
nadiadjibran,siap qaq
nadiadjibran,aduh
nadiadjibran,gagal
nadiadjibran,teapa awal begitu nt jadi biasa
nadiadjibran,mantap betul cinta drama korea kalau saya cuma tonton lewat instagram sja tawa
nadiadjibran,saya rasa jadi orang imut umur dewasa susah adaptasi mg teman teman
nadiadjibran,entah lalu bagaimana izin ikut mountaineering sampai kali meski dapat siram rohani tetap zink pikir
nadiadjibran,kalau orang tua bukan tipe sangat protektif tahu mana jari kaki akan lang
nadiadjibran,kontroversi
nadiadjibran,saya bisa sesuai teman teman libur sampai rabu malu
nadiadjibran,saya saja
nadiadjibran,senin teman teman libur akyu
nadiadjibran,lum jadwal edar nich
nadiadjibran,saya lihat jadwal jaga dulu teman teman heheheh
nadiadjibran,tambah ilmu tahu kartun
nadiadjibran,phineas dan ferb dengan mereka belai platypus in samar mereka paham tawa
nadiadjibran,awal pagi raining adalah selalu tranquilize
nadiadjibran,yups tinggal pilih
nadiadjibran,benar tidak perlu sebut karena jadi wajib tawa
nadiadjibran,tetap ling kpop tawa
nadiadjibran,highlight tonton youtube waktu kelola tips bagaimana untuk jadi organisir sampai produktif kamar dekorasi makeover bagaimana untuk jadi focused nyala studying tonton rebah gumam kapan
nadiadjibran,sebuah sempurna set hanya benar
nadiadjibran,mau skali
nadiadjibran,nyimak
nadiadjibran,matahari terbit lawan mataharikuw
nadiadjibran,lumayan asah otak malam
nadiadjibran,sisir belah tengah pakai topi tampak arnold
nadiadjibran,bagi yang paham
nadiadjibran,tidaknimda adayeo cuma bosan sja baca berita palsu dasar kata macam saya mau elus dpe otak tawa
nadiadjibran,cuma sampai dsitu diza tawa
nadiadjibran,penasaran apa ekwkwkwk
nadiadjibran,memang kalau informasi sumber kata jadi fitnah gosip beberapa orang bangga argumentasi mengunakan referensi kata
nadiadjibran,sangatnim trueyoe
nadiadjibran,jadi imut
nadiadjibran,tangis v v
nadiadjibran,kadang saya couldn t beruang mereka jadi over lindung
nadiadjibran,jadi senang
nadiadjibran,tawa iyasih
nadiadjibran,karena saya tidak salah polos tawa warna maksud saya lebih suka warna
nadiadjibran,itu s ranjau tapi saya lebih suka milik anda
nadiadjibran,ketika milik anda ibu s film marathon daftar adalah suara hati istri turut episode dinonton lebih buat emosi banding twom
nadiadjibran,karena saya sudah rasa bagaimana lewat suatu proses orang
nadiadjibran,selamat tinggal
nadiadjibran,kumpul niat tenaga kerja borang ketik susun bahas copas kemudian simpan loading ter keluar log in periksa borang simpan
nadiadjibran,jiwa malas baca agar kerja uji uji teori malas baca soal
nadiadjibran,mimpi gila kembali muncul gila mimpi besar usaha nol lama lama buat gila
nadiadjibran,jadi hitung nyala ketika needed tapi sudah itu wosh seperti sebuah orang asing dengan tidak komunikasi
nadiadjibran,diam pendam bahkan ukir sampai sangat sulit lupa
nadiadjibran,tipis lapor kasus setip tahu
nadiadjibran,harus punya sudah ini tapi belum saya pikir went gila
nadiadjibran,belum akhir ferguso saudara yoga dapat wahana dimana
nadiadjibran,agar itu hujan cuci jauh semua itu rasa sakit dari kemarin
nadiadjibran,jadwal baca undur dengan sgt paksa jadwal ajar siap baca juga undur
nadiadjibran,baca patofisologi sakit autoimun buat mual
nadiadjibran,pagi pagi tani mcr hantu dari anda jatuh keluar anak laki america s kasih lagu yang alir
nadiadjibran,pikir
nadiadjibran,pikir
nadiadjibran,saya pikir butuh untuk henti creating an exagerating scenario itu tidak pernah benar happens
nadiadjibran,hai
nadiadjibran,tinggal tunggu akun jaeyong shipper gerak
nadiadjibran,eh bli yoga omong omong ijazah jadi kadaluarsa e nt urus ulang kampus
nadiadjibran,saya agar bahan tidak saudara tawa
nadiadjibran,kyknya saudara tina masih lebih banding saya saudara tawa
nadiadjibran,kenapa saya saya jadi buruk di masak
nadiadjibran,tonton itu shawshank redempetion karena salah satu film rencana putar keren sampai akhir film pikir mana plotwist nya rupa plotwist yang saya harap beda saya kira pembunuhanya nyata lain tawa
nadiadjibran,anda bisa t tolong semua orang dan anda kena t punya untuk
nadiadjibran,saya mata hampir popped keluar
nadiadjibran,soal saya tidak berbkat hambar jadi warna sja
nadiadjibran,iya ayo lumayan tenang
nadiadjibran,lokasi mana bapak kalau mau pesan bgmn
nadiadjibran,capai lama
nadiadjibran,suka beli buku tata rapi tidak baca suka lihat tidak baca
nadiadjibran,tangis um
nadiadjibran,selalu jadi sasar amarah kuasa rumah tiba tiba dipangil terus bentak atau marah dan saya seperti apa did saya buat salah marah baru tahu nyata orang telah seperti ini untuk sebuah panjang waktu tidak sudah besar baru erti saya saya tidak itu masalah mereka adalah
nadiadjibran,semoga beri sabar edukasi keluarga sendiri bahaya virus corona cuci tangan etika batuk bersih diri dari luar niat mau ungsi kos tapi misi yang kerja rumah
nadiadjibran,iya saya kena t punya untuk jelas semua untuk buat mereka paham kita akan yang berangapan negatif meski positif apa yang anda buat hanya bcs mereka kena t paham itu seluruh cerita tidak apa apa s sempurna meskipun semua orang makes mistakes
nadiadjibran,iya terima kasih saudara
nadiadjibran,iya saudara saya pesan langsung mohon periksa saudara
nadiadjibran,saudara saya bayar tagih indihome via mbanking transaksi hasil tapi jaringanya masih sambung bisa jelas
nadiadjibran,kenapa saya pikir sebuah menikah adalah yang lain cara dari saya hidup akan jadi controlled oleh lain bahkan sebuah orang asing saya parents telah controlling most dari saya hidup saya saya in butuh dari bebas instead dari soulmate
nadiadjibran,akan dia jantung ubah dia starts untuk tumbuh harap tentang suatu dia hampir believes akan dia beri itu sebuah coba tapi kenapa jadi tiba
nadiadjibran,uri jeong jaehyun akhir opens instagram rekening saya baca getting dekat
nadiadjibran,aduh palu tetap sinar cerah tawa
nadiadjibran,jadi bodoh hurts jadi banyak utama anda bisa t run anda punya untuk hadap dan aku milik anda bodoh in itu orang banyak
nadiadjibran,iya ini suasana hati suram
nadiadjibran,kali harus berani keluar sembunyi dan lindung orang sayang saya otak saya butuh sebuah hebat teamwork tolong buat saya kejut dari bagaimana baik anda adalah praying
nadiadjibran,sangat gugup an mulai jalan baru bawa diri sendiri tidak serendah dulu tanggung jawab lebih tinggi
nadiadjibran,senang ulang tahun uri jaehyuni
nadiadjibran,besok adalah saya bayi s ulang tahun
nadiadjibran,iya bapak yang saya bantu
nadiadjibran,satu bungkus mie goreng akan pernah cukup
nadiadjibran,luas anda wajah diri pilih tumbuh liang telinga dasar jerawat
nadiadjibran,tidak masalah apa percaya in diri sendiri jaehyun
nadiadjibran,jarak rumah sakit rumah paling lama jam jalan jelek santai jadwal jaga rumah sakit santai sgt pulang soal kendaran aman yang iship siapa yang repot siapa yang mau ngekos siapa yang sibuk siapa r saya misi mandiri
nadiadjibran,tiap kantor pajak daftar putar putar merah beludru psycho tahu wendy datang bagaimana daftar putar nya mantul tawa
nadiadjibran,baca balasan tweet orang lagi hadap keras dunia percintan ada yang saran dengar lagu ost naruto yang hidup yap telah saya favorit sejak saya started tonton itu anime baru tahu kalau arti lagu mantul
nadiadjibran,saya dapat anda dapat sembuh ulang apa adalah milik anda rahasia superpower based nyala milik anda oke pop preferences
nadiadjibran,deactive akun instagram lama kyknya deh kurang bahan banding banding diri malu harap itu akan akhir selamanya
nadiadjibran,bagi yang laju jadi lah
nadiadjibran,ayo whatsapp ajar
nadiadjibran,mau mana yah
nadiadjibran,itu s sungguh ramai disini dalam saya kepala juga cekik
nadiadjibran,hasil tebak bunuh suatu cerita detektif sudah buat senang
nadiadjibran,jadi orang inferior rumah memang sesak sering jadi lampias amarah kalau sedang kelah jengkel sama orang harus selalu tunduk haram lawan akhir jadi tular sifat juga suka marah tidak jelas
nadiadjibran,punya cita cita besar adan sosial tetangga sendiri jelas jelas butuh bantu malah cuek
nadiadjibran,pikir lagi momen mana hampir serah pasrah hadap adan usaha lama bulan mental fisik dan financially kering saja kejut tiap minggu yang buat jiwa getar mau menang tapi saya kept pegang nyala dan itu siapa peduli sampai tolong kita
nadiadjibran,hiri kidi ilihrigi cimi pitirin tipi
nadiadjibran,silimit pigi giys hibis ilihrigi nich
nadiadjibran,syukur harap
nadiadjibran,ampun alas kuat untuk hindar tinggal iship semoga anda tahu siapa intervensi bebas adeq
nadiadjibran,bagai mahluk yang kurang suka baca perbarui ilmu wic adalah nat gud kalau kerja soal lebih banyak mengunakan asa meski usaha analisa tentu akhir asa
nadiadjibran,yah manusia biasa masa mana kata kata positif dengar jauh lebih sakit ejek utama kalau batin gumam kan bukan anda yang alami rasa beuh serasa hilang
nadiadjibran,mungkin adalah jalan ninjaku kuat naruto
nadiadjibran,buat anda ingat ketika anda gabung twitter saya buat
nadiadjibran,terlalu banyak kontemplasi tidak aksi
nadiadjibran,sebagai anda growing atas anda lihat atau alam ketika orang tend untuk lebih suatu dan buat itu rumit kenapa bisa t saya buat itu sederhana dan langsung peacefully
nadiadjibran,orang fangirl tidak modal tinggal jauh ibukota kalau ibukota kan kejar bandara
nadiadjibran,nyata lebih sakit dipangil tante banding ibu
nadiadjibran,ibu tidak kuatir whenever anda lihat saya senyum seperti an idiot in depan dari saya telepon bcs itu alas adalah either itu s sebuah lucu cerita video atau saya saya tonton saya favorit kpop seniman
nadiadjibran,itu s tidak pernah telah mudah itu menang t sebagai jadi sebagai untuk terima itu buruk mungkin itu s jadi cekik
nadiadjibran,cita cita jalan jalan keliling kota kenyat rebah sama media sosial
nadiadjibran,pasang tugas milik opini hampir sama persis woah
nadiadjibran,astaga jadi salah erti saya pikir saya tidak akan mve nyala bcs mereka baca saya suasana hati dorong
nadiadjibran,sulit ketampananya terlalu silau
nadiadjibran,ampun jelajah instagram penuh uri taeyong jaehyuni mau pindah nyala sangat sulit
nadiadjibran,salah satu mimpi ter halusinasi astaga fangirling nct terlalu lebih
nadiadjibran,yah kalau begitu mau bagaimna jawab santai aba pikir jadi lega sedikit hati memang kualitas banding kerja
nadiadjibran,h
nadiadjibran,uwuwuwuwu hugs
nadiadjibran,kaum rebah hadap prosedur tidak jelas tidak profesional tawa rasa sangat rugi atas usaha bangkit gerak
nadiadjibran,woa didn t harap itu akan jadi realitas hits sangat keras belum shocking
nadiadjibran,sedih itu s tidak kadang tapi most dari times tangis
nadiadjibran,itu s oke untuk minum cups dari mocha apung benar
nadiadjibran,jadi
nadiadjibran,terlalu banyak hal krusial dintervensi golong orang yang lebih tua padahal yang jalan bukan yang gores jiwa bukan bahkan dengar putus si milik jiwa
nadiadjibran,yang kerja lama terbang biasa foto video
nadiadjibran,saya sungguh benci itu siapa salah itu status quo sambil mereka did tidak apa apa hanya complaining every second
nadiadjibran,barang siapa mudah urus orang maka tuhan mudah urusanya dunia akhirat
nadiadjibran,sebuah cangkir dari teh in itu pagi terlalu lama jadi kaum rebah
nadiadjibran,ohiya terima kasih banyak atas informasi
nadiadjibran,bahahaha siap akan terus latih
nadiadjibran,ketrampilan utama piano tiles saya taruh superstar smtown
nadiadjibran,selamat siang mohon bantuanya bank tidak transfer rekening bri britama padahal sudah pakai kode bank tidak rekening sudah benar
nadiadjibran,invasi kecoa cs mulai kurang sekarang tikus cs kirim agenya hantu tiap malam tempat tempat gelap kamar
nadiadjibran,aduh saudara tina ciye
nadiadjibran,adududuh
nadiadjibran,bagaimana saya saya kejut itu saya insecurities bisa jadi ini lebih buruk
nadiadjibran,hendak tekun anime guna isi yang hilang hidup
nadiadjibran,aduh semua resah adalah kait untuk cinta thingy itu cara sederhana bcs anda baca confused dengan milik anda hidup s goal itu dunia adalah besar belum cinta might jadi itu kecil bagi di least in saya dunia
nadiadjibran,h mulai dia
nadiadjibran,jiwa ingin berontak atas anda sian hidup jiwa bingung bagaimana bisa motivasi buat pola nya sendiri
