username,tweet
bukandove,ken sate tidak mau beli pakai uang sendiri sudah saya butuh gula ibu pikir pikir
bukandove,ambyar ngeduar
bukandove,iya nyanyi tawa
bukandove,wis ambyar
bukandove,pindahin duliu aju penting ada folder whatsap nya habis delete saja aju whatsap aju manajer kalau tidak mau rumit habis pindahin aju hapus dat saja malu
bukandove,tumben malam notif penuh tawa
bukandove,hendery apa kabar tawa maaf saya nyapa teman sampai dengan saya malu
bukandove,tatu oleh didi kempot
bukandove,bias saya sekali sih kwkwk tapiu ujung saya malah nang tawa
bukandove,naver itu susah saya pernah coba berapa kali bahkan sudah kirim kode verifiksi eh tapi saja gagal saya tidak tahu apa yang kurang akhir suka ngeblank
bukandove,bukandove bukan merk sabun nama pngln saya daff dafa
bukandove,mungkin fitur baru instagram tenang saja tidak sesuatu yang curiga
bukandove,ting telepon kalau tidak salah
bukandove,eh maaf maksud secode waktu buka instagram msukin pin bagaimana
bukandove,iya sama verifikasi faktor coba pakai nmr tlpn kalau tidak salah asal nmr tlpn yang harus aktif terus untuk aman juga kala lupa lulus mudah buat set ulang
bukandove,cepat atur ulang ganti lulus sama pkein nmr tlpn aktif takut yang ngehack yang lain suatu buruk
bukandove,tuhan saja coba
bukandove,nila sangat
bukandove,selesai cemil ngembang itu perut tawa
bukandove,umpat terus habis tawa paling kesal kalau tambah ibu bicara terus anda itu kalau lagi rumah bersih seperti teras depan rumah habis hujan malah dibiarin jorok begitu
bukandove,fucek ah pagi sudah buat tawa kejang tawa
bukandove,saya look host nya kim tetangga masa begitu
bukandove,seblak lah
bukandove,iya yang baru kalau tidak salah
bukandove,saya suka dora usia walaupun suka buat emosi tawa lagia kartun nilai nya su
bukandove,ira
bukandove,hai cuk sudah exo adalah nine gosah anda ada sudah tinggal mute saja mulut tambah iket jari jemari anda
bukandove,jaga teman teman ini orang kenapa muncul malam jumat tawa
bukandove,sesap yang judul tolong coba bahkan saya tidak tahu agu apa malm gin buat dingin tawa
bukandove,saya dengar kalung emas oleh didi kempot dilisten jika kenan malu
bukandove,bahasa mana haduh baru dengar
bukandove,itu kalau lari lari pantat suka gutak gitek kan tawa gutak gitek apa sudah bahasa indonya
bukandove,sepupu sial
bukandove,ken mengujat jadi wkwkwkwkwkwk
bukandove,serbet paling
bukandove,sekarang dengar pamer bojo oleh didi kempot
bukandove,eh kan judul
bukandove,iyasih tidak salah
bukandove,sarkasme saudara wanita
bukandove,saya merinding lihat tren nomor satu reisa broto asmoro tangis dari cantik
bukandove,wkwkwkwkwkwkwkwkwkwkwk
bukandove,bingung mau apa
bukandove,gemoy
bukandove,sial
bukandove,nah
bukandove,saya kalau mau beli pesan langsung saja agar saya paketin tawa
bukandove,pagi sudah tren cindy ngeri sial tawa
bukandove,coca cola
bukandove,hangyul jadi seperti kuntum mawar merah
bukandove,dayung pop choco lahar lahar enak malu
bukandove,kartu apa
bukandove,kemarin waktu habis masa premium atetiba muncul lirik eh panjang jadi hilang
bukandove,tidak kuad saya tawa sial
bukandove,ofc cukur
bukandove,kim goeun
bukandove,cemil mie
bukandove,senyumin saja
bukandove,jadi indah indah
bukandove,haha
bukandove,batalin saja
bukandove,biaya transfer kan jadi hitung saja rangin dulu sama biaya bajing
bukandove,saya orang fast responsif
bukandove,tidak kasar kata jadi salah ketik
bukandove,ing suka warna hitam
bukandove,kayak bulan agustus warna kategori biru
bukandove,jadi sinar sinar sinar
bukandove,sial ada mario teguh kali tawa
bukandove,yoyoyo
bukandove,sial jogdae sial
bukandove,mantap jiwa
bukandove,ya sesal buka tren kan jadi ken malas tonton sekarang oke tunggu minggu depan tawa
bukandove,benar takut salh hitung malu
bukandove,bawa pulang
bukandove,haha
bukandove,humoris malu
bukandove,iya
bukandove,jawab biadab anda
bukandove,sial tawa v
bukandove,lain
bukandove,viu premium
bukandove,spotify
bukandove,netflix
bukandove,maksud balik tingkah si kecil rasa sekali loh saya bias kalau sama saudara malah ngerespon pakai responsif yang tidak laku tidak cara buat ngedidik ulang aduh paham tidak maksud saya tawa
bukandove,sial tawa v
bukandove,wanjeng saya tawa v
bukandove,balas pesan langsung lewat tegang email eh kenapa malah jadi nd akun nge balas sial malu sekali tawa
bukandove,indosat
bukandove,saya sudah tidak pernah niat ken ngendarain motor sempat ken sih soalny orang rumah suka maksa ajar sampai sekarang ujngnya santai banyak gojek sama angkut umum lain tawa
bukandove,sial saya syok chen chen
bukandove,memang asli siapa sih saya sampai sekarang sangka nuno nya pradikta
bukandove,ken
bukandove,bukan tekdung dungtek kalau hamil duluan itu v
bukandove,lelah
bukandove,lembut kayak softex
bukandove,sudah
bukandove,kalau tidak salah masuk remaja akhir deh omong omong banyak teori sih
bukandove,kalau kndala coba deh hubung cs shopee nya langsung
bukandove,sumpah saya dengernya saya unch saya unch unch
bukandove,jujur saja album turut saya catchy sekali satu tapi saya cinta semua dari mereka iya exo dan semua itu tracklist ofc
bukandove,tanya dong foto dapat darimana sial
bukandove,biadab mvnya konsep argh pokok semua bigis sekali injir
bukandove,kalau rumah saya nama malika
bukandove,alas kenapa ingrisnya lumayan mudah paham
bukandove,sudah
bukandove,siap
bukandove,tawa anzeng jaman sampai itu suka sekali tulis gituan sungguh kana
bukandove,ayik syekali yah obrolanya
bukandove,tolong tawa dong
bukandove,ikon kunci pingiran pojok kiri atas tanda vpn aktif bukan
bukandove,bagaimana untuk jadi anda apa bisa saya buat untuk jadi sebuah orang seperti anda
bukandove,makin sini makin banyak orang seperti gin
bukandove,pernah malu rasa sakit biadab waktu saya labil sekali jadi manusia semua unek keluar sudah itu
bukandove,ikut dong
bukandove,cerewet walaupun negatif buat saya tawa
bukandove,mereka selalu panjat tiap hari jadi mungkin keluarga anda pikir begitu positif pikir saja untuk buat anda bahagia saya kasih ucap deh selamat ulang tahun pengirim
bukandove,mungkin bukan maksud keluarga tidak yang peduli ingat turut alam makin besar ucap selamat ulang tahun orang itu sudah rasa tidak perlu orang tua juga pikir karena doa panjang umur sehat selalu banyak rezeki
bukandove,iya
bukandove,tasikmalaya
bukandove,ramein dong satu itu pakai tagar tawa
bukandove,chil
bukandove,tampar keras saudara wanita jempol buat anda tawa
bukandove,ya tawa ajig v
bukandove,kalau benar digiveaway in nya exo ken sekali tawa album sama ls nya saya terima tangan buka ehe ehe ehe
bukandove,munafik sih kalau anda suka kpop tidak peduli sama tampil kalau saya sih penting unik masuk daftar sukan
bukandove,mau tumblr
bukandove,tasikmalaya warna biru
bukandove,kosong seperti apa seperti saya pikir ofc
bukandove,sekali
bukandove,greget sekali sama anda gemas
bukandove,bukan cuma teman kuliah saja kali memang banyak seperti begitu
bukandove,pria foto seperti lebih photoshop mulus tiap foto kenapa ada editanya beda cuma peras saya saja kali ya
bukandove,baca cuma ken bilang lah sekarang malam jum di tawa baru sadar dong
bukandove,dulu selalu urus ranking bukan orang tua saya malah tetangga anda tahu apa saya maksud soal orang tua saya sih syukur saja kalau anak masuk puncak tidak lama anak bisa tingkat kualitas ajar
bukandove,kalau saya berapa hari yang lalu saudara saya masih anak suka sama blackpink masa tiba tidak tahu tanya apa bagaimana begitu tiba bicara eh bang blackpink mau bubar langsung saya ceramahin dong tawa sembarang saja kalau bicara tawa
bukandove,buat syok mata dong
bukandove,jadi bias saya itu siapa baekhyun atau bakhyun
bukandove,benang isi tani pagi
bukandove,gantung suasana hati malu
bukandove,mie enak ayam bawang bungkus
bukandove,paham tidak kalau saya ngetik ken diri dua jari kaki saya sendiri
bukandove,halowen mau nyamar jadi badut ah bukan penywise
bukandove,hai benar jadi opa dong tawa
bukandove,lucu
bukandove,saudara wanita kalau benar coba tidak macam colab begitu lah kan soal sudah masing saya goyang inul tengah jalan jalan sepi ehe
bukandove,iya
bukandove,saya baca rep repnya tawa yalord
bukandove,saya pindah banyak sih ngemaklum jadi matin langsung rokok pada baik memang malu
bukandove,kena t lupa tanda saya tolong
bukandove,dong
bukandove,bias utama kim yohan ada bias samping sial istilah saya tawa iya bias samping saya seungyoun hangyul seungwo sama eunsang
bukandove,kenapa saya tawa sih
bukandove,dalam fase lelah jadi anak bungsu notabene anak pria satu nya keluarga kecil
bukandove,butuh sosok saudara laki saya maksud besar saudara ken saja begitu rasa yang bimbing saya punya saudara pria saya lebih buka kalau ambil sebuah waktu dengan saudara
bukandove,sudah pernah deh ini tambah
bukandove,sesap
bukandove,kalau memang enak tidak tahu saya itu mudah sekali ngebandingin mana enak mana mie v
bukandove,iswngnya niat
bukandove,tidak tahu sering sekali saya hadap sama kayak begitu itu
bukandove,ini tawa dong biadab
bukandove,geli sial tawa v
bukandove,tanda
bukandove,tanda pengirim
bukandove,gambar tempat pensil saya waktu sampai dengan gila sih legenda sekali waktu jamanya pria gadis suka sekali sama gambar si daging babi hng
bukandove,saya tidak awal lihat foto minhyuk mana sial
bukandove,bajing humor saya anjibg babik
bukandove,saudara laki jasa titip
bukandove,tasikmalaya
bukandove,ngalus bene edit v tawa
bukandove,begitu baik terimakasih maaf
bukandove,senang ulang tahun yoyo tetap jadi bang orang tua karena yang paling utama
bukandove,senang ulang tahun saudara laki april bentar jadi saudara laki oktober oke
bukandove,bang josh ibu ketombe kilau serbuk berlian
bukandove,saya bela bain tonton kalau jadi tawa
bukandove,indosat
bukandove,tasikmalaya
bukandove,kurang sial seperti itu ibu
bukandove,banyak bahas ngejelekin exo hai helah apa sih diladenin menuhin beranda saya baik penuh sama tidak foto lucu
bukandove,sama sama
bukandove,sudah lama tidak pakai
bukandove,kalau browser pakai mode desktop juga ikon buat download kalau tidak salah
bukandove,pakai aplikasi atau browser
bukandove,iat gin saja sudah tawa humorqyu ampun
bukandove,sama sial ibu saya suka keluar kata mutiara kalau tahu saya suka cemil pedas padahal cabai adalah saya hidup
