username,tweet
nauli_permata,toilet jo
nauli_permata,paling ilfel sama orang yang ngechat tiba cuma misi doang sama yang lebih tua kayak begitu tidak sopan saat
nauli_permata,anda iya tuhan te saing mbek momo tugas akhir momo sial rumah
nauli_permata,asi tidak bagi e sana
nauli_permata,ayo
nauli_permata,sudah bosan warna sekarang ganti jadi kristik kita lihat berapa lama proses
nauli_permata,tenan saudara tawa
nauli_permata,lah iya kayak gadis anda banyak alas
nauli_permata,aduh mesti yang ringkes buat sulit toilet
nauli_permata,kalau buat cerita buat benang gitulo agar enak yang mbaca beranda replyen tweet pertama begitu agar urut
nauli_permata,kp tutup sampai tanggal mei saudara
nauli_permata,wah drama korea pelakor mau di trans televisi ngajakin ibu tonton ah agar teman misuh bareng
nauli_permata,tawa
nauli_permata,banyak
nauli_permata,iya mungkin saudara tekan tidak dibetulno kenal saja malas mbalesi apa anda tidak kenal tawa situ sapa
nauli_permata,iya betul
nauli_permata,ckckck percuma tidak karena ungah unguh tawa
nauli_permata,kali saya tawa kali tanya saya kali orang saya jelas masa hewan kali tawa maksud orang mana tolong lah kenapa susah sekali buat bahasa yang baik benar tidak sampai dengan dibelajarin cara tanya yang benar kan
nauli_permata,tawa tonton seng humoris sebentar saja lek tekan baru tonton seng misuh periksa lego
nauli_permata,saya tonton tapi wedi misuh dong jadi saya tonton itaewon kelas podo saja misuh
nauli_permata,mobil ganti alarm tiap pagi peta yak baksu tawa
nauli_permata,huwaw
nauli_permata,candu lagu itaewon kelas omaigod
nauli_permata,ajar anda
nauli_permata,ken tonton sebuah dunia dari meni pasang tapi saya ingin misuh tawa
nauli_permata,toilet iya saudara saya tahu watuk alon tidak ndek lampu saudara laki posisi ngawe masker saja mobil dokter kenapa
nauli_permata,sekarang kalau hidung gatal tidak jalan terus mau bersin itu mobil mencet hidung agar tidak jadi bersin takut diliatin tatap hina sama belah
nauli_permata,apa teman teman kenapa ramai
nauli_permata,astofir fotone
nauli_permata,gelem sebuah iya
nauli_permata,iya sio tawa
nauli_permata,cangkir cangkir tawa
nauli_permata,tawa sini ambil rumah tawa
nauli_permata,julid tapi bagaimana tawa
nauli_permata,yang nomor jatohnya seperti tukang pijat paman
nauli_permata,iling omahmu sebentar melbu gang
nauli_permata,sumuk iku pitike kostume tebel
nauli_permata,iya tuhan tawa kenapa isone seperti saya kostum ngono
nauli_permata,lapoe saudara kenapa tumben tawa
nauli_permata,iya ampun perhati rek areke tawa kerja saudara ndek bank saiki saya
nauli_permata,tawa di instagram anda ramai berita
nauli_permata,golek sibuk ojok pikir jodoh sebentar umur sakmono ngkok lek sudah rabi getun tidak iso nglakokno seng bebas mbok lakokno tidak kon tunggal tang urip tidak hanya pasang kon apik ngkok seng apik selow
nauli_permata,paling geting mbek konco seng dichat penting tidak balas perbarui cerita ben jam milik anda mata sebuah
nauli_permata,peta saya seperti chanyeol
nauli_permata,kenapa rindu kotak apetit sih ckckck
nauli_permata,tidak nteni videone
nauli_permata,yuhu sudah ot saiki tawa mina kembali
nauli_permata,iya atau iya twice ini ibu
nauli_permata,maaf saya sudah tunggal tahun tidak
nauli_permata,iya saudara sudah tahu kenapa saudara
nauli_permata,pantas saja
nauli_permata,saudara sudah mandi
nauli_permata,betul
nauli_permata,o iya benar juga
nauli_permata,lama juga foto
nauli_permata,biyuh ra cocok momo
nauli_permata,tawa ngawut
nauli_permata,tawa tapi ancen ngono deb nang saya tidak tahu soale
nauli_permata,tidak
nauli_permata,momo ngono lek nang tangan lanang sih biasane
nauli_permata,astaga ckckckck kerja saudara
nauli_permata,iya tuhan apa an tawa
nauli_permata,iya betul juga anda
nauli_permata,bangkay
nauli_permata,tidak apa apa hati kosong salah orang saudara
nauli_permata,lah iya sampai lihat kan sena apa
nauli_permata,anda harus transparan deb
nauli_permata,kenapa kalau pulang jam sore pekerjaan ada numpuk sampai kayak kurang waktu kalau pulang jam sore kenapa waktu lebih sampai ngantuk kenapa
nauli_permata,sudah tidak boco tawa mosok ayo tidak iso ngrasakno lek bedo aduh tolong
nauli_permata,definisi rebah tergabut ketika tonton drama korea episode sekarang ulang lagi dari awal
nauli_permata,ranok hubungane mbek prei sial
nauli_permata,sudah dijelasno malah omong cerewet repot musuh netizen ini ckck
nauli_permata,apa dia
nauli_permata,sekarang mager ckckckck
nauli_permata,giat lama libur rumah tidur jalan pagi sama momo memberi momo cemil gila antar momo grooming rebah utama game tonton drama korea tidur siang mandi jemput momo rebah utama game nontkn drama korea cemil malam tidur
nauli_permata,buka biasa kenapa saudara
nauli_permata,mog baru saja lihat sudah ribu pcs malu
nauli_permata,memang benar si mau sepinter apa handphonenya mau seupdate apa lifestylenya kalau pikir tidak diupdate percuma sih
nauli_permata,ulang giat lama tiap senin ujung telat masuk kantor
nauli_permata,memang tidak bisan panas dikit sekarang pusing lemah
nauli_permata,iya tuhan
nauli_permata,info belum batas umur saudara jadi silah coba
nauli_permata,sila saudara kirim lamar email yang tera
nauli_permata,facebook tadi saudara
nauli_permata,saya balas pesan langsung tadi saudara
nauli_permata,iya saudara
nauli_permata,saudara sila coba saja
nauli_permata,tawa memang ada
nauli_permata,tempat wisata saudara
nauli_permata,saudara admin minta di retweet yak terimakasih
nauli_permata,anda kenapa paham tawa
nauli_permata,kalau yang rumit apa cari yang ringkes kalau ngegas apa pelan okesip
nauli_permata,juga banyak cerewet ini hari
nauli_permata,tidak tahu bodoamat
nauli_permata,hanger onok bentuke gedang memang
nauli_permata,mboh bodoamat selamat tinggal
nauli_permata,umak sehat sebuah tawa
nauli_permata,shiap
nauli_permata,dhal
nauli_permata,soal kan anda sana terus tawa rindu suasana sih tawa enak saja kalau turut
nauli_permata,rindu yogyakarta suasana rindu cemil tempat wisata
nauli_permata,tawa baik tidur saja
nauli_permata,sudah dapat hadiah jam sekarang tambah jam bodoh
nauli_permata,indah bubuk siang
nauli_permata,tidak sial
nauli_permata,alpukat untuk makan malam
nauli_permata,banyak saudara
nauli_permata,bodoh
nauli_permata,kenek angin miber
nauli_permata,sebab akibat tidak mungkin akibat kalau tidak sebab balik jadi bijaksana bicara sama diri sendiri
nauli_permata,orgnya sakit itu pengirim bias buruk pelihara
nauli_permata,wani teges
nauli_permata,apa situ yang gelisah sendiri
nauli_permata,opose deb
nauli_permata,iya tuhan rusak
nauli_permata,kan saya tawar sebuah
nauli_permata,kan ancen dadi wanita modal harus besar
nauli_permata,guduk debat lek ini umak njuk saran sudah tidak seperti saya tapi tidak reken
nauli_permata,tidak lelah jadi orang baik baik orang saja belum orang balik jadi baik kita kita neraka
nauli_permata,iya itu s benar
nauli_permata,ngumpulin bintang lama hari sekali sudah banyak ngumpulin eh habis menit
nauli_permata,onok nyi liti liwat
nauli_permata,hih apa an
nauli_permata,seperti merk kompor tawa
nauli_permata,tenang tidak siapno sofa ratu periksa ayem lek tonton
nauli_permata,tontonen ndek youtube cak percil sampai nyi liti ngkok lak paham tawa
nauli_permata,eh guduk wayang ngundang cak percil cak yudho mbek nyi liti tidak paham umak tawa
nauli_permata,mben lek saya rabi ngundang wayang
nauli_permata,mben ngundang percil cs mbek nyi linti saja oke lek tawa
nauli_permata,bahasa tawa
nauli_permata,apa ini
nauli_permata,opone saudara wanita
nauli_permata,wakeh ayo
nauli_permata,saya imut masa kecil malang
nauli_permata,tidak enak langsung henti ikuti sosmednya cara baik mute saja kurang julid tawa
nauli_permata,joen achim kakean polah seng banyak
nauli_permata,periksa telepon privasi soal
nauli_permata,pintar ayo tambah suwe
nauli_permata,iya kurang e
nauli_permata,lihat deb kasat mata tawa
nauli_permata,yang keras saudara
nauli_permata,ganok tidak harap penghargan dingat saja tawa
nauli_permata,iya
nauli_permata,hapusin kontak teman media sosial banyak tapi tidak apa apa hidup lebih baik semangat
nauli_permata,tidak omongno nang isor tugas akhir periksa mben digawakno
nauli_permata,sudah paran ngono anda
nauli_permata,kenyang sudah lihat angka
nauli_permata,exo pecah telur kim saudara jual keluar
nauli_permata,apa ini rek
nauli_permata,ezo saudara everytime kopi jl dewandaru tidak
nauli_permata,anak tangga tahu samplok spione motor vega kui cangkeme
nauli_permata,baik tidak ingin tahu timbang munek deb tawa
nauli_permata,buset tawa bakso sempak andal
nauli_permata,yang datang tiba kedai roti bakar
nauli_permata,tunggu berita kirim muncul
nauli_permata,sudah tahu
nauli_permata,san iku jaman kapan kenapa sebentar gondrong saja
nauli_permata,ayo kulak
nauli_permata,mobil kulak lemon
nauli_permata,bersih kontak aju aplikasi yang tidak penting tahun mau hidup bersih tahun
nauli_permata,tawa lah ancene toilet kenapa harus tambah kata kayak
nauli_permata,kenapa kalau bicara ditambahin kata kayak yang tidak usah pakai kata kayak kenapa kenapa
nauli_permata,ngaliho
nauli_permata,betul buat debi
nauli_permata,rebah lebih bermanfat harus habis waktu jalan yang sudah macet mana
nauli_permata,tiap libur jam gin saja yang buat sudah mandi
nauli_permata,banyak orang njancuki hari
nauli_permata,timbang saudara wanita meteng admin tidak katek munafik sudah tawa los tidak rewel
nauli_permata,selamat natal
nauli_permata,lempar dulu
nauli_permata,ngertio ngono tonton dewe bajing
nauli_permata,mie bromo pojok saudara enak juga
nauli_permata,oo iya tuhan tawa
nauli_permata,foto opoan
nauli_permata,iya tuhan berisik rek
nauli_permata,hutang opoan
nauli_permata,dion ini tawa
nauli_permata,iya ampun maemunah datang lagi sini
nauli_permata,sama saja panas kayak malang
nauli_permata,nah betul heran saya itu
nauli_permata,bangun siang saat libur mitos
nauli_permata,umur sih lah kategori dewasa pikir tentu cuk sok ngartis lek dikandani mbangel mentolo saja
nauli_permata,besok libur tidak tangungan pekerjaan bulan desember
nauli_permata,bagaimana saudara tadi pagi e saya
nauli_permata,sebentar durung nuemen harus ngeseng e sebentar slemet
nauli_permata,tawa jalan nandi jal harus ngeseng saya
nauli_permata,tawa lah bagaimana ancen bosan saudara sudah kerjoane
nauli_permata,masio bosan tetap
nauli_permata,hari akhir kerja semangat
nauli_permata,lah kan
nauli_permata,awas kenek semprot deb
