username,tweet
kharismagpri,kenapa tidak
kharismagpri,sptnya karakter putra gong memang tidak sekali lee seung gi
kharismagpri,twogether lucu beud lah
kharismagpri,tanya sulit
kharismagpri,mahir beud sih langsung kering luka
kharismagpri,tarik papernya
kharismagpri,salah satu contoh nyata teman bucyn tingkat dewa mobil histeris tidak sapa pertama instagram langsung padahal tidak cuma yang sapa gplah penting bahagia kata
kharismagpri,baru tahu
kharismagpri,dua hari hujan kasih lihat pelangi
kharismagpri,balas penjara playbook rsud daftar putar cinta nya tapi bukan yang utama karena jadi hari hari yang angkat sptnya penjara playbook yang paling sedikit cinta nya tiga
kharismagpri,may itu tahun jadi dengan anda
kharismagpri,efek biasa ain ibu kos gilir habis bingung nyata sudah beberapa waktu langka tapi baru sadar
kharismagpri,sptnya bukan karena psb tapi karena orang banyak trial dalgona kopi gula jadi habis
kharismagpri,baru kali cari gula tidak stok sudah minimarket pasar psbnya padahal baru mulai rabu keduluan
kharismagpri,buku apa tia
kharismagpri,kece beud sih
kharismagpri,siapa anda sungguh adalah itu doesn t masalah ketika hidup gets juga strange juga mustahil juga frightening di sana adalah selalu satu akhir harap bagi dari mary watson s akhir les itu akhir masalah
kharismagpri,saya kena omel tawa
kharismagpri,dasar anak biologi
kharismagpri,rumah sakit dari wahidin sudirohusodo jl rintis kemerdekan anda makasar sulawesi selatan rsud undata palu jalan trans sulawesi tondo mantikulore kota palu sulawesi tengah terima kasih dokter
kharismagpri,ted talks tagih gates juga bilang begitu bringing ekonomi kembali in doing uang itu s lagi dari sebuah reversible benda daripada bringing orang kembali untuk hidup saya baca pergi untuk ambil itu rasa sakit in itu economic dimensi besar rasa sakit in mes untuk kecil itu rasa sakit in itu sakit sampai mati dimensi
kharismagpri,profesor okid
kharismagpri,siap siap saudara
kharismagpri,baru kali parno naek krl tiap yang batuk langsung gerbong ngeliatin
kharismagpri,baru ketemu mayan obat rindu dengan eragon sampai saphira
kharismagpri,selamat ulang tahun buat orang ultahnya tahun sekali
kharismagpri,kurang piknik mungkin ul
kharismagpri,butuh untuk dapat bersih dari itu monyet
kharismagpri,hasil bimbing hari saudara
kharismagpri,lucu tawa
kharismagpri,tolitoli kupas protes duduk
kharismagpri,cinta selingkuh dengan
kharismagpri,jarang dapat mes macam ini
kharismagpri,benar
kharismagpri,ashfal kece lah bencana political tindak komedi sama meaningnya dapat beud dapat promosi beli gratis
kharismagpri,mungkin rebah kronis potensi
kharismagpri,tamu lain nyata bapak banjir tidak mau ketinggalan semoga lekas surut dapat segera tangan
kharismagpri,tawa mau dong diasistenin sabil rindu jadi praktikan
kharismagpri,kece beuds preparat
kharismagpri,wah cuma tidak kena rekam gmaps saja
kharismagpri,mapsnya lucu sudah tawa
kharismagpri,karena milik anda lovingkindnes adalah lebih baik daripada hidup
kharismagpri,sudah lama tidak tonton koreanan sekali ketemu lagu in untuk cinta mobil nyanyi baik anda
kharismagpri,amoeba goes untuk karanganyar ini
kharismagpri,pikir
kharismagpri,setuju
kharismagpri,yakale tes darah remedial
kharismagpri,mendengarkan perahu kertas sampai malaikat tahu nya saudara lestari dinyanyin sama tulus mobil ngefans aduh ris mana saja padahal sudah lebih windu
kharismagpri,lagi bersihin galeri tidak sengaja temu ss lama
kharismagpri,haduh mik malah interogasi balik tawa ada lagi pesan langsung an saja
kharismagpri,jeng jeng tidak bagaimana kenapa mik
kharismagpri,mantap
kharismagpri,saudara laki lain nyata
kharismagpri,saudara laki bassist nya utama twitter juga mik
kharismagpri,stickernya imut kenapa seperti begitu
kharismagpri,ini itu banyak sekale
kharismagpri,dia tidak pernah made sebuah janji itu sudah juga baik untuk jadi benar
kharismagpri,ilustrasi tidak sekali sih sering lihat satu sisi saja
kharismagpri,hidup humoris cari hilang kejar lari yang tunggu pergi hati lelah serah saat semesta kerja episode
kharismagpri,eh tidak cuma bapak ding orang orang yang seperti begitu juga
kharismagpri,tidak habis pikir kalau lihat bapak ngerokok belah bayi sendiri pikir kalau cuma sendiri ngerokok non henti yang rugi sendiri hla bayi kecil anak sendiri sudah diracunin kecil
kharismagpri,tenang tidak semua ada jawab sekarang episode
kharismagpri,somewhere over itu rainbow
kharismagpri,lekat pangilan nya sela maksi kasih ceramah topik seperti begitu
kharismagpri,puk puk aul kalau saya lebih kena yang atas
kharismagpri,jeng jeng
kharismagpri,atau baik
kharismagpri,kali bulan keluarga turut turut kena terus sama lagu senang sunday
kharismagpri,menteri kalau hari akhir kerja akan izin kiri whatsapp kelompok kantor tidak
kharismagpri,yang perlu set karena datenya juga belum atur satu wah nyata lama semua ting hadeuh bapak mksdnya bukan ting seperti begitu ajar geser makna kata hari
kharismagpri,ingin punya mesin yang nge beku waktu halusinasi
kharismagpri,prodi juga deh yang praktikum tiap hari kadang dibarengin tugas uji tidur saja sesal sampai moto tidur adalah untuk itu weak yang susah dipraktekin sekarang
kharismagpri,seperti salah orang mik
kharismagpri,cerita lagi sen grepfod sen apa ini pikir apa pakai topping gula bagaimana terus mau sen apa lagi sen besok langsung hari libur saja tidak hadeuh kalau ibu saya mau
kharismagpri,solo
kharismagpri,aduh kalah rajin euy sama kakek yang sudah uban kepala mungkin kakek tiap hari sudah sawah belum matahari muncul tidak libur wekendnya
kharismagpri,salin aju flashdisk niat cicil tidak hari libur eh tidak cari malah ingat fdnya tidak cabut nempel pc tidak tanda memang tidak kerja dulu alibi
kharismagpri,gejala baru grup angkat kuliah yang sudah ganti fase
kharismagpri,saya tidak pernah pikir saya saudara jadi able untuk buat any dari ini barang tapi saya bisa anyone bisa pakai itu topeng anda bisa pakai itu topeng jika anda didn t tahu itu belum saya harap anda buat sekarang cause saya saya laba manusia dan saya saya tidak itu hanya satu miles morales
kharismagpri,whatever anda pilih untuk buat anda ll jadi hebat kita keluarga doesn t run dari sesuatu anda adalah nyala milik anda cara itu s semua itu adalah miles sebuah lompat dari iman
kharismagpri,adalah itu juga gila tidak miles saya lihat tepat apa anda baca doing di sana
kharismagpri,favorit bagi dari laba manusia pada itu laba ayat
kharismagpri,mobil jadi anak rumah
kharismagpri,komposisi
kharismagpri,jadi hyun sesuatu akan jadi oke does itu punya untuk jadi sebuah senang akhir itu cerita itself adalah penting hanya langsung milik anda hidup di itu fullest
kharismagpri,akan anda jadi di sana favorit bagi hidup adalah apa happens ketika anda bisa t tidur jadi sebuah jika saya hilang seseorang saya bisa t penuh apa harus saya buat lalu jadi hyun pikir dari itu senang times together itu happiest saat dengan itu orang itu memories akan buat anda langsung nyala
kharismagpri,mendengarkan ini ris ibukota pindah asal hati tidak hle sok an kasih saja sudah ganti ibukota saja pindah kapan anda pindah hati hadeuh telat minum obat overdosis ini anak
kharismagpri,rekam diskusi topik ibukota hari saya teman section eh ibukota pindah kuta ini kalau maps dekat sulawesi tetap aman kenapa asal tidak dilewatin patah pikir benar patah hati
kharismagpri,ide bagus
kharismagpri,buat rindu solo
kharismagpri,wuih daebak masuk resep baca ya
kharismagpri,tidak alasan kenapa rindu berat karena ngehabisin daya
kharismagpri,buat yang sudah beli tiket jauh hari coba deh periksa notif sms deh agar tidak syok brngkl sesuai jdwl karena aplikasi sampai kertas boarding lulus tidak ikut ubah notif email tidak
kharismagpri,suka pakai argo jati cireks tegal bahari buat pp jakarta crb kalau updet nama sudah jadi gocher yak argo cheribon mungkin agar lebih kini
kharismagpri,ilmu poin beranda orang saudara wanita
kharismagpri,nice jelas jadi ingat dulu dibilangin cemil daun pepaya agar tidak gigit nyamuk nyata tidak ampuh
kharismagpri,pagi coba nyala televisi tonton kartun sudah beberapa kali ganti judul kartu masih saja bingung kartu yang tambah sulit paham saya yang lupa cara tonton kartun
kharismagpri,memang perlu banyak ajar latih kerja
kharismagpri,tidak butuh untuk kuatir karena berapa sesuatu hanya ambil waktu colorama
kharismagpri,keingetan saudara yang inbox email mungkin lebih banyak
kharismagpri,tidak apa bil arti sudah besar sekarang
kharismagpri,sabil tawa tidak sangka sekarang sudah seperti begitu
kharismagpri,dan jika anda rasa seperti milik anda seluruh hidup has fallen apart itu s fine itu sama sekali has sekarang anda dapat untuk decide bagaimana untuk taruh diri sendiri kembali together di sana s baru hidup untuk jadi lived semua sekitar anda davis
kharismagpri,kurus pada itu anda hanya dapat untuk sedih milik anda loved satu once kena t habis itu seluruh waktu coba untuk alih diri sendiri atau dorong itu turun itu does pergi jauh eventually dan anda akan hilang asa itu hubung untuk itu orang lagi
kharismagpri,buat pernah masih duka
kharismagpri,punya sebuah nice istirahat dari hari libur
kharismagpri,sebelas cerita dalam buku punya makna unik dalam interpretasi tiap orang beda beda jadi mungkin coba baca mendengarkan tonton intai tahu lebih lengkap cerita favorit firasat sampai saya ikut sedikit partnya
kharismagpri,isi cerita pendek lirik lagu baca tiap cerita diawalin mendengarkan lagu kalau mau baca saja juga tetap kenapa kalau yang lebih suka tonton cerita yang sudah dijadin film
kharismagpri,kemarin tiba keingetan tidak sama pernah pegang buku saudara lestari rectoverso cuma bolak balik halamanya saja belum pernah baca sampai akhir dapat playbook tahu kalau album lagu film deuh memang kudet
kharismagpri,itu happens kadang
kharismagpri,gws ul
kharismagpri,kel pokdo tanya sederhana tapi entah kenapa selalu dtng waktu yang tidak
kharismagpri,benar nyata
kharismagpri,benar kata saudara wanita e yang paling berat bukan jalan pikir apa yang jalan perlu ajar kurang pikir lebih
kharismagpri,theravance biosiences
kharismagpri,every belok dia writes pada milik anda cerita adalah benar every putar dari itu rencana adalah untuk itu terbaik every baru karakter atau tidak duga peristiwa adalah sebuah tool dari his rahmat berterimakasih
kharismagpri,lihat anda ketika saya lihat anda
kharismagpri,artikel pintu gerbang baru terbaek sudah poin akhir susah deh
kharismagpri,uluh uluh
kharismagpri,baru hasil temu lirik karena yang nyanyin minggu kemarin dedek tk berterimakasih untuk tahu ini
kharismagpri,berterimakasih untuk tahu ini lagu
kharismagpri,bisa rasa pp kondisi tol lancar berterimakasih lanjut agenda rebah senang hari libur
kharismagpri,pagi sampai malam isi mendengarkan updet sama diskusi topik variatif saja pagi pekerjaan sore jadi idealis realistis petuah dari saudara wanita guru malam sidang mk bahas tg negara oleh sopir taxi yang tonton yutubnya saja bobot
kharismagpri,aduh
kharismagpri,saat scrolling beranda lebih tarik perhati daripada natap layar lepi aju unggul kapan selesai mulai saja
kharismagpri,lelah tidak nyerah padahal libur saudara
kharismagpri,warnawarni
kharismagpri,pindah salur televisi eh temu anak kenapa oke lucu sudah
kharismagpri,tawa iya duns gamesnya lucu
kharismagpri,isi kultum bukber versi ilmuwan orang yang syukur berkat tambah tambah seperti metode analisa tidak kuantitatif juga scr kualitatif saudara
kharismagpri,tangan jari kaki sudah ada seperti jeli ada seperti cony baru temu kasur
kharismagpri,bias sudah sembunyi sembunyi lalala whatsapp sampai lupa tidak semua sama akhir cuma diketawain sama saudara wanita ahli ikuti memang tidak bakat poin orang
kharismagpri,anda punya sebuah seluruh hidup di depan dari anda pi s sama
kharismagpri,bahkan ketika allah seemed untuk punya tinggal saya dia sudah tonton bahkan ketika dia seemed indifferent untuk saya derita dia sudah tonton dan ketika saya sudah beyond semua harap dari hemat dia gave saya istirahat lalu dia gave saya tanda untuk terus saya jalan pi
kharismagpri,favorit les dari hidup dari pi saya harus in itu akhir itu seluruh dari hidup becomes an tindak dari letting pergi tapi apa selalu hurts itu most adalah tidak taking sebuah saat untuk ucap selamat tinggal pi
kharismagpri,berterimakasih untuk hari ini saya favorit garis dari suatu itu raja made
kharismagpri,apa pun nila punya adalah nila tunggu untuk
kharismagpri,aduh dek
kharismagpri,itungan yang tidak laku kalau tidak musim manga saudara
kharismagpri,tetap growing tetap ajar
kharismagpri,kelas jerman saja butuh bas thn rencana tahap depa buat pindah batu bara plants renewable energi jadi tidak langsung selesai pakai golput dia rugi sudah pilih pimpin yang sesuai mayan thn pakai buat usul ide rencana dulu
kharismagpri,astagah tapi kenapa benar
kharismagpri,di sana adalah sesuatu itu saya bisa punya tapi bisa t tetap
kharismagpri,berani doesn t selalu aum kadang berani adalah itu diam suara di itu akhir dari itu hari berkata saya ll coba lagi besok saya sebuah radmacher
kharismagpri,kadang orang cuma lihat yang nampak duga belum yang kira jadi yang benar nah buat ajar sendiri selalu lihat orang dari sisi positif tawa kalau sama orang baru juga tidak tega lah memberi judgement saudara selamat lanjut hari
kharismagpri,kece lah
kharismagpri,alur cerita tidak susah buat kutin tidak habis waktu lama utkdibaca konflik yang muncul beberapa bedan berat karena punya satu sama kasih sayang cielah sampul belakang novel akhir baca masing
kharismagpri,semua tulis sederhana puitis saudara contoh dongeng indonesia hambar hubung tokoh juga cakap ringan karena label waktu masa kini
kharismagpri,novel bingkai hubung tokoh latar belakang hidup solo saat sudah kerja jadi dosen muda di ui beberapa zona luar jawa jepang konflik muncul yang hadap karena bedan asal usul keluarga budaya yakin jarak
kharismagpri,nyata selesai baca novel sajak tersebut tidak dalam cerita ho sok tahu sih novel tetap punya cerita sendiri tokoh utama novel sarwono orang jawa tulen lahir besar solo sampai pingkan ibu manado jawa lahir makasar besar di solo
kharismagpri,saya cinta sederhana kata tidak sempat ucap kayu api menjadikanya abu saya cinta sederhana isyarat tidak sempat awan hujan menjadikanya tiada
kharismagpri,awal sih penasaran nebak akan muncul halaman mana salah satu banyak sajak beliau cuma sajak yang hafal maklum tidak pintar puisi
kharismagpri,novel pertama hasil baca tahun ini sampul depa
kharismagpri,kalau sudah ngantuk gin ini penginya tinggal nempelin kepala buku terus merem harap mobil download
kharismagpri,saudara
kharismagpri,keren beuds
kharismagpri,sempat favors hanya itu siap pikir luncur pt mereka adalah itu products dari siap pikir tidak sks sks an
kharismagpri,hai kode ikut kharismaoxkm tidak dapat diskon beli parsel ruangbelajar aplikasi mobile
kharismagpri,wua dulu juga sering diomongin begitu tapi beda versi pakai omel ibu saudara
kharismagpri,besar terimakasih istirahat in damai ibu
kharismagpri,bisa tawa
kharismagpri,detailed five tahun rencana tentang his milik sendiri teliti daebak
kharismagpri,mungkin keputusanya buat setuju baik depa lebih baik proses kerja laku tidak rugi rakyat biasa
kharismagpri,tawa mau begitu wid tapi kuasa dari ibu susah lawan mungkin sebentar tidak jadi ibu baru rasa kali
kharismagpri,saudara wanita kalau kursi kreta dapat abjad sebuah saudara aturanya sih dapat pojok dekat jendela sama mudah biaya telepon eh tidak sampai lokasi kursi sudah didudukin yang apa daya pekewoh minta tuker
kharismagpri,wuih
