username,tweet
arangkecap,tolong indonesia tidak sampai harus rusuh dulu seperti kita baru utama ubah dalam pengelolan negara
arangkecap,saya harap indonesian tech youtubers bisa buat itu sama benda sebagai mereka did
arangkecap,pmi oke kata tes corona negatif tapi tespak positif
arangkecap,kandani ngeyel sial
arangkecap,waktu wisatawan
arangkecap,jokes bekas aneh
arangkecap,kapan akhir kali anda tidur tenang
arangkecap,sial
arangkecap,kontol
arangkecap,mana dong
arangkecap,coba sendiri sudah
arangkecap,bis merek apa
arangkecap,sudah pagi wktuna masak rendang
arangkecap,saya kira malah belum tidur aowkaowkaowk
arangkecap,lekas tidur sudah pagi
arangkecap,leherna merah kenapa hayo ngaku
arangkecap,preventif nya bagus sih pergi jauh harus pakai surat hasil pacar cepat uji dk tapi kan tidak murah bok kalau uang mepet harus pergi bagaimana
arangkecap,sedih sekali kalau ad giveaway terus akhir embel kita dan atau canada hanya makin puruk sudah kembang negara
arangkecap,rahman komputer terima jasa keti
arangkecap,nah kalau korut kyknya tarik
arangkecap,lah saya kamar balik mawa motor tapi jeung batur duan ganti
arangkecap,btul kecap tradisionil
arangkecap,orang keranjingan drama korea kenapa kenapa saya tidak iya
arangkecap,diam anda akun tersebut sdg hiatus
arangkecap,naik motor dong anda kan bobotoh salam satu aspal
arangkecap,tru sekali dasar fakgurl
arangkecap,slamat siang siapa mana
arangkecap,sial tawa foto masih
arangkecap,anda syp anda spti jeli
arangkecap,terus sampai sekarang muka anda tidak ada beda syukur awet muda
arangkecap,anda nyalahin siapa hyo cpt ngaku
arangkecap,tk saja dhe satu tk keren sekali
arangkecap,istighfar tempat sampah
arangkecap,tidak ampuh
arangkecap,idc
arangkecap,sial mau jubirnya cantik tapi angka naik terus apa beda sama jubir sblmnya
arangkecap,coba ngaku yang nyalahin kale nkcthi nyalahin musim panas kan dos
arangkecap,modalin
arangkecap,pasar ende aspal sekarang
arangkecap,anda harus coba kuliah saudara jawa
arangkecap,motogp drama sekali sudah bursa transfer baru juni
arangkecap,sila duluan
arangkecap,sudah mulai bosan saudara rumah karena biasa bang toyib tidak pernah plng
arangkecap,baik kuinstal lagi kalau begitu
arangkecap,masa joging pk masker nti pingsan
arangkecap,sini saya yang cetak
arangkecap,maaf apmu saya uninstal karena tiap mncari slu tidak ad jadual
arangkecap,mau oke slo iya
arangkecap,sudah buka jor
arangkecap,bodoh pakai salah deposito segala
arangkecap,bajing tanjung sama urus pandemi tidak ada selesai
arangkecap,diam anda lae
arangkecap,tidak supra tidak mesra
arangkecap,rindu puki
arangkecap,jiakh
arangkecap,pukimay lae pongor
arangkecap,eh pacar jual dimana sekarang kalau sekolah libur gin punya anda
arangkecap,pakai dong agar enak tulang saya sruput
arangkecap,syukur ke jalan lurus
arangkecap,saos sambal dong kan lombok
arangkecap,usah lombok gandaria jual kecap ingin marah maksud apa
arangkecap,ikan bakar pakai kecap enak sekali ges memang kecap hitam tapi kalian tidak hina karena resap resep masakan indonesia
arangkecap,konspirasi sekali dulu yang jual ayam herbal ayam fried ayam terus seperti goreng pakai minyak kayu putih
arangkecap,laptop saya cuma satu nti kalau rusak saya skripsi pakai apa bubar saya awokawokawok
arangkecap,isi micin pantas bodoh
arangkecap,buka shopee gulir masuk keranjang terus pikir apa beli karena slama saudara rumah sudah cukup sudah akhir gulir ulang sampai promosi gratis ongkirnya sudah mau habis
arangkecap,tahu jeletot saja kalau begitu yang depan budi agung enak sekali mie yang jual cireng juga tidak pengkol
arangkecap,malam paling enak cemil gehu kopi
arangkecap,bapak saya lihat tonymacx sih panduanya agar keinstal cuma kalau untuk drivernya ada yang memberi pandu jelas soal kan spec tiap laptop beda saya pikir percuma nti saya pasang mac tapi tidak bisa jadi hari sopir kalau wifi suara grafis nya tidak
arangkecap,pihak swasta yang terang an bicara against racism memang usaha value nya bagus atau bagaimana di indonesia kenapa rasisme sistemik pihak swasta kurang lihat vokal
arangkecap,orang tanya jadwal cl itu tidak baca jadwal apa bagaimana sudah
arangkecap,tawa jika any captcha terlihat seperti ini tidak satu akan pernah keluh tentang havin captcha
arangkecap,ini adalah evolving hanya ke belakang
arangkecap,beli sampai dengan apa beli saham hayo
arangkecap,astaga benar juga dar semester hnya jadi wcn
arangkecap,pnerimanya atas nama bapak anda iya
arangkecap,rugi sekali tidak cemil nugget ibu
arangkecap,tidak lupa bismillah
arangkecap,hadir rahman paket terima kirim barang mengunakan motor daerah bogor raya
arangkecap,padahal saban hari kerja gulir syopi liatin soju
arangkecap,tapi itu doesnt maksud jadi tidak usaha nabung iya ges
arangkecap,memang haji urus takdir kalau sudah gin orang seperti apa juga tidak akan brgkt haji
arangkecap,anda bikinin nugget seperti yang buat mak anda tidak
arangkecap,baik untuk anda lalu
arangkecap,asyhadu
arangkecap,ba dum ts
arangkecap,omong kosong sekali diri untuk hitam anda punya teman kuliah orang papua saja masih sering dijulidin dijauhin standar ganda
arangkecap,ayo kawan jasa rahmancomp saya beli emas
arangkecap,kalau sudah jadi fanboi jelas buta
arangkecap,awoakwoakowkaowkaow lingkar cahaya ges
arangkecap,lelah dulu ah buat singkatanya
arangkecap,dasar kalian
arangkecap,rumah ofc
arangkecap,tarik
arangkecap,beli dong maaf iya
arangkecap,asli itu akhir dari terbang solo era keren sekali tidak sesal ges ribu buat konser online
arangkecap,apa yang penting hackintosh
arangkecap,saya kena t punya akses untuk macbok bagaimana kinda keras untuk temu macos iso online
arangkecap,siapa pernah coba hackintosh
arangkecap,kuasa
arangkecap,panik terus anda
arangkecap,bercocoque tanam
arangkecap,iya tuhan tidak jadi brkunjung deh
arangkecap,zah rumah anda mojok di ujung tidak
arangkecap,artsy sekali saudara anda buka kalau mau naek kelas ya pakai anda
arangkecap,baca dong masa agar makin cinta
arangkecap,anda protozoa iya mbelah diri
arangkecap,ekspansi rahman elektronik
arangkecap,ayo kalau urus pater pater saya siap bantu ini tawa
arangkecap,ini tidak mentality minta harga teman bantu bagi saja sudah saudara wanita sekali kenapa appreciate orang dekat yang berani ambil risiko buka usaha bisnis runin sebuah bisnis isn t mudah meskipun
arangkecap,pantas anda sekarang ngumpulin besi bekas
arangkecap,bisa saya hanya peluk each lain dan henti arguing untuk sebuah saat
arangkecap,apa insekyur kalau usaha
arangkecap,tempat sampah hari lalu saya oke komplek anda jn mawar ngaku anda rmhna saudara sna kn
arangkecap,cpt anda periksa pesan langsung dari saya kalau tidak saya kluarkn dari itu garings
arangkecap,salam ibu curhat dong iya dong ibu saya mau tanya kalau buat sop buah iceland kira berkah tidak tidak surat al maidah ayat sebut minum yang mabuk buat syetan tapi enak ibu bagaimana dong lebih baik anda segera brtobat
arangkecap,itu manusia jod semoga anda tenang alam kos
arangkecap,keburu lulus maaf kelam
arangkecap,oplet anda tidak blh mnyamakan bemo dan oplet sefruit penistan
arangkecap,akhir dari terbang solo era tonton tidak ribu iya ampun tidak afdal tapi konser kalau online itu tidak suasana nya
arangkecap,cere gandul cere gandul tbak drmn slogan tersebut hyo cpt jawap
arangkecap,anda saja ndu smogi bahagia
arangkecap,marah angin sama anda
arangkecap,saudara bogor trbalik
arangkecap,maaf rumah saya saudara kota tidak ush blagu anda wargi kbupaten
arangkecap,anda boros air sebaikna pindah rumah oke pinggir kali
arangkecap,syp yang sudah rindu kosanya
arangkecap,tidak lah saya tweet apa yang saya pikir saja brti otak saya pakai pikir lagi skripsi otak untuk skripsi bukan untuk twitter
arangkecap,gila intel masih nm bisa nanganin thermalnya dengan cukup baik coba saja kerjasama sama amd gbungin itu teknologi nm nya baik ngebut dan sejuk deh tapi nti mahal karena jadi monopoli
arangkecap,asyik habis yang viral lelang perawan buat konten undang podkes dedi korbuser dan masuk empat mata dan buka endors mahal
arangkecap,karena telepon harus muat saudara kantung kalau mau tonton youtube puas bli tablet saja segala
arangkecap,tolong prosuden telepon anda kalau buat telepon tidak ush besar saya tidak suka coba buat telepon yang kecil saja
arangkecap,anda klah sama karakter gim
arangkecap,knapi puasa buat lapar iya
arangkecap,opini bagus apip sekarang isi sendiri
arangkecap,anda harus keluar dari hidup
arangkecap,tidak fham du
arangkecap,bingung ajh
arangkecap,untuk kabur tidak gayamsari
arangkecap,syp yang cinta nabi bahagya dalam hidup anda nyanyi anda kalah cpt ngaku karena lagi puasa
arangkecap,pukul saya bayi
arangkecap,kadang harap telepon rusak agar beli yang baru
arangkecap,sampai dengan sudah omong kosong kbeli tapi jadi ragu mnding bli sampai dengan apa iya lebih baik uangna disumbankan
arangkecap,syp jual redmi kali sni saya tawar hpmu
arangkecap,bajing pixel alam anda tidak stabil saya kmbali oke miui eu
arangkecap,bct anda kontol
arangkecap,kalau kata teman saya sih yang penting irama pikir itu saudara makes rasa
arangkecap,bajing tiap hari windows perbarui saya kira apa trnyata windows bela perbarui cuma saudara wanita
arangkecap,memang utama media sosial baik tidak usah baca kolom komentar isi ribut doang argumen tidak ada arah kalau mengangapi dengan bijak kadang malah seru juga hibur aokaowkoawkowakowkwaok
arangkecap,bgs anda bukan spikotap
arangkecap,kontol
arangkecap,syp cemil pizza pakai senduk tidak brteman dgnku lagi
arangkecap,tidak sengaja
arangkecap,nah masalah saya tarik gemar bagaimana dong tawa
arangkecap,lanjutin skripsi saja saya dukung anda
arangkecap,pakai ember bekas cat agar pindah kalau razia tidak akan ciduk
arangkecap,instagram yang sengaja buat saya jelalat
arangkecap,baik muncul sebagai takjil
arangkecap,tidak sneng snengnya yang gres
arangkecap,kenapa xplore instagram saya isi gadis panas yang pakai tanktop doang
arangkecap,maaf saya anak cinta damai
arangkecap,dong
arangkecap,kadang kesi juga pegawai negeri sipil benar kan jabat profesional tapi atasanya jabat politik jadi harus ambil buat bijak publik yang benar tidak layak untuk laku
arangkecap,baik main hayday sj aduh domba
arangkecap,admin periksa pesan langsung tks
arangkecap,kulum kuliah umum
arangkecap,cincau jadi cingcau
arangkecap,minta timed keluar
arangkecap,mes dong tidak maloe
arangkecap,puki enak tahu
arangkecap,karena anda spesial
arangkecap,tidak komentar
arangkecap,apa memang dari lagu saya asal ngetik saja yang ad otak
arangkecap,saya pikir orang bisa ubah jadi perhaps berapa dari dem hanya tidak bisa
arangkecap,hasil koleb dengan yang dari kemarin ingin minum apli
arangkecap,syp mw halusinasi sila dengar pleylis
arangkecap,jinji tidak anda cri
arangkecap,siapa kalau bicara rusak jadi ruksak
arangkecap,bingunk sekali bagaimana cara foto diri begitu cerminya harus tempat dimana
arangkecap,romantis rok mini enak sekali isi
arangkecap,tambah deh satu tanggung
arangkecap,tanjung dulu deh semoga kalian ingat akronim atas dan pusat rahman comp kalau masalah dengan komputer laptop kalian
arangkecap,purbaleunyi purwakarta bandung cileunyi
arangkecap,indihome hujat orang ramai
arangkecap,selat sunda sering telat suka nunda
arangkecap,pasuruan perah susu keburu keluar duluan
arangkecap,kuala lumpur kurang belai bisa tidur
arangkecap,ikut terus benang
arangkecap,macan tanah makin cantik busana
arangkecap,sabar dong pikir ini smbil cuci baju
arangkecap,mojosongo mojok ojo nganti seks untuk
arangkecap,pusat java luas
arangkecap,prameks prambanan ekspres
arangkecap,lebih pusing kalau beda yakin
arangkecap,ciputat cinta pusing status
arangkecap,tawa ikut terus saudara masih banyak
arangkecap,palangkaraya pap t langsung kasih rasa sayang
arangkecap,dimana ini
