username,tweet
estlrsty,untung akhir sama chitoge
estlrsty,yang brutal lebih tarik
estlrsty,onodera terlalu kalem
estlrsty,betul saya sampai sekarang tidak haru sama sekali
estlrsty,benar sekali
estlrsty,loh malam begitu
estlrsty,akhir masuk sini
estlrsty,maaf seperti ceker kantin
estlrsty,gugup gugup serius
estlrsty,repiciain ayo
estlrsty,valid
estlrsty,valid
estlrsty,notip olahraga muncul saya habis piring mie lewat wo dulu deh hari ini
estlrsty,juga jenis maine coon
estlrsty,beruang
estlrsty,kalau yang jengotnya golong kambing
estlrsty,sabuk hitam
estlrsty,yang kumis tipis tapi jauh jauh
estlrsty,kemarin yang nyaranin bio twitter seperti gin semoga ibu ibu jadi baku hantam
estlrsty,rindu kn orang oranganya deh
estlrsty,wih selamat
estlrsty,tenang porjo ada laris
estlrsty,telat bandel tawa
estlrsty,yah anane mung kurang
estlrsty,ngo uang sebentar nko tidak ganti
estlrsty,sal titip le mineral dingin ayo
estlrsty,salam saudara laki cilok ribu sambelnya saya ambil sendiri saja
estlrsty,madang se sendok mungah kilogram biadab
estlrsty,rapopo madang banyak tetap kuru
estlrsty,ojo lali es teh po es susu milo ne
estlrsty,motifasi mz
estlrsty,kancing seragam teriak sebuah selamat saya saya tidak kuat sebuah
estlrsty,benar sekali sih nang angkring malah boros apa anda angkring kampus ayo ra
estlrsty,iya masuk apd
estlrsty,akhir temu cilor
estlrsty,terus kaku sekali seperti tiang listrik tidak bisa ajak canda
estlrsty,benar sekali sumpah
estlrsty,peluk minta peta baik baikin
estlrsty,terus kalau balas singkat tidak jelas begitu malas sekali baca
estlrsty,pacar rangkap jadi rampok
estlrsty,ya orang model begini typingnya jelek
estlrsty,hendro tampan ya kalau pakai apd oke
estlrsty,wih semangat
estlrsty,sial seperti ketupat lebaran
estlrsty,cinta kepentok weton
estlrsty,astaga
estlrsty,tidak boleh sosial jarak
estlrsty,bapak ibu cuma tetangga desa
estlrsty,salam diabetes sakit gigi
estlrsty,yunaxgerard layar tangis gemas sekali
estlrsty,masih ayam gobyos
estlrsty,balik yogyakarta tidak cemil geprek
estlrsty,nagih sekali nontonin video farah quin
estlrsty,ih bagus lucuk
estlrsty,sumpah tawa sekali monanges
estlrsty,pyeha
estlrsty,iya e tidak kira jam an nyata jam sudah bubar
estlrsty,pikir lebih pikir opor ayam bom dipanasin sejak lebaran kemarin
estlrsty,kenapa gin sih saya motong bawang saja lama sekali mana tidak sama tebel tipis
estlrsty,saya pernah kasih momogi sama teman diletakin situ lupa terus tidak saya cemil sampai bermingu minggu kena hujan panas sampai bungkus momoginya buluk
estlrsty,buah ulas janji tawa
estlrsty,ken bisikin semua sekitar anda kuping anda tapi sayang jaoh
estlrsty,pasti hidup jadi ikan nila mati karena jadi ikan bakar terus sekarang reinkarnasi jadi kucing
estlrsty,lihat saya pikir ah sudah lihat saja drama langsung tidak usah pikir teori teori tidak akan masuk materi uji
estlrsty,soal kemarin saya tonton sudah mulai
estlrsty,akhir saya tahu saya bare bears mulai jam
estlrsty,hai kenapa banyak sik
estlrsty,mutualan sama saya pengirim
estlrsty,sampai sekarang saya paling tidak pakai eyeliner bagaimana sik astaga sekali sudah rapi ini malah tidak cocok mata soal mata saya sudah besar
estlrsty,kelam rumah saja sudah seperti cinderela versi tidak jadi babu
estlrsty,kirim ss an bukti transfer
estlrsty,gaperlu bungkus tidak apa apa
estlrsty,saya juga mau kenapa kado sederhana seperti gin
estlrsty,lha wis koyo sisa sisa rapi tinggal museum
estlrsty,corona tidak ibu ingkar janji
estlrsty,heran heran jelas ngeblur
estlrsty,kosanku banyak neraka tidak
estlrsty,seperti iya deh kenapa sih mau akhir malah kabur kabur segala
estlrsty,sial malah jadi hias dinding semoga estetik
estlrsty,ingat hoodie kos jamur apa tidak
estlrsty,akhir itu dunia dari itu meni itu kenapa nangung sekali si
estlrsty,solo ad
estlrsty,samperin rumah minta izin bapak kalau anda mau minta belai
estlrsty,mw saya gebug
estlrsty,sial sebut saya sgala
estlrsty,saya msi lepas pasang kerudung bajing iya saya msi jalan setan
estlrsty,sial syok txtdariunisa
estlrsty,di jalan bulan
estlrsty,kacau sekali jam tidur
estlrsty,terimakasih donatur kuota hingga saya tonton drama hari demi lupa disminorea
estlrsty,ojo lali koyok e pasang nang pipi
estlrsty,ayo blanja tkang syur
estlrsty,sumpah keren sekali jasa malah jadi teringat anime hataraku saibou
estlrsty,skripsi bagaimana sudah
estlrsty,mnungutxtdrhndr tapi tidak pernah
estlrsty,andai cleo seperti
estlrsty,jam jam ngantuk
estlrsty,hala sudah cere
estlrsty,anda doa tapi tidak doa
estlrsty,bilang rindu orang langsung tidak lupa
estlrsty,selamat tinggal selamat tinggal lemak neraka lingkar cahaya imt normal
estlrsty,apa apani
estlrsty,ih tumben sekali jaring ngandat jam gin
estlrsty,tidak ada masalah tetap adain masalah agar ribut tawa
estlrsty,tingkat tinggi rindu orang kalau saya uring uring kesal sendiri cari cari masalah
estlrsty,sp yang nglarang marahin
estlrsty,maksud
estlrsty,sial bab saya yang biomekanik menang lihat
estlrsty,akhir tempat sampah bakso sukar
estlrsty,apa hai kenapa rumit gin anjor belum nontonsialan beterai laptop habis listrik mati
estlrsty,lagi ibu salah buat mie goreng malah ambil yang varian pedas tentu cemil saya
estlrsty,bekti bekti bekti besok besar mau masak apa
estlrsty,tampan tampan sadboi
estlrsty,ijekiel
estlrsty,pedas sekali tidak ada ahlak
estlrsty,sen sana dingin segar begitu kan sampai sini sudah hangat bobanya tidak bentuk
estlrsty,thai grentea bobanya saudara via ovo
estlrsty,dompet insekyur lihat benang
estlrsty,bodoh jadi humoris obrol tidak perlu kala
estlrsty,saya bosan saya cari film begitu kan netplik terus saya mutusin buat tonton itu legenda dari itu biru laut sudah dapat episode terus buka twite mau cari spoileran lah nyata drama tayang indosiar jam malam sial mana sudah mulai tanggal kemarin
estlrsty,jam jam mie bersliweran dasar
estlrsty,amin
estlrsty,bagus sekali
estlrsty,mau
estlrsty,tangan yang jilat saja ada amplas kalau yang jilat mukamana cleo napas napas bau neraka
estlrsty,tidak apa apa semua awal gagal
estlrsty,tangis warna tidak keluar besok cari yang warna terang deh
estlrsty,cakep sekali tuhan mau
estlrsty,ancam dagang jari kaki lima bubar
estlrsty,malas sekali kalau punya pacar yang kerja ngancem tiap hari
estlrsty,beda hai minta dibayarin sama dibayarin
estlrsty,bngun bngun pergi masa depan
estlrsty,saya suka bli sana soal saya dipangilnya saudara wanita sama aa nya
estlrsty,batagor e enak
estlrsty,rindu batagor depan indomart stpn
estlrsty,pukul kepiting pakai kayu semua cara tidak apa apa jika ain t dapat anda
estlrsty,sumpah bukan saya yang kirim dingetin skripsi si tidak buat tekan sih buat saya cuma kadang ngingetinya waktu tidak tidak
estlrsty,lihat begini malah saya tidak tarik lebih tarik kalau isi macam macam buah begitu
estlrsty,kucing tipu daya setan
estlrsty,marathon baca kos keren sekali parah
estlrsty,cri sember
estlrsty,anime bagus sih akhir kesal
estlrsty,mnangis dalam diam
estlrsty,hai
estlrsty,sial cleo cerewet sekali sampai bangunin tidur padahal saya sudah saudara wanita tidur normal
estlrsty,bagus sekali
estlrsty,saya sudah stasiun saya tinggal dulu saya sudah sampai kacau sudah si bahasa cuma itu saja
estlrsty,ada foto dompet
estlrsty,gadoyan
estlrsty,oleng mksih
estlrsty,saya tidak akan tidur ini sampai pagi
estlrsty,tidak lupa cemil putri salju yang gula halus bedak bayi
estlrsty,bagaimana saya jadi calon istri idam kalau cari ujung selotip nastar saja saya hampir serah
estlrsty,ibu dek ken jajal nastar e lembut tidak saya nastar e lembut kenapa lembut pantat bayi ibu moh emoh nenek dipadake pantat bayi tuhan acak sekali
estlrsty,jail sekali nyanyi acak lebaran sebentar thr turun ibu langsung cari dompet memberi uang langsung hahahahahahah luph anda ibu ayah
estlrsty,selamat lbaran saudara laki
estlrsty,mal aidzin wal faidzin mohon maaf lahir batin
estlrsty,tuhan pena triak triak bangunin sahur
estlrsty,pusing tapi seru
estlrsty,isi ketupat malah jadi teringat ibu
estlrsty,selamat lbaran
estlrsty,tidak satu cara harfiah tidak satu saya ibu beli pisang mentah dicantelin dinding buat pajang doang tidak cemil tidak lebaran saya
estlrsty,sering khilaf paling akhir sesal bentar
estlrsty,gadis mna
estlrsty,softboi
estlrsty,pakai sofel saja
estlrsty,lev utama shopee lihat lihat ken lihat harga masuk keranjang tutup shopy jadi keranjang sudah tawa
estlrsty,sayang checkoutin dong
estlrsty,nang keren sekali
estlrsty,gila sekali sial
estlrsty,tunggu txtdrhndro
estlrsty,otak otaku yang colot wajan rasa kalah sama takjil txtdrberseragam
estlrsty,tidak ada apa apa si ya memang enak
estlrsty,sebla enak
estlrsty,jimbon dibotakin mau daptar jadi taruna
estlrsty,uang thrku bom turun saya harus minta kaprodi
estlrsty,baik bapak terimakasih
estlrsty,salam wr wb selamat siang maaf mengangu waktu sebentar est lras kelas biasa fisio minta uang thr bapak besar ribu untuk beli seblak terimakasih atas waktu wasalamualaikum wr wb
estlrsty,ken sekali jam tidur normal
estlrsty,kaguya sama cinta adalah perang musim makin seru saja sayang bom selesai
estlrsty,yang model begini sih cocok jadi polisi tidur saja
estlrsty,tawa
estlrsty,iya utama nyaring seperti buat tiktok bila perlu
estlrsty,iya biadab
estlrsty,mohon peta apa tunggu pria ngegame kan lebih baik kerja skripsi
estlrsty,juga
estlrsty,tuhan ibu revisi mbok sya mau kerja ibu
estlrsty,harusna berger pakai nasi ah anda bgimna sih
estlrsty,nyonya nasi gmw tahu
estlrsty,mkn nasi cepat agar tidak lmes
estlrsty,kenapa ya orang yang buka puasa tidak pakai nasi
estlrsty,nyuekin obrol taruna saya masup neraka
estlrsty,tawa kudanil
