username,tweet
ucciiill,ayo utama ih tolong saya juga rindu sekali format obrol gadis
ucciiill,kaum andry muka mirip semua
ucciiill,anda saja dimana tong
ucciiill,ayoayoayo bnran
ucciiill,ayo utama
ucciiill,baru tahu
ucciiill,apa
ucciiill,hai kira daren
ucciiill,tawa aduh
ucciiill,bumper agung kali iboek indah kalau saya perjuanganya sampai jari gulung saja cukup
ucciiill,apa si kenapa anda jadi rusak didik sekali deh sudah sama isi tua tua utbk juga gajelas apa lagi
ucciiill,tawa tawa semangat ijah
ucciiill,pikir mna smpat buat klamer kburu habis klamer saya yang jadi baru satu lingkar cahaya dosen ortho kenapa anda diam sja hnya suruh akun tidak bimbing bagaimana saya buat anda kira saya amal suruh nebak nebak aduh seperti ceue saja anda ah nyusahin
ucciiill,setuju sekali byarnya lebih murah lagi tidak jt
ucciiill,kita pantaw
ucciiill,maaf saya sudzhon
ucciiill,curiga si bibel tidak bisa buat klamer mangkanya gadikasih contoh video
ucciiill,mau tonton langsung tidak jadi
ucciiill,lagu korea benar enak cuman tidak paham bahasa jadi kalau dinyanyin cmb nganguk nganguk doang
ucciiill,ayo
ucciiill,mak saya sudah suntuk sekali lihat saya rumah malah suruh pergi
ucciiill,percuma sja blajar smlam suntuk
ucciiill,bljr smbil nang nang apa si lebay sekali tapi ingin nang saja h paham tidak si aneh gadis mau apa si gajelas bingung juga
ucciiill,pusing sekali nyutnyutan karena haid mau bljr uji juga tidak bisa hwah seperti habis pukul orang drama sekali si dtgbulan
ucciiill,buat benang dong
ucciiill,kerja ortho video tangan iboek saja kalau yah
ucciiill,tidak mau kuliah online semester depan huah kacau sekali jadwal
ucciiill,hahahahahahahaha
ucciiill,tidak mksdnya bisa begitu ngmng singkat padat jelas tiba tiba jam tawa ngelawak
ucciiill,tiap haid sakit pinggang sampai punggung lebay sekali tapi bnrn skt sekali np seperti gin si aneh
ucciiill,akhir bulan juli sudah idul adha
ucciiill,safari
ucciiill,kalau sama blok belah sudah suruh buat surat pk materai
ucciiill,buset saya kerja admin h
ucciiill,kbnykn ngmng juga deh
ucciiill,buat tmnya juga kalau orgnya sudah kasi tahu tapi ngeyel sudah diemin saja tidak terlalu ikut campur yang penting kan sudah kasih tahu kalau gabaik kalau tetap mau jalanin itu hak juga tidak larang larang sampai ngerusak teman kalian
ucciiill,karena gamungkin si kalau teman dekat mau jatohin anda begitu mksdnya dia memberi tahu karena tidak mau anda kenapa karena orang suka bodoh kalau lagi celaka cinta
ucciiill,nasihat teman buat pilih pasang itu sumpah teman dekat bukan teman lewat karena sama saja seperti nasihat dari orang tua si mnrt saya jadi tidak disepelein langsung tutup kuping juga si apa yang teman kalian omongin
ucciiill,ingin lihat corona tangsel tapi tidak pernah dia masuk mana si peta jakarta tidak peta tangerang juga tidak
ucciiill,jelek sekali tidak syp ih
ucciiill,selamat uji ortho kawan ingat habis uji buat klamer
ucciiill,lah iya deh rhinoplastynya vina gracia bagus sekali tawa
ucciiill,parah sekali dil suka lihat anda derita ortho
ucciiill,tawa
ucciiill,sumpah kadang kesal sudah sama orang tanya terus sudah jawab diread tidak dih kan saya sudah luang waktu buat jawab tanya anda yang sudah uras waktu saya bagaimana si tahu begitu tidak usah saya jawab saja
ucciiill,orgorg kenapa kalau ngechat tengah malam sampai pagi si kan saya sudah bobok np klian tidur pagi semuankan saya jdnya kalau pagi gpnya teman obrol
ucciiill,hahahahahahahahahaha kenapa ras
ucciiill,apa lagi monyong kelas jam pagi saudara sekali agar kayak sampai sama negri
ucciiill,nyebelin sekali ortho sumpah konser cuman kahot praktikum prosto cuman video saja tidak ujianpraktikum prosto terus nti ortho habis uji buat klamer kan krng ajar
ucciiill,ayo baik tidak usah ajar
ucciiill,tidak suasana hati sekali bljr uprak ortho
ucciiill,bahahahahahaha
ucciiill,ini kemenkes apa sekali si buat kesal saja dulu astaga enek sekali liatnye
ucciiill,martin juga karena kerjain tugas
ucciiill,belum ketemu tmntmn bulan maret keren tidak saya
ucciiill,dari jam meja br slesai jam latih sabar sekali tuhan sampai nang lebay sekali karena mau uji begini terus belum edit video terus gila karena kerja sendiri pusing pusing kampus ada temenya hahahihi bantu juga
ucciiill,literasi
ucciiill,kemarin snapgram orang blackpink smwa sekarang gigi smwa wkekekekwkwje
ucciiill,ambyar
ucciiill,tawa sekali ih sama yang masuk yang umur saya
ucciiill,kalau langsung mati si tidak apa apa ini mau mati nyusahin yang
ucciiill,tidak keluar dulu ayo kalau tidak penting masa naik terus mau sampai kapan
ucciiill,tidak lupa syukur yang coas sama ketrampilan laboratorium lebih berat coba tawa
ucciiill,sabtumingu kuliah h ingin rebah
ucciiill,baru regio tidak snank dulu
ucciiill,kenapa saya tidak dichat
ucciiill,ingin pempek lulu tapi habis terus
ucciiill,suka tkt gpnya pasien karena saya blon praktikum
ucciiill,kenapa pada libur bulan
ucciiill,tahajud
ucciiill,ini semester paling tidak hahahihinya sama sekali
ucciiill,kyknya cuman alasan saja deh alas utama karena memang blon saja itu orang tidak bisa saing pdb
ucciiill,tawa sekali reyhan tidak mau masuk negri karena umur teman tmnya pada tua tua
ucciiill,padahal itu sp ort kerja pasien tidak ngitung sna snb
ucciiill,retweet
ucciiill,cinta tidak kenal jarak
ucciiill,tapi syukur sekali juga tidak dapat dokter ivi syukur apa bagaimana nasib coba
ucciiill,benci sekali kuliah online utama praktikum untuk saya yang bodoh praktikum jadi harus sama teman dulu belum video belum jalan teman teman belum tgs tgs makalah pt tgs video praktikum ngeditnya butuh waktu huah keluh hanya maaf tapi lelah bnrn
ucciiill,ngantuk kenapa harus kelas hrsnya jam pulang kampus
ucciiill,smgt fdl smster tinggal minggu
ucciiill,ini saya beli casetify karena cipeng memang benci sekali sudah racun kalau tidak cipeng dinda musnah saja sudah anda
ucciiill,bertemu lah
ucciiill,memang pria paham ukur bh kadang saya saja bingung
ucciiill,seperti lebih lelah kuliah online soal tiba tiba jadi banyak tugas terus jam kuliah gajelas kalau biasa kan tugas cuman makalah saja sama pt tiba tiba video lah itu huf
ucciiill,unsubsribe saja mangkanya apa sih langgan tidak dinaikin juga nilai apa sama
ucciiill,tidur saja deh selamat tinggal
ucciiill,pikir sdih juga
ucciiill,hai yang suka ngeline saya mnta makalah tapi tidak saya minta tidak balas masih saya pntau anda
ucciiill,setuju aplg teman yang suka ngmng saya pasang behel anda gratis ih mnding saya blok saja jadi teman
ucciiill,ydeh fdlhm juga agar sneng
ucciiill,gaenak ih micteams riweuh
ucciiill,fadil jaidi humoris sekali
ucciiill,tebok gaenak
ucciiill,akademis jalan jalan hanya si
ucciiill,sudah ngetik pk tawa tapi saja diangep mrh sama orang jadi yang slah syp
ucciiill,semua salah corona pokok
ucciiill,npa kumat lagi tawa lagi menstruasi anda
ucciiill,tawa
ucciiill,kenapa bisa orgorg ingin sp ort
ucciiill,garis ilangin baca baca dong argh
ucciiill,senop sekbil np jauh sekali sudah anjg lelah saya
ucciiill,np tgsnya tiba tiba numpuk
ucciiill,saya memberi tugas dokter sian gaung terus milen tanya gaung tugas terus kasih sama gaung tugas saya terus milen kasih adin terus adin memberi saya jadi putar saja sampai kiamat
ucciiill,mau cerita humoris tidak
ucciiill,aduh agung agung
ucciiill,gemas
ucciiill,tidak kesal si cuman seru saja baca berita tawa orgorg pada aneh
ucciiill,memang tidak penuh salah warga si gangerti juga perintah buka cfd itu buat apa
ucciiill,pikir mana sempat keburu yang positif pikir mana sempat
ucciiill,ny r eh
ucciiill,benar
ucciiill,cerita wanya
ucciiill,ini si ibu akademis libur pantas saja ini jadwal tidak jelas trnyata lagi libur
ucciiill,pada tahu tidak si kalau misal sudah positif corona walaupun sudah sembuh itu paru paru tidak akan sempurna seperti belum kena alias tapi saja jadi cacat umur hidup
ucciiill,dapat pesan dari dokter fauziah ktnya inisiatif sendiri jaga sehat kalau tidak mau tidak apa apa pilih sndiri kalau mw cpt mati juga
ucciiill,pmerintahnya mau ngurangin populasi wrga yang bodoh agar ngurangin beban ekonomi
ucciiill,seru sudah mendengarkan cerita orang yang hasil kabur korut
ucciiill,semoga sehat sudah anda iya yang cfdan
ucciiill,nyusahin saja
ucciiill,aneh aneh saja orang buat berita kiamat
ucciiill,kiamat sudah revisi dari jumat jadi minggu
ucciiill,banyak orang aneh gjls
ucciiill,total ikut
ucciiill,seru za
ucciiill,tapi gadis pikir
ucciiill,mungkin karena marah pacar folw saya
ucciiill,kenapa ya orang ngefolow duluan terus sudah ikut kembali henti ikuti agar apa padahal itu teman juga begitu bukan strangers terus juga pertama makin aneh saja orgorg
ucciiill,saya mwnya sama agunk hwehehweh
ucciiill,maw sanpachi
ucciiill,kera anda sampai mau jakarta
ucciiill,kenapa ibu kalau suruh mandi selalu ngmng anak perempuan gablh mndi siang siang dengan bahasa jwanya terus kalau pria begitu apsih aneh mitos orang jwa jijik
ucciiill,ibu ibu
ucciiill,tawa sempat sempetnya libur keluar kota lagi seperti gin
ucciiill,tidak syok
ucciiill,kemarin peringkat sekarang makin naik ini peringkat saya lihat lihat
ucciiill,muslim bnrn tidak boleh tidak si kenapa saya suka cemil swike sama ibu ktnya tidak apa apa
ucciiill,prihatin lah saya sama lawa anda peng
ucciiill,saya sih cemil sndiri
ucciiill,ngumpulin niat buat solat sama mandi kenapa susah sekali sudah pakai mukena sudah wudhu tapi tapi saja duduk dulu utama telepon sampai jam tidak sholat sholat sampai batal wudhunya
ucciiill,iri bilang bos
ucciiill,iya yang tinggi
ucciiill,kira bulan bulan rumah muka saya akan cahaya gtaunya kenapa tmbh hancur
ucciiill,tawa
ucciiill,saya suka ingin tahu model gigi yang kasih itu gigi syp yang cetak malu
ucciiill,ih kenapa sudah pada libur
ucciiill,hidup saya banyak copas
ucciiill,saya bangga kenapa jadi pendek ilovemyself
ucciiill,ingin kidzania blh tidak si bongin saja saudara wanita begitu thn percaya kn saya kn pndek
ucciiill,iya corona tidak akan selesai tapi kan akan vaksinya sabar dulu
ucciiill,tawa kn misi tgsnya tiba tiba numpuk
ucciiill,menikah saja lah anda
ucciiill,ingin tonton lany lagi
ucciiill,saya seperti deh ksi
ucciiill,anda bisa diam saja tidak
ucciiill,iya deh edukasi deh
ucciiill,gaji anda sini saya potong kelas saja suka ngaret ngaret senak udel jam lah jam tidak sekali tidak tahajud hai maemunah
ucciiill,kasi ih jauh jauh ambil parsel buat tmnya terus bela bain ikut kelas juga tapi malah potong nilai otak kamo mana ih tidak potong juga kali nilai
ucciiill,teman teman saya yang kena saya yang kesal sekali sudah
ucciiill,besok saja deh lelah tenaga habis marah besar hari
ucciiill,hahahahahaha
ucciiill,cermin cermin nyala itu dinding
ucciiill,teman saya panik kesi
ucciiill,kasihan ketinggalan berita
ucciiill,aduh lagi rekor hanya uang jajan sama jam pcran saya kan jadi kurang muluk
ucciiill,tidak apa apa kali saja dari yang utama twitter
ucciiill,sudah mrh mrhnya saya tidur dulu
ucciiill,ntu yang univ bagus dunia saja gapentingin tidak hadir sama sekali ini kenapa heboh minta harga jadi kayak gila hormat yaudahlah sudah umur juga kalau tidak ikut kuliah kan mahasiswa sendiri yang rugi bayar tapi gadapet ilmu lonya juga tetap dapat gaji kan kenapa sewot sekali mrh mrh pakai nada tinggi
ucciiill,siapa si yang videoin
ucciiill,saja usaha mati an buat tetap rumah kalian malah tidak sosial jarak meanwhile hahahihi tolong dosen keliru pecat saja jadi dokter gigi kerja marah marah suruh sosial jarak tapi malah dempet dempet
ucciiill,sebarin dong agar viral
ucciiill,jujur drtd sih saya tonton lahir lama ikgm dzikir mudah mudah nama saya tidak dipangil maya saja yang diopik jawab tanya dokter lucas hih diam bukan arti merhatin dokter ibu tonton iya tidak tahu kan anda
ucciiill,bnr bnr ini ikgm dari jam sampai tengah dgrin saya salah orgorg hadeu baik sekarang anda tobat wahai dosen dosen ikgm
ucciiill,aduh untung fdl tadi tidak keopik
ucciiill,itu mendengarkan peng otak anda tidak selaras sama congor anda kayak ica
ucciiill,sudah diam dia kemarin mungkin khilaf butuh libur
ucciiill,ter dulu lapar mantengin ikgm cemil dulu
ucciiill,lingkar cahaya yang tunggu saya mrh mrh tidak
ucciiill,tidak mau ah butuh viewers nt makin banyak adsnya
ucciiill,tidak mau
ucciiill,iya kecewa semua nt saya buat saja deh provider ucilhome
ucciiill,ganti provider
ucciiill,tawa kenapa ya orang yakin sekali sampai ngmng tidak pernah putus salah sekali kalau pikir akan putus sudah seperti status facebook anak sampai
ucciiill,kan situ duluan yang suka maki maki
ucciiill,memberi referensi ngasal apa bagaimana si sering sekali materi tidak buku referensi nt kalau isi salah ngomel
ucciiill,saudara wanita karena kasus corona dunia sudah turun grafik wlpun indonesia z begitu deh tahu sendiri
ucciiill,terus kalau saya suka ngepost gaung yang jawab chatnya aneh bagaimana begitu itu mksd saya buat humoris humoris saja karena saya juga baru temu orang yang seperti begitu tapi malah pada bilang gaung tidak ngehargain saya padahal saya rasa biasa saja digituin tapi malah kalian yang ngomel ngomel sudah lah tidak apa apa kacamata orang beda
ucciiill,saya bawel yaudh henti ikuti saja xixixi
ucciiill,pria tidak saya ampun kalau selingkuh mental fisik penyalahgunaan kalau pria sudah ngelakuin itu mrnt saya susah ngobatinya baik mundur deh takut saya kenapa
ucciiill,sekarang sudah malas sekali cerita orang orang bagaimana hubung saya saya baik baik saja kalau masalah saya pendem sendiri saya selesain karena percuma ujung ujung teman saya cuman suruh putus cuman buat saya panik tidak nyelesain masalah
ucciiill,saya syukur sekali karena tidak pernah rasa posisi nama juga manusia kurang lebih tidak bisa mau hidup sama orang yang tidak ada kekuranganya kekuranganya masih saya tutupin tidak
ucciiill,dulu lelah dgrin orang yang suka ngmng seperti begitu tapi lama lama sudah lah tidak paham posisi saya bagaimana kadang saya sedih mendengarkan cerita teman saya yang diselingkuhin sama cowonya padahal hubung obrol jauh lebih baik saya teman dicubitin sampai biru tidak marah
ucciiill,kalau memang niat selingkuh mau posesifin bagaimana pasti saja celah kata kata yang diblg umat itu benar dia juga pernah cemburu sama teman pria saya karena belum tahu saja kalau memang teman akhir juga sudah saya tapi utama sama itu pria
ucciiill,kalau memberi tahu juga baik baik buat saya pikir bukan yang mrh mrh mencak mencak dibebasin utama sama teman pria serah mana saja juga tidak apa apa asal benar teman saja juga tahu mana batas teman sama pacar
ucciiill,saat orgorg ngmng gajelas gaung kenapa aneh sih pacar seperti begitu gasayang cil saya malah syukur bgtbgtbgt punya pacar seperti begitu tidak pernah drama pernah itu sepele lah kalau saya marahin juga selalu iya iya saja tidak pernah balik marah
ucciiill,yayayayayaya whatever
ucciiill,rambut jedar keren juga sudah
