username,tweet
ibnubons,saya pernah nawarin belum sempat realisme tangis
ibnubons,lah salahe apa jal
ibnubons,pindang serani cinta
ibnubons,wah sudah podo mangkal jebule
ibnubons,parsel oke sudah mantap sekali bapak tawa
ibnubons,eh enak betul bapak sabu paling enak se babakan tawa
ibnubons,belum jelas sih kalau suruh sebut tante vera dia bilang tidak tidak tidak
ibnubons,masya tuhan ukh
ibnubons,kirim saja kesini non
ibnubons,obrol sama rara sekar pagi paman hidung rusak apa bagaimana nduk hidung rusak paman tidak nafas anda sakit iya paman hidung rusak
ibnubons,kadang suka kalau ingin buka obrol lama kenapa senyum senyum sendiri yak
ibnubons,sudah tahu sakit saja sering ingin tahu dasar dasar laut
ibnubons,teringat tulis informatif tadi siang cuci motor mobil tutup sedang buka
ibnubons,naik tamiya
ibnubons,tua
ibnubons,sama dong agar semua lekas baik
ibnubons,pikir
ibnubons,kata siapa
ibnubons,butuh buat sebuah kasih sayang ibu
ibnubons,jadi satu satu resep yang susah tidak duplikat
ibnubons,tumis kangkung buat ibu memang paling da terbaik
ibnubons,ken sekali yogyakarta akhir bulan lalu sedih tidak lagi ketemu semua teman syukur teman dekat yang tetap sana jadi selalu alas ke yogyakarta
ibnubons,rindu sekali
ibnubons,cari yang lagi wid tawa
ibnubons,alergi udara dingin kambung untung tidak parah tempo hari
ibnubons,iya
ibnubons,masya tuhan umate gus panji
ibnubons,calo ada hil tidak temu temu ini cari gadis turki lah
ibnubons,keren saudara wanita
ibnubons,mohon peta mau daftar jadi penghulu kalau tidak saksi menikah saja minat
ibnubons,kua sudah buka ini daftar ayo
ibnubons,suka cocokologi tam kali tidak cocok humoris tawa
ibnubons,lebih manis kalau pakai kacamata
ibnubons,senenanya belah mana saudara wanita
ibnubons,tarik saudara laki
ibnubons,loh
ibnubons,cinta milik
ibnubons,anda salah satu
ibnubons,walaupun tidak kenal patah hati ada sekali
ibnubons,lah iya ayo tidak sadar nenek ono gunung es e
ibnubons,maaf kalah koda ketimbang kepiting udang cumi cumi
ibnubons,jadi kapan acaranare ningdi
ibnubons,kalau masalah hati memang widya mahir
ibnubons,terowongan buat apa bapak
ibnubons,tidak jauh jauh sebentar susah putar balik
ibnubons,rumah tidak prediksi akan apa suruh apa suruh jagain ponakan dulu
ibnubons,makanya saya tidak masuk seminar dadit ian septian nyata karena telat terus ba
ibnubons,kalau sudah kiri begitu masul tidak
ibnubons,rindu terlalu berat dil saja
ibnubons,karena tidak utama game porsi utama sosmednya lebih banyak jadi suka ingin tahu komentar sama akun orang
ibnubons,kalau sial sial oke kalau sudah kebun binatang kayalnya sudah tidak asih sih tawa
ibnubons,baik seperti begitu pada kayak panggil saudara saudara eh malah modus pendekatan
ibnubons,sial benar
ibnubons,rindu tidak sih
ibnubons,gibah duniawi mesti ini apa ngomongke jodoh
ibnubons,sinyal jelek kan susah buat modus
ibnubons,udan deras puol admin
ibnubons,saya ke bogor kalian terima
ibnubons,ken ikut
ibnubons,dospem sekaligus rektor terbaeq pokok
ibnubons,tiket mahal sekali soal lewat jalan tikus
ibnubons,wah ini suzon saya itu
ibnubons,sama euy
ibnubons,sih pagi pagi bahasa sudah apa fungsi hara tanam
ibnubons,eh ngupas kulit telur sih
ibnubons,presentase nyeplok telur hari buruk panjang jaran ceplok
ibnubons,ibarat tunggu bansos kita orang seperti jadi tidak dapat bantu kami mahasiswa tingkat akhir yang mudik
ibnubons,tawa sa saja ini surat
ibnubons,sa saja ini
ibnubons,kalau buat beli cendol dapat segimana bapak
ibnubons,in lam takun alaya ghodlobun fala ubali
ibnubons,nah fizi sudah minta maaf ya sekarang
ibnubons,berapa kali ambil ini
ibnubons,berita bagus
ibnubons,lupa nama
ibnubons,baru pergi pasar jepara telah bulan pulang bogor biasa ibu seminggu kali pasar
ibnubons,pikir seperti kisah orang
ibnubons,uwuwuw
ibnubons,uwuwuw
ibnubons,hibernasi tik
ibnubons,urange larang lek
ibnubons,warung sudah yang buka
ibnubons,masya tuhan
ibnubons,mirip jari jemarine juga
ibnubons,bantu dekor buat ultang tahun ponakan
ibnubons,dita karang uwuwuw
ibnubons,mirip ra
ibnubons,kenapa tambah semoga lekas baik
ibnubons,sa saja anda admin
ibnubons,banyak talas
ibnubons,jepara hadir
ibnubons,memang utama mana itu taperwer
ibnubons,jual pohon serut streblus asper ukur cuma besar kelas kontes utama lokasi jepara jateng per bonsai duaniawi
ibnubons,amin rab
ibnubons,semoga lekas baik
ibnubons,lebaran hari per bonsai duaniawi krapyak
ibnubons,lupa kalau hari senin
ibnubons,banyak gadis cantik saudara sendiri
ibnubons,keren
ibnubons,jiwa mahasiswa ronta ronta
ibnubons,saudara teman kerabat handai taul
ibnubons,cantik sekali
ibnubons,terima jagal ayam bebek dsm
ibnubons,saya kayak kena alergi udara deh saya tidak nafas tidak kena alergi udara
ibnubons,amin rabal alamin
ibnubons,berkat oey
ibnubons,biasa alergi biasa saja kali warbiasah gatelnya sampai bentol bentol
ibnubons,tidak mudik rum
ibnubons,tanya anak sudah berapa saudara wanita bagaimana jal
ibnubons,sengaknya ingin ketemu sekali tahun
ibnubons,tadi guru lukman memberi sen saudara laki titip sen kalau tidak lupa tetap baca qur an tiap selesai sholat fardu
ibnubons,akan rindu sama suasana sih ngobrol santai
ibnubons,syukur tugas selesai tinggal tunggu lebaran
ibnubons,rapat qaqak
ibnubons,lucu
ibnubons,sial lebih enak dengar biadab
ibnubons,puasa hai
ibnubons,selamat ulang tahun
ibnubons,tidak ingin ketemu saya rach
ibnubons,tidur malemnya jam tidur pagi jam tuhan
ibnubons,macam cinta wanita masih jomblo begitu bang
ibnubons,syukur zero kasus corona saat semoga jepara selalu aman damai
ibnubons,wah nyata yang dulu janjin buat komitmen nunda nunda hanya eh malah balik sama manta
ibnubons,baru mau tidur eh sudah bunyi bangunin sahur keliling
ibnubons,hari akhir minggu
ibnubons,hiyaks
ibnubons,dulu jadi semangat jaga diri baik baik
ibnubons,nontonin perahu parkir saja sudah saudara wanita pantai prawean
ibnubons,resep baru nich
ibnubons,es gabus
ibnubons,aduh
ibnubons,insting buaya memang hebat
ibnubons,kepedean
ibnubons,pitik patuk potek
ibnubons,bening sekali kayak gelas es buah
ibnubons,hayo siapa yang tadi lupa qunut tidak witir
ibnubons,tanggal padhang bulan bulane bunder ser ser lagu raja didi kempot yang legenda
ibnubons,tuhan tawa
ibnubons,kan kelai jalan ninjamu ver
ibnubons,saya takut kena buat viz
ibnubons,dospemku baik baik kenapa cuma saya saja yang terlalu
ibnubons,nah hati hati loh ver
ibnubons,biasa teman dekat ngajakin cemil kepiting bareng sahabat yang dekat sahabat sebuah kepiting dustin tifany
ibnubons,gila gila psyco
ibnubons,kamera elek gus tawa
ibnubons,inalilahi wainailaihi rojiun sugeng tindak raja didi kempot selalu kenang karya karya
ibnubons,enak soale ra asli solo punya ya tidak serkng tawa
ibnubons,astaga rindu tenan saya
ibnubons,bagaimana kabar
ibnubons,sudah tidak jual kayak e viz syedih unch
ibnubons,rindu tongseng leuwiliang
ibnubons,bunuh saja viz
ibnubons,tumben ngantuk
ibnubons,lingkar cahaya firda
ibnubons,harus laron sik
ibnubons,kim jadi hyun saya cinta
ibnubons,nyiram bonsai kebun bib
ibnubons,saya rindu saudara laki tunas
ibnubons,batu bata hitam
ibnubons,drama lee minho bagus
ibnubons,mimpi ketemu anda
ibnubons,masya tuhan calon sudah sih saudara wanita tidak tahu mana dan sama siapa
ibnubons,ada sesal yang anda sesal wah apa tadz menikah muda bangun keluarga ampun tadz anda kenapa benar sekali sih
ibnubons,kemarin habis dicengin sama guru lukman agama harus landas ilmu yang baik agar tidak kesasar iya guru sesal dulu tidak madrasah ngajinya tidak benar buat formalitas saja sesal sekali tadz
ibnubons,amin tuhan cari calo dulu baru bangun keluarga
ibnubons,walaupun kecil kecil bacan qur an anak guru lukman sudah lumayan bagus
ibnubons,tidak ramadhan seperti gin keluarga tadarus masjid ust lukman sama anak pertama bagi laki laki istri anak beliau bagi perempuan
ibnubons,ken punya keluarga kayak keluarga guru lukman
ibnubons,punya sudah updatr baru tetap tidak admin bagaimana
ibnubons,saya tungale
ibnubons,turut bedan tidak qur an mobile mushaf qur an tadz sebuah biasa c eh coba lihat kalau huruf dhumah terus koma baca panjang gila shilah baik tadz dalam hati baru tahu saya kalau begitu baca
ibnubons,tadi nyemak nyimak pakai telepon maaf iya tadz ambil wudlu kan syukur tadz oke coba sini lihat qur an mobilenya silah tadz
ibnubons,saudara laki bacan tajwid apa maaf lupa nama tadz tahu cara baca oke lanjut
ibnubons,mohon maph apa
ibnubons,bingung mau buka pakai lauk apa eh bapak lek malah nganterin begini suwun sanget lek
ibnubons,tidak gin topang
ibnubons,benar sekali sudah kalau ibu
ibnubons,astaga saya
ibnubons,ayo batal untuk
ibnubons,tonton drama korea apa ra
ibnubons,tidak debat tidak obat
ibnubons,wah nenek ini asli tidak debat
ibnubons,tidak debat
ibnubons,maaf ver saya bukan sepupu
ibnubons,buka cerewet paruh jiwa
ibnubons,gin maksud viz
ibnubons,iya po aremanita tawa
ibnubons,revolusioner
ibnubons,kurang pupuk sama banyak gulma
ibnubons,ketawain dosa tidak sih
ibnubons,wah malas pantun viz baru bangun tawa
ibnubons,pagi pagi mendengarkan lagu yogyakartanya kla proyek kan jadi dudidudidam jadi
ibnubons,masak viz masak air
ibnubons,mungkin gladi resik bangunin orang sahur
ibnubons,astaga saya tobat saya hijrah kembali kaum kuota
ibnubons,ah dasar irit sama
