username,tweet
silvialucyana,kalau sengol di bacok tapi tawa
silvialucyana,lancar tugas akhir
silvialucyana,sekali tawa
silvialucyana,calo nyusul
silvialucyana,surat izin pinang
silvialucyana,kuyla tawa
silvialucyana,tawa sama
silvialucyana,tawa sudah telat bang
silvialucyana,saya awat
silvialucyana,bolu bambank
silvialucyana,cepat sembuh saudara laki semangat terus
silvialucyana,beli
silvialucyana,halah saya mau utama game ganggu blok syalalalalalalala
silvialucyana,baik jalan sama saya maz eh tidak jadi corona syalalalala
silvialucyana,makin hari saya dengar makin ramai saja orang orang seliwer lewat depan rumah hello positif sudah loh pdpnya sudah an loh odpnya sudah tidak usah tanya banyak saya bosan rumah kali bisa mungkin tinggal saja rumah kalau tidak penting gausa keluar lah
silvialucyana,balada penguna tsel tidak bisa tonton netflix nordvpn
silvialucyana,nescafe klasik
silvialucyana,sudah gausa temenan ya
silvialucyana,humoris saja yang suruh tidak begadang malah jadi begadang
silvialucyana,tidak anda sesat gaul buruk rusa bias baik
silvialucyana,episode lebih taik ada masalah apa si sama yang buat film bisa brutal sih film
silvialucyana,greget sekali saudara haha coba saja tonton
silvialucyana,iya benar tawa lebih parah daripada kdrama yang judul vip tentang pelakor haha
silvialucyana,episode nya sebuah dunia dari meni pasang mobil jadi tren tema saya diri untuk anda matahari wo
silvialucyana,sedang langsung baru sampai episode sudah uras emosi jiwa badan
silvialucyana,sebuah dunia dari meni pasang deh tawa
silvialucyana,korea saudara itu dunia dari meni pasang judul
silvialucyana,benar benar tonton teikut tekan
silvialucyana,orang batak tidak bisa hubung
silvialucyana,kenapa si saya baca co co
silvialucyana,bagi hidup kristus mati untung
silvialucyana,cepat sembut talha semangat
silvialucyana,spa itu
silvialucyana,rumah hijau kenang
silvialucyana,benar sekali tawa tiap cemil nasi padang bawan ken tidur peluk eh eh kasur kenapa
silvialucyana,lama tahan tumpah juga kan akhir
silvialucyana,disini comes santa paws santa s rumah
silvialucyana,putusin rawat seluruh tubuh dari atas bawah bukti anda lagi senang tanpa dia agar sesal tidak mau saya kalau perlu jadi gundik bapak agar mati
silvialucyana,iya bagus ris kesal kesal bagaimana begitu
silvialucyana,apa kabar plaza mulia pikir
silvialucyana,sungguh bangga dari anda
silvialucyana,masa depan tawa
silvialucyana,anda ibu memang mau ketemu pikir
silvialucyana,kan yang gendut perut yah masa pap perut kan
silvialucyana,anda tidak seperti paman paman mesum minta pap begitu dong
silvialucyana,saat baju sangat sesak kemudian robek paksa masuk akhir beli baju baju yang robek tuhan badan melar sekali sekarang
silvialucyana,baik anda apa kabar
silvialucyana,apa saya
silvialucyana,sumpah benar sekali
silvialucyana,charlieangel beku okok lebah tampan segera kerja
silvialucyana,sial lama saya tidak pernah pikir pakai
silvialucyana,mau ngepet jay sebentar saya jaga lilin sudah
silvialucyana,jiwa begadang
silvialucyana,bagai tim kunyah es batu saya tolak
silvialucyana,baru mau tonton horas amang kenapa sudah tidak di bioskop sedih
silvialucyana,mirip anda beforenya tidak si
silvialucyana,mau apa memang
silvialucyana,saya juga mau begitu josh jadi sahabat ayo gaena hati ini
silvialucyana,friendzone detected
silvialucyana,nama online saudara wanita jual banyak toko banyak barang banyak ada yang luput dari sortir bagai beli harus pintar kalau temu yang aneh aneh keluh pihak shopee gercep kenapa langsung tindak kayak kasus
silvialucyana,viral tahu pihak shopee otomatis toko langsung hapus shopee kan tidak boleh jual di shopee pihak shopee langsung ambil alih
silvialucyana,sudah delete sama shopenya saudara wanita
silvialucyana,dari tentu tidak jadi dengan semua orang makes anda comfortable dan senang
silvialucyana,jatah yang antivaks buat saya saja bagaimana mau
silvialucyana,kisah cinta orang gin kisah goa kenapa jomplang sekali ya
silvialucyana,palsu senyum palsu tertawa
silvialucyana,tawa anda geli saya gedek
silvialucyana,baru pertama masuk igd
silvialucyana,nang ini saya
silvialucyana,lukas anda dengar saya saya kata kasih musuh buat baik kepada orang benci anda
silvialucyana,beda pakai air zam zam riz lebih subur
silvialucyana,sirem air riz
silvialucyana,jelas maz anda biadab
silvialucyana,yang video undang bukan sih kena juga saya
silvialucyana,suka sekali
silvialucyana,begini
silvialucyana,toh yang tunggu tunggu
silvialucyana,asa saya benar saja malam saya tolak jobnya buruk hari pernah
silvialucyana,tidak tidak haski benci ciken dia ate mereka nom nom
silvialucyana,saya hilang itu old dari anda
silvialucyana,tunggu updatenya
silvialucyana,ah memang dari dulu memang tbx saat teman yang keluh tidak jelas kapan menikah jodoh tidak dulu ada teman yang pikir kebahagian tidak dar pelamin
silvialucyana,sebentar ada yang kain
silvialucyana,pikir tanda ini
silvialucyana,sakit juga abai seperti anda tidak penting anda tidak asik
silvialucyana,tidak boleh tidak tidak
silvialucyana,maju anda pawang
silvialucyana,tawa habis sumbang bekas tusukanya rembes
silvialucyana,mungkin diam terlalu lelah keluh rumah sakit umum aduh syahranie samarinda
silvialucyana,suka ambung lalu hempas
silvialucyana,apa cuma goa yang mobil pindah video gatahan dengar teriakanya
silvialucyana,coba minum vc saya
silvialucyana,tidak baca kenapa saya
silvialucyana,mobil motherlode
silvialucyana,samarinda
silvialucyana,loso selo
silvialucyana,kalau sudah lelah mudah sekali murung pft
silvialucyana,aduh bang kalau pria yang bilang begitu bagaimana
silvialucyana,tragedi darah
silvialucyana,semangat anda
silvialucyana,mau marah marah
silvialucyana,benci saya baca mobil h
silvialucyana,saya punya teman yang mengangap saya bagai teman memangilku teman
silvialucyana,homan
silvialucyana,kalau mau murah pakai botol isi air hangat saja saudara
silvialucyana,calon ibu yang baiq
silvialucyana,samarinda kaltim saudara laki
silvialucyana,bantu retweet paman
silvialucyana,selamat tinggal selamat tinggal yogyakarta
silvialucyana,bantu retweet ci
silvialucyana,baru beli sekali kenapa gitar tidak lecet lecet gratis tas
silvialucyana,tangis iya bantu bagi josh ketemen teman yang
silvialucyana,bantu bagi kali saja yang mau beli gitar jual gitar canwod mulus suara aman nyaman tuner nyala preamp aman harga nego tipis baru beberapa kali pakai jual lagi butuh uang
silvialucyana,humoris sekali si
silvialucyana,tidak cancik memang kenapa haha jadi santey seperti pantey omong omong saya sudah rindu anda loh
silvialucyana,kunci
silvialucyana,akun akun pribadi tawa kesal saja lihat
silvialucyana,sepik sepik
silvialucyana,saya benci anda
silvialucyana,pakai sendal gunung saya pakai sendal gunu ng apa s salah
silvialucyana,tawa sumpah baru sekali lihat tweet ya dong bukan arti beda harus musuh musuh kan
silvialucyana,jadi ingat dulu inap tidak lagi puasa ibu goa yang bangunin buat sahur dong padahal tidak yang puasa rumah
silvialucyana,goa baca tapi goa minus tinggi silinder juga
silvialucyana,mau dong
silvialucyana,kerjain dong sayang omong omong minta woc ibs dong
silvialucyana,ai yang minggu lalu minggu belum sentuh dong
silvialucyana,ayo betimpasan saja qta
silvialucyana,saya rajin kerja tgh malam sampai subuh qaqa
silvialucyana,hiya hiya hiya
silvialucyana,asal saja sudah beda virus beda penularanya juga beda elah percuma bicara sama anda
silvialucyana,bajing malah flu sudah percuma ngeladenin anda tawa
silvialucyana,iya saudara wanita cari saja banyak kenapa jurnal internasional itu kalau saudara wanita paham sih pakai bahasa ingris soal eh tapi mbanya tidak mungkin tidak paham kan bukan orang indonesia yang bodoh
silvialucyana,saudara wanita agar rada pintar tidak browsing mesum hanya saudara wanita browsing gin sekali kali
silvialucyana,tawa ingin tahu ish balik sini
silvialucyana,sekarang si danar kayak tawa wariman malu terus si dika bicara nah kena kan anda buat benang
silvialucyana,saudara wanita saya itu twitter penuh ribut
silvialucyana,jadi amazeing
silvialucyana,saya bangun tidak tahu sama sekali kalau tadi hujan lumayan deras rasa jadi koala sekarang
silvialucyana,kapan main kelereng
silvialucyana,semua
silvialucyana,senang hati bila istri samarinda konvensi aula
silvialucyana,saya hanya sebuah teman untuk anda
silvialucyana,iya ini tidak yang memberi coklat tangis tawa ikha sekali kode begitu yah
silvialucyana,buka instagram isi tg val hari semua jadi ingat tidak sampai dengan ramai memberi cokelat
silvialucyana,sumpah goa juga pernah gin karena pulang libur tidak langsung pulang rumah
silvialucyana,sekarang saya posesif agar tidak kata anda terlalu baik buat saya
silvialucyana,pikir itu
silvialucyana,selalu
silvialucyana,gaperlu deh minta bantu termehek mehek kata putus buat cari info kasih para gadis saja sudah sama mata mata campur detektif
silvialucyana,pernah rasa memang
silvialucyana,senyum manis
silvialucyana,tapi saja ngegas
silvialucyana,penting tapi ramah omong omong kenapa ngegas
silvialucyana,gws untuk milik anda bayi saudara sabar yang penting dnya sehat
silvialucyana,saya senyum padahal
silvialucyana,kejut jadi kambing saudara laki
silvialucyana,kenapa setia lwk setia ngebulynya
silvialucyana,anda tidak begitu
silvialucyana,kesal sama yang ish
silvialucyana,gih bayarin rawat kulit saya buat atas saya tidak lupa suntik putih sama vitamin kulit saya yang anda pikir awat murah mudah guguk
silvialucyana,terkadang retwetan twitter adalah buah kode yang andal pek
silvialucyana,ohlala apw
silvialucyana,iya agar mbamba yang jomblo sini tahu promosi iya
silvialucyana,kode ini
silvialucyana,saudara laki kan taken rasa jomblo tawa tawa tawa
silvialucyana,saudara laki tidak mau duluan begitu
silvialucyana,gembira christmas bang
silvialucyana,gembira christmas semua orang
silvialucyana,sayang santa saya sudah sungguh baik di jadi sungguh nakal does itu hitung
silvialucyana,coba saja tawa
silvialucyana,jalan tengah hujan dengar musik coba kapai hujan buat senang
silvialucyana,hidup diskriminasi mati mungkin pancasila harus edit jadi tuhan esa kata toleransi yang beda agama nyata omong kosong
silvialucyana,tawa saya ajar saudara pegawai ruang rumah sakit na rapi hemat tempat
silvialucyana,buat ikuti muehehehe
silvialucyana,pikir abad mungkin
silvialucyana,oi
silvialucyana,hobi sembunyi saya feelings
silvialucyana,tidak tidur begitu bang tawa
silvialucyana,sudah tidak usah
silvialucyana,tidak ikut kembali tidak mau pesan langsung tidak bisa
silvialucyana,model ini tawa
silvialucyana,ngeri sekali
silvialucyana,daftar cpns keperawatanya ada di s ners lulus saudara awat saya daftar formasi saudara terima kasih
silvialucyana,sudah played oleh anda dan asa hurts
silvialucyana,jadi senang ayo nikmat itu game
silvialucyana,hello december sungguh hilang anda
silvialucyana,suluh sehat rokok hebat saya hanayola wilmar sampai lain di panti asuh ruhama pic
silvialucyana,terimakasih asing alienku duo macan saya nafa syahri sampai lain di anima espresso bar dan dapur pic
