username,tweet
destychaniaa,bagaimana untung saya saya
destychaniaa,bukan wid saya syok volume nya kencang sekali
destychaniaa,apa wid tawa
destychaniaa,sudah hasil tidur cepat biasa terus lupa tidak matin data ada notif muncul syok bukan utama sekarang jadi segar sekali alias tidak bisa tidur
destychaniaa,sending virtual peluk buat deam
destychaniaa,tidak begitu konsep
destychaniaa,tidak kenapa apa lebih lelah kenapa apa
destychaniaa,cocok didengerin pakai earphone sore sore kena angin sepoi sepoi
destychaniaa,ketemu mimpi saudara wanita khan main
destychaniaa,suara sejuk sekali seperti ubin masjid
destychaniaa,gajauh beda sifat
destychaniaa,senang ulang tahun palul pikiranya sangat bersih harap anda semua itu terbaik oleng
destychaniaa,tahun sekarang
destychaniaa,benar kata saudara adam orang
destychaniaa,saya ke koriyah
destychaniaa,asik sepeda balu
destychaniaa,bawa motor pelan pelan terus pakai earphone enak
destychaniaa,campur aduk feelings
destychaniaa,baik sekali ken peluk
destychaniaa,oma
destychaniaa,teh
destychaniaa,strawberry bubblegum
destychaniaa,tidak paham bahasa kenapa sedih sekali
destychaniaa,kena t sembunyi saya akan tunjuk anda
destychaniaa,terimakasih pi
destychaniaa,bagaimana dong tawa
destychaniaa,gimanasi cara agar tidur cepat
destychaniaa,rendang
destychaniaa,kebahagian sedih semua rasa tanggung jawab masing masing
destychaniaa,sengaknya saya jadi ajar tidak rasa sendiri kalau buat baik tidak usah ngarepin timbal balik apa tetap baik sama siapa sebar bahagia saja sudah cukup sayang
destychaniaa,emon baik anda menemani saya tonton yovie sampai nuno sama konser exo wkwkwkwkwkwkwkwkw aminin dulu saja kan
destychaniaa,tonton drama korea tidak bisa begitu dua episode saja
destychaniaa,ija
destychaniaa,ada tiba tiba video panggil paman paman
destychaniaa,tidur
destychaniaa,saya baik tidur saja tidak apa apa
destychaniaa,kenapa gerah sekali
destychaniaa,pernah bahas di henti ip
destychaniaa,saya tonton preman pensiun sobat
destychaniaa,sepatu adinda ada gambar daun singkong tiga
destychaniaa,kelinci sama ikan humoris saja
destychaniaa,ken sekali deh libur
destychaniaa,pangilan
destychaniaa,tunggu sumbangsih ikan guppy nya
destychaniaa,boros sekali idupnya heran
destychaniaa,memang sudah paling creepy kalau lawa ego manusia
destychaniaa,tengorokan itu ya suka tiba tiba begitu kan tidak aman saya keluar rumah kalau batuk batuk gin
destychaniaa,itu sial curah hati untuk danus
destychaniaa,jadi sudah cemil apa malam
destychaniaa,gin lapar tengah malam
destychaniaa,amin semoga sama
destychaniaa,mit syukur tawa
destychaniaa,tawa tidak mit ekspresi nya tak nilai sekali
destychaniaa,ingat saya akan
destychaniaa,jadi gaenak ini
destychaniaa,kalau cara sulit harus mudah
destychaniaa,nyata orang ingat detail saya keren sih
destychaniaa,betul
destychaniaa,tk kuliah selalu jarak dekat sama rumah jadi tiap hari pulang kalau kerja harus tinggal sendiri begitu bagaimana
destychaniaa,joget tipikal nya eon
destychaniaa,ayo beli
destychaniaa,ayo ayo
destychaniaa,kayak dikit tapi itu banyak sekali kerikil
destychaniaa,nontonin cerita nya saja degdegan kacau
destychaniaa,ketawa nya tular tawa
destychaniaa,bagaimana ini komentar cinta pisang
destychaniaa,kacau sih sudah tahu parnoan malah tonton buat makin parno tidur kursi ruang tamu kan jadi
destychaniaa,tunggu saya lulus dulu terus kerja sebentar baru lamar
destychaniaa,nang
destychaniaa,eci
destychaniaa,saudara laki nya saya anda dong
destychaniaa,kata saudara laki tugas akhir penting isi otak sama hati nya oke
destychaniaa,sudah ah lelah
destychaniaa,jadi lebih enak nang sendiri motor apa bonceng li
destychaniaa,bahagia kan tanggung jawab masing masing lebih bahagia kalau jadi alasan
destychaniaa,tawa kesal
destychaniaa,danus
destychaniaa,malas puol
destychaniaa,ayo ci
destychaniaa,bagaimana wid sudah siap
destychaniaa,metode kuantitatif teh
destychaniaa,anda sih ngambil data primer jadi susah kan skripsi nya bajing dude saya sudah dengan anda pergi untuk neraka
destychaniaa,bodoh sekali camping gabawa tidur tas
destychaniaa,maaf saudara laki salah orang seperti
destychaniaa,pantau
destychaniaa,seperti tidak ada deh benar benar kuat ngadepin masalah hidup bisa dilakuin cuma tahan saja waktu tiba
destychaniaa,terus apa anda lakuin sumpah tawa sekali wkwkwkwkwkwk
destychaniaa,bani boong dosa sial tawa
destychaniaa,lupa kalau semua rasa tanggung jawab masing masing ayo tidur dulu besok coba
destychaniaa,baca peta saya ketawa
destychaniaa,panas panas panas
destychaniaa,serius deh tiap cerita sama orang selalu gembira sama cerita itu rasa tak nilai sekali di least natap mata saja rasa nyaman sekali pasti betah buat ngobrol lama lama
destychaniaa,baru tonton parasit bengong sendiri
destychaniaa,kurang tahu rik coba hubung dulu cs nya
destychaniaa,mie goreng pakai rawit dihancurin begitu terus tambah telur ceplok enak kali
destychaniaa,ibu suka jadi luvly
destychaniaa,terimakasih anda
destychaniaa,karet nya agar spesial
destychaniaa,kalau bareng sama lingkung tepat semua masalah itu rasa ringan sekali
destychaniaa,sama saja jarak
destychaniaa,nyata kira dekat nyata tidak dekat
destychaniaa,tencu saya akan
destychaniaa,terimakasih anda seyeng sayang
destychaniaa,apresiasi
destychaniaa,ketawa kesal sekali
destychaniaa,kenapasih saya itu tidak pernah periksa apa apa langsung tempat selalu saja tidak sudah sampai rumah
destychaniaa,napas humoris sekali
destychaniaa,rasa itu seperti mau ledak tidak boleh
destychaniaa,lelah tahu tawa
destychaniaa,saudara wanita ini lihat cinta cintan gin
destychaniaa,iya tawa
destychaniaa,baik sekali kasih mimpi indah cemas tidak karuan bangun bangun bawa senang nya
destychaniaa,tidak apa apa tidak apa apa
destychaniaa,semua punya porsi sedih masing masing semoga tidak jadi lupa tetap kuat
destychaniaa,sudah sekarang istirahat dulu besok bangun
destychaniaa,mei hadir
destychaniaa,tawa tidak dong
destychaniaa,tidur cemil jajan nyiram tanam online pikir lebih
destychaniaa,gemas sekali anak kecil
destychaniaa,semoga beri layak
destychaniaa,itu dunia dari sebuah meni pasang
destychaniaa,tidak mau komunikasin waktu yang sama kita ken dingertin
destychaniaa,ribut sama pikir sendiri padahal banyak penting lebih layak buat dipikirin dilakuin
destychaniaa,mau begitu ya bagaimana ehe
destychaniaa,tawa
destychaniaa,episode saja sudah kesal tapi tidak apa apa ayo lanjutin tawa
destychaniaa,menikah rumit ya
destychaniaa,orang kenapasih humoris sekali
destychaniaa,saya catat sama kai ya li sekali
destychaniaa,maksud anda mau gofod in saya kan
destychaniaa,mon tidak mirip serius
destychaniaa,ya kalau saya ulang tahun tempat sampah mie sadab kardus
destychaniaa,pedas mcd api wings richese cocol saus keju nya terus hazelnut cokelat susu teh chatime sudah lah saya mati
destychaniaa,saya beli mie sadab
destychaniaa,iyap benar benar tidak mau tidak bisa bayangin tinggal sama orang kita sayang li
destychaniaa,hebat apa nyiapin buat ngadepin pergi tidak tiba waktu tetap saja hancur
destychaniaa,jadi bakteri kesal tidak ada salah jadi manusia beril tidak ada salah kalau pilih hidup cari uang semua punya hak buat nentuin hidup jadi jenis untuk semua orang tolong
destychaniaa,coba untuk jadi jenis untuk semua orang tapi sakit diri sendiri jadi keras
destychaniaa,tuhan
destychaniaa,tidak boleh egois tetap baik
destychaniaa,semangat dong
destychaniaa,dan sebuah kecil heran
destychaniaa,senang ya kalau masak terus masakanya enak tawa
destychaniaa,hwapy ulang tahun
destychaniaa,lha gegabah
destychaniaa,tidak usah bang malah pusing
destychaniaa,tawa kesal
destychaniaa,rapot
destychaniaa,saya kirim tidak rekening nya whatsapp bang
destychaniaa,cantik colin
destychaniaa,saldo boros tidak ada saldo menangys
destychaniaa,sungkem ndoro tawa
destychaniaa,lingkar cahaya teman
destychaniaa,mau sungkem sama orang orang hasil buat dalgona kopi saya baru menit sudah nyerah gel cuy
destychaniaa,saya
destychaniaa,tawa sial
destychaniaa,semua changes jadi kuat
destychaniaa,yamplop lempar dong uang
destychaniaa,tawa lah memang iya ini ih bentar bentar
destychaniaa,digiding digiding ding ding
destychaniaa,lelah ehe
destychaniaa,gratis ongkir shopee musuh paling nyata saldo saya banking saya
destychaniaa,saya mau keliling bandung tolong corona cepat pergi
destychaniaa,tawa tidak mau jawab
destychaniaa,tawa sudah tunggu dulu beom
destychaniaa,mau menikah saja begitu gas terus dengan senang hati pernah sudah
destychaniaa,coba otak otak
destychaniaa,benar sekali
destychaniaa,saya rindu lote pasar
destychaniaa,pi tawa
destychaniaa,saya mei alias ulang tahun hari buruh pasti tanggal merah jadi tidak bisa ger seperti orang akan kasih heran seko
destychaniaa,kalau tidak pentas ibu tidak gin monmap
destychaniaa,fajar baik kenapa tawa jadi saya sayang unch
destychaniaa,mute blok isn t salah saya punya kontrol over apa saya ingin untuk lihat
destychaniaa,anda baik tidak
destychaniaa,pakai metode apa paman
destychaniaa,tidak tahu deh saya sayang sekali sama orang orang baik
destychaniaa,ah benar paman
destychaniaa,orang kalau ngechat terus gilir balas malah hilang itu benar masalah apa sih hidup
destychaniaa,ngilangin acne scars buat pusing tengah mati
destychaniaa,lingkar cahaya salam
destychaniaa,tidak boleh botol peluk dulu
destychaniaa,manipulasi bagaimana kan saya usul paman
