username,tweet
keiziasyf,sungguh siapa hurts dia beside yang siapa adalah dat gal
keiziasyf,berapa orang adalah tidak siap untuk realitas mereka ingin peri tales drama hanya
keiziasyf,his vlive alir selalu sebuah komedi hahahahahah
keiziasyf,dia ucap henti mimpi btch haha
keiziasyf,thx bcoz dari anda saya bisa tonton his vlive dan dia hanya made saya hari uh
keiziasyf,june tell kita untuk stan dia lebih keras haha
keiziasyf,uni saya saya tunggu untuk sebuah minggu kenapa jadi panjang omong omong bisa anda nyanyi satu dari ikon opa lagu
keiziasyf,kenapa saya cara jadi seperti kenapa saya punya untuk minta maaf kenapa vlive meskipun ketika saya sudah did songchelin benda tawa ini adalah oke ini adalah sungguh oke
keiziasyf,iya tuhan bluerose adalah saya favorit
keiziasyf,ini adalah kenapa saya cinta gojunhoe tawa
keiziasyf,ibu
keiziasyf,sudah seperti saudara laki nasi goreng siap jual wakakak
keiziasyf,harap kirim bisa clear hanbin s name juga asap
keiziasyf,iya tuhan kenapa saya saya jadi gugup tolong akhir ini mimpi buruk saya emis hsh untuk once
keiziasyf,tawa saya dengen percaya diri nya pilih kali baru terus wakakak padahal nemnya lebih tinggi
keiziasyf,wajar kenapa in saya bahkan ngabisin bungkus tawa
keiziasyf,baca baca
keiziasyf,bukan seperti awat staf rumah sakit jiwa begitu
keiziasyf,iya kalau negri kalau swasta ibu tinggal bayar tawa
keiziasyf,iya kalau nurut taruh
keiziasyf,rambut sama makeupnya yang salah bukit utama alis itu tidak sesuai tawa
keiziasyf,maju ikon lebih baik daripada hanya celebrate mereka prestasi
keiziasyf,walking untuk anda hours itu hanya juga banyak juneya eventho saya saya akan pergi everywhere dengan anda
keiziasyf,hai anda adalah jadi manis untuk replying ini panjang untuk milik anda gemar saya pikir saya punya untuk jadi an ikonic pernah
keiziasyf,terimakasih hanbin
keiziasyf,tapi saya tidak bisa baca baca korea tangis
keiziasyf,semoga thn depan tidak usah pusingin juni ya admin soal hanbin sudah balik ikon amin
keiziasyf,tidak butuh untuk minta maaf kimdongdong
keiziasyf,bisa anda ambil ikon dengan anda
keiziasyf,ini adalah oke anda bisa main dengan internasional ikonic disini
keiziasyf,anda lupa itu selamat tinggal jalan ini adalah saya favorit
keiziasyf,tapi dia bisa jadi bangdeng dia abur itu
keiziasyf,bangdeng adalah sebuah gadis isnt dia
keiziasyf,ayo doa
keiziasyf,kim nayoung harap dan harap
keiziasyf,mariage tidak dating
keiziasyf,kenapa saya tidak paham
keiziasyf,iya taruh mianhae karena nyebar berita palsu tawa
keiziasyf,gwenchana kanghaneul adalah his dekat teman meskipun
keiziasyf,benar ini adalah sungguh keras untuk chose
keiziasyf,semua yang utama nyanyi sungguh kenapa tidak bisa saya bisa anda jadi mualaf saya ll beri semua untuk anda
keiziasyf,suhyun did itu juga
keiziasyf,tawa benar sekali
keiziasyf,anda sudah masuk apa bagaimana taruh
keiziasyf,sudah sebuah panjang waktu saya dapat hanbin hadap clearly
keiziasyf,hotel del luna
keiziasyf,itu spanduk idontunderstand
keiziasyf,tawa saya kira sudah
keiziasyf,pov pov apa omong omong buka anda tidak suka gadis cantik tawa
keiziasyf,spoiler sudah taruh
keiziasyf,ah jadi imut kenapa dia terlihat jadi senang singing ini lyrics
keiziasyf,lalu itu staf harus jadi kimbab gemar haha
keiziasyf,siapa adalah itu satu itu ask untuk his solo album staf kimbab gemar
keiziasyf,iya kan saya jatuh kepala over tumit ketika dia went untuk penuh arti bros saya sudah jadi marah di myself seperti kenapa saya hanya temu dia sekarang dia adalah cara harfiah saya etik
keiziasyf,makna apa
keiziasyf,iya kan cinta anda juseyo tawa
keiziasyf,realy dimana
keiziasyf,tapi untuk jadi realistis ini adalah akan jadi keras untuk lain anggota untuk lepas mereka milik sendiri solo album jika mereka tinggal in yang
keiziasyf,tinggal yang masih dengan ikon dan tell hanbin untuk comeback dan ayo lepas every anggota solo album satu oleh satu
keiziasyf,anda kan bahasa jepang manfatin lah haha
keiziasyf,iri
keiziasyf,saya sih bosan tonton rsud daftar putar seperti ide sutradara turun haha
keiziasyf,iya kan bagus padahal rsud daftar putar
keiziasyf,made saya hari
keiziasyf,saya saya senang itu anda adalah tidak an ikonic jadi di sana isn t racun orang in ini fandom periode
keiziasyf,selamat ulang tahun in wyatb lancar puasa semoga tonton konser bareng
keiziasyf,setuju sama tante ini anak memang harus ruqyah
keiziasyf,koh bayar berapa sih sama kapal api
keiziasyf,tawa amin
keiziasyf,saya tidak hadir taruh tawa
keiziasyf,adalah dia an malaikat jadi cantik
keiziasyf,benam matahari tidak di jakarta saja koh
keiziasyf,wanjeon
keiziasyf,senang untuk anda
keiziasyf,ey andwae kan drama tawa
keiziasyf,sedih
keiziasyf,lucu
keiziasyf,akhir sudah itu masalah uh
keiziasyf,tidak sama saya
keiziasyf,aigo
keiziasyf,atleast saya ll dapat hanbin foto tawa
keiziasyf,sedih bagaimana ini koh
keiziasyf,tara sekali yah mianhae tawa
keiziasyf,untung saya sudah tonton menang malu masa saya tunggu thn buat tonton lagi
keiziasyf,spoiler dong bukit tawa tonton saja
keiziasyf,sedih dikit tipe tipe seperti gila kecil sesuatu called cinta begitu
keiziasyf,taiwan kita times anda tonton bukit
keiziasyf,hanbin loves hiking sama
keiziasyf,kejut saengil chukae untuk milik anda saudara laki
keiziasyf,saya envy dengan bangdeng sama saya tidak pernah pikir saya saya akan envy dengan such sebuah anjing
keiziasyf,mereka adalah jadi panas
keiziasyf,anda di malang nad pukpuk staysafe nad
keiziasyf,garis
keiziasyf,kejut omong omong saya cinta milik anda baru rambut
keiziasyf,saya suka warna biru taruh tawa
keiziasyf,tidak bisa semua masuk fangirling tawa
keiziasyf,tidak apa apa menang saya masih masa kenapa
keiziasyf,menang anda gila gila sama hari sekali tawa
keiziasyf,koh nanti saja kalau corona sudah bubar agar tidak undur batal sama kalau sekali konser
keiziasyf,putri hours pria martabat bijaksana penjara yang lain haeyoung balas
keiziasyf,pulang menang
keiziasyf,wakakakak iya mungkin sudah koas saja belum selesai
keiziasyf,tunggu june ciawe
keiziasyf,ikon songs untuk dapat untuk tahu saya bebas selamat tinggal jalan sempurna tidak agar saya tahu semua cinta anda ah iya
keiziasyf,saya makin pasang bicara volume paling besar sampai anda henti ngetok tawa
keiziasyf,bagaimana kalau anda belah saya taruh tawa
keiziasyf,ini adalah akan jadi sempurna tawa
keiziasyf,koh ikon kapan fixnya tidak mau habis tiket tidak mau asal beli
keiziasyf,baik sekali tahu darimana
keiziasyf,festival apa
keiziasyf,ini adalah hanbin anda adalah tidak sendiri
keiziasyf,juseyo
keiziasyf,juga banyak informasi
keiziasyf,felnya beda sekali tidak sih
keiziasyf,sudah hari senin es yang mau tonton anak koas yang jadwal gajelas tawa bau bau tidak jadi
keiziasyf,nangung tidak sekali tawa
keiziasyf,andwae
keiziasyf,apa
keiziasyf,hanbin balik ot jebal
keiziasyf,sebuah lihat anda lagi
keiziasyf,rambut kuda sini saja cuma anes yang nyala panggil jakarta malah tinggal
keiziasyf,kalau bareng bareng waktu jadi panjang
keiziasyf,saya jadi menteri sehat jamal hapus semua nyala panggil mimpi
keiziasyf,jamal perdana sendokiran pakai acara hujan deras
keiziasyf,tahu masa set sudah mulai nyanyi lagi
keiziasyf,ikut kurang iu nya
keiziasyf,june adalah jadi senang bcoz dari anda thx
keiziasyf,uri uni
keiziasyf,tawa untuk saya masa depan pacar tolong kena t dapat cemburu coz anda baca akan lihat saya seperti ini untuk milik anda seluruh hidup
keiziasyf,ciri orang sepi kos
keiziasyf,ofc tidak
keiziasyf,ayo jadi senang dengan ini
keiziasyf,saya sini
keiziasyf,mau ne tidak
keiziasyf,mau
keiziasyf,wah lampung minta bom
keiziasyf,itu semangat taruh tawa
keiziasyf,humoris anda taruh
keiziasyf,kerja tugas mg pertama itu malesnya minta ampun
keiziasyf,daebak saya sudah sini tawa
keiziasyf,tidak usah dipikirin dipikirin lama lama tidak akan ubah apa lelah
keiziasyf,tiket iu kapan jual koh
keiziasyf,jamal jamal oh saya lelah agar saya tidur duhai igd icu
keiziasyf,periksa pesan langsung
keiziasyf,lihat anda sangat sangat segera juneya
keiziasyf,jakarta bagus
keiziasyf,agar orang tahu orang paling rese dunia juga punya hati
keiziasyf,kalau memang sudah tidak suka mana nikmat
keiziasyf,cowonya kirmizi situ superduper manis
keiziasyf,suka dari drama saya sampai luar biasa tidak sangka saya nona wakakak
keiziasyf,yang paling enak apa
keiziasyf,siapa sih apa yang enak lagu
keiziasyf,di least saya ingin untuk temu baik orang tolong
keiziasyf,uni tolong terjemah june s nonas pos juga malu
keiziasyf,iu in jakarta tolong
keiziasyf,peluk peluk
keiziasyf,tadi saya mau nawarin bikinin visum satu satu lumayan tambah tambah kasus
keiziasyf,pedih gel takut tenaga sudah kuras habis
keiziasyf,rscm rawa bong jam naik ojek saja sudah rekor sekali sih tambah pertama kali dilemparin gas air mata sama polisi tengah demo
keiziasyf,masih demo boleh bubar bentar tidak saya mau pulang sudah mau jam saya atas ojek loh
keiziasyf,lebay
keiziasyf,suasana hati
keiziasyf,dia adalah jadi aneh tawa saya cinta dia
keiziasyf,situ oke bilang kontak yang hubung minta tidak
keiziasyf,thx
keiziasyf,situ tidak mau titip dong tangis
keiziasyf,bagaimana cara upgrade admin
keiziasyf,saya juga
keiziasyf,tanggal nya kan fanmet jepang koh kenapa
keiziasyf,tahu darimana lagu saudara
keiziasyf,saya
keiziasyf,kenapa sih taruh tangis
keiziasyf,kapan anda jakarta rindu goa sama anda tawa
keiziasyf,bisa saya ask apa cara
keiziasyf,mungkin karena tempat sudut tugas akhir
keiziasyf,tugas akhir baru buka tidak ngantri sama sekali
keiziasyf,tidak apa apa akhir selamanya
keiziasyf,yang hibur ikon untuk tinggal yang hibur tanda itu mohon via
keiziasyf,jadi mau menikah tugas akhir taruh tawa
keiziasyf,kesal
keiziasyf,beri mereka sebuah senang akhir dan khusus episode juseyo
keiziasyf,lucu bisa dia jadi ranjau
keiziasyf,saudara ngira seperti begitu memang sudah lihat nyerah sama hanbin coba lihat bagaimana laku ot dulu
keiziasyf,turut mungkin keluar bareng yang tidak neraka sama kenapa kalau masalah tampil televisi korea begitu paling susah comeback saja karena kurang modal
keiziasyf,yang hibur hanbin shouldnt punya untuk tinggal ikon tandatangani petisi via
keiziasyf,pantas saja natrep nya sepi tawa
keiziasyf,hari ke natrep mau ketemu baekhyun exo saudara wanita nya putar anpaman bts
