username,tweet
strybycy,acu ibu maung
strybycy,benar sih tawa
strybycy,gapenting si cuma mau saat saja agar ter tidak tahu kapan kalau lihat lihat twitter ingat iya goa pernah anak bodoh ngetwit begini hehehehe bhay
strybycy,terus mainin lagu sheila tidak lama nyokapnya datang turun motor lsg nyamperin eh lala lama sekali tidak kesini goa bengong lah malu degdegan kicep campur aduk saya ketemu kafe nya iya bos teman saya tiba tiba ajak kesitu terus saya gakepikiran nyokapnya saja
strybycy,tadi malam ketemu sama si saudara laki yang kenal sama sheilaon dulu awal pertama kali tonton sama pacar maksud entah berapa lama gaketemu tapi ibu saudara laki sering kirim kue malu eh temu terus tidak tahu kenapa itu anak seperti sengaja lsg ambil gitar
strybycy,goa sudah makin tidak paham sama maksud setuju buat atur hukum negara seperti sudah ayo bubar saja buat negara sendiri
strybycy,mashok
strybycy,mungkin kepala saudara laki nya lebih keras aspal jalan makanya santai kalau jatuh tidak akan pecah kalau tidak keras aspal mentok cadanganya apa bagaimana gapaham sudah
strybycy,asli tadi sekali lagi jalan yang super ramai tapi jalananya tidak terlalu besar lalu lihat orang pacar pakai sepeda samping begitu ngobrol saya gapake pikir lsg klakson sampai teriak bahaya saudara laki jala satu garis saja cewenya tidak akan mana mana peta emosi
strybycy,bagaimana cara padahal lubuk hati yang paling saya itu ken sekali olahraga sampai seperti sudah ken sekali tapi sebentar paginye bangun doang goler goler tidak olahraga
strybycy,terlalu bodoh diri tahan berat jutan rindu
strybycy,kejut kejut kejut
strybycy,semoga ter tidak goa sudah punya anak sudah tidak ini orang dakwah tapi modelanya begini
strybycy,saya terima sumbang bentuk apa deh tidak apa apa iya tuhan
strybycy,mau bwat beli seblak enak hujan hujan
strybycy,iya tuhan begini orang kenapa neraka neraka ya
strybycy,koh lex saya tidak pernah menang giveaway
strybycy,bismillah ayo kali saja kalau pakai bicara asli saya dapat pacar hehehehe amin dong
strybycy,iya ampun saudara kenapa
strybycy,sial apa
strybycy,hadir
strybycy,saya benar haru sekali sampai bengong ngeliatin gedung gedung walaupun goa tiap stroling jakarta memang selalu bengong spechles kalau lihat gedung tinggi tapi beda cuy rasa gila gaperna pikir kalau akan begini sungguh
strybycy,malam minggu kemarin senayan pergi rumah jam malam jujur syok sekali nyata serame kejut akhir putar hai langsung pulang karena panik keparnoan saya mengebu gebu
strybycy,kemarin benar benar nyanyi serah baim mau mirip siapa mirip siapa itu saya tetap cinta
strybycy,tawa sama energi
strybycy,memang tanjung sudah punya teman seperti teman teman goa saudara mau gaditemenin tapi teman goa pada doang
strybycy,puji orang orang tanya cuy mana habis obrol seperti cuma baca bar notifikasi doang alis buset diread tidak
strybycy,asli
strybycy,benar benar kumpul niat buat olahraga tapi saya tiap hari tidur subuh hanya kan susa
strybycy,sudah lama gakeluar rumah paling kalau ketemu teman juga rumah doang tadi keluar kesudirman bawah lihat ruang baca kejut jiwa tidak aman saya langsung gejolak niat hati foto tapi malah lsg pulang
strybycy,pikir bagaimana bagaimana
strybycy,may bagaimana perkembanganya
strybycy,yah salah ketik mau minta kado tadi
strybycy,iyani syukur malu
strybycy,terimakasih banyak
strybycy,terimakasih banyak
strybycy,jail lagi dong sekali buat kalau saya
strybycy,takut sekali si yang solat tidak kesini dikit kalau angin kencang bagaimana
strybycy,boleh dong bang hitung hitung kado hehehehe
strybycy,boleh dong qaqa
strybycy,setuju detik detik tahun saya tidak exited malah takut sampai mellow habis
strybycy,hai tawa yaiyasi memang iri saja benar
strybycy,mohon peta begitu habis kena gusur apa bagaimana
strybycy,pantas obrol goa bom balas bikon benang oke
strybycy,hancur moveon tahun saya cuma karena
strybycy,cinta anda
strybycy,saya kan tidak punya ibu
strybycy,ngeliatain kue dekorasi lalu hasrat mengebu gebu melakukanya padahal tahu diri tidak mampu bidang cuci mulut
strybycy,rindu
strybycy,cahaya sekali monmap pakai efek susu two apa bagaimana
strybycy,teman yang sudah gila butuh asupan aslik tawa hanya iya tuhan mika
strybycy,yah mabuk sudah
strybycy,habis ngarsipin foto foto instagram saja orang yang nyadar terus jail tanya anda dilema foto didelete semua padahal benar tidak biasa saja seperti memang
strybycy,yogyakarta naik gunung semua festival musik yang batal bandung sumedang dar ikut kopi gila sudah bulan tidak kopi sana
strybycy,saudara laki tata uwouwo jiwa jiwa jaman saya budak cinta dikta gejolak
strybycy,si amatir yang bosan doa saya bisa buat muka layak masuk frame teman teman saudara umar tidak tahu username nya maaf tawa
strybycy,gadizinin pergi keluar
strybycy,untuk janah
strybycy,ayo
strybycy,monmap bapak bagaimana maksud
strybycy,syopi
strybycy,apa sih saudara wanita
strybycy,rindu sekali paham tidak si
strybycy,jadi ken cerita banyak ingat malam jumat sampai saya rumah cuma berduan saja sama saudara seperti bukan waktu tepat ini saja sudah parno sekali malu maaf
strybycy,lagi kata sepupu goa punya teman baca ghoib utama datang rumah tapi lagi pusing begitu mabuk karena tidak datang naik alphard pacar baru pertama kali naik mobil mahal kata jadi kalah saya sama setan jujur
strybycy,belum berapa sih banyak sekali hal syok tiba tiba ponakan sepupu yang jiwa lagi mana tahu nyeteluk ringan benar eh teman saya pakai baju kuning belakang anda tapi anda takut kalau lihat belakang goa dinding coi
strybycy,yang pikir canda tidak teman teman tawa benar para paman goa memang akrab sekali sudah sama mahkluk sudah biasa sih benar begini cuma dengar bawa bawa gas saya mau ketawa peta
strybycy,kemarin goa syok omong saudara ibu anda tahu duduk samping nene saya mana posisi baru balik saudara laki motor digituin langsung mobil bengong memang luar biasa keluarga
strybycy,terus tidak lama anak umur tahun bicara ayah poci yah eh ayah jawab santai sekali seperti tidak punya dosa tidak apa apa numpang lewat doang baik
strybycy,baru saja paman saya bilang lala tahu tidak tadi kan nyebut tetangga yang baru mati lewat bawa bawa gas tahu la benci sekali dengernya mau ketawa takut omong omong memang dulu tetangaku suka beli gas warung samping rumah
strybycy,tidak dong teman teman
strybycy,hai kenapa ngeunfol sih ih saya gapaham tahu saudara anda kan tahu saya gaptek omong omong sudah saya folbek lagi teman teman cinta anda
strybycy,gin hadiah ulang tahun goa
strybycy,bapak
strybycy,tidak paham sudah saya kan primitif tawa cuma seperti saja seminggu sekali orang yang coba masuk akun saya begitu saudara
strybycy,ini teman goa chatting sama temenya gosip goa hanya parah bahas hanya goa begitu padahal temenya banyak tapi anda anda bel iya anda pikir apas tidak bilang begitu saya dengernya saja seperti h apas gapenting
strybycy,kata gaenak kan misal orang yang suka tidak chatting malah bahas orang yang suka bayangin tidak si jadi orang yang bahas bagaimana jujur gaena cui
strybycy,tawa tidak saya syok kenapa anda baru ikut sudah
strybycy,gin gin bela jus anda itu iya ter minum tidak tidak sekarang minum cepetan ter tidak anda abisin bagaimana coi jus nya apa baik campur minum rada curiga
strybycy,bulan lalu renov rumah sampai tidak lebaran gin planing saudara laki goa sudah pindah kesini eh gagal semua tunda tidak apa apa semoga ada waktu paling baik amin
strybycy,pelangiy
strybycy,tahun solat rumah saja padahal depam rumah masjid tidak ziarah ibu biasa ngumpul sepupu rumah eyang tapi eyang nya sakit jadi itu sepupu s putus gausa ngumpul takut berisik walaupun eyang super sudah masak banyak sekali sedih tapi syukur
strybycy,sudah gembira sekali mau solat ied rumah kenapa teman teman eh periode sekarang sih tidak bisa saja jam an begitu
strybycy,pikir hari sahur pakai apa besok pakai apa buat masya bisa khatam alquran iya tuhan seperti akhir khatam tahun lalu jaman saudara laki sekolah syukur makas banyak iya tuhan
strybycy,yang tdnya pikir sahur tidak karena baik tidur sudah soal harus kerja pagi padahal sahur sunah sampai yang benar lagi periode saja tapi bangun buat masakin orang rumah buka puasa siap bukan mau bukber harus disiapin juga senganya tidak buka tinggal layan doang
strybycy,habis tonton sidang isbat lalu lanjut ngepackin paket habis pusing sendiri karena rumah super beranta tidak karuab iya tuhan nikmat sekali nyata ramadhan rumah doang gin sudah sahur akhir saja gila ganyangka penuh bulan masak buat sahur
strybycy,rindu
strybycy,tadi malam lagi rumah teman lalu vcal jam set an selesai teman bilang ih enak sekali punya saudara laki seperti begitu asli telah lewat drama hidup yang hancur sekali antem baru sering panggil cal begini dulu ibu boro boro
strybycy,yah telat baru baca sudah tidak apa apa lancar lancar rejekinya yah paman
strybycy,bukan mahasiswa salah satu kerja rumah sejak bulan lalu gaji bismillah kali insya rezeki tidak mana
strybycy,jujur episode seperti hai tidak bisa ini harus selesai sekarang penasaran
strybycy,biarin mungkin mau mati pakai baju baru kali apa bagaimana sudah sera baik
strybycy,benar benar goa keluar rumah cuma buat ambil uang atm beli bahan pokok doang sisa diam rumah sudah mau bulan anda anda dong ini bos
strybycy,depan tempat goa beli beli ambil jauh kotak alumunium gagal jenis pos polisi buat psb samping jalan tol yang sudah ada pos polisi besar apa tahu tapi toko plastik desek deseknya masya ibu ibu beli bahan kue polisi diam saja ngeliatin
strybycy,pertama kali umur hidup buat nastar boleh lah rasa ibu cuma ukuranya besar besar apa tahu soal yang bulet buletin sepupu goa anak piyik udahanya langsung ditanyain resep karena kata enak melted tidak cemil iya tuhan haru padahal lihat youtube doang
strybycy,memang benar kalau minta nya sama tuhan tidak pernah buat kecewa sudah bukan kasi cukup lebih lebih sekali gin makas iya tuhan maaf sujud banyak permintanku
strybycy,saudara bapak sudah beli tuna capcay sama jamur sahur pakai ya pikir mari bangun jam agar masak telur saja seperti sakit hati pacar kemarin dimasakin mie goreng doang tawa
strybycy,tengah tengah ketentraman hidup ada berita buat pikir nama hidup
strybycy,morse dong agar sambil sms an
strybycy,tawa untung anak pramuka ngalusnya gasampe bawa serius saudara laki tahu batesan walaupun kadang enek
strybycy,ayo gandeng gemini ayo
strybycy,jadi sudah gakuat sama kita lawan itu dunia nya ini mbanya
strybycy,bagaimana goa sudah seminggu biadab bawa rasa sekali tapi tidak tahu itu orang siapa
strybycy,mau buat hampers tapi isi panci
strybycy,omong omong apa foto depan kulkas agar kalau aus mudah ngambil minum apa bagaimana
strybycy,salah satu korban rumah corona buat bayar zakat saja deh saudara karin sisa insya buat bantu orang sama langsung hidup
strybycy,sudah bang goa bom pernah ini
strybycy,sampai tidur siang saja mimpi nya itu orang iya tuhan siapa si anda tong benar sudah goa tidak kenal mukanye
strybycy,sudah hari mimpi selalu sama tidak tahu dalam mimpi siapa saja orang orang saya hepi sekali sampai tidak mau bangun saja rasa
strybycy,degdegan tiap kali ncang goa bilang la ajak bapak suru rumah sekarang lalu conferensi meja bundar
strybycy,iya ibu betul
strybycy,jujur asle rindu nyemilin frot loops
strybycy,gemesnye
strybycy,tulis baru lulus sampai seperti jaman baru putus sama saudara laki mantan ibu mahir buat kue tidak tadi jail buka blog niat mau tulis lihat tulis langsung seperti h apa goa anak bodoh pudar niat mau tulis saya
strybycy,saudara laki bayik kan gemini
strybycy,tim gemini
strybycy,maleman gatidur baru tidur tadi pagi jam bangun jam adan rumah bom rapi lalu bosan nya sampai sekarang padahal siapa suru gatidur malam jadi siang rumah saudara laki beranta
strybycy,sedang pikir mau ganti warna cat rumah apa tidak tahun tapi kenapa mager sekali padahal waktu banyak
strybycy,masjid dekat rumah bias kalau puasa tiap sahur remaja memberi nomor watsap buat kalau yang mau kirim salam dibacain pakai bicara masjid begitu syok sekali tiba tiba kenapa buat bela retweet ayo bela tidak tidur mentang begadang ayo bangun sahur lah jail sapesi tawa
strybycy,mon peta
strybycy,sabar dong ibu tahan puasa
strybycy,rumit urus itu kenapa sudah jam gin saja gaberasa mau tidur tapi kenapa nangung takut siang sahur saja sih soal ini kalau goa siang alamat gasahur rumah
strybycy,depok saji ayam babeh sambelnya mantap sudah saja tidak tahu apa banyak ayam geprek
strybycy,banofe dalgona
strybycy,tidak punya
strybycy,saudara laki bayik
strybycy,baik pertama dilakuin ini semua usai balik bandung
strybycy,bandung kita motor saja tolong kalau pakai mobil setiabudi pvj jam sendiri nang
strybycy,tanjung sekali sama kekeyi an hidup jujur
strybycy,sampai pesan langsung suru balas watsap tawa maaf teman teman saya jarang periksa watsap habis kerja tonton film doang telegram
strybycy,ba seperti anda deh ba kalau dikecilin gin kali bentuk jala
strybycy,mnangis
strybycy,asli knpsi orgorg susa sekali buat nutup pintu doang
strybycy,indah ya hidup orang orang
strybycy,kingin sekali jilin jilin
strybycy,motor jalan jalan keliling jakarta saja ketangkep psb tidak si
strybycy,gemini saking tidak saya keluhin karena saya sudah tidak komentar sama gemini twiternya hilang hai napasih
strybycy,seperti bapak goa kalau kata kata akan bilang gin deh cuma dasar saja tidak jadi anak mau apa iya baik sudah santai
strybycy,mudah
strybycy,gila sama ponakan saja tiap lihat ketawa goa ada celaka cinta sekali bagaimana sama anak sendiri
strybycy,sekali buat dasi warna tiba tiba
strybycy,pasrah saja jujur ganiat masuk situ cuma sudah pepet bingung mau kola mana jadi langsung bayar daftar untung guru pintar pintar jadi ganyesel
strybycy,iya tuhan bapak coba sudah besar ayman
strybycy,tampan sekali sudah anak duta
strybycy,sudah setenga jalan lalu kuyup
strybycy,tidak ada yang berani setan masuk anda saudara laki
strybycy,tanjung sekali sama diri sendiri selalu susah sekali cari baju untung online ini kalau offline ujung ujung saudara goa bilang sudah besok saja cari lalu besok datang rumah bawa baju sudah tempat sampah
strybycy,memang doa doa tiap solat itu kabul gaselalu langsung kita bisa lewat siapa saja tidak sangka sangka
strybycy,seperti nama sayur sial kail
strybycy,baru megang telepon hari pikir lebih
strybycy,bisa anda saudara laki gemas padahal sudah dekade
strybycy,anda mau medoknye seperti apa tetap saja bule bos
strybycy,kalau goa punya anak dinamanin blablabla modjo marah tidak kakek nya duta
strybycy,sayang soundfest goa degdegan sekali tunggu lineup anda kalau anda mau tahu ibu
strybycy,rindu api ungun
strybycy,sabar rap tawa
strybycy,kira baru hari
strybycy,lho gemas ini
strybycy,bisa rindu teman pdktan goa jaman tk padahal tidak tahu bagaimana bentuk muka sekarang
strybycy,sabar buru buru
strybycy,tawa goa
strybycy,sepupu goa kenapa tampan tampan sudah juga jadi sepupu sih
strybycy,yang bilang gin gemini
strybycy,ambil saudara tawa
strybycy,rasa mau bilang terima obrol misi semua orang ngechat misi sudah keburu tidak suasana hati duluan balesnya kalau obrol misi
strybycy,iya tuhan kucing saya dikit datang saudara wanita sekali
strybycy,yah dengerinya sheila nyala ajak tidak
strybycy,tanjung saudara wanita paham tidak si
strybycy,pantas kering kentang mahal buset bik jam sendiri
strybycy,jujur paling tawa ada
strybycy,asli sudah ini orang tidak ada tanjung tanjung goa sudah sampai celaka cinta patah hati saudara laki saja usaha
strybycy,jujur benci sekali lihat orang cakep foto diri pakai terang bagaimana cara ngilangin tidak aman hilih fucek
strybycy,hai
strybycy,gasengaja temu twitter teman goa lalu jail ikuti eh ketemu tweet jaman lalu saat goa sindir habis habis tidak baca kesal sekali untung bom imsak
strybycy,lingkar cahaya teman teman
strybycy,iya tuhan tempat goa nongski jaman kola jauh sekali memang tapi benar kalau utama kesini
strybycy,meski saya bukan pertama
strybycy,kenapa nich
strybycy,hari sama ada sangat mahal makas banyak ayah baba
strybycy,memang tidak ada bisa kalah jawab baba tidak tanya soal tunggal konser kenapa tidak buat konser online seperti orang orang kewren sudah anda mobil cing tanya gakepikiran dapat jawab seperti begitu
strybycy,tidak ayah bilang ini teman mau bicara terus tiba tiba baba bicara lingkar cahaya whatsapp ambyar hancur nang langsung rindu sekali memang kalau rindu terus ketemu dengar suara buka hilang kangenya malah tambah rindu
strybycy,soundfest tidak
strybycy,goa mau cari laki marganys modjo ah
strybycy,bingung sekali jujur baru mulai langsung sensor semua apa mau tonton
strybycy,iya admin tapi itu sponsor tengah tengah sinetron mulai sungguh sangat mengangu rangin pliz
strybycy,selamat ulang tahun saudara laki bucyin
strybycy,jalan terosh
strybycy,asli sama itu rimba
strybycy,nyata punya teman saudara laki satu darah sama duta tidak memberi lihat koleksi album sheila nyebut nama saudara laki eros sama produser sony musik saat saudara laki tidak faseh ampun nyanyi lagu rosa saja rasa saya menang bayang
strybycy,iya plase bulan ulang tahun tidak bisa ketemu
strybycy,iqbal bias jaman coboy muda cjr
strybycy,benci sekali napasih
strybycy,bela karena dulu waktu goa lahir bapak tugas brunei terus goa lahir ditemenin sama eyang sama tante kata tante goa sudah namain saja bela soal kan belabelain kesini karena tidak bapak jauh baik
strybycy,yang bingung sendiri kalau tanya lagu favorit sheila nyala karena enak semua
strybycy,album favorit apa bung
strybycy,banyak tentang hidup sama terimakasih bijaksana enak sih
strybycy,ketua kelas sekertaris bendahara semua mua sudah tanjung
strybycy,asli benar benar birkenstok tawa
strybycy,depok
