username,tweet
finaihsani,suka masak tidak suka cemil
finaihsani,pilih bandung bandung yogya
finaihsani,tidak usah dingetin saya ayo cemil dia
finaihsani,foto sama bapak bapak haduh jebul koe sudah gedhe ayo ngahahaha
finaihsani,dia saya barang
finaihsani,boys seperti gadis toke
finaihsani,itu istirahat dari saya hidup toke tawa
finaihsani,mungkin two adalah lebih baik daripada satu
finaihsani,aduh kayak tidur siang dulu agar tidak mabuk
finaihsani,two adalah lebih baik daripada satu
finaihsani,apa harus saya buat
finaihsani,ikan kod kulon progo tidak saudara des ehehe
finaihsani,anak nya siapa tawa
finaihsani,pergi fud
finaihsani,awokwowk makas lho ret
finaihsani,talking tentang pribadi barang untuk seseorang anda baca tidak bahkan dekat dengan adalah itu oke
finaihsani,bedo mamel kui tidak minyak koyo lamongan
finaihsani,diam anda ret tawa
finaihsani,gaweke mamel diri kuasa masak masak
finaihsani,saudara nti jadi guru anak saya iya tawa
finaihsani,ken nasi timbel ayam goreng sukabumi seperti gin tapi yogyakarta tidak ada
finaihsani,jurus apa pengirim
finaihsani,halodoc pengirim
finaihsani,jijik
finaihsani,pagi sudah panik kenapa jurnal hilang nyata salah set tanggal aduh
finaihsani,orang tempramen obat rabi
finaihsani,jam jam mabuk rekonsiliasi
finaihsani,kae lho enak mie goreng kuah soto ngisore semi
finaihsani,buat bibir ngelotok
finaihsani,sambele abing
finaihsani,saudara wanita pon
finaihsani,saya saja selow orang ngriseni sih
finaihsani,kulit aqua pengirim
finaihsani,sepupu datang rumah simbah silakan saudara laki kaleh macit macit fadil tidak mbah tadi lancar simbah saya dulu fadil macit teh macet kan saya dulu
finaihsani,ayo saudara sepeda murah
finaihsani,golek tempat sik strategis
finaihsani,tinggal bola turu
finaihsani,buka wan saja mgko saya melu idem nyewake
finaihsani,ikan kod ro orang futsal le tunggu jam jaman hesjan
finaihsani,tengsin pagi salah kirim stiker
finaihsani,saya tidak bisa bedain kanan kiri
finaihsani,ini po tawa
finaihsani,pedas gakuat
finaihsani,geprek macam ayam digeprek pakai bekas
finaihsani,sik cabene raiso ngarani raenak soale saya kepedesen
finaihsani,memang enak cabene iso ngarani ra tawa
finaihsani,ayo sus geprek sik enak ng wates ngendi
finaihsani,akhir ibu ngomel koe ki mbok metu anak kenapa ratau keno srengenge
finaihsani,karena lama kerja di rumah ngunder rumah terus
finaihsani,iya ampun ken ayam geprek
finaihsani,lingkar cahaya yun tawa
finaihsani,mie goreng pakai sukro
finaihsani,eh saya barang
finaihsani,ngerus
finaihsani,dikabarin iya ampun
finaihsani,nomerku ra ganti og
finaihsani,rindu mie kuah
finaihsani,jadi ingat sama yang tiap hari obrol whatsapp tapi tidak ganti nomor tidak dibarin ngahaha
finaihsani,tidak laku saya
finaihsani,sampai tidak ngrasain slilitan kali
finaihsani,angep saja kui coklat kabeh
finaihsani,ngahahaha berat ra gur saya tok sik pikir ngono
finaihsani,ono kenapa kopiko sik bunder
finaihsani,koyo permen kopiko dia
finaihsani,tiba yang baca pesan langsung instagram tawa padahal saya tidak pernah masuk igku di hpku sendiri
finaihsani,mas mirip yanti temenmu kelas kae tidak sih
finaihsani,semua martabak
finaihsani,yups lha tagihane tambah e okeh sekali
finaihsani,buka tekan
finaihsani,seperti subsidi silang
finaihsani,saya tidak heran
finaihsani,aqidahnya beda
finaihsani,tidak tahu saudara wanita ri saudara saya tidak mau mampir jadi sekali
finaihsani,lhambuh ji adi kenapa jare wegah le mampir
finaihsani,peras saya titip magelangan tempat sampah jus alpukat
finaihsani,gawene
finaihsani,tanyain saudara des kosong apa tidak
finaihsani,mie lah mie enak buat mabuk
finaihsani,baik daripada jam kopong tidak isi
finaihsani,basa basi yang makin basi
finaihsani,sedih
finaihsani,heran tiap coba produk orang orang pakai bagus saya malah jiriwitnya tambah banyak
finaihsani,tapi beberapa menit kemudian sadar semua aju sudah saya backup syukur tidak jadi nang
finaihsani,jam gin panik mau nang semua aju hapus
finaihsani,ayo apa se
finaihsani,saya bayang betapa manis enegnya
finaihsani,lompat lompat lompat
finaihsani,arah mana
finaihsani,bayang betapa kejam
finaihsani,sabar mamel
finaihsani,hati yang
finaihsani,racun orang tempat kerja nyebeli
finaihsani,bosan rumah tidak sih
finaihsani,pikir positif narkoba bukan corona
finaihsani,eh sudah juni saja ada bulan seperti beku
finaihsani,pikir jadi ingat mbah sidodol
finaihsani,malu tidak sih marah sama orang salah server tawa
finaihsani,pernah utama kayk gin pulang dimarahin ibu
finaihsani,hari bingung cari selisih dian sampai tidak sadar ngabisin nastar setoples
finaihsani,rindu yogya patih
finaihsani,lupa kalau hari sudah masuk
finaihsani,iyain saja malas jelasin
finaihsani,emoh pedas
finaihsani,saya yang sudah kalem kalem saja
finaihsani,tawa
finaihsani,pagi dimandin bersih siang hilang malam baru pulang adan jorok seperti habis nyemplung sawah
finaihsani,iya ampun malam marahin kucing sudah berapa kali ngilangin kalung
finaihsani,saham bumi saja stagnan
finaihsani,semangat saudara wanita tik
finaihsani,lebaran tengah corona jadi paham ibu selalu bilang kalau mbok yogyakarta saja
finaihsani,saya cinta keluarga ibu tawa
finaihsani,aduh
finaihsani,pikir mal aidzin wal faidzin bisa
finaihsani,apa
finaihsani,apa
finaihsani,mohon maaf lahir batin desita
finaihsani,serius vc sama teman tiba sepupu yang umur tahun belakang nimbrung terus bicara anda itu siapa anda bukan temenya saudara wanita nung hai
finaihsani,sedih biasa ngumpul sama keluarga besar sekarang silaturahmi oleh video panggil saja
finaihsani,mal aidzin wal faidzin mohon maaf lahir batin ipid
finaihsani,selamat hari raya idul fitri mohon maaf lahir batin semua
finaihsani,mohon maaf lahir batin begitu
finaihsani,domba rumah tani memang ganas agresif
finaihsani,ayo takbir
finaihsani,indonesia pacar ki ayo apa sih mbok gawe konten sik manfaat tidak gur menikah muda menikah muda ros
finaihsani,baru buka segel nastar sama castengel dipelotin ibu negara
finaihsani,hari sekian buka puasa lupa tidak nanak nasi selamat buka sekian
finaihsani,tidak habis pikir sama bapak bapak kenapa masih saja padahal sudah blokir sana sini
finaihsani,lama tidak lihat bapak
finaihsani,sumpah cari selisih rupiah lebih ngelu cari selisih jt
finaihsani,oke saya pikir jenak
finaihsani,ken tidak ritwit kenapa raiso
finaihsani,sini anak sini temenya banyak
finaihsani,apa siapa dek amel mau dititipin
finaihsani,terima peniti anak
finaihsani,baju baru syukur
finaihsani,huf
finaihsani,banyak ikut requests instagram dengan nama aneh tidak jelas saya habis apa sih jadi rem
finaihsani,kadang responsif kadang tidak
finaihsani,fizi
finaihsani,ijat
finaihsani,mesakne upin ipin ro ehsan
finaihsani,pikir pantas diri tahu
finaihsani,rumah terus tidak dapat jodoh hai
finaihsani,rupawan
finaihsani,omong omong indira khalista siapa
finaihsani,mahasiswa sering ngata in dosen yang tidak tidak belakang
finaihsani,saya buka luar sayang
finaihsani,tawa mafkan saya
finaihsani,kalau tahu dilakuin roy
finaihsani,baru nyala baca paket jadi paracetamol
finaihsani,peta saudara des tawa
finaihsani,iqbal coboy jengot
finaihsani,hai ah
finaihsani,kevin aprilio
finaihsani,bakar ja siapa
finaihsani,kpop asin
finaihsani,apa ini
finaihsani,famungas
finaihsani,kopi tsasetan
finaihsani,inul vista
finaihsani,wayang golex
finaihsani,apa sudah benar enak gado
finaihsani,karena anda butuh jelas
finaihsani,ken pos foto banyak sekali hih
finaihsani,ho
finaihsani,intel wedus dia
finaihsani,nenek ewuwu berat tidak bahagia tanpa anda tanpa anda anda anda anda anda anda
finaihsani,instruktur
finaihsani,peta saya insekyur
finaihsani,bukan saya
finaihsani,ngiang sekali kowe tidak sayang sayang
finaihsani,lucu
finaihsani,orang betah hari tidak mandi
finaihsani,ada yang rumit harus mudah
finaihsani,tawa
finaihsani,lha misi ne coret kenapa
finaihsani,opmie
finaihsani,overthinksjwiwowlashsuhevrv
finaihsani,rindu teman jala tawa
finaihsani,kira angkutan umum trayek bong kebun kelapa sama trayek kebun kelapa bong sama sudah pada saja naik nyata salah nyasar mana tidak tahu jalan arah untung
finaihsani,ken indomih
finaihsani,saya suka cemil cumi tidak suka masak cumi
finaihsani,tidak tidak
finaihsani,kalau tiba letus bagaimana iya ampun
finaihsani,ret apa sunda tidak bicara f
finaihsani,saya rasa bang ian mirip sama saudara laki ayah
finaihsani,aneh kan rasa
finaihsani,koyo maem gabus bel
finaihsani,saya ayo ratau doyan rasa aneh
finaihsani,turbo tidak enak rasa kempes
finaihsani,ken choyo choyo
finaihsani,sudah tidak hadir nyata tanggal merah
finaihsani,kera kera
finaihsani,saya tidak tahu apa
finaihsani,mbendino dingonokne memberi apil haha
finaihsani,tenang hati semua bukan salah
