username,tweet
novitnurul,janji tuhan pasti mereka senantiasa doa sabar sabar engkau sabar baik sabar engkau sungguh janji tuhan benar
novitnurul,banyak anda tahu banyak yang anda lalai anda tahu harap tuhan tidak pernah kecewa anda pilih kantung harap makhluk
novitnurul,flu tembak versi kanjeng mami jahe kunyit sereh kayu manis kencur madu terimakasih ibu
novitnurul,saya tidak cahaya teman teman tawa cuma syukur jerawat yang radang begitu hilang terus kulit sudah tidak sekering produku lokal punya tidak beli yang highend tidak nduwe uang soale tawa
novitnurul,sekolah spesialis tahun tidak bayar yang malah bayar biaya didik buka praktek juga boleh apd siap sendiri sampai tetap ikut andil dalam tangan pasien corona bayangin juang bahkan ada yang mati saat didik hampir slsai
novitnurul,kayak gin ada saja yang neraka bilang dokter ambil untung ada pandemi untung segi mana
novitnurul,banyak chak trial dan salah tenan soale kunci kulit barier sama baik pencernan chak
novitnurul,hati hati waham bisa induksi kalian tawa
novitnurul,tiap obsgyn laptop suka mati layar
novitnurul,tuhan semangat saudara bel
novitnurul,bayam beku pisang nanas polos yogurt chia benih
novitnurul,bisa hubung saudara wanita
novitnurul,sudah saudara wanita ojo bahas malu tetap sedih soale
novitnurul,semoga saya sesal
novitnurul,saya stase apa iku kenapa tidak ikut anak po tawa
novitnurul,lha serba salah nenek saya jawab tawa
novitnurul,sekarang saya pakenya yang balsem nin banila co kalau minyak saya pernah nyobanya kiehl
novitnurul,kalau saya yang wajib bersihin wajah sama baik kulit batas nin pakai sunscreen kalau tidak keluar saja kalau saya bersihin wajah tidur lama sekali soal pakai yang minyak balsem di pijat wajah sudah begitu sih turut tawa
novitnurul,oiya ding tidak cuma trial salah rawat kulit tapi baik pola cemil tidur tambah olahraga ringan pola hidup sehat manfatnya kita sendiri yang rasa
novitnurul,sejak putus henti pakai dari misi sebagai saya trial salah kulit peduli sejak puasa syukur lebaran nemuin yang cocok saudara wanita sekali tuhan kulit baik sekali sampai haru
novitnurul,adain rafting online po saudara wanita
novitnurul,khan saudara wanita bahkan saya kalau tidak pakai kacamata tidak bedain mana orang mana bukan jauh tawa
novitnurul,niat hati ken mendengarkan podcast kepala sudah denyut
novitnurul,hayo tebak pintu apa
novitnurul,orang itu mindsetnya kalau yang cemil an sehat makan bersih di bilang program urus badan mau hidup sehat tidak jadi gendut dulu kan ya
novitnurul,besok tidak akan lah kubukain pintu situ berani dobrak pintu
novitnurul,sebuah saat untuk ingat
novitnurul,pokok apa aktivitas nya kalau keluar rumah saya tetap pakai masker masuk tadi waktu antisipasi corona polusi sinar uv yang buat muka gosong haha
novitnurul,dari rumah prungahan cincin jalan balik rumah asrama haji jalan al falah perum semen rumah sakit nu gor pasar pramuka sampai balik rumah uwo
novitnurul,saat diri pilih buat baik topeng percaya tuhan hadir manusia manusia tulus akan isis hidup
novitnurul,buat benang saja saudara wanita ben ciduk kapok
novitnurul,pepes ikan buat ibu ini tidak kalau tidak tambah
novitnurul,terus akhir saya putus mau buat aglio olio ala anak kos nyanyi sudah mudah tawa
novitnurul,saya dikirimin resep aglio olio sama saudara terus tidak lihat saya bilang kurang tantang eh benar sama kirim yang susah makanya jadi orang tidak banyak mau lubang haha
novitnurul,pagi saya sudah racun produk itu mandi kotak blomka
novitnurul,neraka pilih astaga
novitnurul,ayo teh shin saya melu tawa
novitnurul,kalau damar lemari pasti lama gara sering kecantol coba coba sudah tidak rampung
novitnurul,ayo buat ayo
novitnurul,tips sehat pagi hari cemil apa seduh lemon madu chia benih
novitnurul,saya tidak efek apa kurang lama kali malu
novitnurul,senka
novitnurul,benar pengaruh besar buat ngecilin badan intake kalori pengirim cemil olahraga jadi perhati dulu intake kalori per hari pengirim semangat
novitnurul,coba fw himalaya yang tidak scrubnya hasil sama breakout parah sama persis waktu pakai hadalabo sudah paling benar fw cosrx tidak ush ganti
novitnurul,saya ken nasi padang bermingu yang lalu saja turut mau cemil rumah makan mesir jauh sayang
novitnurul,mauw
novitnurul,rindu cemil rumah cemil mesir nasi kebuli kambing oven
novitnurul,ken lanjutin baca telanjang wisatawan lupa edisi akhir baca yang berapa
novitnurul,cuaca pagi dingin gin memang paling enak pakai pakai mukena
novitnurul,rasa tidak pahit tidak bau sayur tapi kalau kalian suka manis yogurtnya ganti yang rasa pakai merk yang kadar gula lebih banyak
novitnurul,bagi sedikit tips sehat ala saya kalau rumah saya sering nyebutnya mpasi soal tekstur mirip
novitnurul,buat saya yang habis minum kopi efek gelisah takikardi baik beli susu jahe hangat malu
novitnurul,lapar syekale tapi saya gaberani dapur
novitnurul,padahal koas kalau lari an biasa adan gawat benar misal kejar konsulen
novitnurul,kalau drama korea dokter lari an begitu biasa saja kalau nyata koas lari an liatin keluarga pasien ob awat yang lewat bapak satpam mata olah bilang lapo sih arek ini surup tugas akhir
novitnurul,materi ikm ilmu batin hapalan sekali nget nget
novitnurul,jadi ternak tani tawa
novitnurul,mau cari rumput buat cemil sapi saya
novitnurul,tidak sengaja kan iya kan
novitnurul,luput sedikit saja buat sedih ada apa saya
novitnurul,lelah tidak tahu apa
novitnurul,ibu tiap lihat saya mau bimbing arep ajar apa piknik saudara wanita fit ini isine jajan tok bukune cuma satu lha
novitnurul,lembut bagaimana begitu
novitnurul,sudah jadi sekali resep agar tidak dosa
novitnurul,rindu sama solo orang orang nya
novitnurul,buat setup roti pakai keju quick cair enak kayak
novitnurul,tidak hapal bos isi pokoke bahan exfo anda lihat saja instagram nya saya beli shopee ben gratis ongkir
novitnurul,anda tiap hari pakai nya
novitnurul,saya selalu dewe na tawa
novitnurul,anda hasile bagaimana naj
novitnurul,selamat guru barakalah
novitnurul,selamat coba ibu tidak lupa hidrasi kulit agar tetap lembab malu
novitnurul,saya sedang lonjong mati dari pras ibu bingung nenek mau kontrol jadi ayo sebentar coba jane tawa
novitnurul,jadi kan saya jerawat untuk ibu jerawat papul pustul terus tidak sembuhin dulu pakai benzoyl jerawat sembuh baru berani pakai serum saya pakenya cuma kali seminggu pakai pertama kulit mati yang bekas jerawat ngelupas pemakain bekas jerawat pudar ngono ibu
novitnurul,baru minggu naj hasil sudah lihat anda coba naj
novitnurul,kenya pakai tiap hari tapi tidak haha kemaruk
novitnurul,kasih tepuk tangan buat serum kleveru
novitnurul,jadi berapa hari yang lalu saya sering sakit punggung padahal pekerjaan duduk saja depan laptop terus coba stretching pagi aktivitas hasil syukur tidak boyok en saya biasa stretching pakai dan
novitnurul,ngurangin cemil an minyak efek sekali kulit
novitnurul,yang kena tumor hipofisis sampai tekan chiasma opticum terus muncul keluh hemianopsia bitemporal nin saya lihat lgsung benar tawa rekomendasi tidak nin
novitnurul,tutor cerita kalau kasus rsud daftar putar yang mirip sama soal ukmpd arti saya tonton
novitnurul,lihat bhre cemil mie kenapa enak
novitnurul,niat mau praktis lgsung jawab pdfnya eh nyata tidak simpan lubang lubang
novitnurul,ayo hidup sehat mulai kurang manis manis
novitnurul,nyata yang manis nagih sekali cara tidak sadar rasa manis kerja sudah kayak narkoba yang buat candu kalau banyak buat intoksikasi contoh cemil manis minum manis janji manis
novitnurul,sini maino rumah saja che tawa
novitnurul,saya pernah tidur upacara kata teman belah kira sakit soal sempoyongan
novitnurul,kayak enak buat panekuk oat nanas selai nanas buat sendiri nt topingnya pakai es krim
novitnurul,yakin deh tidak semua itu perlu jelas walaupun jari anda gatal lurus
novitnurul,tidak paksa orang buat percaya penuh sama manusiawi jadi tidak beban diri jelas siapa diri orang
novitnurul,saya saya tempe goreng sampai tidak tunguin goreng ibuknya tawa
novitnurul,silah konfirmasi huni temangung asli saudara kayak tidak sinyal sana tawa
novitnurul,tunggu rasa percaya diri saudara wanita tawa terimakasih support kalian
novitnurul,temangung mana suara
novitnurul,saya sedang percaya diri saudara med
novitnurul,tiap buat tulis panjang mau pos saya selalu tidak percaya diri terus akhir simpan saja laptop sih gemas sama diris sendiri
novitnurul,tawa jawab tidak bapak faris mal aidzin wal faidzin bapak semoga sehat terus agar utama twitter
novitnurul,terkadang memang sambat curhat paling lega lewat doa tidak pakai malu malu gosip peras tuhan tidak pakai kode an tuhan sudah paling paham diri penuh cuma tuhan memang
novitnurul,syukur tidak yang nanyain begitu hari
novitnurul,sudah kayak saudara ya
novitnurul,biasa kalau tempat mbah ada tradisi sungkem begitu terus nt tengah sungkem tangan di selipin thr tawa
novitnurul,kan terus pikir mau lebaran berapa lama sih haha
novitnurul,rindu jalan waktu suasana lebaran liatin mobil mobil kalau mudik bawa barang besar kapal dikat atas mobil
novitnurul,sebar sidang malam tentang wonder wanita lokal dari luar tampak biasa saja ternyta tahu kehidupanya benar masya tuhan
novitnurul,sedih ya umur gin hidup di tanggung orang tua mau sini an biji tawa
novitnurul,mungkin tahun minta maaf lewat obrol akan jadi minta maaf tulus soale tidak ketemu rek
novitnurul,usia dilema kalau tidak thr
novitnurul,mau dapat thr tawa
novitnurul,ayam geprek sambal matah yang
novitnurul,ini diri ingat sih
novitnurul,tidak salah sih pencitran kan pencitran memang kait erat sama pribadi branding tapi kalau juga banyak bagaimana begitu
novitnurul,saya lupa habis potong cabai terus ngucek mata tertawa bodoh
novitnurul,saya pernah kecewa doa anda rab
novitnurul,kapan bisa libur tidak keluar biaya
novitnurul,sedang mungkin laku diri sembuh bagi alias saya waktu syukur paling tidak bisa lihat foto nya
novitnurul,ayo ayo semangat lubang
novitnurul,syukur nyata saya manusia haha
novitnurul,haru orang orang kenapa baik sekali tuhan semoga tuhan balas baik kalian yang lebih indah
novitnurul,musuh saya itu sama produk wardah sudah mbuh
novitnurul,murah sekali harga buah nyawa
novitnurul,orang orang ini kayak lebih rela nyawa tukar pakai baju lebaran
novitnurul,habis kerja untuk mandi niat agar tidak ngantuk yang saya makin ken merem
novitnurul,tuhan baik sekali manusia se hina diri saja kasih banyak sempat nikmat
novitnurul,lihat bhrekata cemil oreo saya jadi ken beli oreo dasar lemah
novitnurul,negeri bedebah tere liye negeri ujung tanduk tere liye bumi cinta habiburahman el shirazy cahaya langit eropa hanum rais sang mimpi andrea hirata
novitnurul,jadi sering tegang sakit kepala itu kenapa
novitnurul,iya saudara wanita sudah di jalan balik tidak sampai jam saya sana tawa syukur los
novitnurul,iya saudara wanita bel tawa benar trnyta cegat arah jatim ketat
novitnurul,bukan mudik lho
novitnurul,kanjeng papi tidak muda baru di jalan bentar sudah sambat ngantuk sehat terus ngih
novitnurul,rindu bantai tidak presentasi rindu buat rasa bodoh rindu unjung sama beliau haha
novitnurul,iya naj sama rindu sama konsulen yang super tawan
novitnurul,memang yakin kalau offline lebih semangat tidak banyak alas lubang
novitnurul,sudah mulai tidak semangat bimbing online
novitnurul,tidak laki laki baik dunia kecuali diri sendiri ujar bapak kali bapak sombong diri nyata memang
novitnurul,bulan puasa secepet ya
novitnurul,mau nge log keluar akun google cme telepon itu bagaimana cara gaptek sekali saya
novitnurul,tuhan saknoe kasih reda nyeri dulu roh semoga pandemi segera akhir
novitnurul,chia benih ini itu terbaik lah
novitnurul,saya rencana mau cabut gigi impaksi saja tidak jadi padahal nyeri sampai buat migrain
novitnurul,ngungsi omahku poo tapi banyak cegat ning dal
novitnurul,berapa hari yang lalu saudara beli kombucha saya penasaran efek probiotik utama buat derita hipertiroid besok cari jurnal deh kalau sempat
novitnurul,ayo saudara wanita coba skripsi saudara wanita tawa
novitnurul,omo punya skripsi datang tawa
novitnurul,arti inti memang banyak aktifitas fisik nur
novitnurul,coba saudara wanita lumayan ampuh saya masih tetap nyeri tapi tidak sampai minum analgetik
novitnurul,kayak skripsi teman benar deh kalau rajin olahraga kurang intensitas nyeri dismenore
novitnurul,tidak henti doa baik ucap baik prasangka baik sama tuhan
novitnurul,urus per ukmpd an makin makin mudah tuhan amin
novitnurul,syafakilah saudara wanita tinggal kuat tinggal sehat
novitnurul,sini tidak semangatin saudara wanita bel
novitnurul,tidak nyaman sekali sampai pindah posisi saudara wanita
novitnurul,tidak enak sekali kerja soal tahan dismenore
novitnurul,walaupun saya tidak suka hujan an saya suka bau tanah basah buat tenang ngantuk haha
novitnurul,agar tanya yang anjal tetap jadi misteri entah kapan datang jawab bisa jadi akan jawab
novitnurul,saya selalu bilang kurus padahal biasa saya sudah naik ber kilo yang salah mata orang apa badan
novitnurul,ngaduknya tidak lama tidak mau angkat kompor dibesarin terus siap saji oiya gurita cuci telah potong buat ngilangin tinta jadi nt warna bersih begitu
novitnurul,masuk saus tomat saus sambal saus tiram kecap tambah air sampai blukutuk masuk garam gula kira koreksi rasa lewat soal puasa cemplungin gurita cumi jagung akhir saja tambahin maizena sendok cemil yang sudah campur air
novitnurul,marinasi gurita cumi pakai jeruk nipi garam jahe dikit rebus jagung manis tumis baput bamer cabai sampai wangi masuk bawang bombay masuk jahe daun jeruk tumis sampai layu
novitnurul,resep crabys ala buat mula bahan yang ke foto sini saus sambal gula garam maizena
novitnurul,masio resepe mudah rasa tidak mudah kenapa rek
novitnurul,tidak sabar tenan saya di jalan tulis tawa
novitnurul,terus pikir mau buat ala crabys kan pakai seafood yang gurita sama cumi rajungan sih rajungane tidak sentuh rek haha akhir jadi crabys ala saya nyanyi guampang bikine
novitnurul,jadi tadi saya tawar diri buat masakin menu utama buka puasa buat orang rumah soale biasane saya cuma jadi per dukung nenek masak begitu hari kanjeng mami suruh leyeh saja saya sama saudara yang nyiapin buka
novitnurul,ken masak ala ala carbys begitu
novitnurul,buat penasaran saja sih si lena sama nebula haha
novitnurul,tuhan jadi sedih
novitnurul,tahun benar siap hati banyak ya
novitnurul,wih mantap memang vic
novitnurul,kalau kalian sedang doa tidak lupa selip doa pandemi segera akhir siapa tahu kalau makin banyak minta pandemi segera angkat bumi
novitnurul,sini maino tuban chak tidak suguh rajungan sampai mendem tawa
novitnurul,sini tinggal menit buka puasa dokter saya sempat mandi
novitnurul,harga rajungan sudah ribu kilo tawar bisa dapat ribu kilo harga gurita malah ribu kilo nikmat mana yang anda dusta lubang
novitnurul,ngajakin ibu pelihara kucing tapi tidak mau kata kalau kucing sakit sedih sudah kayak anak sendiri
novitnurul,tidak cemil ding nyemil
novitnurul,dih tidak tingkat tawa
novitnurul,memafkan tentang bebas diri peristiwa kesal sekaligus cegah tindak sama ulang di masa depan
novitnurul,sok an kerja untuk dalam hari satu kampus satu bimbel lagi soal interna rasa keple sudah kayak vena ngono toilet
novitnurul,ibu ibu multitasking memang
novitnurul,rindu pakai baju jaga tidak sih
novitnurul,pepes gurita buat ibu memang tidak pernah salah salah saya jadi ken tambah terus
novitnurul,berterimakasih pintu pintu tutup kadang adalah salah satu jalan buat diri sadar tuhan buka banyak pintu pintu untuk kita percaya tuhan pegang kendali seluruh semesta
novitnurul,rasa kerja lms merem
novitnurul,kasi nopal beberapa kali buat terang bulan tidak blukutuk adonanya kalau dibantuin marah haha
novitnurul,cetaphil
novitnurul,ya tidur pakai mukena enak sekali
novitnurul,ih ngilani yustin tawa
novitnurul,jiwa sekali che
novitnurul,manusia rhinitis memang paling tidak kasih pekerjaan tum bumbu kasi kan yang cemil masakanya
novitnurul,mizu karang peach
novitnurul,jam gin tempat sampah kebab tidak mungkin nolak lah saya
