username,tweet
jollajoly,cepat cepat beli mata tambal karena kantung mata sudah bengkak hitam
jollajoly,kapan saya rasa nikmat semua sedih kwkwkw
jollajoly,makas ainik xixi
jollajoly,saudara wanita buka saja shopee nya saudara wanita tawa
jollajoly,ayah adalah saya kwkw da memang tidak ada yang whatsapp
jollajoly,kenapa sekarang jadi takut tidur sndiri saja jadi tidak bisa seperti selalu sudah sudah begitu gugup gugup
jollajoly,dan pakai susuk instagram tawa rawat kulit apa itu haha
jollajoly,padahal tadi sudah cari salad buah digrabfod tapi scara sadar mes mcd mcd
jollajoly,tawa tawa
jollajoly,kalau orang orang lagi malas hidup kata pada cpt mau menikah kalau saya mau jadi putri saja
jollajoly,haha menurut pendapat saya mau mau ayo saya temenin saudara wanita beli menurut pendapat saya tawa
jollajoly,sini ngobrol sama goa saja tawa
jollajoly,dulu diajakin foto sama ibu tidak pernah mau saja paksa nyata waktu surabaya kemarin libur akhir sama ibu
jollajoly,sumpah ken seperti enak pakai yang tidur sendiri gtgasi tawa
jollajoly,iya ampun ngerebus air penuh sampai tinggal tengah lupa sekali
jollajoly,yah sedih kayak tidak akan wisuda deh masa iya tunda tahun
jollajoly,yipi
jollajoly,ken utama sekali tapi ngantuk
jollajoly,saya lihat jadi nherasa gatal sendiri pena langsung peletusin tawa
jollajoly,menstruasi sakit amatzi
jollajoly,kwkwkw simak klarifikasi husna
jollajoly,kwkwkwkwk
jollajoly,seyeng deh sama enjel enjel saya
jollajoly,cemil janji palsuw
jollajoly,pamer bojo korban janji buang mantan cari baru conta tidak restu
jollajoly,saya sekali otak lancar kalau sudah h beberapa jam kumpul tugas
jollajoly,sudah awal bulan waktu mulai yang baru baru
jollajoly,sayang abe
jollajoly,sumpah saya jadi rontok parah si
jollajoly,sayang sasa haha
jollajoly,iya tuhan mau ulas nya dong saya banyak sekali whiteheads nya hidung
jollajoly,makas daka
jollajoly,anda humoris sekali si suka masak masak xixi
jollajoly,baru hari ketemu ibu mimpi saudara wanita sekali walaupun cuma mimpi tapi nyata sekali sahur sama sahur rasa tidak mau bangun dari tidur
jollajoly,iya tidak apa apa neraka daripada nang kamar mandi ngidupin keran air kwkwkw
jollajoly,malu sukurin
jollajoly,rasa
jollajoly,seru seru tapi saya gatahan saya lgsung loncat episode terakir ekwk
jollajoly,episode dulu baru abistu pre uji deh zanzi
jollajoly,rindu bukber pakai daster
jollajoly,benar deh tidak percaya lagi sama orang yang sudah perna ngebohongin ngecewain gitcu
jollajoly,alih dari drama korea tonton lucifer tawa seru sih parce racun sampai jam seperti ini belum tidur
jollajoly,iya enak tik malu
jollajoly,ceian anda ya tawa tawa
jollajoly,suka sekali sama kentang mcd sekali bgtan seminggu gama meriang seperti malu tapi kan kalau beli tiap hari saya tequr akirnya beli kentang beku kilogram habis goreng ditaburin garam baik rasa sama kentang yang merk pesta enak sumpi
jollajoly,coba bonton drama korea terus lama sekali selesai saudara wanita akhir saya baca saja sinopsis sudah selesai malu
jollajoly,saya gadak tawa
jollajoly,ken wisuda ken ambil ijasah tapi corona bagaimana si
jollajoly,saya saudara laki lho buku kecil nya xixi
jollajoly,saudara wanita deh bilang cantik dong haha
jollajoly,telepon asrama saja tidak begitu begitu sekali sa tawa
jollajoly,lipat kertas neh
jollajoly,suka sekali dengan aksen bola mata nya kalau foto depan kaca lampu
jollajoly,mulai dram koriya legenda dari saudara biru laut sekarang dada saya kembang kempis karena kurang turu tidak bisa benar ken diabisin saat juga episode ny
jollajoly,tawa iya tuhan sering rendem air beras ini seperti
jollajoly,apa dengan tiap telepon yang saya pakai tidak pernah awet diam saja tahun begitu baik baik saja tidak apa apa
jollajoly,saudara laki saya liatin orang bedua ca ban mantu kwkw
jollajoly,uw cayang seperti enak
jollajoly,tadi pikir siapa sih cony
jollajoly,seperti apa
jollajoly,enak minum obh kali tremenza malu
jollajoly,malu ter malu
jollajoly,benar benar seperti kasi onat tidur
jollajoly,minum obat tremenza enak sekali tidur kwkw
jollajoly,iya cakep cakep si
jollajoly,saya mau ngetwet apa saja tidak apa apa serah saya kan twitter saya tawa
jollajoly,rindu deh
jollajoly,aduh ken coba deh
jollajoly,lelah saya sama dalgona dalgonak kopi sumpah sampai keringetan gas ngaduknya
jollajoly,gin rasa tahan bersin kalau ngobrol sama nasabah tahan bersin loh
jollajoly,iuh tidak suka tawa eh beli tepung rekat gratis saja ditemenya ragem produksi
jollajoly,kulo adak buat saja kaloga
jollajoly,tadi habis refreshment uji terus seperti serius sekali begitu kan tawa slesai lgsung matin komputer lgsung cabut buru buru keluar kantor iya jadi tidak sadar seperti gin
jollajoly,sisih keruma utama
jollajoly,ken jalan jalan iya tuhan ken coba steak yang dideket rumah sasa iya tuhan ken wisuda iya tuhan bosan sekali
jollajoly,tidak twitter tidak whatsapp tidak instagram isi caca opi emem dinda terus tawa
jollajoly,mau teman yang ajak cemil apa saja dia dia
jollajoly,lihat tren topics takut takut sekali
jollajoly,dia tampan sekaliy pokok masya
jollajoly,hasil buat srikaya warna hijau nya pakai daun suji sama pandan
jollajoly,hari mau blajar buat kue srikaya sama nenek yuhu
jollajoly,burgerking promosi huhuy ribu burger
jollajoly,emnang sedih tapi saudara laki sedih iya kenapa jadi sedih terus sih
jollajoly,sudah hilang hormat sekali sama orang yang beda mulut beda laku jauh jauh deh tawa
jollajoly,eh empu nya ceker meleduak kwkw
jollajoly,memberi kari tante pacar tidak mau sudah saja yang eksekusi iya tambah katsu katsu an
jollajoly,obrol edeng cepat lagi ngumpulin masa kasi alamat email tawa
jollajoly,wnongki via zoom tawa
jollajoly,sama iya tuhan
jollajoly,diemin saja tawa gosah waro aduh peta tidur aduh peta selesai selesai tawa
jollajoly,tanjung kadang sendiri terus tawa tidak rumah tidak hati eh
jollajoly,kentang disatuin sama mozzarella rasa enak teman teman tawa
jollajoly,ey bosan sekali rumah malu
jollajoly,utama sini makanya ayo
jollajoly,tumben menstruasi kali sakit sekali ya
jollajoly,minyak tanah begitu sebentar jadi bola bekel bukan roti kwkwkw
jollajoly,mau buat roti canai
jollajoly,bleding
jollajoly,tidur bentar tonton leher saya sudah sakit renta sekali
jollajoly,tawa
jollajoly,haha yang penting puasa saja si
jollajoly,kasar ih tawa kenapa anda aik huaha kerja di rumah iya
jollajoly,ingat dulu ibu tempat sampah buat buka puasa kalau puasa penuh sampai magrib tawa
jollajoly,roti canai canai
jollajoly,ken gofud tapi hujan
jollajoly,masak air
jollajoly,iyes jadi saya
jollajoly,hijau gurih manis seperti rasa gitugasi lek lekan na tawa
jollajoly,mcd ros awas jadi ayam lihat cak laku
jollajoly,sebentar dibuatin kalau kesini
jollajoly,jadi oreo cuci mulut enak
jollajoly,kwkwkwkw jadi gasabar coba punya sndiri haha
jollajoly,malam malam buat cuci mulut oreo yang kini buat anak anak kicik rumah tante
jollajoly,sini banyak caca sini saja ksl sama coronak huf
jollajoly,ken buat sambal kecombrang matah sambal roa ca produksi sambal seperti burudi ajayok tawa
jollajoly,ken coba ketan srikaya periuk bunda napas coronak tidak bisa nyebrang kan jdinya ijasah nya pdf kali ini
jollajoly,apa mesam mesum kwkwkwk
jollajoly,yailah sudah kera sudah gladak petir atas saya ngajin sebentar
jollajoly,lusa tawa
jollajoly,olahraga apa tapi suka renang sama yoga si seperti enak saja begitu
jollajoly,napas webton yang saya suka hiatus terus
jollajoly,semua orang dadak nunjukin ketrampilan masak karena rumah saja
jollajoly,ken sekali dendeng sama malbi terus tiba tiba yang ngirimin sayang sekali saya itu syukur
jollajoly,tawa iya tuhan tawa
jollajoly,tawa
jollajoly,dimana si mel sudah sayang
jollajoly,ehm yakok jauh
jollajoly,ken beli dendeng yang enak lampung mana
jollajoly,ini suara hamka laki sekali siskwkwkw
jollajoly,rumus menu masakan sabtu sampai minggu
jollajoly,semangat sasa sayang anda
jollajoly,mau tonton film beku lupa kalau nama beku searchingnya film ibu elsa
jollajoly,kan mobil kantor lho tukimin tawa
jollajoly,lobster si em cari mana dikalianda tapi saya bingung bawa nya takut bauk
jollajoly,bagaimana sef besok masak sef tawa
jollajoly,cari siram rohani bisa tawa
jollajoly,semua dikaitin yol masuk angin dikit nah itutu gaperna olahraga si kaloga nah itutu kurang minum air putih si
jollajoly,alhamdulila akirnya jadi masakan ala ala tawa
jollajoly,ken pejoy rasa coklat
jollajoly,baru hari hepi balik kantor sekarang sudah normal balik jam
jollajoly,tadi mau beli jahe tidak sudah timbang keluar lable nya nyata yang ambil lengkuas
jollajoly,kalau rumah saja pikiranya cemil hanya
jollajoly,syukur untung rumah dekat sama warung sayur efek anak mageran
jollajoly,siniy siniy tawa
jollajoly,masak apa hari
jollajoly,niat cari masker sampai titip sama teman yang aceh trnyata jrang sama mahal cari dimana si
jollajoly,tawa
jollajoly,tawa tapi riuh dian cemil saya da habis kwkw
jollajoly,hari tidak pakai masker kantor lagi ramai ramai nya pulang pulang sakit suges sekali kayak
jollajoly,ken cemil tapi pusing mau tidur apansik
jollajoly,ayo sini lampung gazh iz
jollajoly,kfc rasa nusantara tawa
jollajoly,mati satu tumbuh ribu saudara laki dua kandidat seyenk tawa
jollajoly,mei puy sudah undur juga
jollajoly,semoga wisuda nya tidak online tawa
jollajoly,semoga wisuda tidak online
jollajoly,terus bagaimana tawa
jollajoly,tiap hari libur malah tidak bisa bangun siang dari tidur yang lelaps
jollajoly,antisosial saya pagi realisme karena parsel data saya habis kwkwk
jollajoly,iyah bagus
jollajoly,anak tante tawa
jollajoly,apaya saya tiba tiba acak sekali buka shopee beli buku anak
jollajoly,tidak akan ujung nya ibu
jollajoly,tok muesli
jollajoly,cemil buat bahagia
jollajoly,ish tahu begitu ikut gaboet darah daging tawa
jollajoly,rencana besok mau kerja tunda pekerjaan terus nyata berkas ktingalan mobil kantor dari awal naik mobil sudah feling sekali akan tinggal huf
jollajoly,saya cepat cepat kesana
jollajoly,andro bisak da
jollajoly,perbarui dulu yan whatsapp nyah
jollajoly,akhitnya whatsapp gelap mode uhuhuy
jollajoly,terakir cemil ayam garangasen bandung sama ibu enak sekali buat teman ibu bandung terus kepimgin huf
jollajoly,tawa mana rasa cemil rekat gratis hoek kwkwkwk
jollajoly,mangat randak
jollajoly,kulo
jollajoly,tawa congrats ceu eh ketemu teman sampai tawa
jollajoly,titip indah kemarin ra
jollajoly,pecah si rasa sama seperti coco ichibanya tawa sayang
jollajoly,iya tuhan mau
jollajoly,jaya jaya nya dia dia
jollajoly,mau diet tapi saya lapar jam gin
jollajoly,kalau saya jabarin sebuah z takut bilang cerewet sayang
jollajoly,burger raja heum
jollajoly,saya mau dong
jollajoly,goreng tipis tipis pakein tepung dia yumy
jollajoly,bentar puasa sekarang latih tidak buat dosa kecil apa
jollajoly,kenapa kesal sama sedih lihat banjir bagaimana yang rasa kasi
jollajoly,mungkin em mudah sekali tertypu tawa
jollajoly,saya sama ayah dapur lagi goreng sukun terus tiba tiba suara gadis ktawa sebentar terus hening saya sudah lihat lihat ayah saya blng siapa dek apa langsung lemas kira yang lantai atas sudah berani ngegangu haha tapi tahu tangan saya tidak lwt depan televisi habis mencet tmbol kuasa
jollajoly,matak anda bisa kwkw sudah sudah tidak coba coba
jollajoly,sidang perkara apa kan anda sudah lulus kalau kuliah tawa
jollajoly,benar sebentar mala tidak bisa tidur
jollajoly,tidak melek tidak bisa tidur
jollajoly,yipi besok libur
jollajoly,mau
jollajoly,h napas orang neraka dunia
jollajoly,tadi prasanya acak acak sekali sholat lgsung redalhamdulilah
