username,tweet
salisnurk,kalau sakit hati kero bang
salisnurk,benang kusut pikir
salisnurk,saged basa jawa saudara laki
salisnurk,bebas badan dana sawit penting konglomerat tandatangani petisi lewat
salisnurk,tidak sms sama telepon saja
salisnurk,kenapa dek saya sudah tidak pakai whatsapp hampir tengah tahun
salisnurk,bosan bosan lagu
salisnurk,sudah waktu passes sudah sedih passes scars akan hilang
salisnurk,buka lokasi celaka palu punya thor
salisnurk,drama laku per utama gadis ajaib sekali
salisnurk,setrika juta umat
salisnurk,kreatif malas pepet beda tipis
salisnurk,semoga jual laku
salisnurk,buat atas jam dipoto cuma belakang doang
salisnurk,pakai yang buat sendiri sesuatu sekali
salisnurk,tas serut rajut proyek favorit masuk mudah buat cepat lama cuma tunggu kirim benang iya baju rajut sendiri yang minat pesan
salisnurk,hai teman teman saya buat tas serut rajut penuh handmade kalau minat sekali pesan saya via pesan langsung warna dicustom warna satu warna tali tas adjustable atur panjang pendek jadi sederhana pakai gaul nongki nongki
salisnurk,kemarin bahkan yang jual cabai lalap kilo saya mikirnya aduh kalau seperti itu kenapa tidak kurub sama proses tanam
salisnurk,cabai seperti itu harga tani berapa
salisnurk,serah si kucing saja deh mau bagaimana padahal pangku kayak sama angetnya
salisnurk,saya tidak tahu
salisnurk,cincin saturnus pakai buat lamar tidak
salisnurk,bittersweet oleh najla apa sih tanya benar oh titip yak
salisnurk,retweet seperti sama balas seperti itu banyak bunyi notifnya bagaimana sudah omong omong terima kasih utas
salisnurk,terus diliatin sapa saja yang jadi viewers
salisnurk,motivasi orang orang buat akun tapi gembok itu apa sih kan saya jadi tidak bisa ikuti
salisnurk,jujur saja saya malah tidak tahu nada
salisnurk,hai kenapa sudah foto bayi saja sih ayo
salisnurk,konyol pagi bangun bangun ingat tadi mimpin justin bieber konser hutan pohon jati saya tidak ngefans loh padahal
salisnurk,video pakai efek lambat gera apa memang si paus renang selow selow begitu sih gemas
salisnurk,mesti ayam e tidak kasih cemil
salisnurk,bapak ken tidak tampar boleh sini sini tidak perlu izin nyonya besar kan
salisnurk,sudah tidak tampar kali
salisnurk,tidak saya kesana sering malah tidak tugas yang jaga
salisnurk,dinakalin
salisnurk,mulut kali kali bilang tidak apa apa saya baik baik saja saya ikhlas sambil bilang segenap hati luluh lantak
salisnurk,curhat ini habis tanya kapan punya anak
salisnurk,mungkin mimpi untuk jadi lanjut
salisnurk,serius
salisnurk,terus terusin saja
salisnurk,isi gibahin saya iya sini ngaku
salisnurk,habis itu marah mau sekolah apa tonton gajah
salisnurk,yang buat telat di sekolah
salisnurk,bona gajah kecil bala panjang
salisnurk,terima kasih
salisnurk,terjemah bahasa jawa
salisnurk,makin cepat kalau uang sudah transfer
salisnurk,hai kecil burung
salisnurk,akhir turut mie ayam polsek
salisnurk,proses buat topi rata rata perlu hari gantung ukur topi makin besar makin lama harga mulai dari ribu penuh handmade
salisnurk,buat tas rajut serut saya buat topi rajut paling favorit topi anak anak pompomnya lucu sekali juga topi rajut ala anak hips
salisnurk,hakim hukum berat serang novel negara ungkap aktor intelektual balik serang tandatangani petisi lewat
salisnurk,jadi iya
salisnurk,adil negeri kotawaringin timur orang dakwa tewas tahan bebas juang agraria lik james watt tandatangani petisi lewat
salisnurk,jadi apa bapak jadi ken nonjok aduh tidak dong
salisnurk,agar jadi anda bisa t lihat makenya kayak gin
salisnurk,foto versi penuh warna tetap beranta tutup
salisnurk,eh jelas dong nenek kuwi jelas iya
salisnurk,kalau minat sen saya sekali loh
salisnurk,anda bisa lihat dong kan pola bolong bolong begitu
salisnurk,penuh handmade
salisnurk,jadi mobil tidak sabar buat foto padahal muka kucel kamar seperti kapal pecah ini versi pakai saya tapi warna edit buat nyembunyin kamar yang beranta nanti lebih niat deh foto
salisnurk,lama bulan tidak tiap hari nguwel alias rajut lebih banyak malas daripada rajin hari nguwel hari kemudian agar besok baru nguwel
salisnurk,baju buat dari gulung benang rayon helai kecil pakai hakpen mm kecil jadi dari awal buat sabar nyetok ekstra agar tidak renti selesai
salisnurk,bulan penuh nguwel benang syukur jadi baju rajut
salisnurk,acak pikir dokter gia sampai pikir
salisnurk,tinggal henti ikuti saja kenapa susah
salisnurk,itu s tengah malam dan saya hanya selesai ini cantik crochet blus di sana s sebuah banyak dari crochet sesuatu sera behind saya saya tidak tahan buat foto dulu bersih bersih pagi saja
salisnurk,sekarang pikir kali kalau mau beli produk sarang baik beli yang tangkap basah nestl mars tahu suplai minyak sawit usah bakar gambut lewat
salisnurk,mesti kowe untuk tawa
salisnurk,gumun
salisnurk,na jinja jeongmal neonte wanjeon wanjeon bogosipeoseo geureonika uri manna andwaelka hamban manusia jebal
salisnurk,maeil maeil bogosipeo
salisnurk,wisatawan kelas c yang bagaimana
salisnurk,colorful sebagai selalu
salisnurk,ehey sok tahu nya muncul ini
salisnurk,hilih bapak tegel sekali anak istri tidak ajak
salisnurk,oke bapak biaya ditangung bapak iya
salisnurk,sebrang polsek ngidul sitik
salisnurk,sebrangnya bapak
salisnurk,apa cuma saya yang tidak tonton kekeyi
salisnurk,mie ayam wetan polsek bapak
salisnurk,sudah malam bapak
salisnurk,pundi bapak
salisnurk,tumbaske bapak
salisnurk,tidak tambah tawa
salisnurk,ken mie ayam
salisnurk,bagai orang yang sering pakai wikipedia sangat terima kasih para kontributor sering sekali buka wikipedia tidak belanja rawat kulit
salisnurk,eh bagaimana admin bagaimana kata tidak pakai masker
salisnurk,akan sulit percaya
salisnurk,nenek perbarui begini kalau tidak keduluan menikah keduluan sukses ini biasa tawa
salisnurk,akhir beli
salisnurk,tes kepel mahal lama
salisnurk,malu kalau sama perempuan sebentar jadi saudari bapak
salisnurk,jadi yang nama zodiak ramal horoskop pribadi dasar golong darah lahir hari tanggal adalah bohong
salisnurk,kata guru ngajiku tidak baca kayak gin percaya salat tidak terima hari
salisnurk,padahal baca buat antar tidur tidak apa apa besok semangat
salisnurk,riak bukan teriyaki
salisnurk,lebih enak baca pakai emot jempol apa tepuk tangan tanda seru felnya kayak riak
salisnurk,tawa tidak pakai tanda seru dong ada bentak jadi
salisnurk,masker apa kuasa sudah
salisnurk,yak saja sana tidak usah rumah baik keluar ya tidak gowes tidak pakai masker apapan protokol sehat suruh pakai masker yang malah engap salah salah bablas mati
salisnurk,berita palsu pakai masker tidak tidak akan buat mati
salisnurk,yang sebut bandel tenang anda baca tidak sendiri
salisnurk,kecil berat gr besar cuma kepal tangan yang punya besar ribu gr tampung ribu gr bayi gr plasenta sampai gr air ketuban
salisnurk,air bumi api udara kala hidup bahagia damai lalu semua ubah saat anda datang
salisnurk,eh tidur mau diapain kenapa balas dendam saudara laki
salisnurk,yakin tidak ini
salisnurk,sudah tidak sakit omong omong
salisnurk,saya tidak pernah pikir
salisnurk,saya tahu bagaimana itu terasa ketika anda ucap malu segenap hati luluh lantak
salisnurk,ragu mau cabut tidak soal sekarang tidak sakit
salisnurk,sekali cabut akan sakit apa sebentar
salisnurk,sakit cuma tidak getok palu saja sudah tidak darah tidak sakit cuma takut takut enak kalau bayangin operasi cabut kuku
salisnurk,kayak gin perlu cabut kuku tidak sih
salisnurk,patuh protokol sehat
salisnurk,yang lain waktu tidur cerita ada kuliah dokter jalur paud
salisnurk,iya sama jamur merang
salisnurk,rasa definisi
salisnurk,tawa valid kenapa dek ibu ponakan sering jerawat omong omong terimakasih doa semoga balik anda
salisnurk,sudah dong masa depan doa semoga
salisnurk,mitos dek tidak percaya saya sudah buktin
salisnurk,tahu baru pulau sama pulau
salisnurk,wah iya tulis maksud euh referensi bahasa perlu tinjau ulang
salisnurk,saya baca dongeng tidur arang keren sekali
salisnurk,eh nusa madura kenapa saya tahu madura
salisnurk,hati mak nyes ingat dulu mau ikut daftar sekolah tapi tidak dibolehin karena sandal tidak ada gataunya nyata sandal tidak wadah kresek sadar tidak tenteng mana mana kira hilang
salisnurk,nanti jadi estetis ala ala begitu tidak bapak pada dasar semua yang bahan kertas sifat serap gelombang bunyi sih
salisnurk,pindah nyala curang nya tidak sih lelah tiap hari kalah hanya
salisnurk,bukan yang salah dong hati pikir dari dulu benar lurus cuma waktu
salisnurk,dih pamer maaf untuk ucap bapak saya tidak iri kalau cuma pamer kayak begitu
salisnurk,ket sayap ngono terus alesane tawa sudah bosan karantina mesti
salisnurk,akuisisi bapak yang benar
salisnurk,buat bapak saja deh mau buat tapi kenapa sudah yang punya
salisnurk,titip salam pramuka buat
salisnurk,bapak sepi twitter sini bapak sini tidak temenin
salisnurk,astaga naga bola saya tidak tidak sadar hari pakai saya anda dong sekal diajarin pakai saya saya begitu agar biasa omong omong terima kasih utas tambah tahu jadi
salisnurk,kamar jadi sedikit kedap suara kertas kan punya sifat serap gelombang bunyi kalau mau lebih kedap suara ditempelin gabus sudah sekaligus jaga temperatur ruang tetap stabil
salisnurk,eug maksud apa kenapa benci saya baca
salisnurk,teman baik orang yang agar ponselmu sepi notif
salisnurk,saya tyda tanya
salisnurk,saya bukan nanyain upin ipin tayang negara bapak
salisnurk,eh yang benar bagaimana kenapa
salisnurk,arsip dulu agar tidak lupa
salisnurk,oke baik saudara laki jadi rujuk kalau sudah mentog
salisnurk,apa cuma saya yang rasa tayang upin ipin sekarang dramatisasi adeganya jadi lebay
salisnurk,umur umur baru tahu kata yang arti keren gin saya ajar lebih banyak deh omong omong dijadin nama bayi nama tokoh novel begitu bagus terima kasih saudara laki
salisnurk,winasis apa
salisnurk,latih anak anjing sama pips agar tempat begitu bagaimana sih saya tidak bak pasir tidak kandang tangis na eotoke ken sekali miara kucing padahal
salisnurk,apa cuma saya baca seword jadi sewot
salisnurk,ken ambil kor ibu rumah sering ngomel kalau kucing soal anak anjing sama pips sembarang
salisnurk,tas buat lama hari hari pertama buat tunggu kirim benang beli online badan tas sama tali serut penuh rajut diri kantong besar tas kain katun tali serut adjustable panjang pendek sesuai sendiri harga rp
salisnurk,tas serut rajut
salisnurk,di slowmotion apa memang gera paus kayak begitu selow selow gemas
salisnurk,walikota jacob frey adil untuk george floyd tandatangani petisi lewat
salisnurk,saya tidak minum kopi anda intoleransi kafein juga saya goday enak sekali tidak apa apa lah sekal akhir sulit tidur karena gelas kopi goday
salisnurk,iya
salisnurk,lor sama mlati caket
salisnurk,aduh gusti paringana saya kuat hati
salisnurk,memang pulau padat dunia
salisnurk,mau pakai resepsi tidak pakai resepsi yang penting mampu tidak beban
salisnurk,hari tangan gemetar pikir celaka cinta nyata tadi pagi minum goday nya bungkus
salisnurk,untung sekali
salisnurk,notifikasi khusus sekarang tidak pernah bunyi
salisnurk,lulus kenang nama lulus corona angkat corona
salisnurk,jeneng e favorit mbok seko tahun kapan tetap favorit
salisnurk,vanila senja
salisnurk,mau tampil alim apa urak anda tetap
salisnurk,kenapa resolusi jadi rendah
salisnurk,podo saja
salisnurk,usaha doa dulu hasil belakang
salisnurk,mau ikut orang kalau bionya kasar sombong biasa tidak jadi ikut
salisnurk,mercon bumbung mungkin
salisnurk,dengar suara dentum tidak e
salisnurk,gemas ken sekali buat cetak kartu pos sama daki gunung langsung
salisnurk,kalitalang saudara laki
salisnurk,bukan kaliadem itumah
salisnurk,yang embak duduk seperti kalitalang
salisnurk,saya tahu mana
salisnurk,terima kasih retweet nya
salisnurk,retweet terus tidak bosan bosan
salisnurk,tidak didengerin
salisnurk,di pasar harga
salisnurk,siap bapak pembinasekalian buat pangeran bapak diskon
salisnurk,ribu bapak buat pria sebentar sesuai yang warna maskulin
salisnurk,kalau guru tipe yang tegan biasa nilai tidak dinput
salisnurk,jual backpack serut rajut shopee silah mampir lihat lihat beli boleh kenan silah retweet seperti tweet agar lebih banyak orang tahu terima kasih
salisnurk,omong omong ra folbek ini saudara wanita
