username,tweet
fanirchm27,saya belum pernah kesana saudara laki tawa
fanirchm27,kalau sudah disi dapat apa saudara laki
fanirchm27,gembira introduce saya sebuah baik orang whein dengan saya tears
fanirchm27,sama sudah tekan sekali ken ngonser gamungkin jadi yaudahlah
fanirchm27,rindu siapa saya paman
fanirchm27,hari lama satu tahun ss s rindu ngonser
fanirchm27,kasi sekali sudah tolak padahal belum maksa saudara wanita saudara wanita nya
fanirchm27,kenapa sama sih sama bni taplus muda
fanirchm27,bagaimana itu rasa nyonya kerang hijau sama pacar
fanirchm27,cie alam
fanirchm27,bni taplus muda cuma bulan
fanirchm27,bapak saya
fanirchm27,bapak asep
fanirchm27,kota independen gamasuk mana mana maaf
fanirchm27,biasa diri
fanirchm27,sudah bulan tidak minum baik jadi tiap sakit pakai minyak sampai panas
fanirchm27,temu koyo menstruasi tokopedia tapi pricey sekali jadi tidak nyetok bapak saya
fanirchm27,ya tiap haid kalau tidak minum obat anti nyeri sudah seperti mau mati diri saja tidak
fanirchm27,sayang sekali padahal saya sudah motivasi anda terus tiap hari
fanirchm27,tidak mav khusus yang waras
fanirchm27,sekali saudara laki
fanirchm27,ayo obrol oma lagi buka sesi konseling
fanirchm27,dulu tiap habis cerita sama selalu apresiasi seperti gin padahal tidak rasa habis ngelakuin yang spesial malu anda
fanirchm27,pernah kabur rumah teman garagara tidak tempat sampah tiket konser sdgkn saudara saya tempat sampah cuma hari sih soal iming imingin beli telepon dikibulin
fanirchm27,iya stasiun
fanirchm27,inap sini dong ebi agar saya tidur
fanirchm27,apa gila
fanirchm27,tidak pernah tidur selalu insomnia padahal sudah ngantuk sekali
fanirchm27,anda mbanking tawa
fanirchm27,setuju sekali tambah shopepaylater
fanirchm27,kyot
fanirchm27,musim bapak uju sama songhwa
fanirchm27,kenapa curhat saudara laki
fanirchm27,minta kali dong
fanirchm27,sampai saya selalu gin pengirim karena memang gen ibu coba dokter dulu periksa ada beberapa faktor yang buat tiap anda datang bulan jadi sakit
fanirchm27,baik sekarang buat ktp jadi orang citayem sini
fanirchm27,lingkar cahaya admin infoin dong kereta akhir stasiun lenteng agung bogor jam berapa terima kasih
fanirchm27,psb masa transisi apa iya kereta akhir bogor jam sore sekali
fanirchm27,emina kilap noda sampai tonimoli
fanirchm27,bagaimana jadi nya kamar masuk belalang
fanirchm27,tawa sekali yang nyundul bola
fanirchm27,hayo sebagai fens yang baik editin
fanirchm27,pikir bentar bentar baru kemarin nad
fanirchm27,maci byuti
fanirchm27,buka jasa bantu tidak saya minat
fanirchm27,sejak lulus sampai kan
fanirchm27,gemas sekali uju
fanirchm27,hai rindu sekali hai tawa
fanirchm27,pakai panas dan krim juga tidak mempan saking gel
fanirchm27,baru kali tangan benar benar sakit karena ngetik terus
fanirchm27,baik saya traktir boba anda bulan
fanirchm27,iya bnr kirimin saya juga malu
fanirchm27,elah kode sekali ter saya kirimin buket bunga segaban
fanirchm27,minta thr ibu malah bilang kan buat tes toep thrnya malu juga
fanirchm27,entar saja habis ki selesai yuhuw
fanirchm27,kyknya karma deh karena sudah ningalin choi larang buat sampai seo jin
fanirchm27,rindu sekali cemil jajangmyeon mujigae sayang sudah tidak padahal enak sekali
fanirchm27,tidak akhlak sekali sama jinju mentang mentang habis selingkuhin sama sungjun
fanirchm27,anda tonton memories dari alhambra cantik sekali
fanirchm27,upil hun
fanirchm27,wgwgwgw
fanirchm27,sudah bahagia hidup sama sama jin jo
fanirchm27,iya tuhan yobo saya tonton ah
fanirchm27,selamat ulang tahun
fanirchm27,bingung saudara cara ngabisin uang bagaimana
fanirchm27,loncat memang sudah kenal kale
fanirchm27,anda kenapa sih paman
fanirchm27,tawa
fanirchm27,sayang cinta saya hilang anda each dan every hari
fanirchm27,tadi anda pakai resolusi berapa biarawati
fanirchm27,biarawati streaming abisin berapa gb gb cukup tidak
fanirchm27,tutup atas
fanirchm27,kirimin tolong makasar
fanirchm27,tidak sih saya ngestalking dulu tidak temu soal mai rapih
fanirchm27,tidak saya dulu tempat sampah nya terus jadi tidak coba menu baru tidak se enak perkedel nasdang jadi lapar
fanirchm27,saya pakai perkedel doang sama kuah rendang saja sudah lahap
fanirchm27,perkedel kuah sayur warna kuning apa nama
fanirchm27,niat tonton drama korea doang buat isi libur lebaran e kenapa terus
fanirchm27,kisah cinta tentara bekas anak budak sama putri bangsawan
fanirchm27,saya daritadi ulang ulang
fanirchm27,ditunguin kenapa kan jodoh
fanirchm27,saya sama pa sigit tidak bilang bilang
fanirchm27,di nyata hidup tidak bisa ngambil hati deoksun wakakaka
fanirchm27,ohiya panci mewek tidak senyesek saya hilang anda yang tiap episode nya buat ngembeng hanya
fanirchm27,tolong goblin sama vagabond tidak sedih pakai sekali
fanirchm27,kata deoksun tidak peduli yang penting dia s ranjau in saya hidup
fanirchm27,junki
fanirchm27,saya hilang anda hilang anda days hai selamat tinggal ibu
fanirchm27,hai sembarang
fanirchm27,saya tidak tahu saudara buka slot
fanirchm27,biarawati tahu begitu tadi saya ikut sama anda
fanirchm27,oiya astaga saya malu
fanirchm27,ywdh gapapadeh saya butuh hibur
fanirchm27,saudara saya sudah isi bentuk mes garis
fanirchm27,kenapa sih anda tidak dukung sekali saya
fanirchm27,vod beyond langsung sj liptint
fanirchm27,saya jadi ikut ngebayangin
fanirchm27,sampai cari google psikopat siapa tidak dong
fanirchm27,yang jual sj beyond langsung vod ribu tapi saya beli liptint saja deh
fanirchm27,sampai yesung besok teasernya tidak nyengir awas
fanirchm27,tonton drama memorist sampai episode cari psikopat susah sekali bangsuy dikecohin hanya parah pusing
fanirchm27,sayang kenapa anda nyengir
fanirchm27,ngidam nya apa beli nya apa
fanirchm27,saya kalau jadi anda saya biadab in sher tawa
fanirchm27,tidak apa apa balas sama tuhan swt iya sher
fanirchm27,sher apa saya kira saya paling ngenes wakakakaka
fanirchm27,monmav tidak hilang hari seminggu
fanirchm27,nahitu maksud mana si jaman sekarang omong pegang
fanirchm27,bulshit
fanirchm27,ehehe
fanirchm27,minta maaf buat apa jadi sudah minta maaf
fanirchm27,iya bapak presiden
fanirchm27,tidak menang depok banjir
fanirchm27,aile saya akan pergi untuk anda seperti pertama salju tidak obat
fanirchm27,thr
fanirchm27,juga tidak kontak jadi tidak tahu saya section hijau tawa kuat sekali perut anda
fanirchm27,ih bodoh nya dulu ss s tidak meetup sama anda minum yang ada rasa bukan sih sumpah kuat sekali
fanirchm27,sudah fase jam jam sahur ngunyah cemil tengah sadar
fanirchm27,pantas tiap habis konser saya miskin sekali serebun tidak ya memang mahal mahal sekali sih minimal harus bawa uang ribu
fanirchm27,akhir karena misquen beli nasi liwet sama ayam sudah paling murah tidak ss s total sama minum ribu tapi tidak kenyang
fanirchm27,harga berapa deh bi bukan tawa
fanirchm27,niat sama mauk beli teokpoki eh apa sial ukur nya kecil sekali sama ukur nasi kfc banyak nasi kfc sudah
fanirchm27,lokasi tidak cemil beli air putih merk prima ml ceban cuy
fanirchm27,terus bingung pulang bagaimana tidak sewa hotel habis laba konser selesai pulang apa tidak
fanirchm27,dikit tahun ss s tahun lalu tanggal gin sibuk pikir ujan matkul kerja rumah sampai cari pakai buat konser h
fanirchm27,ken sekali tonton supershow entah kalau tonton konser itu semua hal yang buat sedih hilang tangis hilang anda jadi banyak paman
fanirchm27,rindu jajan es kopi lawson mangarai
fanirchm27,sekarang sudah tidak kan saya tidak rela bagibagi mav
fanirchm27,cakep benar
fanirchm27,iya dibebasin cuma kasi sendiri
fanirchm27,bah
fanirchm27,jongki nya tetap jadi srigala manusia tetap tinggal rumah gadis dulu gakemana mana
fanirchm27,dit kemarin seperti baru sidang bareng sudah debut saja
fanirchm27,saya pernah nyanyi brg raisa itu paling kencang
fanirchm27,kerja ki mendengarkan lagu india enak sekali
fanirchm27,saya tahu lagu
fanirchm27,semoga saya gin juni
fanirchm27,iya maaf nugu sekali gasih
fanirchm27,tetap saja mau sama siapa bodyshaming fatshaming tidak baik
fanirchm27,iya saudara sih tadi saya cari fensnya playing korban sekali
fanirchm27,saya juga baru tahu tidak undang sjtv
fanirchm27,anda jadi youtuber saja pakai jas ada temu tonton
fanirchm27,sudah siap sekali ujan kerja rumah bung
fanirchm27,saya bom kesana sudah tutup saja sih
fanirchm27,tidak sih gin saja terus lama lama nya tidak pikir hal yang buang waktu
fanirchm27,enak fase benar benar produktif sekali terlalu nikmatin sampai lupa sama fikiran nethink liar kepala
fanirchm27,kolam saksi bisu saya sabrina sudah gone
fanirchm27,saya aminin sudah anda
fanirchm27,sekali telepon langsung bangun memang mau sidang saja coba tidak jam baru bangun
fanirchm27,yupsie terimakasih anda
fanirchm27,doa dong
fanirchm27,semangat teman sekloteran puces nazla omaci
fanirchm27,besok sidang sudah pasrah sekali
fanirchm27,ayo ayo
fanirchm27,tolong rumah saya
fanirchm27,oiya tawa geblek ngepas sekali sial
fanirchm27,tawa sekali sial saya rasa teman anda begitu mak
fanirchm27,vira senang ulang tahun
fanirchm27,saudara tolong ambilin uang tidak mata rabun mata juga rabun ibu
fanirchm27,sudah hari atm bca selalu saja orang yang minta diambilin uang buka tidak mau tolong sih takut
fanirchm27,tawa selamat emosi
fanirchm27,tidak rasa
fanirchm27,bangga sekali deh teman saya profesional saya ibu apa modal tumpu agar hapenya nyender
fanirchm27,total sekali bangga deh
fanirchm27,veteran stan
fanirchm27,riuh buat tiktok lagi revisi dong
fanirchm27,saya pantas lebih baik saya pantas lebih baik saya pantas lebih baik saya pantas lebih baik saya pantas lebih baik saya pantas lebih baik saya pantas lebih baik kan bapak
fanirchm27,sumpah sudah tidak mau tahu demi apa
fanirchm27,mau nang depan buopi
fanirchm27,takut buopi nang baca malu
fanirchm27,tulis apa saya bulan
fanirchm27,bagaimana cerita jarak sidang seminar proposal tugas akhir cuma bulan
fanirchm27,bapak leable
fanirchm27,senang la la la
fanirchm27,baik saya dandan lantai
fanirchm27,saya saja yang jam pikir berapa saudara wanita kuota saya hilang
fanirchm27,gila tawa sygsyg beterai sygsyg kuota
fanirchm27,mendengarkan lagu tiba tiba tidur jam tidak buka telepon spotify nya ngeplay
fanirchm27,pakai anggota fanship saudara
fanirchm27,iya tuhan astaga
fanirchm27,memang si deoksun kalau sudah ketemu bapak jungpal mobil gesrek
fanirchm27,terlalu percaya memang kadang ngebuat diri lupa kalau bisa pergi mana dan kapan anda pantas lebih baik saudara wanita semangat
fanirchm27,wuhuw
fanirchm27,kenapa sih
fanirchm27,ingat sekali meis jalan jalan ancol mampir lokasi sama ibu bapak banyak calo jual tiket ribu an tidak beli
fanirchm27,blay tidak gin
fanirchm27,saya ketika tonton oke drama hai selamat tinggal ibu
fanirchm27,sumpah sudah lama tapi baru balas saya takol
fanirchm27,banyak wasap saja
fanirchm27,baik buka laptop tonton drama korea pi
fanirchm27,makin lama isi beranda instagram makin racun sekali jadi malas buka
fanirchm27,seru cip tiba tiba buka telepon drakornya sudah habis
fanirchm27,pekerjaan saya tiap hari hela nafas
fanirchm27,sumpah lelah
fanirchm27,posthink pacar tonton itu raja kekal
