username,tweet
dikmabelarosa,simpan ini dude orang
dikmabelarosa,jauh yutuber masa kini nyata voldemort lebih dulu buat asmr buat ajak harry reuni forbidden hutan
dikmabelarosa,forensik dapat cerita yang urus kasus munir juga tidak hindar eh telur eh tekor eh tuhan mbuh
dikmabelarosa,benar mulai sekuel benar kandung onyen
dikmabelarosa,tidak cara draco punya anda visual
dikmabelarosa,tidak paham conan tapi seperti hercule poirot haha
dikmabelarosa,tonton bagus epik sekali
dikmabelarosa,knives keluar yang tunda karena jaga pulmo waktu akhir tonton juga satu kata e misi saya c
dikmabelarosa,suruh moksa saja
dikmabelarosa,aurat
dikmabelarosa,lihat baju jin bolong gemas ingin jait tapi fasyun
dikmabelarosa,saya saya itu kecil kota satu in seven milyar kenapa bisa t itu jadi saya daisies oleh katy perry
dikmabelarosa,senam skj dokter sekali nostalgia masa sampai dengan
dikmabelarosa,tonton itu autopsi dari jane kelinci betina ada seru sampai horor mulai muncul
dikmabelarosa,bagai belah pinang
dikmabelarosa,denialnya menteri dari sihir tidak voldemort datang kembali sudah seperti denialnya indonesia tidak corona debut
dikmabelarosa,tell twitter tidak saya
dikmabelarosa,mangkas anda hun
dikmabelarosa,senang aniv
dikmabelarosa,lawson kalau yang punya gadis jadi lawdaughter
dikmabelarosa,tawa saya tidak tahu ikut mianhae
dikmabelarosa,mantul
dikmabelarosa,sepsis kalau pria jadi sepbro tidak
dikmabelarosa,festa bts saya adalah antipeluru itu kekal mv via eh bagus
dikmabelarosa,balik kapan tidak usah balik lak wis orang lihat saya rumah hampir bulan asli sudah seperti libur semester mahasiswa baru beda kurung habis jalan hidup jeda
dikmabelarosa,iya tahap tidak langsung muncul semua
dikmabelarosa,baik terimakasih
dikmabelarosa,stealer pt suka sekali sama interaksi dua tambah sim eun rayu kiri gumush sekali pipi chubby rambut pendek
dikmabelarosa,stealer suasana mago nya rasa sekali coba dewa hotel del luna
dikmabelarosa,bagus cukup rekomendasi meski awal seperti enggan enggan mau buat tonton yang lebih tarik sisi psikiatri kdrama memang sering diselipin begini sih turut oe
dikmabelarosa,rencana lumayan dinamis actingnya wu tidak ragu visual enak lihat dramatisasi haha ken sekali sinetron indonesia seperti gin cuma cuma banyak protes orang banyak yang ngambang begitu buat gemas haha
dikmabelarosa,lebih rasa emosi tonton episode spesial karena sekali bahas psikologi seluruh drama dan saya temu itu tarik jinja tidak ragu
dikmabelarosa,tiap karakter dlmnya punya salah tinggal bagaimana diri sadar tobat saja yang benar tobat yang benar minta laknat tawa
dikmabelarosa,hikmah banyak sekali yang ambil yang paling mudah adalah dari hidup dari ji orang independen sekali hantam kali tahan akhir turun karena anak yang khilaf tidak mau ketemu lagi suka pikir karier bagus tapi anak tidak urus
dikmabelarosa,jam harus kantor begitu
dikmabelarosa,elegan pt pupuk emosi episode kemudian eksekusi dengan cakep penting overeaktif dalam hadap shg tidak punchlinenya
dikmabelarosa,ji matahari rayu seonsangnim
dikmabelarosa,tawa
dikmabelarosa,tindak elegan menang baeksang hadiah senyum sambil sumpah
dikmabelarosa,eh sudah selesai episode kapan kesan tonton twotm tidak mosi seperti yang ramai bincang orang santai sekali tonton ketawa paling tidak dialog tae cuma reaksi haha bangsul anda bang
dikmabelarosa,tawa baru baca meskipun tidak boleh ilegal
dikmabelarosa,zombie apocalypse
dikmabelarosa,anda sungguh adalah baik in making saya teary
dikmabelarosa,dan sebuah banyak dari charms untuk rang atas milik anda hari
dikmabelarosa,cantik ibu nyala sayang kelas dari
dikmabelarosa,sayang kelas dari
dikmabelarosa,saya juga
dikmabelarosa,jadi bagaimana indonesia masih panjang cara untuk pergi through budy tambah beberapa umum bijak dua rumah
dikmabelarosa,karena kalau yang disuarain baru normal yang tidak paham itu mikirnya sudah selesai oke saya mau jalan ramai mall tidak pakai masker dempet an mereka agar mereka jaga turun dan lalu anda pulled itu permadani saya sudah getting kinda used untuk jadi seseorang anda loved anda nyanyi anda kalah
dikmabelarosa,media sudah banyak yang bagi soal baru starter pak digambarin apa saja yang harus dilakuin bawa tas dia yang tidak
dikmabelarosa,bahasa yang pakai narsum sini tarik bukan baru normal baru norma maksud gembor in norma baru cuci tangan jaga bersih pakai masker jaga jarak dulu adalah lagi penting daripada gemborin baru normal
dikmabelarosa,kriteria yang pualing tarik manusia edukasi ikut serta empowered arti bias lama hampir bulan harus jadi refleks jadi hidup kalau tidak ngelakuin seperti yang kurang begitu
dikmabelarosa,kriteria sudah mulai banyak terap in tinggal istiqomah
dikmabelarosa,sisi positif kriteria kapasitas uji diagnosa makin tingkat ikut tracingnya tetap saja si arti yang infeksi banyak malu esp kota kenang surabaya yang hangus peta mangat
dikmabelarosa,kemarin featuring lonjak kasus jombs grafik merah
dikmabelarosa,kriteria justru lagi naik puncak gunung kata beliau niy bukti bandingin sama genk asean kasus hari rata pangkat
dikmabelarosa,rather daripada bilang baru normal narsum pilih istilah psb relaksasi pacar syarat skrinsyut dari ptnya bapak ede
dikmabelarosa,jadi pantas pergi untuk itu baru normal
dikmabelarosa,negara tetangga cuma butuh tahap psb sudah selesai karena manusia nurut komando jadi tapi indonesia memang negara besar pulau pimpin pikir keras timbang banyak
dikmabelarosa,sayang tidak serentak dilakuin awal utama provinsi dengan kasus tinggi bom manusia subhana tidak semua nurut
dikmabelarosa,seperti disingung awal soal karantina bijak psb perintah efektif kurang mobilisasi yang arti putus rantai sebar bukti kurva jadi landai begitu jakarta
dikmabelarosa,akhir tingkat birokrasi sampai dunia usaha buat bijak yang tegas sampai sinkron eum tidak awal yaudalaya sudah lewat jadi ajar saja seems lebih baik sekarang
dikmabelarosa,lalu tingkat layan sehat yang damping masyarakat sudah lah sudah jungkir balik lebih dunia banci tidak awal ngenes sekali krisis apd tingkat rumah sakit rujuk sampai puskesmas
dikmabelarosa,jadi bilang adalah garda depan yang benar nya tingkat penting dalam hadap pandemi yaitu tingkat masyarakat
dikmabelarosa,diam rumah cara host tidak ketemu agen tidak jadi infeksi pakai masker cuci tangan segenap upacara lain cara tidak ketemu agen maupun environmentnya tidak infeksi
dikmabelarosa,kalau ngmngin corona arti ngmngin infeksi thus ngmgin trias infeksi host manusia agen sarscov lingkung hidup faktor lingkung sini kerja fungsi karantina bulan lebih putus rantai infeksi
dikmabelarosa,simpul kasus naik terus bang saudara wanita cfrnya an testing kapasitas awal jt duduk sekarang syukur sudah naik jadi ribu tapi ketinggalan sama teman thailand sampai malaysia misal seperti apa lanjut
dikmabelarosa,indonesia sejak minggu maret hari ini kasus ribu dengan syukur nya sembuh tapi lebih nyawa yang harga hilang adalah itu tidak enough untuk jadi considered sebagai sebuah bencana
dikmabelarosa,nah yang tarik bahasa bapak ede beliau maparin data epidnya dulu dunia sampai hari hari sekian kasus sudah jt yang mati hampir rebu antara yep tenaga sehat semoga khusnul khotimah
dikmabelarosa,kawan kebal gaperlu bahas panjang dulu seperti karena papdi awal tidak rekomendasi terlalu risiko begitu
dikmabelarosa,lalu webinar yang diadain kumpul internis papdi yang ngundang ahli kesmas bapak ede yang diomongin kawan kebal baru normal sudah minggu lalu ngeshare tapi nunda ros si bambank
dikmabelarosa,baru normal psb dilongarkan bagaimana ayo kenapa seperti rasa terlalu dini buat gembor in tidak minggu pertama lebaran lewat mendadag bukan dangdud
dikmabelarosa,cause anda ll jadi in saya jantung oleh phil collins
dikmabelarosa,minta dislepet tonsil
dikmabelarosa,ada ada
dikmabelarosa,mulai oleh gaho
dikmabelarosa,disini saya pergi kasus sudah banyak sudah lama sama seperti palestine sudah lama dan punya hanya aku tanding anonim besar hacker kelompok in itu dunia robin kap
dikmabelarosa,nang tidak anda omong omong pikir fisik jarak
dikmabelarosa,ini adalah suatu saya bisa t
dikmabelarosa,kalah dia in syawal cinta adalah hidup
dikmabelarosa,doa akumulasi agar jadi prioritas seperti instagram cerita
dikmabelarosa,saya kerdil in nyata hidup tidak apa apa lah yang penting tidak stunting stunting awa pendek ganguan kognitif apa saya tarung aginst
dikmabelarosa,panas punya anda jantung
dikmabelarosa,sakarepmu le
dikmabelarosa,lokal paman
dikmabelarosa,tawa artis sama si
dikmabelarosa,saudara laki ratau dolen saya isi fednya ranukumbolo madura jember jawa tengah dulu minta dislepet ginjal
dikmabelarosa,saya mau jalan kantong tidak saudara laki besar sekali saya ini buat ngangkut baju manusia bukan baju barbie bang
dikmabelarosa,saya sungguh doing jadi gumawo saudara laki
dikmabelarosa,saya dulu pernah begini sekolah itu memang sakit belum enjoyable
dikmabelarosa,tiba tiba nyanyi senter kemudian antem sama diri sendiri soal ucap flash siram daging
dikmabelarosa,dapat notif tonight tunjuk comeback saya
dikmabelarosa,haduh tidak tawa
dikmabelarosa,asalamu alaykum copid oraemaniyeyo
dikmabelarosa,canda drnya bilang tidak apa apa bosan rumah saja yang penting aman
dikmabelarosa,dekan sampai dekanat coba untuk tetap mereka kids aman dosen paru ayo sini rsp sahabat saja
dikmabelarosa,mau sabar marah puasa in saja
dikmabelarosa,sekali bangsul tetap bangsul
dikmabelarosa,kansas tempat lahir paman duta sheila nyala
dikmabelarosa,nikmat saya betul libur
dikmabelarosa,jadi bulan rumah kena t ganggu saya iya semua
dikmabelarosa,bawa kembali otot ingat
dikmabelarosa,sudah months di rumah heaven oleh bryan adams
dikmabelarosa,nyolong tonton
dikmabelarosa,kemudian jadwal saya padet juga jadi tidak bisa tonton haha sedih bagaimana gembira sekali gdluck indonesia kemot
dikmabelarosa,wah patut coba saudara terimakasih
dikmabelarosa,mantap saudara mau gofud tapi ongkirnya lebih tawa
dikmabelarosa,duet tindak paman paman tentu
dikmabelarosa,baru mau obob tapi tin la la tanah sama tran s
dikmabelarosa,bagus buat gembira sinematografi lumayan mantap
dikmabelarosa,lanjut beberapa tempat jadi yang buat beku untuk sebuah sambil syok saudara wanita
dikmabelarosa,orang tewas sepi sekali tempat kejadian perkara nyata saksi
dikmabelarosa,gupuh habis minum tapi saja nyetir sendiri hampir nabrak biadab hasil hindar tapi kemudian nabrak orang
dikmabelarosa,cerita paman sunkyun jadi polisi divisi bunuh suatu hari mau kamar mayat karena ibu mati
dikmabelarosa,yang lain rekomendasi film sebuah keras hari yang utama paman sunkyun bapak si keluarga seperti parasit sama paman jinwong paman yang hilang sinyal
dikmabelarosa,ketok kudune
dikmabelarosa,ah baik matur nuwun
dikmabelarosa,rumah sama superindo kenapa saya liwat ringin contong tidak ketok phd haha
dikmabelarosa,lebih lurus hidung saudara laki limin
dikmabelarosa,haha idam untuk itu juga
dikmabelarosa,oat choco rasa setoberi sama grinti buat lidah nyaman
dikmabelarosa,dulu suka sekali rindu tengah mati karena bisik voicenya bang rian yang kaleum sekali masuk kuping langsung leleh hati nada mv nya elegan sekali
dikmabelarosa,satu dari legendaris psau sesuatu
dikmabelarosa,tipikal orang matematika gas haha buat garis lebih lurus jalan hidup saya
dikmabelarosa,dapat siap
dikmabelarosa,sumpah belah ndi
dikmabelarosa,sumpah nandi
dikmabelarosa,died
dikmabelarosa,sumpah nang
dikmabelarosa,hai saya harta anda cimoreli baik enough resmi video via
dikmabelarosa,habis tonton bang dika coba belum ubah meskipun
dikmabelarosa,spotipai kalau mendengarkan bang muzamil tetap lyricnya iya tulis arab
dikmabelarosa,anda tayang
dikmabelarosa,asia cuma wakil saudara wanita mulan
dikmabelarosa,jumandi itu lanjut tingkat kecewa paman batu andalanq
dikmabelarosa,tawa di hari akhir sesak
dikmabelarosa,tunggu mulan tahun kemudian gantung lantai
dikmabelarosa,akhir hari saya bangga dengan saya haha
dikmabelarosa,isi hari ngepel rumah sendiri kemudian buka siang
dikmabelarosa,saya tidak mau yang lucu
dikmabelarosa,hebat kemarin yang dayak sama jawa
dikmabelarosa,resep saudara
dikmabelarosa,weathering dengan anda bagus ya film saudara jepang cerita remaja perempuan punya kuat kendali cuaca
dikmabelarosa,memang iya anak bandel sekali sudah disuruh rumah saja itaewon
dikmabelarosa,suruh tetap aktif cara berani
dikmabelarosa,jadi ayo lebih pintar nurut semua lelah bisa kenapa yeorobun
dikmabelarosa,akhir kali ikut rjp igd sampai jam tapi akhir pasien tetap tidak saya yang tidak hadap langsung sama keluarga saja rasa hampa
dikmabelarosa,pernah bangsal pagi sekali cuma koas awat tiba dimintain nensi salah satu pasien sama awat nyata habis pasienya henti jantung rjp sendiri ditanyain terus sama keluarga ayah bisa selamat kan dokter mau nang
dikmabelarosa,pernah jaga jam awal dari shela mau habis shiftnya eh sore belum pulang dari shela sudah datang masya sehat dokter semoga edukasi lebih banyak lagi yang nyangkut pikir masyarakat
dikmabelarosa,stasiun saudara wanita
dikmabelarosa,nyata orang pikir seperti gin tawa
dikmabelarosa,yang bicara saya yang malu iya tidak haha
dikmabelarosa,eh ide tambah nama terimakasih untuk anda
dikmabelarosa,saya jantung lantai tapi berterimakasih
dikmabelarosa,barakalah ibu
dikmabelarosa,sampai sekarang berani tonton video retire nya
dikmabelarosa,jadi saksi emas olimpiade nya owi butet satu satu wakil indonesia tidak puruk nang sekali waktu semoga ketemu paman owi sebagai latih olimpiade amin
dikmabelarosa,bulan rumah ngaduk kopi dalgona terepic haha
dikmabelarosa,bagai ambivert tonton dulu
dikmabelarosa,mahir sekali ngeditnya sampai tidak renti ngeliatin gumawo saranghae
dikmabelarosa,mahir sekali nulisnya sampai buat orang nang kalau baca kati untuk punya anda biasa xoxo
dikmabelarosa,saya ll lihat haha
dikmabelarosa,punya beranta sekali tidak valid jadi acu tawa
dikmabelarosa,hari akhir iya kemudian tabok dismenore
dikmabelarosa,tuhan memberi banyak diskon doa banyak banyak ke yang paling tidak penting
dikmabelarosa,tonton drama tapi ngajinya lebih lama mentor terluv
dikmabelarosa,anda nya saja lah selamet syukur semoga tidak ada buntut segera dapat yang lebih cangih
dikmabelarosa,iya turut ngana saya suruh ajar rumah bulan panik bukan remeh kata orang
dikmabelarosa,ken nyanyi yang kencang begitu tapi saya punya tetangga
dikmabelarosa,na buat
dikmabelarosa,teman saya yang kedengeranya paling semangat motivating sekali
dikmabelarosa,untuk itu dearest ayo dari saya terimakasih anda untuk urus dengan itu lalu dan saji untuk pelekat together through tebal dan tipis dan untuk jadi siapa anda adalah anda harus jadi braver dan tidak overthink sesuatu saranghae
dikmabelarosa,alarm mahmuda saya tiap pagi bangun gara alarm orang memang
dikmabelarosa,biarin saja diare sampai dehidrasi berat
dikmabelarosa,tanding dari ji
dikmabelarosa,sebentar memberi prescribe obat psikotropika untuk minta imbal kyknya pelangaran
dikmabelarosa,sido tawa ejek ketawa
dikmabelarosa,mulih kerjo tekan njobo durung wijik wis mangan ckck tidak tiru yeorobun
dikmabelarosa,setuju episode lengkap disini saya pergi
dikmabelarosa,iya senang warna
dikmabelarosa,lahir kamar operasi besar jombang ayah orang jombang ibu orang jombang sering tanya kenapa tambah cilik bangun kenapa makin kecil bada saya susut seperti kerupuk didiemin
dikmabelarosa,versi sebuah jin matahari rayu melati daeva oktavianti biasa lee tae praven jordan c yeo da kyung saina nehwal saudara putra je hyuk wang yilyu orang ngefans sekali kyknya sama melati tawa e admin hyun seo tai tzu ying
dikmabelarosa,versi sebuah jin matahari rayu huang yaqiong biasa lee tae zheng siwei c yeo da kyung lilyana natsir saudara putra je hyuk lee muda dae e admin hyun seo carolina marin
dikmabelarosa,versi sebuah jin matahari rayu ayo fukushima biasa lee tae fajar alfian orang cocok saja haha damai c yeo da kyung ratchanok intanon saudara putra je hyuk kento momota e admin hyun seo sayaka hirota
dikmabelarosa,ganti password dulu
dikmabelarosa,kyknya aman kemarin konfirmasi tidak sampai data pribadi seperti password data bayar coba periksa email punya kena canva malah tawa
dikmabelarosa,tokopedia baru saja lihat surabaya kyknya tapi memang belum banyak ulas
dikmabelarosa,tidak pernah balik sama mantan yang mutusin duluan
dikmabelarosa,hai itu s oke itu s oke anda baca selamat datang dan terimakasih ayo
dikmabelarosa,du ken tonton haha
dikmabelarosa,iya sayang sekali
dikmabelarosa,saya dipangil sus
dikmabelarosa,seperti gin biasa di gramed dk
dikmabelarosa,ambyar waktu
dikmabelarosa,soal cuma drama
dikmabelarosa,ramadhan nuzulul quran iqra quranya milea iqra quranya dil
dikmabelarosa,lingkar yang mati saya mau ajar buat naikin suasana hati tonton moana dulu ah selesai pikir sudah ngantuk besok saja besok tidur seperti mati ulang astaga tobat milea
dikmabelarosa,tawa saya hanya manusia afteral
dikmabelarosa,habis lewat stasiun solo balap rasa tidak sama
dikmabelarosa,yang berpatern begitu
