username,tweet
husnavinaa,kenapa langsung keingetan cerita novel anda nya tere liye omong omong semoga cepat ketemu titik cerah nya
husnavinaa,dong bangun jalan tol tidak disamain konsep kayak buat kue lapis kayak kue wafer tango tidak perlu putar lapis begitu lah shay
husnavinaa,saya ajar jadi banyak tentang hubung dari kita parents
husnavinaa,kasar sial
husnavinaa,emoji mau bicara kasar tapi tahan
husnavinaa,semangat bapak semoga selalu lancar rezeki amin
husnavinaa,mimpi tentang itu hari ketika anda bangun atas dan temu itu apa anda yang looking untuk has telah disini itu seluruh waktu
husnavinaa,semoga aman saja
husnavinaa,ken ketawa karena sedih
husnavinaa,terus sekarang teras an sepi dengar mau tetap lanjut sampai dago
husnavinaa,kalau saya situ seperti sudah nang lihat lele ukur ember saja takut
husnavinaa,sekarang yang dubbing bukan sekala
husnavinaa,bagus sekali
husnavinaa,hormat
husnavinaa,semangat semoga cepat sembuh untuk saudara amin
husnavinaa,izin simpan pos
husnavinaa,catat ini
husnavinaa,iya iya tawa
husnavinaa,butuh berapa mobil tawa
husnavinaa,sumber pinterest
husnavinaa,iya benar yang seperti gin ini
husnavinaa,ken jalan jalan semoga pankapan jalan jalan sama sobi
husnavinaa,ada yang baru tahu kalau tampil tiktok karena tidak punya tiktok tos
husnavinaa,alas tidak mau tonton film ngeri saya berani kalau saya tonton ngeri saya jadi takut makanya saya tidak tonton saya berani
husnavinaa,bapak adalah saya
husnavinaa,walaupun begitu tiap orang tetap punya hak ekspresi ada lewat bagai cara mau cuit twitter instagram cerita video tiktok dulu bebas pilih lama tidak rugi orang ya silakan
husnavinaa,orang tidak tahu peras kalau sendiri tidak bilang peras bukan tebak bukan salah kalau tidak paham peras tapi nya saja tidak coba bilang mereka
husnavinaa,iring tambah usia makin sadar kalau sedih perlu umbar tidak harus seluruh dunia tahu tidak semua orang peduli sama peras dan memang bukan tugas juga peduli
husnavinaa,pernah fase mana kalau dilema langsung curhat media sosial pasang quotes lagu sebagai kode harap orang yang di maksud akan tahu peras ke terus
husnavinaa,setuju sekali ken suatu saat orang indonesia lebih pilih naik sepeda motor
husnavinaa,yoi betul
husnavinaa,kalau tidak mau putus modal inti tawa
husnavinaa,ingat tidak tidak jadi kayak anak hilang gambir cuma ikut duduk sama beli kfc doang tawa
husnavinaa,ngobrol sama sohib lama yang benar nyambung sama itu memang suasana hati dorong sekali
husnavinaa,pantas saja tawa tapi rumit yak
husnavinaa,orang yang pakai indihome bisa akses netflix pakai orang dalam apa bagaimana butuh cerah
husnavinaa,seperti calon saudara pria saya begini ini sudah beberapa kali belanja online buat rawat kulit lama rumah saja sedang saya saja gabeli apa cuy
husnavinaa,oalah saya tidak paham bahasa bola malu makas jasa
husnavinaa,yang paham maksud dido tidak sih
husnavinaa,bew goa bukan anak psikologi sih tapi siapa tahu bantu
husnavinaa,bayang saja sudah rumit
husnavinaa,nama game nya redecor kayak gin mainanya
husnavinaa,coba redecor deh seperti anda akan suka
husnavinaa,yang sayang besok nya habis saudara
husnavinaa,bisa rasa dong beda orang benar usaha buat kasih bantu tiap kita butuh bantu iya ampun teman kayak begitu itu tak nilai sekali
husnavinaa,dulu kayak paling sering ribut sama daripada teman yang sekarang malah jadi orang selalu usaha kasih bantu tiap dimintain manusia memang ubah cepat ya
husnavinaa,ayo pindah nyala ayo
husnavinaa,iya ampun masbayik gemas
husnavinaa,hai saudara chava saudara laki biru sayang tidak takut buna kan selalu teman terimakasih buna suara biru loh
husnavinaa,soundtrack al hakims keluarga nyangkut kepala
husnavinaa,gulir tweet memang nagih
husnavinaa,bapak perbarui sekali ikut cenderung hormat
husnavinaa,ini adalah jadi
husnavinaa,yang butuh hibur baca balas tweet tawa tawa
husnavinaa,wakakakakak
husnavinaa,terima kasih banyak atas dedikasi bapak antar dan banyak anak lain senang baca dar sampai dengan lewat buku buku kpk pinkbery dulu semoga jalan baik untuk lanjut
husnavinaa,saat anda rasa banyak yang selesai anda baik ada saat anda rasa urus hidup sendiri urus kebahagianmu sendiri
husnavinaa,anda tahu ini adalah itu purest jenis dari cinta ketika seseorang bicara untuk allah tentang anda tanpa anda penuh arti sebut anda in dia doa dia doa untuk milik anda bahagia untuk milik anda hasil ini adalah itu most harga hadiah dia bisa beri untuk anda dan ini adalah sebuah bentuk dari deeper cinta
husnavinaa,baru mau ucap sudah tidak tren selamat hari jadi kota surabaya semoga saya segera unjung amin tidak tahu ken sekali surabaya wakakak ken tahu berapa kota nya surabaya
husnavinaa,bilang tidak lihat masa lalu bilang tiap orang punya sempat ubah jadi lebih baik mereka juga harus ingat kalau orang mereka lihat hari bentuk apa sudah dilakukanya kemarin
husnavinaa,suasana hati ayun mode nyala
husnavinaa,wkwkwkwkwkw
husnavinaa,kerupuk ikan saya nyebutnya karena bentuk mirip ikan cuma nemuin zona rumah nenek saya jawa
husnavinaa,ayo jakarta semangat benah
husnavinaa,sudah lama usaha diam cukup amat bagaimana cara kerja perintah pusat hadap pandemi karena bahas seperti sudah bisa rasa sendiri juga nilai sendiri kali kalau hubung sama perencanan bangun argh tidak bisa diam saja
husnavinaa,kalau yang bilang merat bangun ini kan bangun rangka tangan wabah pandemi sesuai butuh yang paling penting dong beda kasus kalau pandemi sudah akhir ayo lanjut merat bangun nya
husnavinaa,yakin tidak rencana baik semua tahu episentrum sebar virus pulau jawa anga kasus ting terus buat apa jauh bangun di pulau riau tanya dasar sekali ibu
husnavinaa,gemas sekali yang gin buat putus asa sama negara sendiri masterplan perencanan bagus apa akan kalah sama utama politik
husnavinaa,cerita lama perintah itu tidak kurang orang pintar cerdas banyak tenaga ahli bapenas atr yang buat analisa butuh sarana sehat yang paling tepat sasar untuk tangan wabah saat dari segi lokasi yang kurang cuma satu pihak perintah
husnavinaa,yaelah perencanan semua percuma kalau pelaksanan pembangunanya bentur dengan penting politik sudah buat masterplan bagus tidak mau sahkan jadi perda malah diutak atik proyek cuma jadi ambisi pribadi percuma suara mahasiswa perencanan
husnavinaa,haru
husnavinaa,tidak jadi video tiktok bew tawa
husnavinaa,rehat harus malas bukan jawab dido mantap
husnavinaa,wakakakakak
husnavinaa,kalau saya ibu jadi cara nerapin atur buka media sosial cuma tiap jam sekali misal jam pagi siang sore dan maksimal cuma menit tidak lebih dari jadi latih diri kontrol sama diri sendiri
husnavinaa,bisa
husnavinaa,saya jadi ikut utama game nya dan suka sekali padahal saya bukan anak game orang utama ludo cacing ml segala macam saya tidak tarik tapi yang macam redecor gin suka sekali terimakasih saudara uwi kenal pada game
husnavinaa,buat yang suka rasa pikir nya penuh padahal tidak tahu pikir apa coba deh puasa media sosial kalau sudah coba baru rasa sendiri pengaruh benar rasa lebih sejuk ringan saja begitu pikiranya
husnavinaa,walaupun tidak yang benar hari tidak buka media sosial sih tetap saja buka media sosial kali hari lama maksimal menit masih belum tahan tidak buka media sosial pagi malam itu ubah jauh dari yang biasa jam betah utama instagram twitter
husnavinaa,coba tahan diri buat tidak buka media sosial nyata sejuk saja rasa tidak tahu kenapa apa pengaruh lihat hidup orang dunia maya penuh pikir otak bagaimana pokok begitu lah tawa
husnavinaa,akhir hasil hari tahan diri buat tidak banyak buka media sosial sejak rumah saja biasa bangun langsung pegang telepon cemil periksa instagram detik belum tidur juga ngeliatin instastory artis
husnavinaa,yey
husnavinaa,ayo puasa media sosial ayo ayo
husnavinaa,tidak lupa minum beruang brand
husnavinaa,mulai pasuk waktu indonesia pikir lebih
husnavinaa,banyak yang erti hidup juga tahu tanya siapa akhir sudah saja
husnavinaa,anda jadi makin semangat buat akun buat pos tulis kecil saya
husnavinaa,salat ied rumah kemarin para ciwi naik standar untuk calon nya harus jadi imam salat ied
husnavinaa,terlalu sering kalah hingga lupa rasa bahagia anak pertama
husnavinaa,iya pernah baca sih begitu tapi benarkan jika saya salah tawa
husnavinaa,terima kasih wakil jawab
husnavinaa,kalau mbti tahu saya memang ubah tir gantung kondisi tidak kerja tes nya yang dinget tidak ubah kira ubah apa dalam hidup yang sblmnya yang jadi buat hasil ubah
husnavinaa,tuhan ken minta jatah sakit gigi ganti sama sakit hati saja tidak
husnavinaa,maaf lahir batin baik selamat lebaran
husnavinaa,sedih sekali tidak sih sudah kayak hari biasa saja
husnavinaa,orang yang jarang sekali foto diri sampai akhir foto diri arti yang salah alias bosan sekali lebaran kali sepi huehueheue
husnavinaa,benar jarang sekali lebaran rumah kayak gin hampir tiap tahun selalu lebaran rumah mbah jawa sekali lebaran rumah tidak salam an
husnavinaa,sholat ied dengan protokol periksa
husnavinaa,insya sudah maafin semua satu bulan peta
husnavinaa,selamat ulang tahun saudara laki bayik tumbuh jadi anak hebat dari saya ikut anda sejak piyik
husnavinaa,dengung versi arif lokal
husnavinaa,yoi rusak hai pasang nya dido
husnavinaa,iya sekali baik jadi semangat juga sahur lihat cerita dido tawa
husnavinaa,akan rindu hai pasang ini adalah saya menu
husnavinaa,oke kita ganti maksud bukan dewasa deh bijak sudah cocok bom
husnavinaa,iya ampun dewasa gin nyata bang
husnavinaa,semangat ngeditnya tawa
husnavinaa,iya terus backsound nya lagu taruh milik anda tangan in ranjau
husnavinaa,video tiktok yang manis begitu bew
husnavinaa,sumber
husnavinaa,diri nila adalah recognizing saya saya lebih besar daripada semua dari itu sesuatu itu adalah sebuah deep penuh arti itu saya saya dari value itu saya saya loveable necessary untuk ini hidup dan dari tidak bisa erti nila
husnavinaa,nyata over pikir tidak cuma jadi tidak tidur saja tidak bangun tidur bisa tiba over pikir
husnavinaa,ambil chances buat mistakes itu bagaimana anda tumbuh mary tyler lagi
husnavinaa,tidak pernah belanja online via website sekali coba buat tekan website kali turun loading nya lama sekali jam diabisin cuma buat sen itu belum sampai konfirmasi bayar
husnavinaa,rusak jam tidur malam sekali
husnavinaa,kacau jam gin segar sekali tidak ngantuk sama sekali anda tidak ngantuk siang anda tidur teus anak tahun
husnavinaa,di dunia politik hadu
husnavinaa,sudah berapa kali ulang tidak kagum lebih sama orang titik
husnavinaa,wah saudara laki moreno
husnavinaa,saya pernah ambil kab landak jadi studi kasus tugas terus sedih lihat
husnavinaa,dan sudah ini far anda yang masih tanya kenapa semua dari itu sesuatu jadi untuk saya
husnavinaa,baru sadar ini masjid bagus tiap lewat tidak pernah ngelirik seperti tawa
husnavinaa,siapa si yang kalau chatan suka bicara sendiri dulu jawab yang mau balas apa terus baru ketik
husnavinaa,malang mana saudara sama kayak ibu hohoho
husnavinaa,sayang saya henti blaming milik anda diri
husnavinaa,ayo siapa yang cair juga kalau dapat apresiasi kayak gin
husnavinaa,memang aneh sekali dasar saya
husnavinaa,seperti istikhoroh ibu putt perkara wifi memang penting kalau masa seperti gin kan tawa
husnavinaa,saudara laki dilema saja ini tawa
husnavinaa,tawa oiya goa sudah seperti tinggal jaman batu saja yak
husnavinaa,gangerti si tapi kalau goa ibu tweet nya tidak loading begitu
husnavinaa,mau buat zoom temu buat grup obrol
husnavinaa,oiya kayak pribahasa yang cari jarum jeromi nas
husnavinaa,akun twitter yang lama nya locked belum balik seperti buat akun baru deh tahu goa sih begitu
husnavinaa,belum pernah restoran warung lama bew tawa
husnavinaa,kalau habis ada yang ngedm bilang rindu baik tanda kayak sinetron
husnavinaa,kalau teman tiba ngedm bilang rindu waktu dekat tanda nya apa kenapa langsung rasa aneh
husnavinaa,terus siapa akan jamin kalau urus di dapil nya masing cuma kerja kalau melipir rumah keluarga bagaimana
husnavinaa,baru tonton asimetris di jalan tonton yang
husnavinaa,beberapa lagu akrab sekali kuping walaupun tidak paham arti padahal orang jawa tapi enak saja mudah listening buat rasa jadi orang jawa sering mendengarkan dulu tidak pakai mobil yang radio pakai kaset baru nyadar nyata lagu milik alm inalilahi
husnavinaa,jadi bagaimana orang balik akun siapa bew
husnavinaa,loh akun yang ngedm nasya kan
husnavinaa,iya kenapa tapi kenapa enak turut goa kalau begitu
husnavinaa,favorit kalau kematengan
husnavinaa,apa sudah ubah gin iya ampun
husnavinaa,tahu yeyeye mirip rawon kalau jatim tidak sih turut
husnavinaa,sudah beberapa kali ketinggalan tidak hadir gaikut forum diskusi nilai ujian jeblok semoga kuliah online cepat akhir
husnavinaa,ibukota bau eh baru maksud
husnavinaa,terbaiq
husnavinaa,anda selalu lihat kurang mata orang tidak suka buah quotes saat orang ingin celaka padahal tidak pernah tahu apa sudah anda laku
husnavinaa,tidak tidur karena tiba pikir terus temu ini hua makin saja ambyar
husnavinaa,yang buat buat adon roti otomatis
husnavinaa,agar twitter ikut jadi saksi juang lawan lewat studio
husnavinaa,tuhan beri saya kuat untuk ngebut buat semua peta sebar sarana hari hari karena kemarin belum cicil amin kabulin doa baim tuhan
husnavinaa,dulu saudara wanita nana kalau pa presiden memang begitu tidak sih selalu yang tahan tidak lepas kalau sama narasumber lain
husnavinaa,pusing pikir perkot perwil peta ekdes amdal lagi studio ken keluh anda lebih untung karena kuliah semangat tidak keluh akhir istighfar jadi jalan akhir astaga
husnavinaa,tawa baru saja ibu curhat ingin buat teriyaki tidak ada bawang bombay akhir beli siung oke
husnavinaa,wah terimakasih tipsnya akhir jadi seduh kopi pindah meja cemil agar tidak ngantuk
husnavinaa,kalau mau ajar ngantuk kalau utama telepon tidak ngantuk z
husnavinaa,yang paling buat kagum sih sifat rendah nya pria mau keren apa kalau sombong suka membangakan diri sih kere akan luntur yang biasa saja terus sombong iya apa mau disombongin pria rendah baik kere kali lipat
husnavinaa,habis tonton video wawancara okin youtube awal lihat di wawancara belum nya sudah lihat ini orang rendah sekali kerja keras tidak rumit sayang keluarga suportif bertangung jawab dewasa peduli sama teman nya tuhan ken yang kayak begitu
husnavinaa,saya hormat adalah beliau pilih jawab tanya publik dengan beri jelas pribadi jauh lebih baik daripada jabat yang tahu bicara banyak orang media masih tutup kuping tidak muncul batang hidung sedikit tidak gentle
husnavinaa,jujur saya ikut bangga lihat saudara belva perintah harap positif bisa beri banyak input inovasi khusus untuk didik mungkin sekarang waktu tepat semoga jadi putus baik
husnavinaa,sempat syok tidak tadi lihat pos nya instagram dengan ikut instagram beliau cukup lama buat saya yakin dengan kredibilitas integritas sekarang betul bukti
husnavinaa,sangat hormat dengan putus saudara belva berani ambil sikap tengah polemik yang ramai bicara orang saja beliau pilih diam pergi di depan besar jiwa menuntunya pilih hormat saudara
husnavinaa,balik kali
husnavinaa,wah memang nyata tidak ditentuin pendiem tidak nya yah semua juga pendiem saat tawa kalau gara diam rumah seperti semua orang tekan tidak sih hebat kalau tidak tekan
husnavinaa,orang extrovert energi luar diri ketemu orang banyak ngobrol sama orang baru saat mana dapat energi introvert balik dapat energi justru sedang sendiri
husnavinaa,nyata extrovert introvert bukan soal orang diam tidak dia banyak bicara tidak ini soal bagaimana dapat energi alias recharge habis energi
husnavinaa,pertama kali goa sadar goa tinggal ngekost alias sendiri satu yang lama ini goa coba sangkal karena goa rasa bukan orang yang selalu heboh ceria ketemu orang bukan yang selalu senang tengah ramai
husnavinaa,satu benda itu made saya realize itu saya an extrovert tidak ketemu tidak ngobrol sama manusia lama hari benar buat rasa habis energi hampir gila
husnavinaa,sesap setuju maaf awal goa kira bahas bijak scr umum tidak tidak sadar kalau kasus nya corona untuk bangun sadar dalam adan darurat gin betul sekali lewat sosialisasi dengan dekat yang beda sesuai dengan kultur masyarakat tiap zona omong omong baik titik
husnavinaa,goa kira tidak cara cepat buat rubah pola pikir masyarakat karena bentuk dari proses tahun makanya butuh waktu juga buat ubah jala lewat didik walaupun lama tapi solusi jangka panjang
husnavinaa,dengar putus asa tapi memang fakta begitu akar masalah satu didik
husnavinaa,selesai baca kenapa jadi sedih bayang bagaimana macan nya indonesia kala pertama asia tengara nya cukup banyak sekarang banding malaysia saja apa kabar
husnavinaa,artikel bagus ulas nya tajam keren
husnavinaa,wah
husnavinaa,dong
husnavinaa,sudah set alarm lupa mau apa saya
husnavinaa,iyadah jadi seru nyimak nya tawa
husnavinaa,makas loh tawa
husnavinaa,terima kasi saudara wanita doa yah tawa
husnavinaa,tidur siang terus mimpi lagi renang bangun langsung ingin renang habis pikir goa kerja keras agar punya rumah yang kolam renang nya terus habis periksa youtube cari vlog orang renang super duper acak ps doa nanti punya kolam renang yah
husnavinaa,kenapa tidak simpan padahal baru ingin tonton
husnavinaa,iya yah penasaran tapi takut
husnavinaa,bogor taruh iya yang jakarta kata dengar serius tidak dengar kayak jauh begitu sih memang
husnavinaa,sini kedengeran sekali malah sampai getar jendela begitu taruh
husnavinaa,awal pikir suara dinding tendang kamar bawah kamar goa kenapa sumber suara kayak jauh sekali
husnavinaa,bangun tidak tidur terus dengar kayak suara bom rasa jauh sekali usaha pikir positif kenapa penasaran tidak periksa instagram tetangga goa ngestory dengar suara dentum nyata krakatau akhir saya cari berita belum yang perbarui masuk twitter sudah ramai
husnavinaa,kalau misal yang sama laku jajar perintah tingkat atas bagaimana itu ibu orang dulu fasilitas dampak malah se indonesia loh malu
