username,tweet
yusrinasmarani,memang semua balik ke pilih si ibu saya saudara wanita susu anak saya sampai sekarang rasa utama mata sama anak muka pegang pegang canda tidak nyusuin luk ciumin tidak lagi nyusuin benar benar tidak di ungkap pakai kata kata rasa
yusrinasmarani,awal awal asi saya bilang sedikit anak saya nang terus kuning terus anak saya nolak susuin patah sekali hati rasa sampai akhir saya relaktasi hari malam kulit untuk kulit sama bayi syukur lancar nyusuin bantu sufor sampai anak saya tahun
yusrinasmarani,saya bukan orang yang mudah hal susu banyak sekali kendala teman teman anak saya tounge dasi anak saya bingung puting saya tekan nang terus sampai bilang gila sama ibu sendiri tapi kalau memang ibu mau pasti
yusrinasmarani,untuk informasi anda perintah susu sudah loh al quran coba baca al baqarah ayat
yusrinasmarani,kadang sampai kulit piss suka bruntusan cuma sekarang varen belum spesifik ini alergi apa soal kadang mkan tidak apa apa kadang bruntus
yusrinasmarani,sudah tidak pis semanjak bulan varen sudah tidak gumohan jadi saya pelan pelan coba cemil minum susu produk lagi
yusrinasmarani,sedih dulu takut sekali buat ayah marah karena takut tidak digodain tidak mendengarkan jayusanya hari sekarang malah tidak digodain dijayusin lama
yusrinasmarani,sama pispah dulu varen juga alergi tiap minum susu produk langsung gumoh banyak sekali
yusrinasmarani,ter punya anak tanya kenapa anak kecil besar terus tanya asi sufor ih kenapa tidak asi sufor saja tawa tidak habis habis
yusrinasmarani,pakai halodoc ter drive thru cepat nya
yusrinasmarani,wakakaka baik si anda paling apdet musik sampai kalau mau minta lagu selalu tanya dulu mau lagu yang bagaimana tawa
yusrinasmarani,zona merah bagaimana za
yusrinasmarani,tawa ingat jaman sampai minta mp hanya sama gerenyet
yusrinasmarani,wakwakwak
yusrinasmarani,kadang memang lupa sama nikmat nikmat tuhan malah fokus sama kekuranganya nyata lihat anak utama terus tidak mau tidur tukang gigit memang tidak nilai harga cepat sembuh sayang ibu ayah ajar jalan lagi saudara
yusrinasmarani,sudah bela bain tidak praktek agar anak sehat tapi tetap kasih nikmat sakit besok sembuh anak ibu
yusrinasmarani,saya sampai lahir tangis terus tidak selesai lahir malah bengkak padahal tidak hamil tidak bengkak sama sekali
yusrinasmarani,peluk
yusrinasmarani,sayang anda teman teman
yusrinasmarani,saya begitu dulu kalau tanjung sama bangun tidur
yusrinasmarani,pa
yusrinasmarani,rasa sebentar kalau tiba tiba teringat kamis pagi jam kuat saya selalu tuhan
yusrinasmarani,amin
yusrinasmarani,varen memang saya yang pegang sendiri dari nb sampai bulan seni cuma bantu cuci jagain kalau saya mau mandi cemil tapi sejak bulan sudah tidak diam tidak sanggup juga saya kalau sendiri
yusrinasmarani,benar ngurus anak seni asik juga rasa puas saja kasih cemil anak mandin anak nyusuin anak masakin anak cuma memang ada sekali sampai lupa sama diri sendiri cemil mandi saja sampai tidak sempat
yusrinasmarani,sayang papis canda
yusrinasmarani,paling sedih sekali kalau anak bangun nang nang tengah malam
yusrinasmarani,saya puasa puasa
yusrinasmarani,tidak apa apa yang penting tidak keluh yang arti tugas akhir
yusrinasmarani,terimakasih ajar hani jadi anak kuat pa
yusrinasmarani,semangat pispah
yusrinasmarani,apatu kenapa jadi ken tahu
yusrinasmarani,bahaya ini bangun bangun varen sudah tidur ujung kasur sekali tinggal minum sebentar tiba tiba sudah duduk ngigo di ujung kasur kan jadi takut saya itu mau tidur takut anak jatuh bahaya betul
yusrinasmarani,memang tingkat jujur orang indonesia patut tanya sekali tidak sekali kali temu pasien gin padahal ampuh sekali sama tindak terapi gilir sakit nyalahin nakesnya padahal jelas salah terapi karena si pasien tidak jujur
yusrinasmarani,ngantuk deh saya tengah malam bangun kalau tidak nenin varen menemani ibu ngobrol
yusrinasmarani,bingung sama konsep orangtua yang tidak ngevaksin anak aduh rasa ken sekali si kaum antivaksin asing saja satu pulau jadi tidak nularin sakit ibu hamil bayi bayi kecil virus masuk ke tubuh cepat sekali loh
yusrinasmarani,iya
yusrinasmarani,karena rem menang
yusrinasmarani,kasi nyata tadi malam riwil karena mau demam pagi ukur suhu nang sekali anak begini suami kerja sampai senin sehat anak ibu
yusrinasmarani,coban sekian kali kalau gin ibu juga jadi ken nanges
yusrinasmarani,cepat nongol dong gigi varen agar tidak begadang lagi ogut iya mungkin ini bayi baru tiduin tiba tiba langsung duduk kalau tidak langsung nunging
yusrinasmarani,kelilingin sama es gel ci
yusrinasmarani,saya semua
yusrinasmarani,eh ikutin kasus mana tawa
yusrinasmarani,tuhan paman sama emaknya juga baru mau tidur
yusrinasmarani,nat anda tidak ambil itu situ malu
yusrinasmarani,bayik sudah bangun ibu pura pura merem habis muka hidung saya colok colok
yusrinasmarani,tawa orang si bapak jelas jelas bilang mati sedia kenapa marah nangisin masker
yusrinasmarani,tutup nat
yusrinasmarani,wkwkwkwkwkwk wadu tidak anda juga
yusrinasmarani,bingung saya itu grup whatsapp isi dokter gigi semua tapi banyak juga yang nyebar berita palsu
yusrinasmarani,percuma dong pakai sarung tangan kalau bada turun bodoh sih jadi orang
yusrinasmarani,saya habis lihat benci sekali tawa terus apa si pakai sarung tangan megang megang muka begitu
yusrinasmarani,aman kenapa menang malu tinggal aman menang mana mana pakai masker
yusrinasmarani,atas tinggi menang
yusrinasmarani,tuhan sampai tidak tidur mantengin jasa titip bw
yusrinasmarani,samiun tawa
yusrinasmarani,pdgi mana nat tawa bangkrut memang
yusrinasmarani,jadi ibu istri harus kuat pepet kanan kiri
yusrinasmarani,misi
yusrinasmarani,tawa saya menang paling halusinasi lihat maps sampai pernah nyasar serang karena tidak bedain utara selatan
yusrinasmarani,makin jadi ibu ibu kebahagian makin sederhana anak anak anjing bahagia anak cemil lahap bahagia anak ketawa bahagia anak tidur nyenyak bahagia syukur tuhan
yusrinasmarani,semangat wina
yusrinasmarani,larang gigit kaidut
yusrinasmarani,sama si malu tapi enak juga punya anak jarak dekat tapi tidak bayang lelah hadu
yusrinasmarani,le teman saya banyak yang bobol le
yusrinasmarani,wakakaka cinta anda tik
yusrinasmarani,tul tul tul yang penting cari pospak yang cocok sering ganti sudah aman tidak cuci cuci niat mau bersih malah takut jadi jorok karena nyucinya tidak bersih
yusrinasmarani,kalau saya selalu hakim apa saja yang anda lakuin
yusrinasmarani,habis mutusin seni rasa seperti mutusin pacar mewek
yusrinasmarani,kai sama varen ini maksud
yusrinasmarani,dia kenapa rem
yusrinasmarani,tidak bawa rasa tidak bawa rasa
yusrinasmarani,definisi mau nang benar lihat langsung melukin anak saya
yusrinasmarani,tawa lucu
yusrinasmarani,sakit yang timbul karena pisah tidur sama anak
yusrinasmarani,tidak
yusrinasmarani,benci sekali sama orang yang ngamen suara kencang sekali cari uang tapi tidak ganggu orang kan
yusrinasmarani,tawa sekali
yusrinasmarani,syukur saya kati
yusrinasmarani,akhir ibu turun mana bayik tidak mau tidur tidur memang jadi ibu tidak sakit
yusrinasmarani,mau nang
yusrinasmarani,ramai sekali tidak yang mau saling an
yusrinasmarani,apa cuma saya yang ken ritwit tweet cimeng cuma saya cuma saya
yusrinasmarani,bayi saya pintar sekali ayah bilang tunguin ayah pulang benar tidak tidur sampai ayah pulang terus lagi nen dengar suara ayah langsung lihat lihat minta tegor gemas
yusrinasmarani,ken ikut nang asli kalau anak lagi rewel
yusrinasmarani,loh sejak kapan
yusrinasmarani,kalau malam agung tidak pulang bawa gugup gugup an takut anak dadak rewel padahal kalau juga cuma tidur doang tidak akan bangun mau anak nang kencang apa paling ngigo doang dia
yusrinasmarani,kalau lagi promosi an isi murah beli dus an isi dulu saya ada benar beli genki karena beli satu kali tangis coba deh yang sensasi lembut beli lazada tiap rabu diskon kalau tidak diskon sama saja harga seperti genki tawa
yusrinasmarani,wakakak iya si saya alih mamypoko
yusrinasmarani,saya tiap beli langsung dus le
yusrinasmarani,takut
yusrinasmarani,gubernur anda
yusrinasmarani,kalau ada darurat bukan langsung igd rujuk yah
yusrinasmarani,satu pasien anak sama pasien dewasa
yusrinasmarani,tawa napas sama sekali seperti saya bawa varen kondangan sepupu terus ibu ibu tanya umur saudara laki bulan kenapa sudah ajak syudududu
yusrinasmarani,semangat yah bisa
yusrinasmarani,iya tangis kalau sudah anak kepikiranya sampai mimpi mimpi
yusrinasmarani,dulu saya pikir susu dar buka mulut lep lep sudah nyata hebat sekali memang ibu ibu semoga varen selalu cukup saya terus asih tambah terus pintar sabar makin hari amin
yusrinasmarani,serius ken sekali rasa jadi orang santai
yusrinasmarani,ken deh nge retweet tweet ayo
yusrinasmarani,tuhan punya anak rasa gatal sekali ken ngepost cerita instagram hanya tawa mafkan yang rasa tergangu
yusrinasmarani,suami saya kerja pergi pagi pulang malam saya kayak mau lupa muka tawa
yusrinasmarani,yeay yeay bentar lagi launching
yusrinasmarani,pumping tiba tiba tidak jalan sudah panik cari tukang layan eh nyata cuma karena tingkat vacumnya tekan jadi tingkat
yusrinasmarani,semangat semoga lancar sehat sehat semua lele
yusrinasmarani,terimakasih banyak fifi
yusrinasmarani,huf iya ger doa yah agar sehat terus
yusrinasmarani,makaci cinca saya sehat sehat lee
yusrinasmarani,sejak punya anak parnoanya parah anak gumoh nang anak tidur tidak mau nyusu nang anak napas grok grok nang anak nang emaknya lebih nang nama yusrina cengeng asmarani
yusrinasmarani,sejak jadi ibu ibu benci sekali kalau yang sakit terus dekat dekat anak saya pegang pegang bayi cuci tangan emaknya saja habis kenapa apa selalu cuci tangan dulu
yusrinasmarani,rasa jam jam pagi lama sekali
yusrinasmarani,tidak tugas akhir wakakakak
yusrinasmarani,makaci wina
yusrinasmarani,lapar tidur
yusrinasmarani,minum saya tiap hari tugas akhir
yusrinasmarani,kira tidak cuti tidak pernah rindu sama urus gigi geligi nyata rindu juga urus gigi
yusrinasmarani,amin tuhan doa nata
yusrinasmarani,sekarang kalau buka shopee yang lihat baju anak bayik lengkap anak bayik semua yang bayik bayik sudah tidak ingin lihat rawat kulit buat atas
yusrinasmarani,iya tangis sayang sekali sama bayik semoga sama bayik sehat sehat terus le amin
yusrinasmarani,sama kalau lagi tidak enak badan terus minta peta eh nendang nendang tangis langsung semangat lagi
yusrinasmarani,amin amin rab doa ontih
yusrinasmarani,momen mana lagi bicara terus tendang tendang seperti sudah paham tiap ajak bicara akan rindu tendang tendang bayiknya ini kalau sudah lahir sehat terus sayang ibu
yusrinasmarani,shopee coba le
yusrinasmarani,kalau pikir pikir ajaib sekali dulu kesana sini cari obat buat ngilangin jerawat sama rambut rontok eh sejak hamil tidak pakai apa apa jerawat bersih rambut rontok hampir tidak syukur
yusrinasmarani,hahahahahaha diemin saja saya juga gendats sekali ini le
yusrinasmarani,sabar ibu hamil
yusrinasmarani,sabar
yusrinasmarani,amin doa dong saya punya klinik tawa
yusrinasmarani,kemarin pasien kasi tua akhir gratis in karena tensi tinggi tidak jadi cabut ujung konsul doang e ujung tegur milik tawa semoga saya cepat punya klinik tuhan
yusrinasmarani,cian bumi tidak lelah lelah yah
yusrinasmarani,tawa saya bicara saja sudah engap lee parah si
yusrinasmarani,parah le hamil kuat sekali hebat
yusrinasmarani,mayang kena cacar
yusrinasmarani,nyata anak saya suka utama petak umpet kali usg saudara yang pertama muka tutupin tangan yang muka ditutupin tangan jari kaki lagi salto yang tiga diliatin sayang
yusrinasmarani,amin tuhan semangat suamik
yusrinasmarani,tapi kadang butuh buat mantengin online shop tawa
yusrinasmarani,kalau senjata ngemute tawa
yusrinasmarani,ken ritwit tapi tidak
yusrinasmarani,tawa
yusrinasmarani,peras dari jaman koas tidak pernah masalah sama yang nama bau mulut pasien kenapa akhir akhir jadi sensitip sekali langsung mual tidak tahan
yusrinasmarani,sedih sekali asli lihat suami yang biasa kesana kesini sekarang sakit gin tangis bagaimana kalau lihat anak sakit bisa mewek hanya saya lihat orang sayang sakit
yusrinasmarani,anda mana si
yusrinasmarani,gin rasa jadi ibu ketemu saja sudah rindu hanya bawa sama yang dalam perut
yusrinasmarani,syukur asli lelah sekali
yusrinasmarani,sekarang paling tidak bangun jam jam atas mual parah
yusrinasmarani,sering nasehatin orang diri sendiri sering jebak
yusrinasmarani,efek php in saudara wanita saudara laki gosok tangis
yusrinasmarani,syukur satu hari kemarin tepar hari bisa kelarin tri yang abrek cuci ngelapin debu debu nyapu ngepel nyikat kamar mandi saya rasa jadi ibu rumah tangga yang utuh tawa
yusrinasmarani,malu makaci banyak curo cayang doa agar sehat sehat terus
yusrinasmarani,nes syukur doa nes
yusrinasmarani,amin amin tuhan terimakasih banyak bela doa bel
yusrinasmarani,makaci banyak eri doa
yusrinasmarani,rasa tidak rela ningalin syukur segala capai besar di capai tahun dari mulai dapat gelar drg lamar dinikahin dinyatain positif hamil saya syukur sekali tuhan
yusrinasmarani,tuhan hamba selalu temu pasien cabut
yusrinasmarani,sekarang rasa hepi sekali baca obrol saya di jalan pulang dari suamik
yusrinasmarani,gemas deh paling bawah
yusrinasmarani,makaci cinta saya
yusrinasmarani,semoga tangis doa dem buat jerawat jerawat saya
yusrinasmarani,tekan parah jerawat mana mana rasa lebih percaya diri pakai masker pada pakai dasar
yusrinasmarani,mantul sekali sayang tawa rindu
yusrinasmarani,semoga percaya selalu tahu cara tetap jadi percaya
yusrinasmarani,tidur bangun bangun terus badan lelah sekali
yusrinasmarani,lagu denting memang cocok sekali buat melow melow an rindu huhuw
yusrinasmarani,tidak hubung sayang tangis justru yang buat pikir sekali
yusrinasmarani,si saya orang pikir lebih sekali
yusrinasmarani,paling sedih rontok bulumata
yusrinasmarani,yak buat ketawa saja tawa tukang les
yusrinasmarani,malu saya yang receh sinar langsung senyum senyum sendiri
yusrinasmarani,tadi tidak jalan pulang kelaperan terus nelfon agung bilang mau drive thru mcd tidak gubris tidak blh jajan suruh mkn rumah padahal rumah tidak cemil sama sekali kemudian sampai rumah lihat motor sama sendal agung saya lsg senyum senyum receh sekali saya gin saja leleh
yusrinasmarani,lapar ken cemil balik tanya anda tidak lapar anda tidak mau cemil
yusrinasmarani,tawa
yusrinasmarani,gereget sekali
yusrinasmarani,selalu alas rasa syukur tiap hari syukur
yusrinasmarani,baru rasa cekek akhir bulan haru orang yang diam diam rela dua isi dompet buat saya yang miskin kata tidak minta sama ibu ayah antara haru sama tidak enak untung punya pasang yang ajak susah saudara wanita mau juang bareng
yusrinasmarani,wakakakak iya sekali
yusrinasmarani,yuyur kesal sekali sama orang yang pasang instagram jadin foto seperti puzzle begitu jadi pasang banyak foto h tolong dong saudara laki saudara wanita rumah kan jadi penuh gambar gambar zoom kalian yang pecah pecah
yusrinasmarani,sungguh waktu kecil ken sekali menikah adat solo eh tidak sudah besar ken sekali adat palembang cuma tidak nari saya itu
yusrinasmarani,tuhan habis imunisasi tangan seperti digelendotin gorila
yusrinasmarani,walaupun belakang nama sudah embel embel drg nya tapi tetap saja kalau sakit tanya obat tetap tanya sama mamitow wakakakakak
yusrinasmarani,sedih rasa dekat h eh kemarin malah celaka sekarang jari kaki bengkak jalan susah tapi positif lihat agung sabar sekali nenangin saya yang nang nang sakit panjang jalan seperti anak kecil ngompresin jari kaki saya pakein obat untung
yusrinasmarani,tadi mes pergi kirim tapi drivernya tidak yang benar bagaimana si ini
yusrinasmarani,saya pikir saya doang
yusrinasmarani,lelah kerjain pasien anak begitu kerjain pasien dewasa
yusrinasmarani,sumpah saudara wanita saudara wanita online toko ada saja yang buat kesal buat kesal semua malah
yusrinasmarani,lipstainya
yusrinasmarani,kemarin yang bilang tidak ikut piala dunia peras siapa
yusrinasmarani,ada apa apa banding anda bebku rindu
yusrinasmarani,tawa kan senasip
yusrinasmarani,anda takut air karena takut catokanya tidak badai ya tawa
yusrinasmarani,sungguh nyata saya bukan orang yang konsisten pengunan kulit peduli malas sekali saudara
yusrinasmarani,kejut rekor sekali masa laku habis kuota telkomselku sisa banyak
yusrinasmarani,asli
yusrinasmarani,tawa asli
yusrinasmarani,selesai libur bulan bulanya waktu cari uang
