username,tweet
aliencuk,degdegan begitu kan tadi kenapa tidak dicarin ibu takut marah sampai tingkat bodoamat lah mau balik jam berapa eh nyata sudah tidur
aliencuk,gas
aliencuk,eh cerah itu
aliencuk,tiap malam lihat citylight
aliencuk,sial baru sadar lah ngemil freezer
aliencuk,kejut tengs info saudara wanita
aliencuk,tawa terus jadi atlet
aliencuk,gila kieu ngatur lanceuk
aliencuk,botram euy
aliencuk,beli gratis belah mana iya saudara wanita
aliencuk,toserba jual kali gang
aliencuk,ingin punya suami
aliencuk,setrikana pindah tangan
aliencuk,naonsih cangkir
aliencuk,apa sih orang yang keluar tidak pakai masker teh cukup anda haduh bodoh tidak usah bilang orang yang pakai masker lebay lah cupu naonlah minta suntik mati
aliencuk,tidak tahu
aliencuk,tawa tidak tahu siapa tahu kan
aliencuk,beda weton
aliencuk,saya retweet ribu kali
aliencuk,lingkar cahaya sayang
aliencuk,siamah inner haseum baik nodebat
aliencuk,inner tampan memang tidak bisa lawan meski benget keur haseum haseumna tetap saja tampan
aliencuk,akumah sudah tunduh jigana
aliencuk,satu orang ikut saya otomatis periksa oleh
aliencuk,saya sayang bintang emon
aliencuk,dasngab anda orang
aliencuk,nyata saya memang bodoh dulu
aliencuk,temu foto aju jadul hardisk ibu jadi rindu sama huhuk
aliencuk,kecewa lur
aliencuk,panas
aliencuk,saya tidak pernah jamet
aliencuk,aduh gila kieu euy bandung sebuah misi tawa
aliencuk,sial bosan oge sebut aa saya aa aa
aliencuk,saya sudah jadi orang bandung sekarang euy vibesna sudah beda sama dramagon
aliencuk,ayo saya buka jalan
aliencuk,h memang kurang ajar kalau gabutuh ibu moal saya ge
aliencuk,bentar juga keapus
aliencuk,tiati
aliencuk,pikir bau bol
aliencuk,ingin sekali gegenjrengan iya mungkin jam gin
aliencuk,hobi baru balap tiap malam balap sama telepon ibu
aliencuk,luar kota bandung kirim via jne jnt paxel minta ukur besar
aliencuk,siap sedia balado bq lada hitam keju manis jeruk pedas pedas siap kirim mas tinggal pesan langsung saja khusus bandung saya kirim sendiri kalau jauh pakai gosend malu siap penuh asupan micin hari
aliencuk,orang ikut saya otomatis periksa oleh
aliencuk,mata merah muka tanjung ngobrol tidak nyambung sudah seperti penguna saja saya
aliencuk,wakakakaka saya ingin
aliencuk,h jadi tidak bisa lihat beterai kan ripuh memang emosi
aliencuk,percaya saya ombakna gandeng
aliencuk,gandeng
aliencuk,anak kecil memang kesal baik
aliencuk,saudara laki
aliencuk,brangkat
aliencuk,sudah buang saja saya tidak ini kenapa
aliencuk,mon peta apa tidak ngantuk
aliencuk,awaz nyemplung saudara wanita
aliencuk,mana coba cuci mulut kotak asin aduh bodoh piara gin ini keju saja dimasukin terus gula lupa
aliencuk,orang ikut saya otomatis periksa oleh
aliencuk,ibu wb sudah pindah ya
aliencuk,nongki sama fwb
aliencuk,iya saya bisa
aliencuk,seperti bosan cemil gasih
aliencuk,mngerikan
aliencuk,puasa tidak puasa sama saja tidak cemil sial beda kalau puasa siang lapar
aliencuk,inimah benar saya candu dimsum
aliencuk,rindu emot ym sekali
aliencuk,tidak mw
aliencuk,penting otd sehat mental
aliencuk,lesgow
aliencuk,tidak lupa bawa soju
aliencuk,siapa dis seperti begitu
aliencuk,ajar harga sekali
aliencuk,hindar itu negatif energi
aliencuk,segera yah buka pesta apa saya
aliencuk,dih ngaku
aliencuk,magnet kali
aliencuk,kenapa saya tidak pernah tarik tawa
aliencuk,ken belanja gas cangkir tidak ada uang tawa
aliencuk,sama akhsan baihaqi
aliencuk,mulai bosan baju itu saja
aliencuk,sial seperti kuat saja dis mau
aliencuk,langsung ya nin gila si adis memang
aliencuk,kozanku sekarang sepi
aliencuk,nyimak
aliencuk,sejak psb saya tiap naik motor pakai sarung tangan
aliencuk,yang nongol tawa
aliencuk,satu orang henti ikuti saya otomatis periksa oleh
aliencuk,cashback cashback begitu nin bayar pakai ovo besar cashbacknya gantung promonya sih
aliencuk,tsel sih boi
aliencuk,saya sayang tokopedia
aliencuk,drama uji online rumah itu buat pusing susah sekali dibilangin padahal buat diri sendiri memang laku orang rumah itu nyebelinya lipat ganda
aliencuk,tidak nguteuk
aliencuk,freya gemas bgtbgtbgt sebuah
aliencuk,kenapa tiba tiba ayam geprek mozzarella saudara laki ireng
aliencuk,lingkar cahaya gais saya sekarang jual basreng ini super tipis krispi rasa asli pedas jeruk pedas bq lada hitam keju manis sama keju asin bungkus saja tinggal pesan langsung saya saja siap kirim kirim mana siap penuh asupan micin hari
aliencuk,itu kan tidak pnya uang asli
aliencuk,bct
aliencuk,sama kenapa seperti nomor wasap
aliencuk,akun linkaja saya pakai nomor saya yang biasa kenapa lih
aliencuk,dong uang
aliencuk,sudah lihat saya ekeke
aliencuk,anda sudah seperti jual
aliencuk,saya tagih dimsum apa bagaimana yak tiap lapar ken
aliencuk,mau punya kermit
aliencuk,netflix gajelas ludo tidak konek ah
aliencuk,h kenapasih padahal kan lagi netflix dan chilz
aliencuk,ibu bangga
aliencuk,wuhu terimakasih suhu memang ajar ini
aliencuk,sial memang orang mikirnya hanimun hanya baru romadon
aliencuk,astaga
aliencuk,tawa tapi tapi sudah jadi kenapa hehehehehe
aliencuk,tidak lama ngetwit video reset ngulang lagi awal ngeditnya tawa
aliencuk,kolong
aliencuk,biasa jam gin baru bangun pikir sekarang baru mau tidur
aliencuk,orang ikut saya dan satu orang henti ikuti saya otomatis periksa oleh
aliencuk,mntp
aliencuk,pikir lebih baik anda psg ingat sekarang juga
aliencuk,tidak blh lupa
aliencuk,iya sama sama kn sudah saudara kbrn
aliencuk,slmt iya saya bulan depan
aliencuk,akhir jadi video edit ala ala wkekekeke
aliencuk,begitu
aliencuk,ah manehmah ayo ayo cicing
aliencuk,ken dimsum teukiat
aliencuk,bagaimana mau banyak uang jajan hanya h
aliencuk,tidak
aliencuk,iya soal jarang mandi saya tik tawa
aliencuk,sekarang beli masker sudah kayak beli baju ken humoris
aliencuk,pangeran abu machiatonya xiboba enak gas
aliencuk,sini juga panas riz hujan
aliencuk,bosan sih jebak hujan teh padahal cuma antapani
aliencuk,dong inimah rumahna garut meren
aliencuk,karisong
aliencuk,h dimandin tuhan kan padahal cerah
aliencuk,kejut
aliencuk,tawa enyoy dong
aliencuk,mg anda mnum soju
aliencuk,apa sih instagram banyak iklan pinjam online padahal tidak butuh tidak pernah cari
aliencuk,tralala trilili syudududu
aliencuk,orang ikut saya otomatis periksa oleh
aliencuk,mimpi mau puncak memberi jatah mobil buat ciwi terus tidak mau naik motor motor ban sama teman laen akhir saya jalan jari kaki sampai di tugas akhir awun untung mimpi jadi tidak tanjung
aliencuk,sudah kenal menit yang lalu saudara
aliencuk,baca dong
aliencuk,beli total ikut begitu apa bagaimana gang tawa
aliencuk,josu astaga tawa
aliencuk,bukan breadtalk sih
aliencuk,pernah seperti gin gofod buat orang kan padahal saudara laki tahu tapi struknya tapi dikasin benci sekali
aliencuk,iya seperti begitu soal komodo kalau makin tua makin lemas makin tidak cemil terus lemas begitu saja terus sampai mati
aliencuk,pikir saudara laki galuh mau ikut vcs
aliencuk,misi saudara mau dagang ukur ml oke liter oke hihiw
aliencuk,dulu kan saya teliti memberi tanda begitu tawa terus kalau tugas sana sudah hapal tiap komodo seperti jesica masuk komodo sudah tuir lah tidak saya teliti dia sudah kurus kurus lemas gitusih
aliencuk,sudah seperti orang mati yah tawa
aliencuk,lagi pdktin doang tapi tidak mau itu si jesicanya
aliencuk,tahun lalu saya baru kolokium
aliencuk,kayak kenal saja
aliencuk,kejut hebat langsung muncul
aliencuk,h mager
aliencuk,jesica depan masa hidup
aliencuk,parsel netflix tak batas hilang
aliencuk,tawa tunggu iya saudara
aliencuk,pikir anda rada eror yah seperti
aliencuk,smgt viul
aliencuk,kan yang lelah lari
aliencuk,mau buat menu baru ah soju yakult
aliencuk,lebih lelah lari kenyat
aliencuk,tawa benar anda
aliencuk,benci tidak sh bcnya
aliencuk,tidak
aliencuk,fwb fren warung belakang vcs video panggil sandra
aliencuk,senang sudah ngobrol sama fwb tambah vcs
aliencuk,saya mau retweet kali
aliencuk,tidak apa apa kan jadi ada lebih enak
aliencuk,kenapa si beranda gabener sekali iya ampun ingin ejek
aliencuk,tebing apatuh
aliencuk,sadel sepeda tidak
aliencuk,sebuah depresing sekali rawr ken cemil
aliencuk,bisa ngeshare begini
aliencuk,rasa tidak enak kenapa
aliencuk,peras tidak habis cemil pedas deh kenapa panas bol sih
aliencuk,sial
aliencuk,satu orang ikut saya otomatis periksa oleh
aliencuk,agre
aliencuk,ih kenapa sindir
aliencuk,saya cinta saya sekali
aliencuk,ken boba gadibolehin beli tangis
aliencuk,ini saya bangun dadak penuh cinta
aliencuk,memang biadab jari kaki empat
aliencuk,sebuah alias saya
aliencuk,saya kasih gas deh
aliencuk,pakein selimut dong agar hangat
aliencuk,kyut sekali ulululu shoo hangat
aliencuk,pala saya selalu pusing kalau tidak kurang tidur banyak tidur
aliencuk,pikir begitu
aliencuk,satu orang ikut saya otomatis periksa oleh
