username,tweet
nstlstnngrm,sudah kena santet jadi tidak gambar
nstlstnngrm,suster tidak ditaro meja apa agar lihat
nstlstnngrm,belah kamar nyanyi menstruasi mbendino
nstlstnngrm,nada
nstlstnngrm,syukur
nstlstnngrm,horoh
nstlstnngrm,kalem ledak waktu waktu
nstlstnngrm,ndasmu
nstlstnngrm,jauh
nstlstnngrm,ya bapak kayak selalu tahu suasana hati padahal saya diam
nstlstnngrm,suram suram
nstlstnngrm,bps saja begini cuma
nstlstnngrm,halusinasi tempat sila
nstlstnngrm,malah kayak untung hakim
nstlstnngrm,wis mangane kemproh tiba tibo mbladhok pis
nstlstnngrm,oiya anda juli
nstlstnngrm,iya
nstlstnngrm,mobil s perkoreyan
nstlstnngrm,cukup anda saja halusinasi rektor tidak
nstlstnngrm,tidak apa apa ibu cuma ngliyer dikit
nstlstnngrm,ng nganu
nstlstnngrm,gublik
nstlstnngrm,padahal biasa duduk sendiri bentar sana tidak apa apa
nstlstnngrm,ken lempar rudal kamar saudara sebentar kamar kena
nstlstnngrm,masih sibuk fokus youtuber
nstlstnngrm,wah bagaimana si tidak perbarui
nstlstnngrm,berisik sekali orang itu
nstlstnngrm,saya
nstlstnngrm,paling enak tetap ayam geprek bapak wage
nstlstnngrm,tawa sial
nstlstnngrm,masa kecil penuh tipu nyata
nstlstnngrm,gas
nstlstnngrm,mie ayam saja lah
nstlstnngrm,inspirasi muncul kelakar nya tetap saja rebah hanya
nstlstnngrm,acak sekali gaya nya biarin lah
nstlstnngrm,saya
nstlstnngrm,tidak mau hijrah
nstlstnngrm,aduh ingin keceh
nstlstnngrm,saya ciblon bareng
nstlstnngrm,indonesia tanggap buat bencana
nstlstnngrm,jo gelem saudara laki tidak gur dikon gelar kloso
nstlstnngrm,nah
nstlstnngrm,banyak
nstlstnngrm,piring favorit muat nasi banyak
nstlstnngrm,dekat saja tidak apa apa si
nstlstnngrm,reuni sama anda bom
nstlstnngrm,sampai dengan langanan setor teks pancasila bina dadi kibar pis kapok lagune wis rampung lah benderane iseh paro akhire ngebut kerek mungah
nstlstnngrm,kalau babe sendiri memang sudah biasa ngerokoknya luar rumah hubung tamu jah ngikut ruang tamu sudah haha
nstlstnngrm,tidak pilih satu taichan sama sate madura
nstlstnngrm,seminggu minggu waktu indonesia corona
nstlstnngrm,babe sudah reuni kapan
nstlstnngrm,bapak saya sendiri iya tawa tidak tahu sudah
nstlstnngrm,iya pintu buka sama saja bau sampai atas bos
nstlstnngrm,temenya babe datang tamu tolak salam dibuatin minum duduk jaga jarak mereka ngerokok ng negatif corona positif bengek
nstlstnngrm,jurusanya geografi awal ospek cari kampus saja nyasar
nstlstnngrm,takoyaki ribu telur gulung ribu es teh ribu cilor ribu lha kenapa banyak
nstlstnngrm,saya hindar sabtu minggu takut lihat kerumun ramenya jebol
nstlstnngrm,paling ujung buat mie
nstlstnngrm,hai
nstlstnngrm,gelembung gumers
nstlstnngrm,haha haha haha tawa tawa tawa
nstlstnngrm,sudah
nstlstnngrm,selesai nyapu tutup pintu selesai
nstlstnngrm,langsung jawab tetap nyapu ayo libur terus lah ibu tetangga cuma malu malu
nstlstnngrm,suatu sore cerah banyak burung kicau benar saya nyapu depan rumah tetangga lewat silakan saudara wanita libur
nstlstnngrm,mungkin saking sering makanya sampai sekarang kalau tetangga tanya kerja mana wis mati rasa
nstlstnngrm,ingat
nstlstnngrm,saya pindah nyah
nstlstnngrm,ndasnya
nstlstnngrm,bijak sekali anda seperti siwon
nstlstnngrm,hitam mutiara dan jantung serang masih in saya daftar putar sekarang
nstlstnngrm,jual nyuapin langsung beli
nstlstnngrm,salam
nstlstnngrm,menang bangke
nstlstnngrm,gagal tidur karena majikan laknat anak anjing bawah tempat tidur
nstlstnngrm,saya akan lebih baik lupa jumlah dan maaf
nstlstnngrm,juga tanjung deh
nstlstnngrm,ketawa sampai sebentar
nstlstnngrm,mbribeni nyanyi saudara wanita njero anak
nstlstnngrm,lain sudah tonton twotm tkem rsud daftar putar saya tidak pindah nyala extracurricular terlalu suram terlalu bagus tidak tahu musim apa tidak tidak resmi ost intro padahal bagus
nstlstnngrm,coba saja sendiri
nstlstnngrm,ini ulah rafi ahmad kan
nstlstnngrm,pagi pagi sudah lawak
nstlstnngrm,saya laughed juga keras dan saya ayah dadak kamjagiya
nstlstnngrm,siwon asli kan agung
nstlstnngrm,bantu makhluk astral
nstlstnngrm,hadap nikou
nstlstnngrm,lah mana tahu tawa
nstlstnngrm,corona kasih umur panjang mbah
nstlstnngrm,ada yangti
nstlstnngrm,boneka tuan daruma tidak seram boneka oke e oke e iya saya
nstlstnngrm,makin mau nang tinggal dapur bentar remot televisi sabotase bapak
nstlstnngrm,kata nenek nobita jadi boneka tuan daruma walaupun celaka kali kali tetap tegak diri
nstlstnngrm,lah lemah sekali masa tonton doraemon baru saja episode tuan daruma saja mau nang
nstlstnngrm,num num dia kelam karantina
nstlstnngrm,mana lanjutanya
nstlstnngrm,sudah baru lebaran sudah dosa
nstlstnngrm,bagaimana peras kameramen
nstlstnngrm,hebat
nstlstnngrm,dengar solat taubat
nstlstnngrm,tidak mau dengar sendiri
nstlstnngrm,cara beda bagaimana apaka dipilok kayak sapi begitu
nstlstnngrm,hiyek
nstlstnngrm,lihat racun
nstlstnngrm,kpop makin lokal
nstlstnngrm,drama korea apa murotal itu
nstlstnngrm,sini
nstlstnngrm,kamar
nstlstnngrm,gublik
nstlstnngrm,kejut saya tidak tonton arti tidak otak
nstlstnngrm,hubung
nstlstnngrm,saya sudah syok kemarin siang baik tidak saya bagi eh tetap nongol
nstlstnngrm,pikir pikir tekan corona rampung
nstlstnngrm,restune orang tuwo begitu weton begitu zodiak bicara apa saya koyo wonge wis ono saja
nstlstnngrm,kaum rebah senang sekali lihat
nstlstnngrm,buat taruh laptop buat taruh buku buat taruh barang sembarang buat rebah kucing poteh
nstlstnngrm,ada saja fizi tren tidak selesai tadi malam siapa kalau bukan saudara laki
nstlstnngrm,orang suka harga oh arti bukan kawan ding
nstlstnngrm,kaum bapak saja
nstlstnngrm,bapak video panggil temenya malam jam tengah lebih ngenyek temenya yah mene kenapa arep turu ki lho iseh jam kurang telepon nya diarahin jam dinding
nstlstnngrm,tonton ya
nstlstnngrm,baik kerja uwa tahun depan duduk pesta saja agar tidak usah pakai nunging
nstlstnngrm,lebaran paling beda lain video panggil telp dulu saya ngurek ngurek malu
nstlstnngrm,mau usaha ternak hantu astagfirulahaladzim
nstlstnngrm,cicik toko emas
nstlstnngrm,putih nama si putih kalau satu nama cimbel ken punya baju soal suka jorok utama nguling kebun wakakaka
nstlstnngrm,ini kalau sengat lebah bengkak sakit tidak si jari kaki kucing pernah bengkak malah saya toel
nstlstnngrm,yona saja paripurna bagaimana kali
nstlstnngrm,iq saya jeblok
nstlstnngrm,ruled oleh rahasia bagus bwang
nstlstnngrm,kalau tidak bahagia orang dendam kita makin rasa menang
nstlstnngrm,apaka yang beli makhluk astral
nstlstnngrm,rasa ken tidak
nstlstnngrm,padahal ingin tahu cuma diri sendiri
nstlstnngrm,tayangin spongebob tidak usah potong potong adeganya sudah
nstlstnngrm,baru ingat rumah nyebutnya cente centhe
nstlstnngrm,lup nagasari cantik manis nama jawanya apa ketan srundeng
nstlstnngrm,wak hati kosmu dini hari digrebek
nstlstnngrm,jauh lebih bagus sekali yang buat onoh
nstlstnngrm,tawa teringat malah bengong bengong
nstlstnngrm,tidak pacar ketemu teman kayak anda saja nyata temenya mel wakaka
nstlstnngrm,seperti ini lebih baik daripada tendang itu dan tinju jujur saja
nstlstnngrm,engko bar buko
nstlstnngrm,sudah imbang bom misuh sama nyebutnya
nstlstnngrm,hasil tes otak kiri kanan otak kiri otak kanan cenderung otak kanan imajinasi malu
nstlstnngrm,bismilahirahmanirahim bodoh astagfirulahaladzim
nstlstnngrm,seperti kuntilanak merah
nstlstnngrm,zona yogyakarta tukang minjem ngampilan
nstlstnngrm,hai
nstlstnngrm,tidak apa apa antara banyak kue lebaran saya malah paling suka astor
nstlstnngrm,lompat munduro seng wuadoh sampek akherat
nstlstnngrm,andan mangan ndek janga ngo grabfod lak ayo iso untuk
nstlstnngrm,maaf saya bebal
nstlstnngrm,sp tahu kan dapetnya bukan thr koin thr pegawai negeri sipil
nstlstnngrm,murid murid tadika mesra keren bagaimana cikgunya
nstlstnngrm,saya tidak mau hidup damping corona pakde saya selalu damping kucing kucing rumah saja
nstlstnngrm,kapten rek
nstlstnngrm,nyiramin punya teman nyiramin punya dinkes
nstlstnngrm,karantina buat tahu kalau lagu kurang ajar
nstlstnngrm,halah
nstlstnngrm,saudara uang
nstlstnngrm,isine dodol kuabeh
nstlstnngrm,jadi mlempem gin peraturanya apa apa ah elah
nstlstnngrm,tolong saya ra kuat
nstlstnngrm,mau sungkemseyo yang buat
nstlstnngrm,makin sini makna sosial jarak benar tidak lagi
nstlstnngrm,sudah tahan tidak pernah utama keluar cuma indomarch sudah kayak mau jihad eh orang orang senak
nstlstnngrm,pengirim cuma bahas bagi wasalamualaikum nyata banyak humor selubung dalam
nstlstnngrm,tuhan meng nya humoris lholhok sekali
nstlstnngrm,mangkat
nstlstnngrm,saya
nstlstnngrm,salah server
nstlstnngrm,tambah adegan mie tumpah sebentar
nstlstnngrm,jah lee minho gaet indosiar mentang mentang habis nyanyi mati lampu sama saya menang
nstlstnngrm,tidak begitu cuy
nstlstnngrm,dingetin sama aplikasi
nstlstnngrm,kurma wah murka
nstlstnngrm,keluar backsound saya menang
nstlstnngrm,tidak lupa ngelem aipon
nstlstnngrm,lebih emosi sama sensor iklan cerita itu
nstlstnngrm,saya kalah
nstlstnngrm,henti baik
nstlstnngrm,kirim yang sangkut
