username,tweet
inditarizky,baru tahu saya sibuk tapi mati tawa goa kalau obrol cuma kalau tanya pekerjaan
inditarizky,rian main saham
inditarizky,tidak punya pacar saudara baik minta anda saja buat ajar saya tawa
inditarizky,yang mau ajar saya utama saham tidak
inditarizky,bcnd sayang iya tahu jijik tolong tidak hujat trims
inditarizky,heran saya itu kenapa tempat tidur suka disemutin padahal gaperna cemil atas kasur handuk begitu jemur baju tidak disemutin handuk saya doang yang disemutin ap karena saya mniez
inditarizky,kt ibu ibu lebih saudara wanita anda kantor sih daripada pabrik kimia an ih bahaya tahu semoga sebentar anda sana saja pantas saja tiap saya daftar pabrik gaperna lolos
inditarizky,bersih itu tanjung tapi senang nama hobi tawa
inditarizky,tawa cupang humoris tao
inditarizky,kalau tidak gerak tidak humoris nar mati tawa iya tunggu uang akhir bulan dulu ini saya agar sekali beli akuarium pelet lain lain
inditarizky,ken punya ikan cupang sudah
inditarizky,bagus pol kan torr
inditarizky,tonton kim tidak nawa doang nar asli tidak boong
inditarizky,kenya begitu ti semua sudah pernah dilakuin sampai bosan tawa
inditarizky,ayo jamber langsung ketemu sana apa bagaimana
inditarizky,apalu senyam senyum
inditarizky,telat haid sampai mulai panik sudah bulan hari belum tanda asli seperti saya gila butuh libur biasa tiap bulan minimal utama mall sekarang sudah bulan tidak mana mana tawa
inditarizky,kenapa tahu si
inditarizky,buat syarat s iq
inditarizky,sekali inimah tidak humoris sudah sore hai buat tanjung tanjung masa tidak bisa disave
inditarizky,hoo saya doang berat yang tidak mandi tawa tapi kadang mandi kenapa jam
inditarizky,harga tiap cabang sama tidak  apa memang karena ya ayam nelongso tidak buka jakarta pikir
inditarizky,saya juga kerja ngemil goler goler mandi hemat lagi iya ki tawa tidak tanjung jalan buat yang kantor jauh
inditarizky,btul ayam krispi tawa kapan ayam nelongso di jakarta
inditarizky,saya
inditarizky,itu nyata tukang tampol online pasar tor bisa dijadin bisnis tawa
inditarizky,tukang tampol sayang tawa tahu torr buat kapa kyknya kamis di cibitung sama antam torr
inditarizky,aduch baca jadi malu tawa siap saudara wanita tor cukup baca chatmu sudah buat saya tampar bolak balik kenapa kalau butuh tampar lebih keras baru kuchat anda
inditarizky,saat baca ulang obrol tory hiya
inditarizky,amin terimakasih bim doa semoga kasih sempat kesana amin
inditarizky,habis mimpi mekah saya mimpi nyetir sendiri cibitung sampai nyasar dalam stasiun sampai dekat rel kereta tawa ganti episode dong benar tidak masuk akal bukan
inditarizky,mimpi saya abstrak kadang tidak masuk akal padahal tidur tidak pikir apapa kemarin mimpi teman saya sembuh eh nyata sudah sembuh benar tapi baru kali mimpi tempat yang bom pernah lihat sama sekali sampai nyata tempat asli mirip sekali sama mimpi
inditarizky,mimpi saya sholat ashar masjid yang mirip sekali sama masjid padahal baru tahu sekarang isi masjid nabawi seperti begitu di mimpi saya sama ibu pria tidak tahu siapa anak kecil gadis humoris cantik yang saya gandeng tidak tahu anak kecil siapa
inditarizky,mimpi lebaran mekah padahal tidak tahu mekah kayak bagaimana
inditarizky,saya minta dong kalian colabnya ngereview tempe rasa tempe sekali kalau tahu kan kemarin sudah
inditarizky,samsung catat kamera bagus bok pusing saya lihat harganye
inditarizky,tawa diupload benar dong
inditarizky,jaksel coret padahal bekas lebih jaktim coret iya ki tawa
inditarizky,kan kemarin sudah ajak hoho
inditarizky,wakakaka siap saudara wanita tor agar karma kerja
inditarizky,nah ki kalau sering ketemu enak cepat hafal keluarga ibu saya begitu keluarga bapak ketemu cuma tidak lebaran sama menikah makanya tidak apalapal
inditarizky,tawa benar sih
inditarizky,saya juga rik tawa knpya ibu
inditarizky,baru nama pakde bom tambah nama sepupu semua sepupu saya kalau dikumpulin kira jumlah sama seperti jumlah murid kelas lah
inditarizky,bapak saudara dulu tiap mudik saya ngapalin dulu nama pakde budhe saya sampai sana tetap saja ingetnya pakde cirebon pakde bandung pakde sumatra kadang sala panggil tawa gapal bok nama sampai mukanye mirip smw
inditarizky,tawa ikut saya kan anda
inditarizky,iya ampun jadi rindu tidur rumah mbah jejer jejer seperti ikan pindang tahun tidak bisa seperti begini
inditarizky,dilema kenapa malam ganjil hari akhir ramadhan ada ajani saya
inditarizky,bim anda sudah selesai tonton kalau ude selesai baca deh dapat teman saya sedibgt
inditarizky,rindu naik perahu sungai kalimas sama cemil seafood genteng
inditarizky,yampon semoga cepat pulang yak bim ken kelelawar cerita langsung sudah kabar kalau pulang sebentar coba warkop tanjakanya oke
inditarizky,gentian dong saudara wanita tor masa anak cililitan hanya nyamper chandra tawa
inditarizky,aslidah rindu kopi kulo ayo tawa
inditarizky,oiya lupak kira pulang kapan bim
inditarizky,rindu anda juga mau utama sekali tangis kalau tidak corona sudah saya samper sudah cililitan
inditarizky,saya juga kamo kapan pulang cepat pulang elah rindu mau utama
inditarizky,rindu teman teman tidak ada yang rindu saya apa
inditarizky,sama mcd
inditarizky,surabaya saya tahu mcd manyar
inditarizky,pondok besar ti anda di tangerang sekarang
inditarizky,hari yang lalu saya beginiheu
inditarizky,beda cuy
inditarizky,memang iya tapi tidak bisa segar sedih
inditarizky,bagas sepi ti makanya semua orang jb in punya teman yang jomblo tidak ti bolehtu dikenalin bagas
inditarizky,tonton gm tidak sih yang seatnya penuh terus duduk misah atas bawah wakakak baru kali saya tonton sama orang yang duduk misah ada tonton sendiri
inditarizky,saya saja gainget ti akhir tonton apa tawa
inditarizky,rindu tonton sampai lupa kapan akhir sen tiket bioskop
inditarizky,oya sala ngitung saya sepurane tawa
inditarizky,neh netizen penasaran ca cepat kasitaw
inditarizky,e tidak dulu ca kasi tahu saya dulu lagu kuda an apa tawa
inditarizky,btul kapan si anda ngetik gapake emosi tawa
inditarizky,sama saudara wanita caca semoga kesan sampai ngebantu kilas balik masa masa jadi admin fenbes kita idola kita pahlawan kita inspirasi jastin bibier
inditarizky,tapi jujur status anda tidak anak bodoh anak bodoh bgtko alayan saya sumpah
inditarizky,tawa baru ingat saya kalau caca perna jadi admin fanbase juga
inditarizky,wakakaka maklum gabot nar
inditarizky,tawa beda
inditarizky,senang ulang tahun fansnya justin bieber
inditarizky,efek lihat brewok anda sudah seperti
inditarizky,kacau sekali badan hari dilep hari pusing sampai pandang kabur kepala nyutnyutan muntah kali mau tidur bosan diri ada layang utama telepon pusing baca buku mata kabur mau jadi takjil saja tidak
inditarizky,bupati suruh ganti dulu slah
inditarizky,ken deh punya suami yang desa pedesan agar kalau lebaran pulang desa bukan pulang kota
inditarizky,lebih baik lambat tidak sama sekali
inditarizky,bupati ckck
inditarizky,hoo kira tawa
inditarizky,omong omong selamat ulang tahun slah nyata anda bareng sama nadhia untuk tawa peta telat
inditarizky,lapo
inditarizky,siapa ngerusakin sonikator gates mana gates
inditarizky,mau sebuah rindu surabaya
inditarizky,ajak utama lulus itu sikat tantang tapi saya tidak bisa rias
inditarizky,jadi sas tawa kadang tidak pikir juga mimpi saya baca obrol orang grup angkat belum tidur saja orang masuk mimpi kocakda
inditarizky,jadi takot
inditarizky,saya begitu sas mimpi beda episode kadang lanjut kadang beda judul bangun lelah ken sudah tidur yang tidak ada mimpi tiba langsung pagi
inditarizky,kutuk malin doang vit tawa tidak keluar bawang putih ditambahin backsound suara jangkrik agar lebih kena
inditarizky,mungkin punya
inditarizky,nah manusia yang di foto sampai inspirasi saya buat ikut pakai dalam kerudung tawa tapi sekarang sudah tidak betah sakit kuping
inditarizky,ulangtaun memang harus diliatin komuknya nar
inditarizky,tawa saudara laki jamet omong omong saudara laki punya foto tidak bola bromo yogyakarta tidak saya hilang mau minta
inditarizky,senang ulang tahun teman bang ini bonus foto diri kita tahun lalu dulu tiap ajar kosong foto
inditarizky,habis bongkar galeri laptop temu foto jaman sama pertama kali coba pakai kerudung hari buat jalan sama anak besok lepas lagi tawa waktu saya mulai rasa nyaman sampai rasa cakep kalau pakai kerudung tawa
inditarizky,ayo habis corona selesai yak tawa
inditarizky,nyata masuk angin saya tor tawa tidak sudah muntah langsung enak
inditarizky,dia kyknya benar iya tuhan rindu ngemol
inditarizky,sudah tor darah rendah buat mual
inditarizky,pusing sampai mual buat tidak suasana hati siang panadol merah tidak mempan dingin tapi keringetan kalau sholat bangun sujud seperti mau jatuh mau tidur tapi bentar lagi maghrib saya
inditarizky,pria jawa itu memang ya
inditarizky,haha sama saya kalau buat kue puding cemilan humoris itungan jam sudah habis lebih cepat ngabisinya waktu bik juga saya yang disisain kalau banyak mau pasti harus tempat sampah buat rumah gaenak saja tahu gofod terus tidak mau cemil luar tapi tidak bisa keluar apa
inditarizky,sama sama tawa
inditarizky,saya juga
inditarizky,sama banci memang lebih rem sik tawa
inditarizky,selamat ulang tahun timocan
inditarizky,kan memang tidak ada sekarang tor tawa
inditarizky,senang ulang tahun semoga tidak takut ondel ondel
inditarizky,hai tidak pamit tawa
inditarizky,gausa tanda orang hoho
inditarizky,aduw saya mau aplod tapi gtw mau ngetag sapa bagaimana dong
inditarizky,ajar ndi ajar
inditarizky,yampon rindu utama harvestmon
inditarizky,hai
inditarizky,mereka senyum omong omong bobok kayak bayik
inditarizky,senang ulang tahun sheyeng semoga panjang umur sehat selalu
inditarizky,tawa ayo
inditarizky,yastaga garagara saya tidak boleh naik kendaran umum
inditarizky,buat gerah iya gas
inditarizky,tidak mau pulang sekarang sudah temenin belanja ayo selese belanja masih belum mau pulang mau kmn serah kopi kenang saya tidak kopi gokana kenyang jco tidak ingin donat terus mau apa serah anda nyata saya kesal
inditarizky,semangat buat kita
inditarizky,mata nar
inditarizky,cocok bim tawa
inditarizky,singa pikir
inditarizky,ayo eh
inditarizky,tidak begitu maksud jalananya lebih rawan karena licin begitu saudara laki
inditarizky,gas
inditarizky,waktu mau coba tapi tidak boleh sama ibu karena lagi musim hujan
inditarizky,buru habis
inditarizky,perbarui hai itu tubuh toko promosi ini bisa lihat lihat dulu kalau mau tanya cus langsung sebut pesan langsung saya saja
inditarizky,lupa ngehide pintar
inditarizky,tawa muhamad
inditarizky,btul bapak bim saya memang jarang olahraga mau jogging kenapa malas tawa gamao jogging bareng apa
inditarizky,omaigat sudah tua nyata
inditarizky,waktu pinggang kecetit tidak lagi ngunci pintu rumah sekarang otot pundak kiri tarik tidak lagi bayar tol karena jauh kenapa si saya jompo sekali
inditarizky,perbarui yang promosi ini saudara wanita
inditarizky,mana ini unch
inditarizky,kirim jakarta minat pesan langsung saya terimakasih
inditarizky,benang jual lingkar cahaya twitter saya jual itu tubuh toko ini jual atas untuk mati semua item
inditarizky,mau peluk kanguru
inditarizky,tidak begitu
inditarizky,semoga bukan kode
inditarizky,syukur radit rumah saja lelah seperti gin ngunduh mantu sebentar sebentar bagaimana ini maksud e
inditarizky,awal tahun dong tawa
inditarizky,goa rief tapi rumah goa jadi banjir tawa bala doa
inditarizky,iya ampun far tidak bayang saya bersih repot apa gila sekali tidak  banjir kali
inditarizky,banjir depan rumah sudah tengah larang ujanya sudah po o
inditarizky,iya bor salah doa goa sekarang rumah goa banjir tawa
inditarizky,iya tuhan repot bersih yak kalau sudah masuk rumah ini depan rumah goa sudah dengkul lapang keranjang sudah cem kolam bentukanye
inditarizky,iya ampun ruang mana bim jalan depan rumah goa banjir tidak tahu sudah ini pangkal ch dalam apa
inditarizky,semoga bekas ujanya awet sampai tahun baru agar tidak ada kembang api sampai saya tidur nyenya e kabul saudara laki hujan deras sampai detik
inditarizky,tawa
inditarizky,malang iya sebuah
inditarizky,budak cinta kalau utama jakarta gas
inditarizky,habis nensi hasil pantas saja rasa kayak layang kemarin kira celaka cinta nyata darah rendah
inditarizky,tidak lucuk ibu
inditarizky,ketemu bagaimana dong
inditarizky,mau punya anak kembar po o
inditarizky,siyap ibu ninis tawa
inditarizky,surat lamar tutup surat nis cv ijazah transkrip begitu masuk lampir surat lamar tutup surat
inditarizky,amin terimakasih doa rul
inditarizky,amin terimakasih pis
inditarizky,jadi rumah saya tiap hari tamu parsel buah sampai kue kue baru syukur banyak yang ngedoain
inditarizky,tiap hari dari bapak rumah sakit nov sampai hari des saja yang datang jengukin ntah tetangga teman ibu teman saya teman kantor bapak teman sampai dengan sampai sama kuliah bapak saudara kandung saudara jauh bahkan orang yang belum pernah ketemu bapak sblmnya cuma tahu dari grup whatsapp juga datang
inditarizky,menikah tidak lupa cari jodoh dulu saudara laki titip buat juga kalau
inditarizky,kata kalau rezeki tidak akan mana saudara laki jadi menikah dulu saja
inditarizky,kepsyenmu tidak nguawur tenan
inditarizky,vidi semua bantu saya nyanyi iya sayang vidi iya sayang kejut saya tahu saya sudah lama tidak dipangil sayang tidak begitu haha tampan tampan kenapa jomblo sik tawa asli mz vidi tampan sekali tadi malam
inditarizky,woke pergi bareng saja cc evita alfa sampai inar kalau bisa
inditarizky,whatsapp ke wisuda tory dong
inditarizky,dia anda pulang
inditarizky,oiya bim mana threadnya mau baca malu eh tapi kalau lambung apa tidak apa minum yakult
