username,tweet
_sylvialestari,teriak ayo
_sylvialestari,iri
_sylvialestari,yang usai
_sylvialestari,mau perempuan titik nol le petit pangeran sapiens hilang teman sepi semoga sekarang mendapatkanya buat saya teman teman
_sylvialestari,sudah tetap saja tidak ada jaring tidak ada sama sekali sampai sekarang tadi jam tidak pagi pagi begitu
_sylvialestari,dulu saudara wanita kuliah sini tidak megah sudah seperti bangun tua
_sylvialestari,jeruk
_sylvialestari,indi ngobatin
_sylvialestari,saha anda
_sylvialestari,yang cinta sendiri
_sylvialestari,semangat sehat semangat sembuh
_sylvialestari,ingat tiap hari dekat ajal mau hitung mundur sekarang
_sylvialestari,kalau ngalaminya itu usir setan akal
_sylvialestari,selamat dekat ajal
_sylvialestari,anak ayah bukan
_sylvialestari,akun baru
_sylvialestari,bang
_sylvialestari,dulu tidak sampai dengan kayagini sama saya
_sylvialestari,kata suatu yang anda ragu benar apa tidak nyeselnya akhir susah lepas
_sylvialestari,astaga salah ketik
_sylvialestari,lingkar cahaya daging babi
_sylvialestari,padahal saya itu tidak ken nang
_sylvialestari,hirup apa hembus
_sylvialestari,si sayang ih tidak ngabarin ayo suki unboxing rumah mpi
_sylvialestari,keong buah sakit jempol jari kaki mana kuku tumbuh dalam kalau gasala juga sebut bodoh eusi bodoh volume kata orang sunda
_sylvialestari,diri seperti dikerjain salah tidak kerjain makin salah
_sylvialestari,tidak baca judul langsung tawa padahal dulu kalau pasien batuk lang cemil coklat kata sp sebuah karena coklat buat tengorokan gatal makin parah batuk jadi gemas
_sylvialestari,sudah ah hapus foto foto malu
_sylvialestari,tawa
_sylvialestari,meledaq
_sylvialestari,astaga tawa saya
_sylvialestari,tidak boleh keluh ucap orang buku saya beli
_sylvialestari,kapan
_sylvialestari,copot kepala
_sylvialestari,ayo mitup buat suki suki nanti tawa
_sylvialestari,paling susah ajak mitup
_sylvialestari,humoris
_sylvialestari,saudara wanita sekali badan kena sinar matahari
_sylvialestari,iya saval
_sylvialestari,seperti tahu yang dulu suka jual jagung rebus sama goreng waktu sama
_sylvialestari,mangats
_sylvialestari,saya saya masih duduk
_sylvialestari,bukan badan yang lelah syukur
_sylvialestari,anda mesti yakin hati bahawa apa tuhan tetap paling sesuai paling bermanfat anda imam ghazali
_sylvialestari,facebook tidak bisa buka hanya si
_sylvialestari,tidak jauh saudara wanita kalau amal tahu jalan ayo keretan
_sylvialestari,hello lagi sama sylvia selalu ceria terimakasih bunga wisuda terimakasih ucapanya terimakasih hiasanya maaf baru buka tw ayo gramed
_sylvialestari,saya marah lampias
_sylvialestari,saya nyubuh dari purwakarta sampai saval jam seperti kalau cari saya paling dpr panggil saya beibi
_sylvialestari,amal saya tanggal lepas dong
_sylvialestari,bawa saya terbang jurang
_sylvialestari,bawa saya pergi hilang mana saja
_sylvialestari,tidak deng boong
_sylvialestari,anda
_sylvialestari,kan jadi malesin
_sylvialestari,humoris
_sylvialestari,tidur tuhan
_sylvialestari,libur apa libur jenis cemil
_sylvialestari,via mau pagi siang apa pagi malam pagi siang malam saya sanggup kenapa teh
_sylvialestari,terimakasih hari sangat sangat sangat luarbiasa
_sylvialestari,malas pagi siang malam
_sylvialestari,malas dines pagi
_sylvialestari,siapa
_sylvialestari,waktu untuk ganguin anak orang
_sylvialestari,saya tidak pernah cerita jadi bagaimana mau dengar tawa
_sylvialestari,saya teriak
_sylvialestari,pikir negatif hancur diri sendiri oke sesap
_sylvialestari,mundur tidak mudah siapa bilang mudah lawan diri kata ikhlas tapi hati terus sakit rasa
_sylvialestari,semangat
_sylvialestari,semoga masuk dalam
_sylvialestari,ingat anda baca tidak apa apa
_sylvialestari,tidak kuat tidak tahan makanya saya lampias tangis
_sylvialestari,titip dulu
_sylvialestari,amal sayang sayang ayo utama ayo
_sylvialestari,greget ken bilang bicara semua curah tahan tahan sabar akhir cuma bilang tidak usah bicara tidak penting sylv
_sylvialestari,urus pasien hanya diri sendiri tidak urus malu
_sylvialestari,mau akhir pekan libur nasional tidak ampuh saya libur tidak syukur
_sylvialestari,rindu jemur belum angkat
_sylvialestari,ibu t t
_sylvialestari,ibnul qayim al jauziah dahsyat bisa praktikan bila engkau doa waktu anda milik begitu sempit padahal dada penuh begitu
_sylvialestari,saya dapat sms dari nomor telepon biasa tipu bukan si
_sylvialestari,selesai selesai selesai selesai akhlak
_sylvialestari,kenapa saya sms sih si ibu ngambek saya apa
_sylvialestari,lihat sms pangilanya coba
_sylvialestari,doa saja tiap anak panah yang saya lepas langit tepat pada sasaranya
_sylvialestari,serius bareng kenapa kesitu c anda lantai sama ibu nia tawa terus rumah apa saja
_sylvialestari,cuma lihat kubur
_sylvialestari,iyup akal doa dede yak malu
_sylvialestari,astaga gibahin orang tidak punya twitter
_sylvialestari,hai saya limbad
_sylvialestari,seperti si veni suka sandar hanya wanita butuh sandar iya tidak
_sylvialestari,suka naik bahu sudah seperti limbad
_sylvialestari,dulu teman kata mangilnya diri diri
_sylvialestari,xabiru
_sylvialestari,isma sehat saudara
_sylvialestari,semangat sylv
_sylvialestari,luka akibat leceh pedofilia kadang yang umur hidup turut
_sylvialestari,ayah tidak main facebook bang t t
_sylvialestari,tatap ancam
_sylvialestari,lifehack
_sylvialestari,coba bayangin anda ngelamun tiba tiba kagetin orang
_sylvialestari,ken mungut t t
_sylvialestari,ikanya ayam sama semua benar tempe
_sylvialestari,kenapa temlen twitter konte seperti habis baca isi hati
_sylvialestari,bikes apa
_sylvialestari,sungguh kenapa kesal
_sylvialestari,receh tidak cepat lalu
_sylvialestari,astaga teman ini t t
_sylvialestari,warga sumut langsung kejang tawa serah bapak lah
_sylvialestari,terimakasih sista
_sylvialestari,iya
_sylvialestari,tonton apa
_sylvialestari,solusi buat anda anak kos low anggar ken tetap instagramable
_sylvialestari,bodoh
_sylvialestari,saya sylvi saudara laki bukan silvy
_sylvialestari,coba tutup mata tutup telinga tutup mulut terus tutup usia eh bagaimana si maksud
_sylvialestari,maaf siapa
_sylvialestari,ingat saya coba biasa kalau halusinasi datang apa anda laku
_sylvialestari,iya bhsp dulu minimal sudah kontak mata lah kaji dulu halusinasi ada apa untuk sudah sampai waham
_sylvialestari,lingkar cahaya rumah biasa cakap cakap sama siapa kalau halusinasi datang apa anda laku
_sylvialestari,simpen simpen
_sylvialestari,humoris komentar
_sylvialestari,saya periode adalah coba untuk bunuh saya
_sylvialestari,sempat temu orang cerita sama sekali karena sudah tidak percaya kepada siapa lebih pilih pendam hati sendiri
_sylvialestari,nyata saudara laki saudara laki kira saudara wanita saudara wanita
_sylvialestari,ini butuh libur kurang asupan dana
_sylvialestari,tidak tahu sebuah tiba tiba nang lihat suatu pasang terus tiba tiba renti haduh nang kesal marah marah mudah kesingung entah
_sylvialestari,sylvia si
_sylvialestari,jomblo tidur bangun tiga malam buat nikung si
_sylvialestari,malam minggu mati lampu
_sylvialestari,fitnah besar laki laki wanita igin jadi baik baik hias dunia besar besar fitnah
_sylvialestari,tawa benar oke sesap
_sylvialestari,terimakasih untuk untuk making ini foto available bebas nyala
_sylvialestari,banyak kasus saudara rsi chrono logika math kode trivia nimbus rebus dulu banyak peristiwa loh tbgc peristiwa pasang dulu
_sylvialestari,ayo suka sama dunia detektif gabung grup facebook teka-teki cerita indonesia link rsi begitu
_sylvialestari,senang internasional nurses hari sylvia
_sylvialestari,polbek mut
_sylvialestari,perut kenapa pegang pegang bang
_sylvialestari,aduh nembe angkat
_sylvialestari,salah bukan agama muslim yang salah orang simpan muslim
_sylvialestari,senang ulang tahun novy kapan ketemu
_sylvialestari,ingin main
_sylvialestari,asrama tidak purwadadi tahun dimana
_sylvialestari,akper pemkab subang
_sylvialestari,bunga skolah dimana saya kuliah saudara subang
_sylvialestari,maaf rasa singgung status yang saudara buat tanggal september kemarin asli saudara bajak orang
_sylvialestari,ikut kembali admin
_sylvialestari,tidak tahu ath gy saya sudah mulai ajar soal
_sylvialestari,gy angy sudah
_sylvialestari,e biasa
_sylvialestari,anda sudah
_sylvialestari,belum ngambil skhu siapa saja
_sylvialestari,akang ada ada saja nyandakna peci nya saudara laki tong golok saudara
_sylvialestari,semoga ultang tahun sekarang admin punya pacar semua agar twitnya tidak tntang jones hanya
_sylvialestari,pruk kenapa selalu selalu pernah tidak pernah
_sylvialestari,dian
_sylvialestari,riset bukti buah riset dapat saudara bukti omong omong riset apa
_sylvialestari,sumpah haru sama tulisan yang tidak baca
_sylvialestari,anda saudara unjani kan
_sylvialestari,lihat anda lagi teman teman
_sylvialestari,pa kalau buat surat laku baik polres buat lanjut didik guru tinggi tidak pa
_sylvialestari,iah cantik baik hati rajin tabung
_sylvialestari,sudah
_sylvialestari,kan puasa selamat admin saudara
_sylvialestari,begini pimpin tidak sehat negara adalah negara muslim jadi muslim pimpin
_sylvialestari,pikir duga nama fans klub cocok buat zon es
_sylvialestari,baik malam madi saya saya madians indonesia
_sylvialestari,saya temu itu salah itu itu salah benar
_sylvialestari,sman bandung admin semoga sekarang yang sama amin
_sylvialestari,sman bandung admin carin yang sama kemarin tidak terus
_sylvialestari,baik pagi dari indonesian
_sylvialestari,sudah
_sylvialestari,saudara kalau sbmptn ui sama seperti simak tidak beda
_sylvialestari,umum tahun benar saudara web nya bukan pakai surat yang pakai surat mh kelulus
_sylvialestari,amin
_sylvialestari,bermanfat kah entah tuhan tahu
_sylvialestari,iah smsin saja nama saya tidak pulsa
_sylvialestari,pukul waktu brangkat sekolah jarak rumah skolah skitar anda
_sylvialestari,matakna sadar diri
_sylvialestari,kapan kata siapa kan senin upacara kota baru bukan
_sylvialestari,teori kinetik gas htp t co iya misi kjhsq via
