username,tweet
imadamii,bunuh yang bneran bunuh diri karena gantung diri mayat julur lidah yang tidak benarkan jika saya salah
imadamii,sudah seperti istri indosiar yang sakit ris
imadamii,saudara wanita mata juga buat konsep begitu
imadamii,lumayan yang abadi
imadamii,tawa tawa peh selamat debut yak ngetwet nya tidak anda
imadamii,eid mubarak nurul
imadamii,ibu eid mubarak saudara
imadamii,may tuhan allow kita untuk lihat anda lagi ramadhan in normal circumstances
imadamii,berita ngegas muak kali seperti sama orang banyak cerewet
imadamii,adios nya hody juga enak sembunyi gem sekali
imadamii,iya ini amin yun
imadamii,uyun jadi kuat uji hidup bentuk macam yah
imadamii,layar name nya dapat ilham dari mana mana letak tali persaudaran seblak jeruk
imadamii,ho siklus hidup untuk jadi sebuah manusia
imadamii,puasa ceku
imadamii,mungkin karena ngomongnya suka tiba baku seperti mau buat sudah
imadamii,tunggu orang sini ngepost begini juga
imadamii,tonton cloy malah buat ambyar sama second pimpin couplenya huwe tempat jadi pimpin couplenya malah ingat edit kejar ondel
imadamii,terbang over arah mall bal kota nya lubang nya lebih rem mobil istigfar kalau lewat situ
imadamii,mcd beli mcflury ngobrolnya abad
imadamii,utama gartic terus sampai jadi terus van gogh
imadamii,ibu bukan gelap lingkar bronzer kenapa makenya mata
imadamii,pesan langsung iya ucap
imadamii,ih kalau waktu kabar tidak
imadamii,ega baik sekali tawa ega juga bagaimana rindu ega tauk
imadamii,mobil kejar
imadamii,rumit
imadamii,turunin gelap jadi samar foto yak
imadamii,syok euy jam malam tapi masjid sudah abu shalatu khairum admin naum ini orang sekomplek pada bingung ustadznya
imadamii,candu sisi terang
imadamii,sedih sekali dengar banyak yang jebak atap rumah
imadamii,warga jabodetabek seperti tidak perlu beli mobil beli perahu
imadamii,ini judul dasar saya nora
imadamii,saya ll ucap suatu seperti ini untuk saya masa depan kiddos
imadamii,kalau memang punya pikir yang rude seperti gin tolong dong hanya tetap itu untuk diri sendiri hanya tetap itu in milik anda pikir saja
imadamii,syahdu
imadamii,bayang rasa keju omija
imadamii,iya peh asal tidak sugih saja
imadamii,selamat tambah umur peh semoga makin sugih ehe
imadamii,mendengarkan lagu himalaya jalan pulang ngeliatin langit yang habis hujan syahdu
imadamii,kiblat jadi
imadamii,bajing pantas saja putar
imadamii,tiba masa
imadamii,iya ampun lupeh sebagai cetus grup grup tidak kuat tampung jomblo indonesia raya
imadamii,tawa sdg buru sama riri
imadamii,punya senang di stan
imadamii,yang lain tingkat dari percaya
imadamii,mau sesuatu yang benar dengan cara yang salah tidak sampai
imadamii,o ow
imadamii,terimakasih pranknya lengkoas nasi ayam saus padang nice
imadamii,kenapa suka mimpi balik lagi sama waktu lagi kelas kimia sekarang klas matematika dalam mimpi saja eike disuruh ajar
imadamii,anak desa sana memangilnya dup dunia panyirapan
imadamii,sama ibu hamil maklum
imadamii,yang bukan siang teh kevol
imadamii,beberapa yang buat diri parno truk besar rel kereta sebuah racun orang
imadamii,kenapa bisa kata rasisme keluar dari orang yang seragam malu
imadamii,tawa tul
imadamii,yang banyak ambil agar tidak bolak balik jauh
imadamii,seperti kuah pakai air zam zam peh
imadamii,beli seblak tidak tahu harga rebu tidak cemil asin mau tidak sakit asa tapi tidak bisargh
imadamii,saudara laki password wifinya apa
imadamii,waktu lagi ngantri tiba tanya saudara wanita memang enak sekali karena lihat antre yang ebusyet tawa
imadamii,buat anda ingat ketika anda gabung twitter saya buat
imadamii,saya tahu anak bonang seperti anda maenya mana tawa
imadamii,terus beli lipo lantai bawah tawa
imadamii,mungkin sana ayam tidak kokok medok
imadamii,wo wo wo ini adalah sihir anda tahu
imadamii,buset karakter memang buat palin in lope iya
imadamii,ayo pindah grup
imadamii,di jalan tgr sel tawa
imadamii,iyah ini bulan purnama lanjut harus temu saudara wanita
imadamii,yoih sel
imadamii,telat anda balik
imadamii,typonya cukup dingomong saja yah bapak
imadamii,whatsapp syok an tawa memang jari kaki udik ini bulan peta
imadamii,buat flatshoes seminggu malah buat kelingking kanan kiri canteng ahahahahahahah
imadamii,tawa terimakasih bumilnya saya amin saja dulu tawa
imadamii,komentar tidak titik koma jadi pusing pala
imadamii,itu nyata konten cipta
imadamii,loh kenapa hubung sama sharingnya nkcthi bareng begitu tapi kebalikanya
imadamii,sehat sehat calon ibok
imadamii,tidak tidak tidak saudara
imadamii,iyah saki kesal
imadamii,naik bis murni saudara laki balepan sama bis asli seperti setan saya teriakin hai bang kenek bilang tenang saja tenang tenang ndasmu kalau jadi cuma kicep doang anda
imadamii,saya benar diam sama anda
imadamii,raka tidak sadar aksi cuma jadi bumerang
imadamii,sapa sudah mukul bedug jam gin coba tidur tapi brisik tidak coba sahur tapi tidur
imadamii,selalu kalau lagi sendiri rumah suka bablas sahur tadi pagi sahur menit trakhir lihat telepon nyata ibu ue miscal kali rasa seperti lomba an umur hidup cemil tergrasa grusu
imadamii,tawa tawa ini orang tidak kerja buat kamus ketawa hanya kali iya
imadamii,apa jadi ingat waktu tunggu busway halte ibu yang nyandar pintu otomatis dengan sengaja agar pintu tidak tutup tidak saya bilang ibu pintu mau nutup bilang jutek tidak apa apa sudah biasa gerah kejut
imadamii,tps rasa lebaran lihat wajah tetangga yang sudah lama tidak ketemu
imadamii,euforia masa kampanye dengan segala macam cerita keriweuhanya ini dokumenter gave saya sebuah rencana putar tawa thx
imadamii,bagi tolong saudara wanita
imadamii,merinding saya dengar seyeung geli geli
imadamii,sunday sore
imadamii,itu nyata oke drama ckck
imadamii,mimpi balik sama kelas kimia lagi sesi suruh depan kerja soal guru kimia guru yang killer yang di mimpi saya tanya kabar
imadamii,tetap bau semeriwingmu bisa bohong ucap
imadamii,bukan peh tapi saya anggota
imadamii,mimpi jadi wisata guidenya blekping tawa gara muncul hanya jelajah instagram
imadamii,lihat benar salah mudah kadang ego buat jadi bias
imadamii,kaca rumah ramping buat kaca jadi tidak sadar diri
imadamii,eh syok eh syok
imadamii,benar peh peras dulu kenal sebagai negara toleransi
imadamii,mengapa surat al kafirun ada ibu bapak agama untukulah agama benarkan jika saya salah
imadamii,rasa nya daya ingat sudah telolet
imadamii,sory saudara
imadamii,kalau saya bilang anda cantik kayak priyanka kobra lihat seperti marah tidak
imadamii,buku tulis
imadamii,larut ratap ketidakberuntungan amnesia nikmat yang tidak terhinga manusia
imadamii,hormat sih sama thailand raja nya seperti benar cinta sama warga sudah tidak saja ulang tahu tetap ingat sampai tren waktu meningalpun semua warga seperti duka semua memang raja yang bijak saking cinta
imadamii,jadi sakit jadi delulu
imadamii,pernah tidak sih tiba bengong pikir tg makna hidup
imadamii,nguras bak terus isi bak tinggal tunggu penuh stgah jam kemudian balik loh kenapa kosong bak ah chit eike tadi lupa nutup keran bak
imadamii,lihat komentar youtube akhir yep indonesians adalah overproud sedih saya itu
imadamii,ajak masuk dong kostan anda
imadamii,wo keren jim
imadamii,haha iya peh
imadamii,udang tepung
imadamii,pokok tidak balas obrol tidak baru sekali bangun tidur ngawur
imadamii,kenapa nurul anak kir kan tawa
imadamii,ada yang suka liatin tren tema tidak sih dulu ibu seperti kalau tren itu ada bagaimana begitu
imadamii,kadang mohon dapat satu dunia lupa syukur sama nikmat tuhan yang sudah kasih sampai tidak terhinga hampura dong gusti
imadamii,semangat juga peh
imadamii,selalu harap hari esok
imadamii,tiap bunga mekar musim rando kim
imadamii,sakit dunia saja tidak tahan akherat
imadamii,ingin salto haft
imadamii,ibu dendy niat mau viralin pelakor malah yang jadi bahan parodi netijen
imadamii,pertama dengar tidak cuci baju buset melodi cakep sampai ngiang padahal tidak tahu lagu sapose
imadamii,kata wakil rakyat batas rakyat
imadamii,semoga tuhan selalu beri lindung amin
imadamii,tawa tawa
imadamii,wala bisan saja cari yang tamvan ikuti idola yak
imadamii,nah tul itu
imadamii,itu s oke untuk buat salah once in sebuah sambil semua orang does itu nafas kenapa felnya dapat sekali padahal tidak paham bahasa tawa gudjub lehi
imadamii,pikir
imadamii,tumben an retweet kpop an
imadamii,desember
imadamii,jebak saat dari siklus repisian
imadamii,kapan seluruh warga indonesia sejahtera cara rata yak lihat kake jual buah pakai ontel saja buat saya
imadamii,tidak itu baik satu tapi saya coba saya terbaik
imadamii,jenuh
imadamii,mungkin proses bentuk diri agar kuat baja anti penyok
imadamii,kadang jadi yang tahu apa lebih baik
imadamii,benahin suasana hati
imadamii,gela rem juga ingat film rec
imadamii,saya adalah hanya manusia siapa punya tidak apa apa
imadamii,kalau bosan bingung mau apa tapi sekali tidak waktu rasa ingin kerja itu
imadamii,amin sibuk ya jadi polisi
imadamii,aduh bapak polisi yang satu tawa ngumpul dong kapan
imadamii,banyak yang perlu syukur
imadamii,nikmatin tugaz ini
imadamii,nikmat tuhan mana anda dusta tidak terhinga nikmat yang beri
imadamii,syukur
imadamii,tingalkan segala benci khilaf kesal sesal detik akan jadi lalu kemudian agar lalu
imadamii,sabar
imadamii,yah nama manusia kesal omong tiba tajam kemudian sesal
imadamii,malam ikan bobok
imadamii,enyah anda pekat
imadamii,untirta salah satu yang tolak apa terima ini aju fknya tawa
imadamii,satu dari itu terbaik cara untuk dapat juta pahala amin
imadamii,jadi takjub
imadamii,lantai ini adalah apa mereka pikir tentang muslim
imadamii,rindu putih abu
imadamii,hai siapa adalah anda hari ini pesan dari itu lalu dari diri sendiri untuk diri sendiri terimakasih untuk gulir turun
imadamii,pergi malas malas pergi
imadamii,positif pikir terus saja sama usaha yang sungguh mental baja bismillah semua dihadepin amin
imadamii,hidup saya kurang mendengarkan musik
imadamii,alahuma ajirni admin an nar
imadamii,syukur tidak lupa syukur tiap hari
imadamii,nyamuks
imadamii,tiga minggu tidak minum es kompetisi
imadamii,suasana hati
imadamii,cepat sembuh tuhan tidak sampai lupa sama suara sendiri
imadamii,antipeluru
imadamii,senang ied mubarak semua orang selamat opor sombong
imadamii,jadi wel tawa anda sibuk sama dunia medis tawa sudah ngobatin apa saja cik
imadamii,ciko baik cik tawa panjang waktu tidak se
imadamii,ih ken balik tangerang
imadamii,kebita planologi pikir
imadamii,buat itu benar benda bahkan ketika anda takut itu kena t buat itu salah benda bahkan ketika anda ingin itu
imadamii,semangt saudara tawa
imadamii,sekarang jamanya ngelakuin salah diangap lumrah ngelakuin benar diangap kaku tawa
imadamii,sok haru baca kata nya ica jadi ada ustadzah
imadamii,terimakasih sampai tidak bosan memberi yang baik tuhan amin
imadamii,saya tried dan tried untuk agar anda tahu saya cinta anda tapi saya saya letting pergi tidak apa apa akhir selamanya
imadamii,semoga usaha beri lancar yah gengs amin
imadamii,agar tidak kelam tunggu yang tidak yah nop tawa
imadamii,serah songenge
